Sheet: 1.Формулы
A1: 1 | B1: Работа с текстом
A3: 1.1 | B3: Используя формулу Excel, объедините значение ячеек фамилия имя отчество в одну ячейку с одинарными знаками пробела между словами
B5: Фамилия | C5: Имя | D5: Отчество | F5: ФИО
B6: Миронов | C6: Геннадий | D6: Юрьевич | F6: of:=COM.MICROSOFT.TEXTJOIN(" ";1;[.B6];[.C6];[.D6]) -> Миронов Геннадий Юрьевич
A9: 1.2 | B9: Используя функции Excel, разъедините ячейку с фамилией именем и отчеством на три ячейки (Фамилия, Имя, Отчество). Поясните, как вы это сделали
B11: ФИО | F11: Фамилия | G11: Имя | H11: Отчество
B12: Власов Иван Александрович | F12: of:=LEFT([.B12];FIND(" ";[.B12];1)-1) -> Власов | G12: of:=MID([.B12];FIND(" ";[.B12];1)+1;FIND(" ";[.B12];FIND(" ";[.B12];1)+1)-FIND(" ";[.B12];1)-1) -> Иван | H12: of:=RIGHT([.B12];LEN([.B12])-FIND(" ";[.B12];FIND(" ";[.B12];1)+1)) -> Александрович
B14: Пояснение: | C14: Созданы две вспомогательные ячеки, в которых с помощью поиска подстроки высчитывается номер первого и второго вхождения в исходную строку символа ' ' (пробел). Чтобы получить одно слово из ФИО, использовалась функция ПСТР, возвращающая подстроку из исходной строки по заданным параметрам (начальный элемент, длина подстроки). При нахождении длины отчества использовалась функция ДЛСТР для вычисления общей длины ФИО.
A17: 2 | B17: Работа с данными
B19: +739122232232
A21: 2.1 | B21: Используя формулу Excel, подсчитайте количество символов в ячейке B19
D23: of:=LEN([.B19]) -> 21
A25: 2.2 | B25: Используя формулу Excel, уберите из ячейки B19 пробелы
D27: of:=TRIM([.B19]) -> +739122232232
A29: 2.3 | B29: Используя формулу Excel, произведите замену знаков из ячейки B19 c +7 на 8
D31: of:=REPLACE(TRIM([.B19]);1;2;8) -> 839122232232
A33: 2.4 | B33: Используя формулу Excel, извлеките из ячейки B19 первые 5 символов
D35: of:=LEFT([.B19];5) ->   +73
A37: 3 | B37: Работа с таблицами
B39: Магазин | C39: Реализация | E39: 3.1 | F39: Используя формулу Excel, подставить данные по реализации магазина
B40: Магазин-1 | C40: 9583 | D40: of:=IF(ISBLANK([.C40]);0;[.C40]) -> 9583
B41: Магазин-2 | C41: 2794 | D41: of:=IF(ISBLANK([.C41]);0;[.C41]) -> 2794 | E41: Магазин-1 | F41: of:=VLOOKUP([.E41];[.B40:.C59];2;0) -> 9583
B42: Магазин-3 | C42: 792 | D42: of:=IF(ISBLANK([.C42]);0;[.C42]) -> 792
B43: Магазин-4 | C43: 8279 | D43: of:=IF(ISBLANK([.C43]);0;[.C43]) -> 8279 | E43: 3.2 | F43: Используя формулу Excel, подставить данные по реализации магазина
B44: Магазин-5 | C44: 8250 | D44: of:=IF(ISBLANK([.C44]);0;[.C44]) -> 8250
B45: Магазин-6 | C45: 418 | D45: of:=IF(ISBLANK([.C45]);0;[.C45]) -> 418 | E45: Магазин-4 | F45: of:=VLOOKUP([.E45];[.B40:.C59];2;0) -> 8279
B46: Магазин-7 | C46: 9541 | D46: of:=IF(ISBLANK([.C46]);0;[.C46]) -> 9541
B47: Магазин-8 | C47: 9663 | D47: of:=IF(ISBLANK([.C47]);0;[.C47]) -> 9663 | E47: 3.3 | F47: Используя формулу Excel, выведете данные с заменой ошибки #Н/Д на 0
B48: Магазин-9 | C48: 3710 | D48: of:=IF(ISBLANK([.C48]);0;[.C48]) -> 3710
B49: Магазин-10 | C49: 7702 | D49: of:=IF(ISBLANK([.C49]);0;[.C49]) -> 7702 | E49: Магазин-21 | F49: of:=IFERROR(VLOOKUP([.E49];[.B40:.C59];2;0);0) -> 0
B50: Магазин-11 | C50: 9200 | D50: of:=IF(ISBLANK([.C50]);0;[.C50]) -> 9200
B51: Магазин-12 | C51: 8667 | D51: of:=IF(ISBLANK([.C51]);0;[.C51]) -> 8667 | E51: 3.4 | F51: Используя формулу Excel, найти сумму реализации по указанным магазинам
B52: Магазин-13 | C52: 0 | D52: of:=IF(ISBLANK([.C52]);0;[.C52]) -> 0
B53: Магазин-14 | C53: 9896 | D53: of:=IF(ISBLANK([.C53]);0;[.C53]) -> 9896 | E53: Магазин-5 | F53: of:=VLOOKUP([.$E53];[.$B$40:.$C$60];2;0) -> 8250
B54: Магазин-15 | C54: 4630 | D54: of:=IF(ISBLANK([.C54]);0;[.C54]) -> 4630 | E54: Магазин-10 | F54: of:=VLOOKUP([.$E54];[.$B$40:.$C$60];2;0) -> 7702
B55: Магазин-16 | C55: 8832 | D55: of:=IF(ISBLANK([.C55]);0;[.C55]) -> 8832 | E55: Магазин-15 | F55: of:=VLOOKUP([.$E55];[.$B$40:.$C$60];2;0) -> 4630
B56: Магазин-17 | C56: 0 | D56: of:=IF(ISBLANK([.C56]);0;[.C56]) -> 0
B57: Магазин-18 | C57: 5118 | D57: of:=IF(ISBLANK([.C57]);0;[.C57]) -> 5118 | E57: 3.5 | F57: Используя формулу Excel, определите среднее значение реализации по всем магазинам
B58: Магазин-19 | C58: 2110 | D58: of:=IF(ISBLANK([.C58]);0;[.C58]) -> 2110
B59: Магазин-20 | C59: 9451 | D59: of:=IF(ISBLANK([.C59]);0;[.C59]) -> 9451 | F59: of:=AVERAGE([.D40:.D60]) -> 5649.33333333333
B60: Магазин-21 | D60: of:=IF(ISBLANK([.C60]);0;[.C60]) -> 0
E61: 3.6 | F61: Используя формулу Excel, определите среднее значение реализации не учитывая нулевые значения
F63: of:=AVERAGE([.C40:.C60]) -> 5931.8
A69: 4 | B69: Работа с таблицами (при выполнении задания 4.3 используйте в качестве статусов русские буквы "А";"Б";"В")
I70: Таблица-2 | M70: Таблица-3
A71: 4.1 | B71: Используя формулу Excel, подставьте в таблицу 1 названия городов из таблицы 2 в соответствии с кодом города | I71: Код города | J71: Название города | K71: Сумма | L71: Место | M71: Условие | N71: Статус
A72: 4.2 | B72: Используя формулу Excel, посчитайте суммы по каждому городу из таблицы 1 и подставьте значения в таблицу 2 | I72: 1 | J72: Москва | K72: of:=SUMIF([.$C$90:.$C$1089];"="&[.$J72];[.$F$90:.$F$1089]) -> 240320963 | L72: of:=RANK([.K72]; [.$K$72:.$K$81]) -> 8 | M72: больше 5 млн | N72: А
A73: 4.3 | B73: Используя формулу Excel, проставьте в таблице 1 статус каждой строки из таблицы 3 в зависимости от стоимости | I73: 2 | J73: Санкт-Петербург | K73: of:=SUMIF([.$C$90:.$C$1089];"="&[.$J73];[.$F$90:.$F$1089]) -> 224997697 | L73: of:=RANK([.K73]; [.$K$72:.$K$81]) -> 9 | M73: от 1 до 5 млн | N73: Б
I74: 3 | J74: Челябинск | K74: of:=SUMIF([.$C$90:.$C$1089];"="&[.$J74];[.$F$90:.$F$1089]) -> 295786410 | L74: of:=RANK([.K74]; [.$K$72:.$K$81]) -> 1 | M74: меньше 1 млн | N74: В
A75: 4.4 | B75: Используя формулу Excel, проставить место по объёму реализации для каждой строки в таблице 1 | I75: 4 | J75: Архангельск | K75: of:=SUMIF([.$C$90:.$C$1089];"="&[.$J75];[.$F$90:.$F$1089]) -> 271035716 | L75: of:=RANK([.K75]; [.$K$72:.$K$81]) -> 2
A76: 4.5 | B76: Используя формулу Excel, найти города занявшие первые три места по объёмам реализации | I76: 5 | J76: Краснодар | K76: of:=SUMIF([.$C$90:.$C$1089];"="&[.$J76];[.$F$90:.$F$1089]) -> 264890435 | L76: of:=RANK([.K76]; [.$K$72:.$K$81]) -> 4
I77: 6 | J77: Владивосток | K77: of:=SUMIF([.$C$90:.$C$1089];"="&[.$J77];[.$F$90:.$F$1089]) -> 243156318 | L77: of:=RANK([.K77]; [.$K$72:.$K$81]) -> 7
B78: место: | C78: город: | I78: 7 | J78: Мурманск | K78: of:=SUMIF([.$C$90:.$C$1089];"="&[.$J78];[.$F$90:.$F$1089]) -> 214483982 | L78: of:=RANK([.K78]; [.$K$72:.$K$81]) -> 10
B79: 1 | C79: of:=INDEX([.J72:.J81];MATCH([.$B$79];[.$L$72:.$L$81];0);1) -> Челябинск | I79: 8 | J79: Новосибирск | K79: of:=SUMIF([.$C$90:.$C$1089];"="&[.$J79];[.$F$90:.$F$1089]) -> 256068049 | L79: of:=RANK([.K79]; [.$K$72:.$K$81]) -> 5
B80: 2 | C80: of:=INDEX([.J73:.J82];MATCH([.$B$79];[.$L$72:.$L$81];0);1) -> Архангельск | I80: 9 | J80: Тюмень | K80: of:=SUMIF([.$C$90:.$C$1089];"="&[.$J80];[.$F$90:.$F$1089]) -> 269061092 | L80: of:=RANK([.K80]; [.$K$72:.$K$81]) -> 3
B81: 3 | C81: of:=INDEX([.J74:.J83];MATCH([.$B$79];[.$L$72:.$L$81];0);1) -> Краснодар | I81: 10 | J81: Сочи | K81: of:=SUMIF([.$C$90:.$C$1089];"="&[.$J81];[.$F$90:.$F$1089]) -> 249391138 | L81: of:=RANK([.K81]; [.$K$72:.$K$81]) -> 6
A83: 4.6 | B83: Найти количество Статусов А для городов Челябинск и Мурманск
B84: статус: | C84: А
B85: город: | C85: Челябинск | D85: of:=COUNTIFS([.$C$90:.$C$1089];"="&[.$C85];[.$G$90:.$G$1089];"="&[.$C$84]) -> 19
B86: город: | C86: Мурманск | D86: of:=COUNTIFS([.$C$90:.$C$1089];"="&[.$C86];[.$G$90:.$G$1089];"="&[.$C$84]) -> 13
B88: Таблица-1
B89: Код города | C89: Название города | D89: Кол-во | E89: Цена | F89: Реализация | G89: Статус | H89: Место по объёму реализации
B90: 1 | C90: of:=VLOOKUP([.$B90];[.$I$71:.$J$81];2;0) -> Москва | D90: 26 | E90: 93470 | F90: of:=IF(ISBLANK([.E90]*[.D90]);"0";[.E90]*[.D90]) -> 2430220 | G90: of:=COM.MICROSOFT.IFS([.F90]>5000000;[.$N$72];AND([.F90]>=1000000;[.F90]<=5000000);[.$N$73];AND([.F90]<1000000;[.F90]>0);[.$N$74];[.F90]=0;" ") -> Б | H90: of:=VLOOKUP([.$B90];[.$I$71:.$L$81];4;0) -> 8
B91: 4 | C91: of:=VLOOKUP([.$B91];[.$I$71:.$J$81];2;0) -> Архангельск | D91: 100 | E91: 15436 | F91: of:=IF(ISBLANK([.E91]*[.D91]);"0";[.E91]*[.D91]) -> 1543600 | G91: of:=COM.MICROSOFT.IFS([.F91]>5000000;[.$N$72];AND([.F91]>=1000000;[.F91]<=5000000);[.$N$73];AND([.F91]<1000000;[.F91]>0);[.$N$74];[.F91]=0;" ") -> Б | H91: of:=VLOOKUP([.$B91];[.$I$71:.$L$81];4;0) -> 2
B92: 4 | C92: of:=VLOOKUP([.$B92];[.$I$71:.$J$81];2;0) -> Архангельск | D92: 84 | E92: 85030 | F92: of:=IF(ISBLANK([.E92]*[.D92]);"0";[.E92]*[.D92]) -> 7142520 | G92: of:=COM.MICROSOFT.IFS([.F92]>5000000;[.$N$72];AND([.F92]>=1000000;[.F92]<=5000000);[.$N$73];AND([.F92]<1000000;[.F92]>0);[.$N$74];[.F92]=0;" ") -> А | H92: of:=VLOOKUP([.$B92];[.$I$71:.$L$81];4;0) -> 2
B93: 1 | C93: of:=VLOOKUP([.$B93];[.$I$71:.$J$81];2;0) -> Москва | D93: 58 | E93: 17080 | F93: of:=IF(ISBLANK([.E93]*[.D93]);"0";[.E93]*[.D93]) -> 990640 | G93: of:=COM.MICROSOFT.IFS([.F93]>5000000;[.$N$72];AND([.F93]>=1000000;[.F93]<=5000000);[.$N$73];AND([.F93]<1000000;[.F93]>0);[.$N$74];[.F93]=0;" ") -> В | H93: of:=VLOOKUP([.$B93];[.$I$71:.$L$81];4;0) -> 8
B94: 5 | C94: of:=VLOOKUP([.$B94];[.$I$71:.$J$81];2;0) -> Краснодар | D94: 24 | E94: 64494 | F94: of:=IF(ISBLANK([.E94]*[.D94]);"0";[.E94]*[.D94]) -> 1547856 | G94: of:=COM.MICROSOFT.IFS([.F94]>5000000;[.$N$72];AND([.F94]>=1000000;[.F94]<=5000000);[.$N$73];AND([.F94]<1000000;[.F94]>0);[.$N$74];[.F94]=0;" ") -> Б | H94: of:=VLOOKUP([.$B94];[.$I$71:.$L$81];4;0) -> 4
B95: 9 | C95: of:=VLOOKUP([.$B95];[.$I$71:.$J$81];2;0) -> Тюмень | D95: 52 | E95: 88369 | F95: of:=IF(ISBLANK([.E95]*[.D95]);"0";[.E95]*[.D95]) -> 4595188 | G95: of:=COM.MICROSOFT.IFS([.F95]>5000000;[.$N$72];AND([.F95]>=1000000;[.F95]<=5000000);[.$N$73];AND([.F95]<1000000;[.F95]>0);[.$N$74];[.F95]=0;" ") -> Б | H95: of:=VLOOKUP([.$B95];[.$I$71:.$L$81];4;0) -> 3
B96: 6 | C96: of:=VLOOKUP([.$B96];[.$I$71:.$J$81];2;0) -> Владивосток | D96: 8 | E96: 31965 | F96: of:=IF(ISBLANK([.E96]*[.D96]);"0";[.E96]*[.D96]) -> 255720 | G96: of:=COM.MICROSOFT.IFS([.F96]>5000000;[.$N$72];AND([.F96]>=1000000;[.F96]<=5000000);[.$N$73];AND([.F96]<1000000;[.F96]>0);[.$N$74];[.F96]=0;" ") -> В | H96: of:=VLOOKUP([.$B96];[.$I$71:.$L$81];4;0) -> 7
B97: 9 | C97: of:=VLOOKUP([.$B97];[.$I$71:.$J$81];2;0) -> Тюмень | D97: 71 | E97: 99825 | F97: of:=IF(ISBLANK([.E97]*[.D97]);"0";[.E97]*[.D97]) -> 7087575 | G97: of:=COM.MICROSOFT.IFS([.F97]>5000000;[.$N$72];AND([.F97]>=1000000;[.F97]<=5000000);[.$N$73];AND([.F97]<1000000;[.F97]>0);[.$N$74];[.F97]=0;" ") -> А | H97: of:=VLOOKUP([.$B97];[.$I$71:.$L$81];4;0) -> 3
B98: 8 | C98: of:=VLOOKUP([.$B98];[.$I$71:.$J$81];2;0) -> Новосибирск | D98: 56 | E98: 70360 | F98: of:=IF(ISBLANK([.E98]*[.D98]);"0";[.E98]*[.D98]) -> 3940160 | G98: of:=COM.MICROSOFT.IFS([.F98]>5000000;[.$N$72];AND([.F98]>=1000000;[.F98]<=5000000);[.$N$73];AND([.F98]<1000000;[.F98]>0);[.$N$74];[.F98]=0;" ") -> Б | H98: of:=VLOOKUP([.$B98];[.$I$71:.$L$81];4;0) -> 5
B99: 10 | C99: of:=VLOOKUP([.$B99];[.$I$71:.$J$81];2;0) -> Сочи | D99: 76 | E99: 26226 | F99: of:=IF(ISBLANK([.E99]*[.D99]);"0";[.E99]*[.D99]) -> 1993176 | G99: of:=COM.MICROSOFT.IFS([.F99]>5000000;[.$N$72];AND([.F99]>=1000000;[.F99]<=5000000);[.$N$73];AND([.F99]<1000000;[.F99]>0);[.$N$74];[.F99]=0;" ") -> Б | H99: of:=VLOOKUP([.$B99];[.$I$71:.$L$81];4;0) -> 6
B100: 7 | C100: of:=VLOOKUP([.$B100];[.$I$71:.$J$81];2;0) -> Мурманск | D100: 7 | E100: 79777 | F100: of:=IF(ISBLANK([.E100]*[.D100]);"0";[.E100]*[.D100]) -> 558439 | G100: of:=COM.MICROSOFT.IFS([.F100]>5000000;[.$N$72];AND([.F100]>=1000000;[.F100]<=5000000);[.$N$73];AND([.F100]<1000000;[.F100]>0);[.$N$74];[.F100]=0;" ") -> В | H100: of:=VLOOKUP([.$B100];[.$I$71:.$L$81];4;0) -> 10
B101: 7 | C101: of:=VLOOKUP([.$B101];[.$I$71:.$J$81];2;0) -> Мурманск | D101: 79 | E101: 99983 | F101: of:=IF(ISBLANK([.E101]*[.D101]);"0";[.E101]*[.D101]) -> 7898657 | G101: of:=COM.MICROSOFT.IFS([.F101]>5000000;[.$N$72];AND([.F101]>=1000000;[.F101]<=5000000);[.$N$73];AND([.F101]<1000000;[.F101]>0);[.$N$74];[.F101]=0;" ") -> А | H101: of:=VLOOKUP([.$B101];[.$I$71:.$L$81];4;0) -> 10
B102: 8 | C102: of:=VLOOKUP([.$B102];[.$I$71:.$J$81];2;0) -> Новосибирск | D102: 33 | E102: 59856 | F102: of:=IF(ISBLANK([.E102]*[.D102]);"0";[.E102]*[.D102]) -> 1975248 | G102: of:=COM.MICROSOFT.IFS([.F102]>5000000;[.$N$72];AND([.F102]>=1000000;[.F102]<=5000000);[.$N$73];AND([.F102]<1000000;[.F102]>0);[.$N$74];[.F102]=0;" ") -> Б | H102: of:=VLOOKUP([.$B102];[.$I$71:.$L$81];4;0) -> 5
B103: 7 | C103: of:=VLOOKUP([.$B103];[.$I$71:.$J$81];2;0) -> Мурманск | D103: 62 | E103: 13577 | F103: of:=IF(ISBLANK([.E103]*[.D103]);"0";[.E103]*[.D103]) -> 841774 | G103: of:=COM.MICROSOFT.IFS([.F103]>5000000;[.$N$72];AND([.F103]>=1000000;[.F103]<=5000000);[.$N$73];AND([.F103]<1000000;[.F103]>0);[.$N$74];[.F103]=0;" ") -> В | H103: of:=VLOOKUP([.$B103];[.$I$71:.$L$81];4;0) -> 10
B104: 6 | C104: of:=VLOOKUP([.$B104];[.$I$71:.$J$81];2;0) -> Владивосток | D104: 20 | E104: 76951 | F104: of:=IF(ISBLANK([.E104]*[.D104]);"0";[.E104]*[.D104]) -> 1539020 | G104: of:=COM.MICROSOFT.IFS([.F104]>5000000;[.$N$72];AND([.F104]>=1000000;[.F104]<=5000000);[.$N$73];AND([.F104]<1000000;[.F104]>0);[.$N$74];[.F104]=0;" ") -> Б | H104: of:=VLOOKUP([.$B104];[.$I$71:.$L$81];4;0) -> 7
B105: 10 | C105: of:=VLOOKUP([.$B105];[.$I$71:.$J$81];2;0) -> Сочи | D105: 51 | E105: 57536 | F105: of:=IF(ISBLANK([.E105]*[.D105]);"0";[.E105]*[.D105]) -> 2934336 | G105: of:=COM.MICROSOFT.IFS([.F105]>5000000;[.$N$72];AND([.F105]>=1000000;[.F105]<=5000000);[.$N$73];AND([.F105]<1000000;[.F105]>0);[.$N$74];[.F105]=0;" ") -> Б | H105: of:=VLOOKUP([.$B105];[.$I$71:.$L$81];4;0) -> 6
B106: 10 | C106: of:=VLOOKUP([.$B106];[.$I$71:.$J$81];2;0) -> Сочи | D106: 7 | E106: 67723 | F106: of:=IF(ISBLANK([.E106]*[.D106]);"0";[.E106]*[.D106]) -> 474061 | G106: of:=COM.MICROSOFT.IFS([.F106]>5000000;[.$N$72];AND([.F106]>=1000000;[.F106]<=5000000);[.$N$73];AND([.F106]<1000000;[.F106]>0);[.$N$74];[.F106]=0;" ") -> В | H106: of:=VLOOKUP([.$B106];[.$I$71:.$L$81];4;0) -> 6
B107: 7 | C107: of:=VLOOKUP([.$B107];[.$I$71:.$J$81];2;0) -> Мурманск | D107: 89 | E107: 76144 | F107: of:=IF(ISBLANK([.E107]*[.D107]);"0";[.E107]*[.D107]) -> 6776816 | G107: of:=COM.MICROSOFT.IFS([.F107]>5000000;[.$N$72];AND([.F107]>=1000000;[.F107]<=5000000);[.$N$73];AND([.F107]<1000000;[.F107]>0);[.$N$74];[.F107]=0;" ") -> А | H107: of:=VLOOKUP([.$B107];[.$I$71:.$L$81];4;0) -> 10
B108: 4 | C108: of:=VLOOKUP([.$B108];[.$I$71:.$J$81];2;0) -> Архангельск | D108: 15 | E108: 51504 | F108: of:=IF(ISBLANK([.E108]*[.D108]);"0";[.E108]*[.D108]) -> 772560 | G108: of:=COM.MICROSOFT.IFS([.F108]>5000000;[.$N$72];AND([.F108]>=1000000;[.F108]<=5000000);[.$N$73];AND([.F108]<1000000;[.F108]>0);[.$N$74];[.F108]=0;" ") -> В | H108: of:=VLOOKUP([.$B108];[.$I$71:.$L$81];4;0) -> 2
B109: 3 | C109: of:=VLOOKUP([.$B109];[.$I$71:.$J$81];2;0) -> Челябинск | D109: 63 | E109: 67867 | F109: of:=IF(ISBLANK([.E109]*[.D109]);"0";[.E109]*[.D109]) -> 4275621 | G109: of:=COM.MICROSOFT.IFS([.F109]>5000000;[.$N$72];AND([.F109]>=1000000;[.F109]<=5000000);[.$N$73];AND([.F109]<1000000;[.F109]>0);[.$N$74];[.F109]=0;" ") -> Б | H109: of:=VLOOKUP([.$B109];[.$I$71:.$L$81];4;0) -> 1
B110: 3 | C110: of:=VLOOKUP([.$B110];[.$I$71:.$J$81];2;0) -> Челябинск | D110: 10 | E110: 61505 | F110: of:=IF(ISBLANK([.E110]*[.D110]);"0";[.E110]*[.D110]) -> 615050 | G110: of:=COM.MICROSOFT.IFS([.F110]>5000000;[.$N$72];AND([.F110]>=1000000;[.F110]<=5000000);[.$N$73];AND([.F110]<1000000;[.F110]>0);[.$N$74];[.F110]=0;" ") -> В | H110: of:=VLOOKUP([.$B110];[.$I$71:.$L$81];4;0) -> 1
B111: 10 | C111: of:=VLOOKUP([.$B111];[.$I$71:.$J$81];2;0) -> Сочи | D111: 90 | E111: 45225 | F111: of:=IF(ISBLANK([.E111]*[.D111]);"0";[.E111]*[.D111]) -> 4070250 | G111: of:=COM.MICROSOFT.IFS([.F111]>5000000;[.$N$72];AND([.F111]>=1000000;[.F111]<=5000000);[.$N$73];AND([.F111]<1000000;[.F111]>0);[.$N$74];[.F111]=0;" ") -> Б | H111: of:=VLOOKUP([.$B111];[.$I$71:.$L$81];4;0) -> 6
B112: 4 | C112: of:=VLOOKUP([.$B112];[.$I$71:.$J$81];2;0) -> Архангельск | D112: 0 | E112: 20725 | F112: of:=IF(ISBLANK([.E112]*[.D112]);"0";[.E112]*[.D112]) -> 0 | G112: of:=COM.MICROSOFT.IFS([.F112]>5000000;[.$N$72];AND([.F112]>=1000000;[.F112]<=5000000);[.$N$73];AND([.F112]<1000000;[.F112]>0);[.$N$74];[.F112]=0;" ") ->   | H112: of:=VLOOKUP([.$B112];[.$I$71:.$L$81];4;0) -> 2
B113: 3 | C113: of:=VLOOKUP([.$B113];[.$I$71:.$J$81];2;0) -> Челябинск | D113: 70 | E113: 60550 | F113: of:=IF(ISBLANK([.E113]*[.D113]);"0";[.E113]*[.D113]) -> 4238500 | G113: of:=COM.MICROSOFT.IFS([.F113]>5000000;[.$N$72];AND([.F113]>=1000000;[.F113]<=5000000);[.$N$73];AND([.F113]<1000000;[.F113]>0);[.$N$74];[.F113]=0;" ") -> Б | H113: of:=VLOOKUP([.$B113];[.$I$71:.$L$81];4;0) -> 1
B114: 5 | C114: of:=VLOOKUP([.$B114];[.$I$71:.$J$81];2;0) -> Краснодар | D114: 29 | E114: 11164 | F114: of:=IF(ISBLANK([.E114]*[.D114]);"0";[.E114]*[.D114]) -> 323756 | G114: of:=COM.MICROSOFT.IFS([.F114]>5000000;[.$N$72];AND([.F114]>=1000000;[.F114]<=5000000);[.$N$73];AND([.F114]<1000000;[.F114]>0);[.$N$74];[.F114]=0;" ") -> В | H114: of:=VLOOKUP([.$B114];[.$I$71:.$L$81];4;0) -> 4
B115: 4 | C115: of:=VLOOKUP([.$B115];[.$I$71:.$J$81];2;0) -> Архангельск | D115: 40 | E115: 41872 | F115: of:=IF(ISBLANK([.E115]*[.D115]);"0";[.E115]*[.D115]) -> 1674880 | G115: of:=COM.MICROSOFT.IFS([.F115]>5000000;[.$N$72];AND([.F115]>=1000000;[.F115]<=5000000);[.$N$73];AND([.F115]<1000000;[.F115]>0);[.$N$74];[.F115]=0;" ") -> Б | H115: of:=VLOOKUP([.$B115];[.$I$71:.$L$81];4;0) -> 2
B116: 8 | C116: of:=VLOOKUP([.$B116];[.$I$71:.$J$81];2;0) -> Новосибирск | D116: 56 | E116: 23655 | F116: of:=IF(ISBLANK([.E116]*[.D116]);"0";[.E116]*[.D116]) -> 1324680 | G116: of:=COM.MICROSOFT.IFS([.F116]>5000000;[.$N$72];AND([.F116]>=1000000;[.F116]<=5000000);[.$N$73];AND([.F116]<1000000;[.F116]>0);[.$N$74];[.F116]=0;" ") -> Б | H116: of:=VLOOKUP([.$B116];[.$I$71:.$L$81];4;0) -> 5
B117: 6 | C117: of:=VLOOKUP([.$B117];[.$I$71:.$J$81];2;0) -> Владивосток | D117: 13 | E117: 97901 | F117: of:=IF(ISBLANK([.E117]*[.D117]);"0";[.E117]*[.D117]) -> 1272713 | G117: of:=COM.MICROSOFT.IFS([.F117]>5000000;[.$N$72];AND([.F117]>=1000000;[.F117]<=5000000);[.$N$73];AND([.F117]<1000000;[.F117]>0);[.$N$74];[.F117]=0;" ") -> Б | H117: of:=VLOOKUP([.$B117];[.$I$71:.$L$81];4;0) -> 7
B118: 1 | C118: of:=VLOOKUP([.$B118];[.$I$71:.$J$81];2;0) -> Москва | D118: 97 | E118: 82442 | F118: of:=IF(ISBLANK([.E118]*[.D118]);"0";[.E118]*[.D118]) -> 7996874 | G118: of:=COM.MICROSOFT.IFS([.F118]>5000000;[.$N$72];AND([.F118]>=1000000;[.F118]<=5000000);[.$N$73];AND([.F118]<1000000;[.F118]>0);[.$N$74];[.F118]=0;" ") -> А | H118: of:=VLOOKUP([.$B118];[.$I$71:.$L$81];4;0) -> 8
B119: 3 | C119: of:=VLOOKUP([.$B119];[.$I$71:.$J$81];2;0) -> Челябинск | D119: 72 | E119: 94804 | F119: of:=IF(ISBLANK([.E119]*[.D119]);"0";[.E119]*[.D119]) -> 6825888 | G119: of:=COM.MICROSOFT.IFS([.F119]>5000000;[.$N$72];AND([.F119]>=1000000;[.F119]<=5000000);[.$N$73];AND([.F119]<1000000;[.F119]>0);[.$N$74];[.F119]=0;" ") -> А | H119: of:=VLOOKUP([.$B119];[.$I$71:.$L$81];4;0) -> 1
B120: 7 | C120: of:=VLOOKUP([.$B120];[.$I$71:.$J$81];2;0) -> Мурманск | D120: 91 | E120: 79322 | F120: of:=IF(ISBLANK([.E120]*[.D120]);"0";[.E120]*[.D120]) -> 7218302 | G120: of:=COM.MICROSOFT.IFS([.F120]>5000000;[.$N$72];AND([.F120]>=1000000;[.F120]<=5000000);[.$N$73];AND([.F120]<1000000;[.F120]>0);[.$N$74];[.F120]=0;" ") -> А | H120: of:=VLOOKUP([.$B120];[.$I$71:.$L$81];4;0) -> 10
B121: 1 | C121: of:=VLOOKUP([.$B121];[.$I$71:.$J$81];2;0) -> Москва | D121: 45 | E121: 5272 | F121: of:=IF(ISBLANK([.E121]*[.D121]);"0";[.E121]*[.D121]) -> 237240 | G121: of:=COM.MICROSOFT.IFS([.F121]>5000000;[.$N$72];AND([.F121]>=1000000;[.F121]<=5000000);[.$N$73];AND([.F121]<1000000;[.F121]>0);[.$N$74];[.F121]=0;" ") -> В | H121: of:=VLOOKUP([.$B121];[.$I$71:.$L$81];4;0) -> 8
B122: 1 | C122: of:=VLOOKUP([.$B122];[.$I$71:.$J$81];2;0) -> Москва | D122: 12 | E122: 62962 | F122: of:=IF(ISBLANK([.E122]*[.D122]);"0";[.E122]*[.D122]) -> 755544 | G122: of:=COM.MICROSOFT.IFS([.F122]>5000000;[.$N$72];AND([.F122]>=1000000;[.F122]<=5000000);[.$N$73];AND([.F122]<1000000;[.F122]>0);[.$N$74];[.F122]=0;" ") -> В | H122: of:=VLOOKUP([.$B122];[.$I$71:.$L$81];4;0) -> 8
B123: 6 | C123: of:=VLOOKUP([.$B123];[.$I$71:.$J$81];2;0) -> Владивосток | D123: 11 | E123: 80082 | F123: of:=IF(ISBLANK([.E123]*[.D123]);"0";[.E123]*[.D123]) -> 880902 | G123: of:=COM.MICROSOFT.IFS([.F123]>5000000;[.$N$72];AND([.F123]>=1000000;[.F123]<=5000000);[.$N$73];AND([.F123]<1000000;[.F123]>0);[.$N$74];[.F123]=0;" ") -> В | H123: of:=VLOOKUP([.$B123];[.$I$71:.$L$81];4;0) -> 7
B124: 6 | C124: of:=VLOOKUP([.$B124];[.$I$71:.$J$81];2;0) -> Владивосток | D124: 28 | E124: 70724 | F124: of:=IF(ISBLANK([.E124]*[.D124]);"0";[.E124]*[.D124]) -> 1980272 | G124: of:=COM.MICROSOFT.IFS([.F124]>5000000;[.$N$72];AND([.F124]>=1000000;[.F124]<=5000000);[.$N$73];AND([.F124]<1000000;[.F124]>0);[.$N$74];[.F124]=0;" ") -> Б | H124: of:=VLOOKUP([.$B124];[.$I$71:.$L$81];4;0) -> 7
B125: 4 | C125: of:=VLOOKUP([.$B125];[.$I$71:.$J$81];2;0) -> Архангельск | D125: 80 | E125: 16106 | F125: of:=IF(ISBLANK([.E125]*[.D125]);"0";[.E125]*[.D125]) -> 1288480 | G125: of:=COM.MICROSOFT.IFS([.F125]>5000000;[.$N$72];AND([.F125]>=1000000;[.F125]<=5000000);[.$N$73];AND([.F125]<1000000;[.F125]>0);[.$N$74];[.F125]=0;" ") -> Б | H125: of:=VLOOKUP([.$B125];[.$I$71:.$L$81];4;0) -> 2
B126: 8 | C126: of:=VLOOKUP([.$B126];[.$I$71:.$J$81];2;0) -> Новосибирск | D126: 93 | E126: 1093 | F126: of:=IF(ISBLANK([.E126]*[.D126]);"0";[.E126]*[.D126]) -> 101649 | G126: of:=COM.MICROSOFT.IFS([.F126]>5000000;[.$N$72];AND([.F126]>=1000000;[.F126]<=5000000);[.$N$73];AND([.F126]<1000000;[.F126]>0);[.$N$74];[.F126]=0;" ") -> В | H126: of:=VLOOKUP([.$B126];[.$I$71:.$L$81];4;0) -> 5
B127: 4 | C127: of:=VLOOKUP([.$B127];[.$I$71:.$J$81];2;0) -> Архангельск | D127: 49 | E127: 81535 | F127: of:=IF(ISBLANK([.E127]*[.D127]);"0";[.E127]*[.D127]) -> 3995215 | G127: of:=COM.MICROSOFT.IFS([.F127]>5000000;[.$N$72];AND([.F127]>=1000000;[.F127]<=5000000);[.$N$73];AND([.F127]<1000000;[.F127]>0);[.$N$74];[.F127]=0;" ") -> Б | H127: of:=VLOOKUP([.$B127];[.$I$71:.$L$81];4;0) -> 2
B128: 10 | C128: of:=VLOOKUP([.$B128];[.$I$71:.$J$81];2;0) -> Сочи | D128: 11 | E128: 49566 | F128: of:=IF(ISBLANK([.E128]*[.D128]);"0";[.E128]*[.D128]) -> 545226 | G128: of:=COM.MICROSOFT.IFS([.F128]>5000000;[.$N$72];AND([.F128]>=1000000;[.F128]<=5000000);[.$N$73];AND([.F128]<1000000;[.F128]>0);[.$N$74];[.F128]=0;" ") -> В | H128: of:=VLOOKUP([.$B128];[.$I$71:.$L$81];4;0) -> 6
B129: 1 | C129: of:=VLOOKUP([.$B129];[.$I$71:.$J$81];2;0) -> Москва | D129: 69 | E129: 55723 | F129: of:=IF(ISBLANK([.E129]*[.D129]);"0";[.E129]*[.D129]) -> 3844887 | G129: of:=COM.MICROSOFT.IFS([.F129]>5000000;[.$N$72];AND([.F129]>=1000000;[.F129]<=5000000);[.$N$73];AND([.F129]<1000000;[.F129]>0);[.$N$74];[.F129]=0;" ") -> Б | H129: of:=VLOOKUP([.$B129];[.$I$71:.$L$81];4;0) -> 8
B130: 8 | C130: of:=VLOOKUP([.$B130];[.$I$71:.$J$81];2;0) -> Новосибирск | D130: 34 | E130: 77563 | F130: of:=IF(ISBLANK([.E130]*[.D130]);"0";[.E130]*[.D130]) -> 2637142 | G130: of:=COM.MICROSOFT.IFS([.F130]>5000000;[.$N$72];AND([.F130]>=1000000;[.F130]<=5000000);[.$N$73];AND([.F130]<1000000;[.F130]>0);[.$N$74];[.F130]=0;" ") -> Б | H130: of:=VLOOKUP([.$B130];[.$I$71:.$L$81];4;0) -> 5
B131: 1 | C131: of:=VLOOKUP([.$B131];[.$I$71:.$J$81];2;0) -> Москва | D131: 20 | E131: 82926 | F131: of:=IF(ISBLANK([.E131]*[.D131]);"0";[.E131]*[.D131]) -> 1658520 | G131: of:=COM.MICROSOFT.IFS([.F131]>5000000;[.$N$72];AND([.F131]>=1000000;[.F131]<=5000000);[.$N$73];AND([.F131]<1000000;[.F131]>0);[.$N$74];[.F131]=0;" ") -> Б | H131: of:=VLOOKUP([.$B131];[.$I$71:.$L$81];4;0) -> 8
B132: 9 | C132: of:=VLOOKUP([.$B132];[.$I$71:.$J$81];2;0) -> Тюмень | D132: 36 | E132: 70746 | F132: of:=IF(ISBLANK([.E132]*[.D132]);"0";[.E132]*[.D132]) -> 2546856 | G132: of:=COM.MICROSOFT.IFS([.F132]>5000000;[.$N$72];AND([.F132]>=1000000;[.F132]<=5000000);[.$N$73];AND([.F132]<1000000;[.F132]>0);[.$N$74];[.F132]=0;" ") -> Б | H132: of:=VLOOKUP([.$B132];[.$I$71:.$L$81];4;0) -> 3
B133: 8 | C133: of:=VLOOKUP([.$B133];[.$I$71:.$J$81];2;0) -> Новосибирск | D133: 6 | E133: 39870 | F133: of:=IF(ISBLANK([.E133]*[.D133]);"0";[.E133]*[.D133]) -> 239220 | G133: of:=COM.MICROSOFT.IFS([.F133]>5000000;[.$N$72];AND([.F133]>=1000000;[.F133]<=5000000);[.$N$73];AND([.F133]<1000000;[.F133]>0);[.$N$74];[.F133]=0;" ") -> В | H133: of:=VLOOKUP([.$B133];[.$I$71:.$L$81];4;0) -> 5
B134: 10 | C134: of:=VLOOKUP([.$B134];[.$I$71:.$J$81];2;0) -> Сочи | D134: 14 | E134: 6807 | F134: of:=IF(ISBLANK([.E134]*[.D134]);"0";[.E134]*[.D134]) -> 95298 | G134: of:=COM.MICROSOFT.IFS([.F134]>5000000;[.$N$72];AND([.F134]>=1000000;[.F134]<=5000000);[.$N$73];AND([.F134]<1000000;[.F134]>0);[.$N$74];[.F134]=0;" ") -> В | H134: of:=VLOOKUP([.$B134];[.$I$71:.$L$81];4;0) -> 6
B135: 4 | C135: of:=VLOOKUP([.$B135];[.$I$71:.$J$81];2;0) -> Архангельск | D135: 25 | E135: 80879 | F135: of:=IF(ISBLANK([.E135]*[.D135]);"0";[.E135]*[.D135]) -> 2021975 | G135: of:=COM.MICROSOFT.IFS([.F135]>5000000;[.$N$72];AND([.F135]>=1000000;[.F135]<=5000000);[.$N$73];AND([.F135]<1000000;[.F135]>0);[.$N$74];[.F135]=0;" ") -> Б | H135: of:=VLOOKUP([.$B135];[.$I$71:.$L$81];4;0) -> 2
B136: 2 | C136: of:=VLOOKUP([.$B136];[.$I$71:.$J$81];2;0) -> Санкт-Петербург | D136: 8 | E136: 51584 | F136: of:=IF(ISBLANK([.E136]*[.D136]);"0";[.E136]*[.D136]) -> 412672 | G136: of:=COM.MICROSOFT.IFS([.F136]>5000000;[.$N$72];AND([.F136]>=1000000;[.F136]<=5000000);[.$N$73];AND([.F136]<1000000;[.F136]>0);[.$N$74];[.F136]=0;" ") -> В | H136: of:=VLOOKUP([.$B136];[.$I$71:.$L$81];4;0) -> 9
B137: 4 | C137: of:=VLOOKUP([.$B137];[.$I$71:.$J$81];2;0) -> Архангельск | D137: 52 | E137: 99026 | F137: of:=IF(ISBLANK([.E137]*[.D137]);"0";[.E137]*[.D137]) -> 5149352 | G137: of:=COM.MICROSOFT.IFS([.F137]>5000000;[.$N$72];AND([.F137]>=1000000;[.F137]<=5000000);[.$N$73];AND([.F137]<1000000;[.F137]>0);[.$N$74];[.F137]=0;" ") -> А | H137: of:=VLOOKUP([.$B137];[.$I$71:.$L$81];4;0) -> 2
B138: 8 | C138: of:=VLOOKUP([.$B138];[.$I$71:.$J$81];2;0) -> Новосибирск | D138: 10 | E138: 47089 | F138: of:=IF(ISBLANK([.E138]*[.D138]);"0";[.E138]*[.D138]) -> 470890 | G138: of:=COM.MICROSOFT.IFS([.F138]>5000000;[.$N$72];AND([.F138]>=1000000;[.F138]<=5000000);[.$N$73];AND([.F138]<1000000;[.F138]>0);[.$N$74];[.F138]=0;" ") -> В | H138: of:=VLOOKUP([.$B138];[.$I$71:.$L$81];4;0) -> 5
B139: 7 | C139: of:=VLOOKUP([.$B139];[.$I$71:.$J$81];2;0) -> Мурманск | D139: 65 | E139: 24543 | F139: of:=IF(ISBLANK([.E139]*[.D139]);"0";[.E139]*[.D139]) -> 1595295 | G139: of:=COM.MICROSOFT.IFS([.F139]>5000000;[.$N$72];AND([.F139]>=1000000;[.F139]<=5000000);[.$N$73];AND([.F139]<1000000;[.F139]>0);[.$N$74];[.F139]=0;" ") -> Б | H139: of:=VLOOKUP([.$B139];[.$I$71:.$L$81];4;0) -> 10
B140: 9 | C140: of:=VLOOKUP([.$B140];[.$I$71:.$J$81];2;0) -> Тюмень | D140: 31 | E140: 51809 | F140: of:=IF(ISBLANK([.E140]*[.D140]);"0";[.E140]*[.D140]) -> 1606079 | G140: of:=COM.MICROSOFT.IFS([.F140]>5000000;[.$N$72];AND([.F140]>=1000000;[.F140]<=5000000);[.$N$73];AND([.F140]<1000000;[.F140]>0);[.$N$74];[.F140]=0;" ") -> Б | H140: of:=VLOOKUP([.$B140];[.$I$71:.$L$81];4;0) -> 3
B141: 10 | C141: of:=VLOOKUP([.$B141];[.$I$71:.$J$81];2;0) -> Сочи | D141: 84 | E141: 35436 | F141: of:=IF(ISBLANK([.E141]*[.D141]);"0";[.E141]*[.D141]) -> 2976624 | G141: of:=COM.MICROSOFT.IFS([.F141]>5000000;[.$N$72];AND([.F141]>=1000000;[.F141]<=5000000);[.$N$73];AND([.F141]<1000000;[.F141]>0);[.$N$74];[.F141]=0;" ") -> Б | H141: of:=VLOOKUP([.$B141];[.$I$71:.$L$81];4;0) -> 6
B142: 3 | C142: of:=VLOOKUP([.$B142];[.$I$71:.$J$81];2;0) -> Челябинск | D142: 43 | E142: 55351 | F142: of:=IF(ISBLANK([.E142]*[.D142]);"0";[.E142]*[.D142]) -> 2380093 | G142: of:=COM.MICROSOFT.IFS([.F142]>5000000;[.$N$72];AND([.F142]>=1000000;[.F142]<=5000000);[.$N$73];AND([.F142]<1000000;[.F142]>0);[.$N$74];[.F142]=0;" ") -> Б | H142: of:=VLOOKUP([.$B142];[.$I$71:.$L$81];4;0) -> 1
B143: 7 | C143: of:=VLOOKUP([.$B143];[.$I$71:.$J$81];2;0) -> Мурманск | D143: 8 | E143: 77027 | F143: of:=IF(ISBLANK([.E143]*[.D143]);"0";[.E143]*[.D143]) -> 616216 | G143: of:=COM.MICROSOFT.IFS([.F143]>5000000;[.$N$72];AND([.F143]>=1000000;[.F143]<=5000000);[.$N$73];AND([.F143]<1000000;[.F143]>0);[.$N$74];[.F143]=0;" ") -> В | H143: of:=VLOOKUP([.$B143];[.$I$71:.$L$81];4;0) -> 10
B144: 8 | C144: of:=VLOOKUP([.$B144];[.$I$71:.$J$81];2;0) -> Новосибирск | D144: 5 | E144: 83295 | F144: of:=IF(ISBLANK([.E144]*[.D144]);"0";[.E144]*[.D144]) -> 416475 | G144: of:=COM.MICROSOFT.IFS([.F144]>5000000;[.$N$72];AND([.F144]>=1000000;[.F144]<=5000000);[.$N$73];AND([.F144]<1000000;[.F144]>0);[.$N$74];[.F144]=0;" ") -> В | H144: of:=VLOOKUP([.$B144];[.$I$71:.$L$81];4;0) -> 5
B145: 8 | C145: of:=VLOOKUP([.$B145];[.$I$71:.$J$81];2;0) -> Новосибирск | D145: 76 | E145: 91918 | F145: of:=IF(ISBLANK([.E145]*[.D145]);"0";[.E145]*[.D145]) -> 6985768 | G145: of:=COM.MICROSOFT.IFS([.F145]>5000000;[.$N$72];AND([.F145]>=1000000;[.F145]<=5000000);[.$N$73];AND([.F145]<1000000;[.F145]>0);[.$N$74];[.F145]=0;" ") -> А | H145: of:=VLOOKUP([.$B145];[.$I$71:.$L$81];4;0) -> 5
B146: 2 | C146: of:=VLOOKUP([.$B146];[.$I$71:.$J$81];2;0) -> Санкт-Петербург | D146: 48 | E146: 51832 | F146: of:=IF(ISBLANK([.E146]*[.D146]);"0";[.E146]*[.D146]) -> 2487936 | G146: of:=COM.MICROSOFT.IFS([.F146]>5000000;[.$N$72];AND([.F146]>=1000000;[.F146]<=5000000);[.$N$73];AND([.F146]<1000000;[.F146]>0);[.$N$74];[.F146]=0;" ") -> Б | H146: of:=VLOOKUP([.$B146];[.$I$71:.$L$81];4;0) -> 9
B147: 4 | C147: of:=VLOOKUP([.$B147];[.$I$71:.$J$81];2;0) -> Архангельск | D147: 78 | E147: 10557 | F147: of:=IF(ISBLANK([.E147]*[.D147]);"0";[.E147]*[.D147]) -> 823446 | G147: of:=COM.MICROSOFT.IFS([.F147]>5000000;[.$N$72];AND([.F147]>=1000000;[.F147]<=5000000);[.$N$73];AND([.F147]<1000000;[.F147]>0);[.$N$74];[.F147]=0;" ") -> В | H147: of:=VLOOKUP([.$B147];[.$I$71:.$L$81];4;0) -> 2
B148: 10 | C148: of:=VLOOKUP([.$B148];[.$I$71:.$J$81];2;0) -> Сочи | D148: 69 | E148: 43544 | F148: of:=IF(ISBLANK([.E148]*[.D148]);"0";[.E148]*[.D148]) -> 3004536 | G148: of:=COM.MICROSOFT.IFS([.F148]>5000000;[.$N$72];AND([.F148]>=1000000;[.F148]<=5000000);[.$N$73];AND([.F148]<1000000;[.F148]>0);[.$N$74];[.F148]=0;" ") -> Б | H148: of:=VLOOKUP([.$B148];[.$I$71:.$L$81];4;0) -> 6
B149: 3 | C149: of:=VLOOKUP([.$B149];[.$I$71:.$J$81];2;0) -> Челябинск | D149: 97 | E149: 62405 | F149: of:=IF(ISBLANK([.E149]*[.D149]);"0";[.E149]*[.D149]) -> 6053285 | G149: of:=COM.MICROSOFT.IFS([.F149]>5000000;[.$N$72];AND([.F149]>=1000000;[.F149]<=5000000);[.$N$73];AND([.F149]<1000000;[.F149]>0);[.$N$74];[.F149]=0;" ") -> А | H149: of:=VLOOKUP([.$B149];[.$I$71:.$L$81];4;0) -> 1
B150: 1 | C150: of:=VLOOKUP([.$B150];[.$I$71:.$J$81];2;0) -> Москва | D150: 72 | E150: 17417 | F150: of:=IF(ISBLANK([.E150]*[.D150]);"0";[.E150]*[.D150]) -> 1254024 | G150: of:=COM.MICROSOFT.IFS([.F150]>5000000;[.$N$72];AND([.F150]>=1000000;[.F150]<=5000000);[.$N$73];AND([.F150]<1000000;[.F150]>0);[.$N$74];[.F150]=0;" ") -> Б | H150: of:=VLOOKUP([.$B150];[.$I$71:.$L$81];4;0) -> 8
B151: 1 | C151: of:=VLOOKUP([.$B151];[.$I$71:.$J$81];2;0) -> Москва | D151: 65 | E151: 12408 | F151: of:=IF(ISBLANK([.E151]*[.D151]);"0";[.E151]*[.D151]) -> 806520 | G151: of:=COM.MICROSOFT.IFS([.F151]>5000000;[.$N$72];AND([.F151]>=1000000;[.F151]<=5000000);[.$N$73];AND([.F151]<1000000;[.F151]>0);[.$N$74];[.F151]=0;" ") -> В | H151: of:=VLOOKUP([.$B151];[.$I$71:.$L$81];4;0) -> 8
B152: 7 | C152: of:=VLOOKUP([.$B152];[.$I$71:.$J$81];2;0) -> Мурманск | D152: 51 | E152: 69919 | F152: of:=IF(ISBLANK([.E152]*[.D152]);"0";[.E152]*[.D152]) -> 3565869 | G152: of:=COM.MICROSOFT.IFS([.F152]>5000000;[.$N$72];AND([.F152]>=1000000;[.F152]<=5000000);[.$N$73];AND([.F152]<1000000;[.F152]>0);[.$N$74];[.F152]=0;" ") -> Б | H152: of:=VLOOKUP([.$B152];[.$I$71:.$L$81];4;0) -> 10
B153: 4 | C153: of:=VLOOKUP([.$B153];[.$I$71:.$J$81];2;0) -> Архангельск | D153: 41 | E153: 11244 | F153: of:=IF(ISBLANK([.E153]*[.D153]);"0";[.E153]*[.D153]) -> 461004 | G153: of:=COM.MICROSOFT.IFS([.F153]>5000000;[.$N$72];AND([.F153]>=1000000;[.F153]<=5000000);[.$N$73];AND([.F153]<1000000;[.F153]>0);[.$N$74];[.F153]=0;" ") -> В | H153: of:=VLOOKUP([.$B153];[.$I$71:.$L$81];4;0) -> 2
B154: 7 | C154: of:=VLOOKUP([.$B154];[.$I$71:.$J$81];2;0) -> Мурманск | D154: 92 | E154: 12755 | F154: of:=IF(ISBLANK([.E154]*[.D154]);"0";[.E154]*[.D154]) -> 1173460 | G154: of:=COM.MICROSOFT.IFS([.F154]>5000000;[.$N$72];AND([.F154]>=1000000;[.F154]<=5000000);[.$N$73];AND([.F154]<1000000;[.F154]>0);[.$N$74];[.F154]=0;" ") -> Б | H154: of:=VLOOKUP([.$B154];[.$I$71:.$L$81];4;0) -> 10
B155: 10 | C155: of:=VLOOKUP([.$B155];[.$I$71:.$J$81];2;0) -> Сочи | D155: 72 | E155: 30573 | F155: of:=IF(ISBLANK([.E155]*[.D155]);"0";[.E155]*[.D155]) -> 2201256 | G155: of:=COM.MICROSOFT.IFS([.F155]>5000000;[.$N$72];AND([.F155]>=1000000;[.F155]<=5000000);[.$N$73];AND([.F155]<1000000;[.F155]>0);[.$N$74];[.F155]=0;" ") -> Б | H155: of:=VLOOKUP([.$B155];[.$I$71:.$L$81];4;0) -> 6
B156: 3 | C156: of:=VLOOKUP([.$B156];[.$I$71:.$J$81];2;0) -> Челябинск | D156: 57 | E156: 27631 | F156: of:=IF(ISBLANK([.E156]*[.D156]);"0";[.E156]*[.D156]) -> 1574967 | G156: of:=COM.MICROSOFT.IFS([.F156]>5000000;[.$N$72];AND([.F156]>=1000000;[.F156]<=5000000);[.$N$73];AND([.F156]<1000000;[.F156]>0);[.$N$74];[.F156]=0;" ") -> Б | H156: of:=VLOOKUP([.$B156];[.$I$71:.$L$81];4;0) -> 1
B157: 7 | C157: of:=VLOOKUP([.$B157];[.$I$71:.$J$81];2;0) -> Мурманск | D157: 76 | E157: 27241 | F157: of:=IF(ISBLANK([.E157]*[.D157]);"0";[.E157]*[.D157]) -> 2070316 | G157: of:=COM.MICROSOFT.IFS([.F157]>5000000;[.$N$72];AND([.F157]>=1000000;[.F157]<=5000000);[.$N$73];AND([.F157]<1000000;[.F157]>0);[.$N$74];[.F157]=0;" ") -> Б | H157: of:=VLOOKUP([.$B157];[.$I$71:.$L$81];4;0) -> 10
B158: 6 | C158: of:=VLOOKUP([.$B158];[.$I$71:.$J$81];2;0) -> Владивосток | D158: 61 | E158: 25116 | F158: of:=IF(ISBLANK([.E158]*[.D158]);"0";[.E158]*[.D158]) -> 1532076 | G158: of:=COM.MICROSOFT.IFS([.F158]>5000000;[.$N$72];AND([.F158]>=1000000;[.F158]<=5000000);[.$N$73];AND([.F158]<1000000;[.F158]>0);[.$N$74];[.F158]=0;" ") -> Б | H158: of:=VLOOKUP([.$B158];[.$I$71:.$L$81];4;0) -> 7
B159: 6 | C159: of:=VLOOKUP([.$B159];[.$I$71:.$J$81];2;0) -> Владивосток | D159: 70 | E159: 35183 | F159: of:=IF(ISBLANK([.E159]*[.D159]);"0";[.E159]*[.D159]) -> 2462810 | G159: of:=COM.MICROSOFT.IFS([.F159]>5000000;[.$N$72];AND([.F159]>=1000000;[.F159]<=5000000);[.$N$73];AND([.F159]<1000000;[.F159]>0);[.$N$74];[.F159]=0;" ") -> Б | H159: of:=VLOOKUP([.$B159];[.$I$71:.$L$81];4;0) -> 7
B160: 4 | C160: of:=VLOOKUP([.$B160];[.$I$71:.$J$81];2;0) -> Архангельск | D160: 72 | E160: 12470 | F160: of:=IF(ISBLANK([.E160]*[.D160]);"0";[.E160]*[.D160]) -> 897840 | G160: of:=COM.MICROSOFT.IFS([.F160]>5000000;[.$N$72];AND([.F160]>=1000000;[.F160]<=5000000);[.$N$73];AND([.F160]<1000000;[.F160]>0);[.$N$74];[.F160]=0;" ") -> В | H160: of:=VLOOKUP([.$B160];[.$I$71:.$L$81];4;0) -> 2
B161: 7 | C161: of:=VLOOKUP([.$B161];[.$I$71:.$J$81];2;0) -> Мурманск | D161: 21 | E161: 2459 | F161: of:=IF(ISBLANK([.E161]*[.D161]);"0";[.E161]*[.D161]) -> 51639 | G161: of:=COM.MICROSOFT.IFS([.F161]>5000000;[.$N$72];AND([.F161]>=1000000;[.F161]<=5000000);[.$N$73];AND([.F161]<1000000;[.F161]>0);[.$N$74];[.F161]=0;" ") -> В | H161: of:=VLOOKUP([.$B161];[.$I$71:.$L$81];4;0) -> 10
B162: 7 | C162: of:=VLOOKUP([.$B162];[.$I$71:.$J$81];2;0) -> Мурманск | D162: 77 | E162: 37998 | F162: of:=IF(ISBLANK([.E162]*[.D162]);"0";[.E162]*[.D162]) -> 2925846 | G162: of:=COM.MICROSOFT.IFS([.F162]>5000000;[.$N$72];AND([.F162]>=1000000;[.F162]<=5000000);[.$N$73];AND([.F162]<1000000;[.F162]>0);[.$N$74];[.F162]=0;" ") -> Б | H162: of:=VLOOKUP([.$B162];[.$I$71:.$L$81];4;0) -> 10
B163: 8 | C163: of:=VLOOKUP([.$B163];[.$I$71:.$J$81];2;0) -> Новосибирск | D163: 95 | E163: 7682 | F163: of:=IF(ISBLANK([.E163]*[.D163]);"0";[.E163]*[.D163]) -> 729790 | G163: of:=COM.MICROSOFT.IFS([.F163]>5000000;[.$N$72];AND([.F163]>=1000000;[.F163]<=5000000);[.$N$73];AND([.F163]<1000000;[.F163]>0);[.$N$74];[.F163]=0;" ") -> В | H163: of:=VLOOKUP([.$B163];[.$I$71:.$L$81];4;0) -> 5
B164: 5 | C164: of:=VLOOKUP([.$B164];[.$I$71:.$J$81];2;0) -> Краснодар | D164: 1 | E164: 86296 | F164: of:=IF(ISBLANK([.E164]*[.D164]);"0";[.E164]*[.D164]) -> 86296 | G164: of:=COM.MICROSOFT.IFS([.F164]>5000000;[.$N$72];AND([.F164]>=1000000;[.F164]<=5000000);[.$N$73];AND([.F164]<1000000;[.F164]>0);[.$N$74];[.F164]=0;" ") -> В | H164: of:=VLOOKUP([.$B164];[.$I$71:.$L$81];4;0) -> 4
B165: 7 | C165: of:=VLOOKUP([.$B165];[.$I$71:.$J$81];2;0) -> Мурманск | D165: 47 | E165: 29766 | F165: of:=IF(ISBLANK([.E165]*[.D165]);"0";[.E165]*[.D165]) -> 1399002 | G165: of:=COM.MICROSOFT.IFS([.F165]>5000000;[.$N$72];AND([.F165]>=1000000;[.F165]<=5000000);[.$N$73];AND([.F165]<1000000;[.F165]>0);[.$N$74];[.F165]=0;" ") -> Б | H165: of:=VLOOKUP([.$B165];[.$I$71:.$L$81];4;0) -> 10
B166: 1 | C166: of:=VLOOKUP([.$B166];[.$I$71:.$J$81];2;0) -> Москва | D166: 82 | E166: 26485 | F166: of:=IF(ISBLANK([.E166]*[.D166]);"0";[.E166]*[.D166]) -> 2171770 | G166: of:=COM.MICROSOFT.IFS([.F166]>5000000;[.$N$72];AND([.F166]>=1000000;[.F166]<=5000000);[.$N$73];AND([.F166]<1000000;[.F166]>0);[.$N$74];[.F166]=0;" ") -> Б | H166: of:=VLOOKUP([.$B166];[.$I$71:.$L$81];4;0) -> 8
B167: 8 | C167: of:=VLOOKUP([.$B167];[.$I$71:.$J$81];2;0) -> Новосибирск | D167: 56 | E167: 53748 | F167: of:=IF(ISBLANK([.E167]*[.D167]);"0";[.E167]*[.D167]) -> 3009888 | G167: of:=COM.MICROSOFT.IFS([.F167]>5000000;[.$N$72];AND([.F167]>=1000000;[.F167]<=5000000);[.$N$73];AND([.F167]<1000000;[.F167]>0);[.$N$74];[.F167]=0;" ") -> Б | H167: of:=VLOOKUP([.$B167];[.$I$71:.$L$81];4;0) -> 5
B168: 8 | C168: of:=VLOOKUP([.$B168];[.$I$71:.$J$81];2;0) -> Новосибирск | D168: 20 | E168: 37262 | F168: of:=IF(ISBLANK([.E168]*[.D168]);"0";[.E168]*[.D168]) -> 745240 | G168: of:=COM.MICROSOFT.IFS([.F168]>5000000;[.$N$72];AND([.F168]>=1000000;[.F168]<=5000000);[.$N$73];AND([.F168]<1000000;[.F168]>0);[.$N$74];[.F168]=0;" ") -> В | H168: of:=VLOOKUP([.$B168];[.$I$71:.$L$81];4;0) -> 5
B169: 7 | C169: of:=VLOOKUP([.$B169];[.$I$71:.$J$81];2;0) -> Мурманск | D169: 6 | E169: 33128 | F169: of:=IF(ISBLANK([.E169]*[.D169]);"0";[.E169]*[.D169]) -> 198768 | G169: of:=COM.MICROSOFT.IFS([.F169]>5000000;[.$N$72];AND([.F169]>=1000000;[.F169]<=5000000);[.$N$73];AND([.F169]<1000000;[.F169]>0);[.$N$74];[.F169]=0;" ") -> В | H169: of:=VLOOKUP([.$B169];[.$I$71:.$L$81];4;0) -> 10
B170: 9 | C170: of:=VLOOKUP([.$B170];[.$I$71:.$J$81];2;0) -> Тюмень | D170: 76 | E170: 76366 | F170: of:=IF(ISBLANK([.E170]*[.D170]);"0";[.E170]*[.D170]) -> 5803816 | G170: of:=COM.MICROSOFT.IFS([.F170]>5000000;[.$N$72];AND([.F170]>=1000000;[.F170]<=5000000);[.$N$73];AND([.F170]<1000000;[.F170]>0);[.$N$74];[.F170]=0;" ") -> А | H170: of:=VLOOKUP([.$B170];[.$I$71:.$L$81];4;0) -> 3
B171: 8 | C171: of:=VLOOKUP([.$B171];[.$I$71:.$J$81];2;0) -> Новосибирск | D171: 78 | E171: 45961 | F171: of:=IF(ISBLANK([.E171]*[.D171]);"0";[.E171]*[.D171]) -> 3584958 | G171: of:=COM.MICROSOFT.IFS([.F171]>5000000;[.$N$72];AND([.F171]>=1000000;[.F171]<=5000000);[.$N$73];AND([.F171]<1000000;[.F171]>0);[.$N$74];[.F171]=0;" ") -> Б | H171: of:=VLOOKUP([.$B171];[.$I$71:.$L$81];4;0) -> 5
B172: 1 | C172: of:=VLOOKUP([.$B172];[.$I$71:.$J$81];2;0) -> Москва | D172: 63 | E172: 55811 | F172: of:=IF(ISBLANK([.E172]*[.D172]);"0";[.E172]*[.D172]) -> 3516093 | G172: of:=COM.MICROSOFT.IFS([.F172]>5000000;[.$N$72];AND([.F172]>=1000000;[.F172]<=5000000);[.$N$73];AND([.F172]<1000000;[.F172]>0);[.$N$74];[.F172]=0;" ") -> Б | H172: of:=VLOOKUP([.$B172];[.$I$71:.$L$81];4;0) -> 8
B173: 5 | C173: of:=VLOOKUP([.$B173];[.$I$71:.$J$81];2;0) -> Краснодар | D173: 82 | E173: 16660 | F173: of:=IF(ISBLANK([.E173]*[.D173]);"0";[.E173]*[.D173]) -> 1366120 | G173: of:=COM.MICROSOFT.IFS([.F173]>5000000;[.$N$72];AND([.F173]>=1000000;[.F173]<=5000000);[.$N$73];AND([.F173]<1000000;[.F173]>0);[.$N$74];[.F173]=0;" ") -> Б | H173: of:=VLOOKUP([.$B173];[.$I$71:.$L$81];4;0) -> 4
B174: 6 | C174: of:=VLOOKUP([.$B174];[.$I$71:.$J$81];2;0) -> Владивосток | D174: 71 | E174: 32980 | F174: of:=IF(ISBLANK([.E174]*[.D174]);"0";[.E174]*[.D174]) -> 2341580 | G174: of:=COM.MICROSOFT.IFS([.F174]>5000000;[.$N$72];AND([.F174]>=1000000;[.F174]<=5000000);[.$N$73];AND([.F174]<1000000;[.F174]>0);[.$N$74];[.F174]=0;" ") -> Б | H174: of:=VLOOKUP([.$B174];[.$I$71:.$L$81];4;0) -> 7
B175: 3 | C175: of:=VLOOKUP([.$B175];[.$I$71:.$J$81];2;0) -> Челябинск | D175: 63 | E175: 83233 | F175: of:=IF(ISBLANK([.E175]*[.D175]);"0";[.E175]*[.D175]) -> 5243679 | G175: of:=COM.MICROSOFT.IFS([.F175]>5000000;[.$N$72];AND([.F175]>=1000000;[.F175]<=5000000);[.$N$73];AND([.F175]<1000000;[.F175]>0);[.$N$74];[.F175]=0;" ") -> А | H175: of:=VLOOKUP([.$B175];[.$I$71:.$L$81];4;0) -> 1
B176: 7 | C176: of:=VLOOKUP([.$B176];[.$I$71:.$J$81];2;0) -> Мурманск | D176: 25 | E176: 49402 | F176: of:=IF(ISBLANK([.E176]*[.D176]);"0";[.E176]*[.D176]) -> 1235050 | G176: of:=COM.MICROSOFT.IFS([.F176]>5000000;[.$N$72];AND([.F176]>=1000000;[.F176]<=5000000);[.$N$73];AND([.F176]<1000000;[.F176]>0);[.$N$74];[.F176]=0;" ") -> Б | H176: of:=VLOOKUP([.$B176];[.$I$71:.$L$81];4;0) -> 10
B177: 10 | C177: of:=VLOOKUP([.$B177];[.$I$71:.$J$81];2;0) -> Сочи | D177: 61 | E177: 41422 | F177: of:=IF(ISBLANK([.E177]*[.D177]);"0";[.E177]*[.D177]) -> 2526742 | G177: of:=COM.MICROSOFT.IFS([.F177]>5000000;[.$N$72];AND([.F177]>=1000000;[.F177]<=5000000);[.$N$73];AND([.F177]<1000000;[.F177]>0);[.$N$74];[.F177]=0;" ") -> Б | H177: of:=VLOOKUP([.$B177];[.$I$71:.$L$81];4;0) -> 6
B178: 1 | C178: of:=VLOOKUP([.$B178];[.$I$71:.$J$81];2;0) -> Москва | D178: 52 | E178: 65839 | F178: of:=IF(ISBLANK([.E178]*[.D178]);"0";[.E178]*[.D178]) -> 3423628 | G178: of:=COM.MICROSOFT.IFS([.F178]>5000000;[.$N$72];AND([.F178]>=1000000;[.F178]<=5000000);[.$N$73];AND([.F178]<1000000;[.F178]>0);[.$N$74];[.F178]=0;" ") -> Б | H178: of:=VLOOKUP([.$B178];[.$I$71:.$L$81];4;0) -> 8
B179: 3 | C179: of:=VLOOKUP([.$B179];[.$I$71:.$J$81];2;0) -> Челябинск | D179: 83 | E179: 83971 | F179: of:=IF(ISBLANK([.E179]*[.D179]);"0";[.E179]*[.D179]) -> 6969593 | G179: of:=COM.MICROSOFT.IFS([.F179]>5000000;[.$N$72];AND([.F179]>=1000000;[.F179]<=5000000);[.$N$73];AND([.F179]<1000000;[.F179]>0);[.$N$74];[.F179]=0;" ") -> А | H179: of:=VLOOKUP([.$B179];[.$I$71:.$L$81];4;0) -> 1
B180: 7 | C180: of:=VLOOKUP([.$B180];[.$I$71:.$J$81];2;0) -> Мурманск | D180: 2 | E180: 70998 | F180: of:=IF(ISBLANK([.E180]*[.D180]);"0";[.E180]*[.D180]) -> 141996 | G180: of:=COM.MICROSOFT.IFS([.F180]>5000000;[.$N$72];AND([.F180]>=1000000;[.F180]<=5000000);[.$N$73];AND([.F180]<1000000;[.F180]>0);[.$N$74];[.F180]=0;" ") -> В | H180: of:=VLOOKUP([.$B180];[.$I$71:.$L$81];4;0) -> 10
B181: 4 | C181: of:=VLOOKUP([.$B181];[.$I$71:.$J$81];2;0) -> Архангельск | D181: 45 | E181: 28965 | F181: of:=IF(ISBLANK([.E181]*[.D181]);"0";[.E181]*[.D181]) -> 1303425 | G181: of:=COM.MICROSOFT.IFS([.F181]>5000000;[.$N$72];AND([.F181]>=1000000;[.F181]<=5000000);[.$N$73];AND([.F181]<1000000;[.F181]>0);[.$N$74];[.F181]=0;" ") -> Б | H181: of:=VLOOKUP([.$B181];[.$I$71:.$L$81];4;0) -> 2
B182: 3 | C182: of:=VLOOKUP([.$B182];[.$I$71:.$J$81];2;0) -> Челябинск | D182: 79 | E182: 69979 | F182: of:=IF(ISBLANK([.E182]*[.D182]);"0";[.E182]*[.D182]) -> 5528341 | G182: of:=COM.MICROSOFT.IFS([.F182]>5000000;[.$N$72];AND([.F182]>=1000000;[.F182]<=5000000);[.$N$73];AND([.F182]<1000000;[.F182]>0);[.$N$74];[.F182]=0;" ") -> А | H182: of:=VLOOKUP([.$B182];[.$I$71:.$L$81];4;0) -> 1
B183: 2 | C183: of:=VLOOKUP([.$B183];[.$I$71:.$J$81];2;0) -> Санкт-Петербург | D183: 90 | E183: 97003 | F183: of:=IF(ISBLANK([.E183]*[.D183]);"0";[.E183]*[.D183]) -> 8730270 | G183: of:=COM.MICROSOFT.IFS([.F183]>5000000;[.$N$72];AND([.F183]>=1000000;[.F183]<=5000000);[.$N$73];AND([.F183]<1000000;[.F183]>0);[.$N$74];[.F183]=0;" ") -> А | H183: of:=VLOOKUP([.$B183];[.$I$71:.$L$81];4;0) -> 9
B184: 8 | C184: of:=VLOOKUP([.$B184];[.$I$71:.$J$81];2;0) -> Новосибирск | D184: 43 | E184: 79297 | F184: of:=IF(ISBLANK([.E184]*[.D184]);"0";[.E184]*[.D184]) -> 3409771 | G184: of:=COM.MICROSOFT.IFS([.F184]>5000000;[.$N$72];AND([.F184]>=1000000;[.F184]<=5000000);[.$N$73];AND([.F184]<1000000;[.F184]>0);[.$N$74];[.F184]=0;" ") -> Б | H184: of:=VLOOKUP([.$B184];[.$I$71:.$L$81];4;0) -> 5
B185: 4 | C185: of:=VLOOKUP([.$B185];[.$I$71:.$J$81];2;0) -> Архангельск | D185: 68 | E185: 84626 | F185: of:=IF(ISBLANK([.E185]*[.D185]);"0";[.E185]*[.D185]) -> 5754568 | G185: of:=COM.MICROSOFT.IFS([.F185]>5000000;[.$N$72];AND([.F185]>=1000000;[.F185]<=5000000);[.$N$73];AND([.F185]<1000000;[.F185]>0);[.$N$74];[.F185]=0;" ") -> А | H185: of:=VLOOKUP([.$B185];[.$I$71:.$L$81];4;0) -> 2
B186: 4 | C186: of:=VLOOKUP([.$B186];[.$I$71:.$J$81];2;0) -> Архангельск | D186: 4 | E186: 82070 | F186: of:=IF(ISBLANK([.E186]*[.D186]);"0";[.E186]*[.D186]) -> 328280 | G186: of:=COM.MICROSOFT.IFS([.F186]>5000000;[.$N$72];AND([.F186]>=1000000;[.F186]<=5000000);[.$N$73];AND([.F186]<1000000;[.F186]>0);[.$N$74];[.F186]=0;" ") -> В | H186: of:=VLOOKUP([.$B186];[.$I$71:.$L$81];4;0) -> 2
B187: 5 | C187: of:=VLOOKUP([.$B187];[.$I$71:.$J$81];2;0) -> Краснодар | D187: 56 | E187: 43253 | F187: of:=IF(ISBLANK([.E187]*[.D187]);"0";[.E187]*[.D187]) -> 2422168 | G187: of:=COM.MICROSOFT.IFS([.F187]>5000000;[.$N$72];AND([.F187]>=1000000;[.F187]<=5000000);[.$N$73];AND([.F187]<1000000;[.F187]>0);[.$N$74];[.F187]=0;" ") -> Б | H187: of:=VLOOKUP([.$B187];[.$I$71:.$L$81];4;0) -> 4
B188: 10 | C188: of:=VLOOKUP([.$B188];[.$I$71:.$J$81];2;0) -> Сочи | D188: 33 | E188: 20720 | F188: of:=IF(ISBLANK([.E188]*[.D188]);"0";[.E188]*[.D188]) -> 683760 | G188: of:=COM.MICROSOFT.IFS([.F188]>5000000;[.$N$72];AND([.F188]>=1000000;[.F188]<=5000000);[.$N$73];AND([.F188]<1000000;[.F188]>0);[.$N$74];[.F188]=0;" ") -> В | H188: of:=VLOOKUP([.$B188];[.$I$71:.$L$81];4;0) -> 6
B189: 8 | C189: of:=VLOOKUP([.$B189];[.$I$71:.$J$81];2;0) -> Новосибирск | D189: 50 | E189: 53579 | F189: of:=IF(ISBLANK([.E189]*[.D189]);"0";[.E189]*[.D189]) -> 2678950 | G189: of:=COM.MICROSOFT.IFS([.F189]>5000000;[.$N$72];AND([.F189]>=1000000;[.F189]<=5000000);[.$N$73];AND([.F189]<1000000;[.F189]>0);[.$N$74];[.F189]=0;" ") -> Б | H189: of:=VLOOKUP([.$B189];[.$I$71:.$L$81];4;0) -> 5
B190: 8 | C190: of:=VLOOKUP([.$B190];[.$I$71:.$J$81];2;0) -> Новосибирск | D190: 20 | E190: 28281 | F190: of:=IF(ISBLANK([.E190]*[.D190]);"0";[.E190]*[.D190]) -> 565620 | G190: of:=COM.MICROSOFT.IFS([.F190]>5000000;[.$N$72];AND([.F190]>=1000000;[.F190]<=5000000);[.$N$73];AND([.F190]<1000000;[.F190]>0);[.$N$74];[.F190]=0;" ") -> В | H190: of:=VLOOKUP([.$B190];[.$I$71:.$L$81];4;0) -> 5
B191: 9 | C191: of:=VLOOKUP([.$B191];[.$I$71:.$J$81];2;0) -> Тюмень | D191: 41 | E191: 76157 | F191: of:=IF(ISBLANK([.E191]*[.D191]);"0";[.E191]*[.D191]) -> 3122437 | G191: of:=COM.MICROSOFT.IFS([.F191]>5000000;[.$N$72];AND([.F191]>=1000000;[.F191]<=5000000);[.$N$73];AND([.F191]<1000000;[.F191]>0);[.$N$74];[.F191]=0;" ") -> Б | H191: of:=VLOOKUP([.$B191];[.$I$71:.$L$81];4;0) -> 3
B192: 8 | C192: of:=VLOOKUP([.$B192];[.$I$71:.$J$81];2;0) -> Новосибирск | D192: 5 | E192: 35148 | F192: of:=IF(ISBLANK([.E192]*[.D192]);"0";[.E192]*[.D192]) -> 175740 | G192: of:=COM.MICROSOFT.IFS([.F192]>5000000;[.$N$72];AND([.F192]>=1000000;[.F192]<=5000000);[.$N$73];AND([.F192]<1000000;[.F192]>0);[.$N$74];[.F192]=0;" ") -> В | H192: of:=VLOOKUP([.$B192];[.$I$71:.$L$81];4;0) -> 5
B193: 3 | C193: of:=VLOOKUP([.$B193];[.$I$71:.$J$81];2;0) -> Челябинск | D193: 79 | E193: 91631 | F193: of:=IF(ISBLANK([.E193]*[.D193]);"0";[.E193]*[.D193]) -> 7238849 | G193: of:=COM.MICROSOFT.IFS([.F193]>5000000;[.$N$72];AND([.F193]>=1000000;[.F193]<=5000000);[.$N$73];AND([.F193]<1000000;[.F193]>0);[.$N$74];[.F193]=0;" ") -> А | H193: of:=VLOOKUP([.$B193];[.$I$71:.$L$81];4;0) -> 1
B194: 9 | C194: of:=VLOOKUP([.$B194];[.$I$71:.$J$81];2;0) -> Тюмень | D194: 26 | E194: 90883 | F194: of:=IF(ISBLANK([.E194]*[.D194]);"0";[.E194]*[.D194]) -> 2362958 | G194: of:=COM.MICROSOFT.IFS([.F194]>5000000;[.$N$72];AND([.F194]>=1000000;[.F194]<=5000000);[.$N$73];AND([.F194]<1000000;[.F194]>0);[.$N$74];[.F194]=0;" ") -> Б | H194: of:=VLOOKUP([.$B194];[.$I$71:.$L$81];4;0) -> 3
B195: 9 | C195: of:=VLOOKUP([.$B195];[.$I$71:.$J$81];2;0) -> Тюмень | D195: 76 | E195: 75839 | F195: of:=IF(ISBLANK([.E195]*[.D195]);"0";[.E195]*[.D195]) -> 5763764 | G195: of:=COM.MICROSOFT.IFS([.F195]>5000000;[.$N$72];AND([.F195]>=1000000;[.F195]<=5000000);[.$N$73];AND([.F195]<1000000;[.F195]>0);[.$N$74];[.F195]=0;" ") -> А | H195: of:=VLOOKUP([.$B195];[.$I$71:.$L$81];4;0) -> 3
B196: 2 | C196: of:=VLOOKUP([.$B196];[.$I$71:.$J$81];2;0) -> Санкт-Петербург | D196: 70 | E196: 92395 | F196: of:=IF(ISBLANK([.E196]*[.D196]);"0";[.E196]*[.D196]) -> 6467650 | G196: of:=COM.MICROSOFT.IFS([.F196]>5000000;[.$N$72];AND([.F196]>=1000000;[.F196]<=5000000);[.$N$73];AND([.F196]<1000000;[.F196]>0);[.$N$74];[.F196]=0;" ") -> А | H196: of:=VLOOKUP([.$B196];[.$I$71:.$L$81];4;0) -> 9
B197: 4 | C197: of:=VLOOKUP([.$B197];[.$I$71:.$J$81];2;0) -> Архангельск | D197: 4 | E197: 72763 | F197: of:=IF(ISBLANK([.E197]*[.D197]);"0";[.E197]*[.D197]) -> 291052 | G197: of:=COM.MICROSOFT.IFS([.F197]>5000000;[.$N$72];AND([.F197]>=1000000;[.F197]<=5000000);[.$N$73];AND([.F197]<1000000;[.F197]>0);[.$N$74];[.F197]=0;" ") -> В | H197: of:=VLOOKUP([.$B197];[.$I$71:.$L$81];4;0) -> 2
B198: 9 | C198: of:=VLOOKUP([.$B198];[.$I$71:.$J$81];2;0) -> Тюмень | D198: 25 | E198: 10609 | F198: of:=IF(ISBLANK([.E198]*[.D198]);"0";[.E198]*[.D198]) -> 265225 | G198: of:=COM.MICROSOFT.IFS([.F198]>5000000;[.$N$72];AND([.F198]>=1000000;[.F198]<=5000000);[.$N$73];AND([.F198]<1000000;[.F198]>0);[.$N$74];[.F198]=0;" ") -> В | H198: of:=VLOOKUP([.$B198];[.$I$71:.$L$81];4;0) -> 3
B199: 2 | C199: of:=VLOOKUP([.$B199];[.$I$71:.$J$81];2;0) -> Санкт-Петербург | D199: 82 | E199: 59029 | F199: of:=IF(ISBLANK([.E199]*[.D199]);"0";[.E199]*[.D199]) -> 4840378 | G199: of:=COM.MICROSOFT.IFS([.F199]>5000000;[.$N$72];AND([.F199]>=1000000;[.F199]<=5000000);[.$N$73];AND([.F199]<1000000;[.F199]>0);[.$N$74];[.F199]=0;" ") -> Б | H199: of:=VLOOKUP([.$B199];[.$I$71:.$L$81];4;0) -> 9
B200: 7 | C200: of:=VLOOKUP([.$B200];[.$I$71:.$J$81];2;0) -> Мурманск | D200: 72 | E200: 49455 | F200: of:=IF(ISBLANK([.E200]*[.D200]);"0";[.E200]*[.D200]) -> 3560760 | G200: of:=COM.MICROSOFT.IFS([.F200]>5000000;[.$N$72];AND([.F200]>=1000000;[.F200]<=5000000);[.$N$73];AND([.F200]<1000000;[.F200]>0);[.$N$74];[.F200]=0;" ") -> Б | H200: of:=VLOOKUP([.$B200];[.$I$71:.$L$81];4;0) -> 10
B201: 6 | C201: of:=VLOOKUP([.$B201];[.$I$71:.$J$81];2;0) -> Владивосток | D201: 69 | E201: 11437 | F201: of:=IF(ISBLANK([.E201]*[.D201]);"0";[.E201]*[.D201]) -> 789153 | G201: of:=COM.MICROSOFT.IFS([.F201]>5000000;[.$N$72];AND([.F201]>=1000000;[.F201]<=5000000);[.$N$73];AND([.F201]<1000000;[.F201]>0);[.$N$74];[.F201]=0;" ") -> В | H201: of:=VLOOKUP([.$B201];[.$I$71:.$L$81];4;0) -> 7
B202: 8 | C202: of:=VLOOKUP([.$B202];[.$I$71:.$J$81];2;0) -> Новосибирск | D202: 46 | E202: 96772 | F202: of:=IF(ISBLANK([.E202]*[.D202]);"0";[.E202]*[.D202]) -> 4451512 | G202: of:=COM.MICROSOFT.IFS([.F202]>5000000;[.$N$72];AND([.F202]>=1000000;[.F202]<=5000000);[.$N$73];AND([.F202]<1000000;[.F202]>0);[.$N$74];[.F202]=0;" ") -> Б | H202: of:=VLOOKUP([.$B202];[.$I$71:.$L$81];4;0) -> 5
B203: 8 | C203: of:=VLOOKUP([.$B203];[.$I$71:.$J$81];2;0) -> Новосибирск | D203: 4 | E203: 19740 | F203: of:=IF(ISBLANK([.E203]*[.D203]);"0";[.E203]*[.D203]) -> 78960 | G203: of:=COM.MICROSOFT.IFS([.F203]>5000000;[.$N$72];AND([.F203]>=1000000;[.F203]<=5000000);[.$N$73];AND([.F203]<1000000;[.F203]>0);[.$N$74];[.F203]=0;" ") -> В | H203: of:=VLOOKUP([.$B203];[.$I$71:.$L$81];4;0) -> 5
B204: 8 | C204: of:=VLOOKUP([.$B204];[.$I$71:.$J$81];2;0) -> Новосибирск | D204: 77 | E204: 29480 | F204: of:=IF(ISBLANK([.E204]*[.D204]);"0";[.E204]*[.D204]) -> 2269960 | G204: of:=COM.MICROSOFT.IFS([.F204]>5000000;[.$N$72];AND([.F204]>=1000000;[.F204]<=5000000);[.$N$73];AND([.F204]<1000000;[.F204]>0);[.$N$74];[.F204]=0;" ") -> Б | H204: of:=VLOOKUP([.$B204];[.$I$71:.$L$81];4;0) -> 5
B205: 1 | C205: of:=VLOOKUP([.$B205];[.$I$71:.$J$81];2;0) -> Москва | D205: 59 | E205: 14635 | F205: of:=IF(ISBLANK([.E205]*[.D205]);"0";[.E205]*[.D205]) -> 863465 | G205: of:=COM.MICROSOFT.IFS([.F205]>5000000;[.$N$72];AND([.F205]>=1000000;[.F205]<=5000000);[.$N$73];AND([.F205]<1000000;[.F205]>0);[.$N$74];[.F205]=0;" ") -> В | H205: of:=VLOOKUP([.$B205];[.$I$71:.$L$81];4;0) -> 8
B206: 4 | C206: of:=VLOOKUP([.$B206];[.$I$71:.$J$81];2;0) -> Архангельск | D206: 86 | E206: 84110 | F206: of:=IF(ISBLANK([.E206]*[.D206]);"0";[.E206]*[.D206]) -> 7233460 | G206: of:=COM.MICROSOFT.IFS([.F206]>5000000;[.$N$72];AND([.F206]>=1000000;[.F206]<=5000000);[.$N$73];AND([.F206]<1000000;[.F206]>0);[.$N$74];[.F206]=0;" ") -> А | H206: of:=VLOOKUP([.$B206];[.$I$71:.$L$81];4;0) -> 2
B207: 1 | C207: of:=VLOOKUP([.$B207];[.$I$71:.$J$81];2;0) -> Москва | D207: 83 | E207: 91687 | F207: of:=IF(ISBLANK([.E207]*[.D207]);"0";[.E207]*[.D207]) -> 7610021 | G207: of:=COM.MICROSOFT.IFS([.F207]>5000000;[.$N$72];AND([.F207]>=1000000;[.F207]<=5000000);[.$N$73];AND([.F207]<1000000;[.F207]>0);[.$N$74];[.F207]=0;" ") -> А | H207: of:=VLOOKUP([.$B207];[.$I$71:.$L$81];4;0) -> 8
B208: 2 | C208: of:=VLOOKUP([.$B208];[.$I$71:.$J$81];2;0) -> Санкт-Петербург | D208: 77 | E208: 33516 | F208: of:=IF(ISBLANK([.E208]*[.D208]);"0";[.E208]*[.D208]) -> 2580732 | G208: of:=COM.MICROSOFT.IFS([.F208]>5000000;[.$N$72];AND([.F208]>=1000000;[.F208]<=5000000);[.$N$73];AND([.F208]<1000000;[.F208]>0);[.$N$74];[.F208]=0;" ") -> Б | H208: of:=VLOOKUP([.$B208];[.$I$71:.$L$81];4;0) -> 9
B209: 5 | C209: of:=VLOOKUP([.$B209];[.$I$71:.$J$81];2;0) -> Краснодар | D209: 80 | E209: 60658 | F209: of:=IF(ISBLANK([.E209]*[.D209]);"0";[.E209]*[.D209]) -> 4852640 | G209: of:=COM.MICROSOFT.IFS([.F209]>5000000;[.$N$72];AND([.F209]>=1000000;[.F209]<=5000000);[.$N$73];AND([.F209]<1000000;[.F209]>0);[.$N$74];[.F209]=0;" ") -> Б | H209: of:=VLOOKUP([.$B209];[.$I$71:.$L$81];4;0) -> 4
B210: 5 | C210: of:=VLOOKUP([.$B210];[.$I$71:.$J$81];2;0) -> Краснодар | D210: 82 | E210: 93406 | F210: of:=IF(ISBLANK([.E210]*[.D210]);"0";[.E210]*[.D210]) -> 7659292 | G210: of:=COM.MICROSOFT.IFS([.F210]>5000000;[.$N$72];AND([.F210]>=1000000;[.F210]<=5000000);[.$N$73];AND([.F210]<1000000;[.F210]>0);[.$N$74];[.F210]=0;" ") -> А | H210: of:=VLOOKUP([.$B210];[.$I$71:.$L$81];4;0) -> 4
B211: 10 | C211: of:=VLOOKUP([.$B211];[.$I$71:.$J$81];2;0) -> Сочи | D211: 35 | E211: 42456 | F211: of:=IF(ISBLANK([.E211]*[.D211]);"0";[.E211]*[.D211]) -> 1485960 | G211: of:=COM.MICROSOFT.IFS([.F211]>5000000;[.$N$72];AND([.F211]>=1000000;[.F211]<=5000000);[.$N$73];AND([.F211]<1000000;[.F211]>0);[.$N$74];[.F211]=0;" ") -> Б | H211: of:=VLOOKUP([.$B211];[.$I$71:.$L$81];4;0) -> 6
B212: 2 | C212: of:=VLOOKUP([.$B212];[.$I$71:.$J$81];2;0) -> Санкт-Петербург | D212: 22 | E212: 71985 | F212: of:=IF(ISBLANK([.E212]*[.D212]);"0";[.E212]*[.D212]) -> 1583670 | G212: of:=COM.MICROSOFT.IFS([.F212]>5000000;[.$N$72];AND([.F212]>=1000000;[.F212]<=5000000);[.$N$73];AND([.F212]<1000000;[.F212]>0);[.$N$74];[.F212]=0;" ") -> Б | H212: of:=VLOOKUP([.$B212];[.$I$71:.$L$81];4;0) -> 9
B213: 8 | C213: of:=VLOOKUP([.$B213];[.$I$71:.$J$81];2;0) -> Новосибирск | D213: 61 | E213: 99673 | F213: of:=IF(ISBLANK([.E213]*[.D213]);"0";[.E213]*[.D213]) -> 6080053 | G213: of:=COM.MICROSOFT.IFS([.F213]>5000000;[.$N$72];AND([.F213]>=1000000;[.F213]<=5000000);[.$N$73];AND([.F213]<1000000;[.F213]>0);[.$N$74];[.F213]=0;" ") -> А | H213: of:=VLOOKUP([.$B213];[.$I$71:.$L$81];4;0) -> 5
B214: 7 | C214: of:=VLOOKUP([.$B214];[.$I$71:.$J$81];2;0) -> Мурманск | D214: 7 | E214: 32845 | F214: of:=IF(ISBLANK([.E214]*[.D214]);"0";[.E214]*[.D214]) -> 229915 | G214: of:=COM.MICROSOFT.IFS([.F214]>5000000;[.$N$72];AND([.F214]>=1000000;[.F214]<=5000000);[.$N$73];AND([.F214]<1000000;[.F214]>0);[.$N$74];[.F214]=0;" ") -> В | H214: of:=VLOOKUP([.$B214];[.$I$71:.$L$81];4;0) -> 10
B215: 10 | C215: of:=VLOOKUP([.$B215];[.$I$71:.$J$81];2;0) -> Сочи | D215: 74 | E215: 79432 | F215: of:=IF(ISBLANK([.E215]*[.D215]);"0";[.E215]*[.D215]) -> 5877968 | G215: of:=COM.MICROSOFT.IFS([.F215]>5000000;[.$N$72];AND([.F215]>=1000000;[.F215]<=5000000);[.$N$73];AND([.F215]<1000000;[.F215]>0);[.$N$74];[.F215]=0;" ") -> А | H215: of:=VLOOKUP([.$B215];[.$I$71:.$L$81];4;0) -> 6
B216: 2 | C216: of:=VLOOKUP([.$B216];[.$I$71:.$J$81];2;0) -> Санкт-Петербург | D216: 83 | E216: 23922 | F216: of:=IF(ISBLANK([.E216]*[.D216]);"0";[.E216]*[.D216]) -> 1985526 | G216: of:=COM.MICROSOFT.IFS([.F216]>5000000;[.$N$72];AND([.F216]>=1000000;[.F216]<=5000000);[.$N$73];AND([.F216]<1000000;[.F216]>0);[.$N$74];[.F216]=0;" ") -> Б | H216: of:=VLOOKUP([.$B216];[.$I$71:.$L$81];4;0) -> 9
B217: 7 | C217: of:=VLOOKUP([.$B217];[.$I$71:.$J$81];2;0) -> Мурманск | D217: 78 | E217: 80011 | F217: of:=IF(ISBLANK([.E217]*[.D217]);"0";[.E217]*[.D217]) -> 6240858 | G217: of:=COM.MICROSOFT.IFS([.F217]>5000000;[.$N$72];AND([.F217]>=1000000;[.F217]<=5000000);[.$N$73];AND([.F217]<1000000;[.F217]>0);[.$N$74];[.F217]=0;" ") -> А | H217: of:=VLOOKUP([.$B217];[.$I$71:.$L$81];4;0) -> 10
B218: 6 | C218: of:=VLOOKUP([.$B218];[.$I$71:.$J$81];2;0) -> Владивосток | D218: 92 | E218: 14123 | F218: of:=IF(ISBLANK([.E218]*[.D218]);"0";[.E218]*[.D218]) -> 1299316 | G218: of:=COM.MICROSOFT.IFS([.F218]>5000000;[.$N$72];AND([.F218]>=1000000;[.F218]<=5000000);[.$N$73];AND([.F218]<1000000;[.F218]>0);[.$N$74];[.F218]=0;" ") -> Б | H218: of:=VLOOKUP([.$B218];[.$I$71:.$L$81];4;0) -> 7
B219: 8 | C219: of:=VLOOKUP([.$B219];[.$I$71:.$J$81];2;0) -> Новосибирск | D219: 44 | E219: 96467 | F219: of:=IF(ISBLANK([.E219]*[.D219]);"0";[.E219]*[.D219]) -> 4244548 | G219: of:=COM.MICROSOFT.IFS([.F219]>5000000;[.$N$72];AND([.F219]>=1000000;[.F219]<=5000000);[.$N$73];AND([.F219]<1000000;[.F219]>0);[.$N$74];[.F219]=0;" ") -> Б | H219: of:=VLOOKUP([.$B219];[.$I$71:.$L$81];4;0) -> 5
B220: 5 | C220: of:=VLOOKUP([.$B220];[.$I$71:.$J$81];2;0) -> Краснодар | D220: 25 | E220: 15961 | F220: of:=IF(ISBLANK([.E220]*[.D220]);"0";[.E220]*[.D220]) -> 399025 | G220: of:=COM.MICROSOFT.IFS([.F220]>5000000;[.$N$72];AND([.F220]>=1000000;[.F220]<=5000000);[.$N$73];AND([.F220]<1000000;[.F220]>0);[.$N$74];[.F220]=0;" ") -> В | H220: of:=VLOOKUP([.$B220];[.$I$71:.$L$81];4;0) -> 4
B221: 10 | C221: of:=VLOOKUP([.$B221];[.$I$71:.$J$81];2;0) -> Сочи | D221: 5 | E221: 98214 | F221: of:=IF(ISBLANK([.E221]*[.D221]);"0";[.E221]*[.D221]) -> 491070 | G221: of:=COM.MICROSOFT.IFS([.F221]>5000000;[.$N$72];AND([.F221]>=1000000;[.F221]<=5000000);[.$N$73];AND([.F221]<1000000;[.F221]>0);[.$N$74];[.F221]=0;" ") -> В | H221: of:=VLOOKUP([.$B221];[.$I$71:.$L$81];4;0) -> 6
B222: 3 | C222: of:=VLOOKUP([.$B222];[.$I$71:.$J$81];2;0) -> Челябинск | D222: 63 | E222: 1305 | F222: of:=IF(ISBLANK([.E222]*[.D222]);"0";[.E222]*[.D222]) -> 82215 | G222: of:=COM.MICROSOFT.IFS([.F222]>5000000;[.$N$72];AND([.F222]>=1000000;[.F222]<=5000000);[.$N$73];AND([.F222]<1000000;[.F222]>0);[.$N$74];[.F222]=0;" ") -> В | H222: of:=VLOOKUP([.$B222];[.$I$71:.$L$81];4;0) -> 1
B223: 6 | C223: of:=VLOOKUP([.$B223];[.$I$71:.$J$81];2;0) -> Владивосток | D223: 91 | E223: 34301 | F223: of:=IF(ISBLANK([.E223]*[.D223]);"0";[.E223]*[.D223]) -> 3121391 | G223: of:=COM.MICROSOFT.IFS([.F223]>5000000;[.$N$72];AND([.F223]>=1000000;[.F223]<=5000000);[.$N$73];AND([.F223]<1000000;[.F223]>0);[.$N$74];[.F223]=0;" ") -> Б | H223: of:=VLOOKUP([.$B223];[.$I$71:.$L$81];4;0) -> 7
B224: 5 | C224: of:=VLOOKUP([.$B224];[.$I$71:.$J$81];2;0) -> Краснодар | D224: 27 | E224: 34065 | F224: of:=IF(ISBLANK([.E224]*[.D224]);"0";[.E224]*[.D224]) -> 919755 | G224: of:=COM.MICROSOFT.IFS([.F224]>5000000;[.$N$72];AND([.F224]>=1000000;[.F224]<=5000000);[.$N$73];AND([.F224]<1000000;[.F224]>0);[.$N$74];[.F224]=0;" ") -> В | H224: of:=VLOOKUP([.$B224];[.$I$71:.$L$81];4;0) -> 4
B225: 5 | C225: of:=VLOOKUP([.$B225];[.$I$71:.$J$81];2;0) -> Краснодар | D225: 97 | E225: 78828 | F225: of:=IF(ISBLANK([.E225]*[.D225]);"0";[.E225]*[.D225]) -> 7646316 | G225: of:=COM.MICROSOFT.IFS([.F225]>5000000;[.$N$72];AND([.F225]>=1000000;[.F225]<=5000000);[.$N$73];AND([.F225]<1000000;[.F225]>0);[.$N$74];[.F225]=0;" ") -> А | H225: of:=VLOOKUP([.$B225];[.$I$71:.$L$81];4;0) -> 4
B226: 8 | C226: of:=VLOOKUP([.$B226];[.$I$71:.$J$81];2;0) -> Новосибирск | D226: 22 | E226: 78436 | F226: of:=IF(ISBLANK([.E226]*[.D226]);"0";[.E226]*[.D226]) -> 1725592 | G226: of:=COM.MICROSOFT.IFS([.F226]>5000000;[.$N$72];AND([.F226]>=1000000;[.F226]<=5000000);[.$N$73];AND([.F226]<1000000;[.F226]>0);[.$N$74];[.F226]=0;" ") -> Б | H226: of:=VLOOKUP([.$B226];[.$I$71:.$L$81];4;0) -> 5
B227: 1 | C227: of:=VLOOKUP([.$B227];[.$I$71:.$J$81];2;0) -> Москва | D227: 43 | E227: 67739 | F227: of:=IF(ISBLANK([.E227]*[.D227]);"0";[.E227]*[.D227]) -> 2912777 | G227: of:=COM.MICROSOFT.IFS([.F227]>5000000;[.$N$72];AND([.F227]>=1000000;[.F227]<=5000000);[.$N$73];AND([.F227]<1000000;[.F227]>0);[.$N$74];[.F227]=0;" ") -> Б | H227: of:=VLOOKUP([.$B227];[.$I$71:.$L$81];4;0) -> 8
B228: 8 | C228: of:=VLOOKUP([.$B228];[.$I$71:.$J$81];2;0) -> Новосибирск | D228: 6 | E228: 55013 | F228: of:=IF(ISBLANK([.E228]*[.D228]);"0";[.E228]*[.D228]) -> 330078 | G228: of:=COM.MICROSOFT.IFS([.F228]>5000000;[.$N$72];AND([.F228]>=1000000;[.F228]<=5000000);[.$N$73];AND([.F228]<1000000;[.F228]>0);[.$N$74];[.F228]=0;" ") -> В | H228: of:=VLOOKUP([.$B228];[.$I$71:.$L$81];4;0) -> 5
B229: 10 | C229: of:=VLOOKUP([.$B229];[.$I$71:.$J$81];2;0) -> Сочи | D229: 80 | E229: 72955 | F229: of:=IF(ISBLANK([.E229]*[.D229]);"0";[.E229]*[.D229]) -> 5836400 | G229: of:=COM.MICROSOFT.IFS([.F229]>5000000;[.$N$72];AND([.F229]>=1000000;[.F229]<=5000000);[.$N$73];AND([.F229]<1000000;[.F229]>0);[.$N$74];[.F229]=0;" ") -> А | H229: of:=VLOOKUP([.$B229];[.$I$71:.$L$81];4;0) -> 6
B230: 4 | C230: of:=VLOOKUP([.$B230];[.$I$71:.$J$81];2;0) -> Архангельск | D230: 36 | E230: 48899 | F230: of:=IF(ISBLANK([.E230]*[.D230]);"0";[.E230]*[.D230]) -> 1760364 | G230: of:=COM.MICROSOFT.IFS([.F230]>5000000;[.$N$72];AND([.F230]>=1000000;[.F230]<=5000000);[.$N$73];AND([.F230]<1000000;[.F230]>0);[.$N$74];[.F230]=0;" ") -> Б | H230: of:=VLOOKUP([.$B230];[.$I$71:.$L$81];4;0) -> 2
B231: 9 | C231: of:=VLOOKUP([.$B231];[.$I$71:.$J$81];2;0) -> Тюмень | D231: 30 | E231: 25566 | F231: of:=IF(ISBLANK([.E231]*[.D231]);"0";[.E231]*[.D231]) -> 766980 | G231: of:=COM.MICROSOFT.IFS([.F231]>5000000;[.$N$72];AND([.F231]>=1000000;[.F231]<=5000000);[.$N$73];AND([.F231]<1000000;[.F231]>0);[.$N$74];[.F231]=0;" ") -> В | H231: of:=VLOOKUP([.$B231];[.$I$71:.$L$81];4;0) -> 3
B232: 10 | C232: of:=VLOOKUP([.$B232];[.$I$71:.$J$81];2;0) -> Сочи | D232: 78 | E232: 4631 | F232: of:=IF(ISBLANK([.E232]*[.D232]);"0";[.E232]*[.D232]) -> 361218 | G232: of:=COM.MICROSOFT.IFS([.F232]>5000000;[.$N$72];AND([.F232]>=1000000;[.F232]<=5000000);[.$N$73];AND([.F232]<1000000;[.F232]>0);[.$N$74];[.F232]=0;" ") -> В | H232: of:=VLOOKUP([.$B232];[.$I$71:.$L$81];4;0) -> 6
B233: 4 | C233: of:=VLOOKUP([.$B233];[.$I$71:.$J$81];2;0) -> Архангельск | D233: 91 | E233: 86547 | F233: of:=IF(ISBLANK([.E233]*[.D233]);"0";[.E233]*[.D233]) -> 7875777 | G233: of:=COM.MICROSOFT.IFS([.F233]>5000000;[.$N$72];AND([.F233]>=1000000;[.F233]<=5000000);[.$N$73];AND([.F233]<1000000;[.F233]>0);[.$N$74];[.F233]=0;" ") -> А | H233: of:=VLOOKUP([.$B233];[.$I$71:.$L$81];4;0) -> 2
B234: 9 | C234: of:=VLOOKUP([.$B234];[.$I$71:.$J$81];2;0) -> Тюмень | D234: 59 | E234: 49527 | F234: of:=IF(ISBLANK([.E234]*[.D234]);"0";[.E234]*[.D234]) -> 2922093 | G234: of:=COM.MICROSOFT.IFS([.F234]>5000000;[.$N$72];AND([.F234]>=1000000;[.F234]<=5000000);[.$N$73];AND([.F234]<1000000;[.F234]>0);[.$N$74];[.F234]=0;" ") -> Б | H234: of:=VLOOKUP([.$B234];[.$I$71:.$L$81];4;0) -> 3
B235: 6 | C235: of:=VLOOKUP([.$B235];[.$I$71:.$J$81];2;0) -> Владивосток | D235: 23 | E235: 23224 | F235: of:=IF(ISBLANK([.E235]*[.D235]);"0";[.E235]*[.D235]) -> 534152 | G235: of:=COM.MICROSOFT.IFS([.F235]>5000000;[.$N$72];AND([.F235]>=1000000;[.F235]<=5000000);[.$N$73];AND([.F235]<1000000;[.F235]>0);[.$N$74];[.F235]=0;" ") -> В | H235: of:=VLOOKUP([.$B235];[.$I$71:.$L$81];4;0) -> 7
B236: 6 | C236: of:=VLOOKUP([.$B236];[.$I$71:.$J$81];2;0) -> Владивосток | D236: 38 | E236: 37785 | F236: of:=IF(ISBLANK([.E236]*[.D236]);"0";[.E236]*[.D236]) -> 1435830 | G236: of:=COM.MICROSOFT.IFS([.F236]>5000000;[.$N$72];AND([.F236]>=1000000;[.F236]<=5000000);[.$N$73];AND([.F236]<1000000;[.F236]>0);[.$N$74];[.F236]=0;" ") -> Б | H236: of:=VLOOKUP([.$B236];[.$I$71:.$L$81];4;0) -> 7
B237: 6 | C237: of:=VLOOKUP([.$B237];[.$I$71:.$J$81];2;0) -> Владивосток | D237: 18 | E237: 32453 | F237: of:=IF(ISBLANK([.E237]*[.D237]);"0";[.E237]*[.D237]) -> 584154 | G237: of:=COM.MICROSOFT.IFS([.F237]>5000000;[.$N$72];AND([.F237]>=1000000;[.F237]<=5000000);[.$N$73];AND([.F237]<1000000;[.F237]>0);[.$N$74];[.F237]=0;" ") -> В | H237: of:=VLOOKUP([.$B237];[.$I$71:.$L$81];4;0) -> 7
B238: 4 | C238: of:=VLOOKUP([.$B238];[.$I$71:.$J$81];2;0) -> Архангельск | D238: 77 | E238: 1458 | F238: of:=IF(ISBLANK([.E238]*[.D238]);"0";[.E238]*[.D238]) -> 112266 | G238: of:=COM.MICROSOFT.IFS([.F238]>5000000;[.$N$72];AND([.F238]>=1000000;[.F238]<=5000000);[.$N$73];AND([.F238]<1000000;[.F238]>0);[.$N$74];[.F238]=0;" ") -> В | H238: of:=VLOOKUP([.$B238];[.$I$71:.$L$81];4;0) -> 2
B239: 4 | C239: of:=VLOOKUP([.$B239];[.$I$71:.$J$81];2;0) -> Архангельск | D239: 95 | E239: 31231 | F239: of:=IF(ISBLANK([.E239]*[.D239]);"0";[.E239]*[.D239]) -> 2966945 | G239: of:=COM.MICROSOFT.IFS([.F239]>5000000;[.$N$72];AND([.F239]>=1000000;[.F239]<=5000000);[.$N$73];AND([.F239]<1000000;[.F239]>0);[.$N$74];[.F239]=0;" ") -> Б | H239: of:=VLOOKUP([.$B239];[.$I$71:.$L$81];4;0) -> 2
B240: 6 | C240: of:=VLOOKUP([.$B240];[.$I$71:.$J$81];2;0) -> Владивосток | D240: 74 | E240: 51105 | F240: of:=IF(ISBLANK([.E240]*[.D240]);"0";[.E240]*[.D240]) -> 3781770 | G240: of:=COM.MICROSOFT.IFS([.F240]>5000000;[.$N$72];AND([.F240]>=1000000;[.F240]<=5000000);[.$N$73];AND([.F240]<1000000;[.F240]>0);[.$N$74];[.F240]=0;" ") -> Б | H240: of:=VLOOKUP([.$B240];[.$I$71:.$L$81];4;0) -> 7
B241: 7 | C241: of:=VLOOKUP([.$B241];[.$I$71:.$J$81];2;0) -> Мурманск | D241: 85 | E241: 4216 | F241: of:=IF(ISBLANK([.E241]*[.D241]);"0";[.E241]*[.D241]) -> 358360 | G241: of:=COM.MICROSOFT.IFS([.F241]>5000000;[.$N$72];AND([.F241]>=1000000;[.F241]<=5000000);[.$N$73];AND([.F241]<1000000;[.F241]>0);[.$N$74];[.F241]=0;" ") -> В | H241: of:=VLOOKUP([.$B241];[.$I$71:.$L$81];4;0) -> 10
B242: 8 | C242: of:=VLOOKUP([.$B242];[.$I$71:.$J$81];2;0) -> Новосибирск | D242: 78 | E242: 75751 | F242: of:=IF(ISBLANK([.E242]*[.D242]);"0";[.E242]*[.D242]) -> 5908578 | G242: of:=COM.MICROSOFT.IFS([.F242]>5000000;[.$N$72];AND([.F242]>=1000000;[.F242]<=5000000);[.$N$73];AND([.F242]<1000000;[.F242]>0);[.$N$74];[.F242]=0;" ") -> А | H242: of:=VLOOKUP([.$B242];[.$I$71:.$L$81];4;0) -> 5
B243: 2 | C243: of:=VLOOKUP([.$B243];[.$I$71:.$J$81];2;0) -> Санкт-Петербург | D243: 11 | E243: 62357 | F243: of:=IF(ISBLANK([.E243]*[.D243]);"0";[.E243]*[.D243]) -> 685927 | G243: of:=COM.MICROSOFT.IFS([.F243]>5000000;[.$N$72];AND([.F243]>=1000000;[.F243]<=5000000);[.$N$73];AND([.F243]<1000000;[.F243]>0);[.$N$74];[.F243]=0;" ") -> В | H243: of:=VLOOKUP([.$B243];[.$I$71:.$L$81];4;0) -> 9
B244: 4 | C244: of:=VLOOKUP([.$B244];[.$I$71:.$J$81];2;0) -> Архангельск | D244: 94 | E244: 12474 | F244: of:=IF(ISBLANK([.E244]*[.D244]);"0";[.E244]*[.D244]) -> 1172556 | G244: of:=COM.MICROSOFT.IFS([.F244]>5000000;[.$N$72];AND([.F244]>=1000000;[.F244]<=5000000);[.$N$73];AND([.F244]<1000000;[.F244]>0);[.$N$74];[.F244]=0;" ") -> Б | H244: of:=VLOOKUP([.$B244];[.$I$71:.$L$81];4;0) -> 2
B245: 6 | C245: of:=VLOOKUP([.$B245];[.$I$71:.$J$81];2;0) -> Владивосток | D245: 48 | E245: 79623 | F245: of:=IF(ISBLANK([.E245]*[.D245]);"0";[.E245]*[.D245]) -> 3821904 | G245: of:=COM.MICROSOFT.IFS([.F245]>5000000;[.$N$72];AND([.F245]>=1000000;[.F245]<=5000000);[.$N$73];AND([.F245]<1000000;[.F245]>0);[.$N$74];[.F245]=0;" ") -> Б | H245: of:=VLOOKUP([.$B245];[.$I$71:.$L$81];4;0) -> 7
B246: 3 | C246: of:=VLOOKUP([.$B246];[.$I$71:.$J$81];2;0) -> Челябинск | D246: 48 | E246: 94737 | F246: of:=IF(ISBLANK([.E246]*[.D246]);"0";[.E246]*[.D246]) -> 4547376 | G246: of:=COM.MICROSOFT.IFS([.F246]>5000000;[.$N$72];AND([.F246]>=1000000;[.F246]<=5000000);[.$N$73];AND([.F246]<1000000;[.F246]>0);[.$N$74];[.F246]=0;" ") -> Б | H246: of:=VLOOKUP([.$B246];[.$I$71:.$L$81];4;0) -> 1
B247: 7 | C247: of:=VLOOKUP([.$B247];[.$I$71:.$J$81];2;0) -> Мурманск | D247: 45 | E247: 86538 | F247: of:=IF(ISBLANK([.E247]*[.D247]);"0";[.E247]*[.D247]) -> 3894210 | G247: of:=COM.MICROSOFT.IFS([.F247]>5000000;[.$N$72];AND([.F247]>=1000000;[.F247]<=5000000);[.$N$73];AND([.F247]<1000000;[.F247]>0);[.$N$74];[.F247]=0;" ") -> Б | H247: of:=VLOOKUP([.$B247];[.$I$71:.$L$81];4;0) -> 10
B248: 2 | C248: of:=VLOOKUP([.$B248];[.$I$71:.$J$81];2;0) -> Санкт-Петербург | D248: 84 | E248: 18266 | F248: of:=IF(ISBLANK([.E248]*[.D248]);"0";[.E248]*[.D248]) -> 1534344 | G248: of:=COM.MICROSOFT.IFS([.F248]>5000000;[.$N$72];AND([.F248]>=1000000;[.F248]<=5000000);[.$N$73];AND([.F248]<1000000;[.F248]>0);[.$N$74];[.F248]=0;" ") -> Б | H248: of:=VLOOKUP([.$B248];[.$I$71:.$L$81];4;0) -> 9
B249: 8 | C249: of:=VLOOKUP([.$B249];[.$I$71:.$J$81];2;0) -> Новосибирск | D249: 25 | E249: 49994 | F249: of:=IF(ISBLANK([.E249]*[.D249]);"0";[.E249]*[.D249]) -> 1249850 | G249: of:=COM.MICROSOFT.IFS([.F249]>5000000;[.$N$72];AND([.F249]>=1000000;[.F249]<=5000000);[.$N$73];AND([.F249]<1000000;[.F249]>0);[.$N$74];[.F249]=0;" ") -> Б | H249: of:=VLOOKUP([.$B249];[.$I$71:.$L$81];4;0) -> 5
B250: 7 | C250: of:=VLOOKUP([.$B250];[.$I$71:.$J$81];2;0) -> Мурманск | D250: 93 | E250: 47134 | F250: of:=IF(ISBLANK([.E250]*[.D250]);"0";[.E250]*[.D250]) -> 4383462 | G250: of:=COM.MICROSOFT.IFS([.F250]>5000000;[.$N$72];AND([.F250]>=1000000;[.F250]<=5000000);[.$N$73];AND([.F250]<1000000;[.F250]>0);[.$N$74];[.F250]=0;" ") -> Б | H250: of:=VLOOKUP([.$B250];[.$I$71:.$L$81];4;0) -> 10
B251: 7 | C251: of:=VLOOKUP([.$B251];[.$I$71:.$J$81];2;0) -> Мурманск | D251: 14 | E251: 69557 | F251: of:=IF(ISBLANK([.E251]*[.D251]);"0";[.E251]*[.D251]) -> 973798 | G251: of:=COM.MICROSOFT.IFS([.F251]>5000000;[.$N$72];AND([.F251]>=1000000;[.F251]<=5000000);[.$N$73];AND([.F251]<1000000;[.F251]>0);[.$N$74];[.F251]=0;" ") -> В | H251: of:=VLOOKUP([.$B251];[.$I$71:.$L$81];4;0) -> 10
B252: 5 | C252: of:=VLOOKUP([.$B252];[.$I$71:.$J$81];2;0) -> Краснодар | D252: 98 | E252: 78323 | F252: of:=IF(ISBLANK([.E252]*[.D252]);"0";[.E252]*[.D252]) -> 7675654 | G252: of:=COM.MICROSOFT.IFS([.F252]>5000000;[.$N$72];AND([.F252]>=1000000;[.F252]<=5000000);[.$N$73];AND([.F252]<1000000;[.F252]>0);[.$N$74];[.F252]=0;" ") -> А | H252: of:=VLOOKUP([.$B252];[.$I$71:.$L$81];4;0) -> 4
B253: 2 | C253: of:=VLOOKUP([.$B253];[.$I$71:.$J$81];2;0) -> Санкт-Петербург | D253: 45 | E253: 65239 | F253: of:=IF(ISBLANK([.E253]*[.D253]);"0";[.E253]*[.D253]) -> 2935755 | G253: of:=COM.MICROSOFT.IFS([.F253]>5000000;[.$N$72];AND([.F253]>=1000000;[.F253]<=5000000);[.$N$73];AND([.F253]<1000000;[.F253]>0);[.$N$74];[.F253]=0;" ") -> Б | H253: of:=VLOOKUP([.$B253];[.$I$71:.$L$81];4;0) -> 9
B254: 10 | C254: of:=VLOOKUP([.$B254];[.$I$71:.$J$81];2;0) -> Сочи | D254: 78 | E254: 33908 | F254: of:=IF(ISBLANK([.E254]*[.D254]);"0";[.E254]*[.D254]) -> 2644824 | G254: of:=COM.MICROSOFT.IFS([.F254]>5000000;[.$N$72];AND([.F254]>=1000000;[.F254]<=5000000);[.$N$73];AND([.F254]<1000000;[.F254]>0);[.$N$74];[.F254]=0;" ") -> Б | H254: of:=VLOOKUP([.$B254];[.$I$71:.$L$81];4;0) -> 6
B255: 8 | C255: of:=VLOOKUP([.$B255];[.$I$71:.$J$81];2;0) -> Новосибирск | D255: 48 | E255: 36458 | F255: of:=IF(ISBLANK([.E255]*[.D255]);"0";[.E255]*[.D255]) -> 1749984 | G255: of:=COM.MICROSOFT.IFS([.F255]>5000000;[.$N$72];AND([.F255]>=1000000;[.F255]<=5000000);[.$N$73];AND([.F255]<1000000;[.F255]>0);[.$N$74];[.F255]=0;" ") -> Б | H255: of:=VLOOKUP([.$B255];[.$I$71:.$L$81];4;0) -> 5
B256: 6 | C256: of:=VLOOKUP([.$B256];[.$I$71:.$J$81];2;0) -> Владивосток | D256: 54 | E256: 24693 | F256: of:=IF(ISBLANK([.E256]*[.D256]);"0";[.E256]*[.D256]) -> 1333422 | G256: of:=COM.MICROSOFT.IFS([.F256]>5000000;[.$N$72];AND([.F256]>=1000000;[.F256]<=5000000);[.$N$73];AND([.F256]<1000000;[.F256]>0);[.$N$74];[.F256]=0;" ") -> Б | H256: of:=VLOOKUP([.$B256];[.$I$71:.$L$81];4;0) -> 7
B257: 7 | C257: of:=VLOOKUP([.$B257];[.$I$71:.$J$81];2;0) -> Мурманск | D257: 27 | E257: 16646 | F257: of:=IF(ISBLANK([.E257]*[.D257]);"0";[.E257]*[.D257]) -> 449442 | G257: of:=COM.MICROSOFT.IFS([.F257]>5000000;[.$N$72];AND([.F257]>=1000000;[.F257]<=5000000);[.$N$73];AND([.F257]<1000000;[.F257]>0);[.$N$74];[.F257]=0;" ") -> В | H257: of:=VLOOKUP([.$B257];[.$I$71:.$L$81];4;0) -> 10
B258: 8 | C258: of:=VLOOKUP([.$B258];[.$I$71:.$J$81];2;0) -> Новосибирск | D258: 4 | E258: 40877 | F258: of:=IF(ISBLANK([.E258]*[.D258]);"0";[.E258]*[.D258]) -> 163508 | G258: of:=COM.MICROSOFT.IFS([.F258]>5000000;[.$N$72];AND([.F258]>=1000000;[.F258]<=5000000);[.$N$73];AND([.F258]<1000000;[.F258]>0);[.$N$74];[.F258]=0;" ") -> В | H258: of:=VLOOKUP([.$B258];[.$I$71:.$L$81];4;0) -> 5
B259: 3 | C259: of:=VLOOKUP([.$B259];[.$I$71:.$J$81];2;0) -> Челябинск | D259: 74 | E259: 60727 | F259: of:=IF(ISBLANK([.E259]*[.D259]);"0";[.E259]*[.D259]) -> 4493798 | G259: of:=COM.MICROSOFT.IFS([.F259]>5000000;[.$N$72];AND([.F259]>=1000000;[.F259]<=5000000);[.$N$73];AND([.F259]<1000000;[.F259]>0);[.$N$74];[.F259]=0;" ") -> Б | H259: of:=VLOOKUP([.$B259];[.$I$71:.$L$81];4;0) -> 1
B260: 8 | C260: of:=VLOOKUP([.$B260];[.$I$71:.$J$81];2;0) -> Новосибирск | D260: 78 | E260: 39117 | F260: of:=IF(ISBLANK([.E260]*[.D260]);"0";[.E260]*[.D260]) -> 3051126 | G260: of:=COM.MICROSOFT.IFS([.F260]>5000000;[.$N$72];AND([.F260]>=1000000;[.F260]<=5000000);[.$N$73];AND([.F260]<1000000;[.F260]>0);[.$N$74];[.F260]=0;" ") -> Б | H260: of:=VLOOKUP([.$B260];[.$I$71:.$L$81];4;0) -> 5
B261: 5 | C261: of:=VLOOKUP([.$B261];[.$I$71:.$J$81];2;0) -> Краснодар | D261: 79 | E261: 33436 | F261: of:=IF(ISBLANK([.E261]*[.D261]);"0";[.E261]*[.D261]) -> 2641444 | G261: of:=COM.MICROSOFT.IFS([.F261]>5000000;[.$N$72];AND([.F261]>=1000000;[.F261]<=5000000);[.$N$73];AND([.F261]<1000000;[.F261]>0);[.$N$74];[.F261]=0;" ") -> Б | H261: of:=VLOOKUP([.$B261];[.$I$71:.$L$81];4;0) -> 4
B262: 5 | C262: of:=VLOOKUP([.$B262];[.$I$71:.$J$81];2;0) -> Краснодар | D262: 5 | E262: 33072 | F262: of:=IF(ISBLANK([.E262]*[.D262]);"0";[.E262]*[.D262]) -> 165360 | G262: of:=COM.MICROSOFT.IFS([.F262]>5000000;[.$N$72];AND([.F262]>=1000000;[.F262]<=5000000);[.$N$73];AND([.F262]<1000000;[.F262]>0);[.$N$74];[.F262]=0;" ") -> В | H262: of:=VLOOKUP([.$B262];[.$I$71:.$L$81];4;0) -> 4
B263: 2 | C263: of:=VLOOKUP([.$B263];[.$I$71:.$J$81];2;0) -> Санкт-Петербург | D263: 31 | E263: 80203 | F263: of:=IF(ISBLANK([.E263]*[.D263]);"0";[.E263]*[.D263]) -> 2486293 | G263: of:=COM.MICROSOFT.IFS([.F263]>5000000;[.$N$72];AND([.F263]>=1000000;[.F263]<=5000000);[.$N$73];AND([.F263]<1000000;[.F263]>0);[.$N$74];[.F263]=0;" ") -> Б | H263: of:=VLOOKUP([.$B263];[.$I$71:.$L$81];4;0) -> 9
B264: 9 | C264: of:=VLOOKUP([.$B264];[.$I$71:.$J$81];2;0) -> Тюмень | D264: 54 | E264: 17260 | F264: of:=IF(ISBLANK([.E264]*[.D264]);"0";[.E264]*[.D264]) -> 932040 | G264: of:=COM.MICROSOFT.IFS([.F264]>5000000;[.$N$72];AND([.F264]>=1000000;[.F264]<=5000000);[.$N$73];AND([.F264]<1000000;[.F264]>0);[.$N$74];[.F264]=0;" ") -> В | H264: of:=VLOOKUP([.$B264];[.$I$71:.$L$81];4;0) -> 3
B265: 9 | C265: of:=VLOOKUP([.$B265];[.$I$71:.$J$81];2;0) -> Тюмень | D265: 26 | E265: 14051 | F265: of:=IF(ISBLANK([.E265]*[.D265]);"0";[.E265]*[.D265]) -> 365326 | G265: of:=COM.MICROSOFT.IFS([.F265]>5000000;[.$N$72];AND([.F265]>=1000000;[.F265]<=5000000);[.$N$73];AND([.F265]<1000000;[.F265]>0);[.$N$74];[.F265]=0;" ") -> В | H265: of:=VLOOKUP([.$B265];[.$I$71:.$L$81];4;0) -> 3
B266: 5 | C266: of:=VLOOKUP([.$B266];[.$I$71:.$J$81];2;0) -> Краснодар | D266: 58 | E266: 73849 | F266: of:=IF(ISBLANK([.E266]*[.D266]);"0";[.E266]*[.D266]) -> 4283242 | G266: of:=COM.MICROSOFT.IFS([.F266]>5000000;[.$N$72];AND([.F266]>=1000000;[.F266]<=5000000);[.$N$73];AND([.F266]<1000000;[.F266]>0);[.$N$74];[.F266]=0;" ") -> Б | H266: of:=VLOOKUP([.$B266];[.$I$71:.$L$81];4;0) -> 4
B267: 9 | C267: of:=VLOOKUP([.$B267];[.$I$71:.$J$81];2;0) -> Тюмень | D267: 13 | E267: 34756 | F267: of:=IF(ISBLANK([.E267]*[.D267]);"0";[.E267]*[.D267]) -> 451828 | G267: of:=COM.MICROSOFT.IFS([.F267]>5000000;[.$N$72];AND([.F267]>=1000000;[.F267]<=5000000);[.$N$73];AND([.F267]<1000000;[.F267]>0);[.$N$74];[.F267]=0;" ") -> В | H267: of:=VLOOKUP([.$B267];[.$I$71:.$L$81];4;0) -> 3
B268: 1 | C268: of:=VLOOKUP([.$B268];[.$I$71:.$J$81];2;0) -> Москва | D268: 12 | E268: 46694 | F268: of:=IF(ISBLANK([.E268]*[.D268]);"0";[.E268]*[.D268]) -> 560328 | G268: of:=COM.MICROSOFT.IFS([.F268]>5000000;[.$N$72];AND([.F268]>=1000000;[.F268]<=5000000);[.$N$73];AND([.F268]<1000000;[.F268]>0);[.$N$74];[.F268]=0;" ") -> В | H268: of:=VLOOKUP([.$B268];[.$I$71:.$L$81];4;0) -> 8
B269: 2 | C269: of:=VLOOKUP([.$B269];[.$I$71:.$J$81];2;0) -> Санкт-Петербург | D269: 63 | E269: 73208 | F269: of:=IF(ISBLANK([.E269]*[.D269]);"0";[.E269]*[.D269]) -> 4612104 | G269: of:=COM.MICROSOFT.IFS([.F269]>5000000;[.$N$72];AND([.F269]>=1000000;[.F269]<=5000000);[.$N$73];AND([.F269]<1000000;[.F269]>0);[.$N$74];[.F269]=0;" ") -> Б | H269: of:=VLOOKUP([.$B269];[.$I$71:.$L$81];4;0) -> 9
B270: 5 | C270: of:=VLOOKUP([.$B270];[.$I$71:.$J$81];2;0) -> Краснодар | D270: 37 | E270: 72746 | F270: of:=IF(ISBLANK([.E270]*[.D270]);"0";[.E270]*[.D270]) -> 2691602 | G270: of:=COM.MICROSOFT.IFS([.F270]>5000000;[.$N$72];AND([.F270]>=1000000;[.F270]<=5000000);[.$N$73];AND([.F270]<1000000;[.F270]>0);[.$N$74];[.F270]=0;" ") -> Б | H270: of:=VLOOKUP([.$B270];[.$I$71:.$L$81];4;0) -> 4
B271: 4 | C271: of:=VLOOKUP([.$B271];[.$I$71:.$J$81];2;0) -> Архангельск | D271: 28 | E271: 28712 | F271: of:=IF(ISBLANK([.E271]*[.D271]);"0";[.E271]*[.D271]) -> 803936 | G271: of:=COM.MICROSOFT.IFS([.F271]>5000000;[.$N$72];AND([.F271]>=1000000;[.F271]<=5000000);[.$N$73];AND([.F271]<1000000;[.F271]>0);[.$N$74];[.F271]=0;" ") -> В | H271: of:=VLOOKUP([.$B271];[.$I$71:.$L$81];4;0) -> 2
B272: 9 | C272: of:=VLOOKUP([.$B272];[.$I$71:.$J$81];2;0) -> Тюмень | D272: 33 | E272: 18638 | F272: of:=IF(ISBLANK([.E272]*[.D272]);"0";[.E272]*[.D272]) -> 615054 | G272: of:=COM.MICROSOFT.IFS([.F272]>5000000;[.$N$72];AND([.F272]>=1000000;[.F272]<=5000000);[.$N$73];AND([.F272]<1000000;[.F272]>0);[.$N$74];[.F272]=0;" ") -> В | H272: of:=VLOOKUP([.$B272];[.$I$71:.$L$81];4;0) -> 3
B273: 3 | C273: of:=VLOOKUP([.$B273];[.$I$71:.$J$81];2;0) -> Челябинск | D273: 29 | E273: 23693 | F273: of:=IF(ISBLANK([.E273]*[.D273]);"0";[.E273]*[.D273]) -> 687097 | G273: of:=COM.MICROSOFT.IFS([.F273]>5000000;[.$N$72];AND([.F273]>=1000000;[.F273]<=5000000);[.$N$73];AND([.F273]<1000000;[.F273]>0);[.$N$74];[.F273]=0;" ") -> В | H273: of:=VLOOKUP([.$B273];[.$I$71:.$L$81];4;0) -> 1
B274: 3 | C274: of:=VLOOKUP([.$B274];[.$I$71:.$J$81];2;0) -> Челябинск | D274: 83 | E274: 53092 | F274: of:=IF(ISBLANK([.E274]*[.D274]);"0";[.E274]*[.D274]) -> 4406636 | G274: of:=COM.MICROSOFT.IFS([.F274]>5000000;[.$N$72];AND([.F274]>=1000000;[.F274]<=5000000);[.$N$73];AND([.F274]<1000000;[.F274]>0);[.$N$74];[.F274]=0;" ") -> Б | H274: of:=VLOOKUP([.$B274];[.$I$71:.$L$81];4;0) -> 1
B275: 7 | C275: of:=VLOOKUP([.$B275];[.$I$71:.$J$81];2;0) -> Мурманск | D275: 91 | E275: 23017 | F275: of:=IF(ISBLANK([.E275]*[.D275]);"0";[.E275]*[.D275]) -> 2094547 | G275: of:=COM.MICROSOFT.IFS([.F275]>5000000;[.$N$72];AND([.F275]>=1000000;[.F275]<=5000000);[.$N$73];AND([.F275]<1000000;[.F275]>0);[.$N$74];[.F275]=0;" ") -> Б | H275: of:=VLOOKUP([.$B275];[.$I$71:.$L$81];4;0) -> 10
B276: 9 | C276: of:=VLOOKUP([.$B276];[.$I$71:.$J$81];2;0) -> Тюмень | D276: 81 | E276: 56436 | F276: of:=IF(ISBLANK([.E276]*[.D276]);"0";[.E276]*[.D276]) -> 4571316 | G276: of:=COM.MICROSOFT.IFS([.F276]>5000000;[.$N$72];AND([.F276]>=1000000;[.F276]<=5000000);[.$N$73];AND([.F276]<1000000;[.F276]>0);[.$N$74];[.F276]=0;" ") -> Б | H276: of:=VLOOKUP([.$B276];[.$I$71:.$L$81];4;0) -> 3
B277: 8 | C277: of:=VLOOKUP([.$B277];[.$I$71:.$J$81];2;0) -> Новосибирск | D277: 9 | E277: 70908 | F277: of:=IF(ISBLANK([.E277]*[.D277]);"0";[.E277]*[.D277]) -> 638172 | G277: of:=COM.MICROSOFT.IFS([.F277]>5000000;[.$N$72];AND([.F277]>=1000000;[.F277]<=5000000);[.$N$73];AND([.F277]<1000000;[.F277]>0);[.$N$74];[.F277]=0;" ") -> В | H277: of:=VLOOKUP([.$B277];[.$I$71:.$L$81];4;0) -> 5
B278: 8 | C278: of:=VLOOKUP([.$B278];[.$I$71:.$J$81];2;0) -> Новосибирск | D278: 93 | E278: 48370 | F278: of:=IF(ISBLANK([.E278]*[.D278]);"0";[.E278]*[.D278]) -> 4498410 | G278: of:=COM.MICROSOFT.IFS([.F278]>5000000;[.$N$72];AND([.F278]>=1000000;[.F278]<=5000000);[.$N$73];AND([.F278]<1000000;[.F278]>0);[.$N$74];[.F278]=0;" ") -> Б | H278: of:=VLOOKUP([.$B278];[.$I$71:.$L$81];4;0) -> 5
B279: 6 | C279: of:=VLOOKUP([.$B279];[.$I$71:.$J$81];2;0) -> Владивосток | D279: 31 | E279: 47165 | F279: of:=IF(ISBLANK([.E279]*[.D279]);"0";[.E279]*[.D279]) -> 1462115 | G279: of:=COM.MICROSOFT.IFS([.F279]>5000000;[.$N$72];AND([.F279]>=1000000;[.F279]<=5000000);[.$N$73];AND([.F279]<1000000;[.F279]>0);[.$N$74];[.F279]=0;" ") -> Б | H279: of:=VLOOKUP([.$B279];[.$I$71:.$L$81];4;0) -> 7
B280: 8 | C280: of:=VLOOKUP([.$B280];[.$I$71:.$J$81];2;0) -> Новосибирск | D280: 64 | E280: 77797 | F280: of:=IF(ISBLANK([.E280]*[.D280]);"0";[.E280]*[.D280]) -> 4979008 | G280: of:=COM.MICROSOFT.IFS([.F280]>5000000;[.$N$72];AND([.F280]>=1000000;[.F280]<=5000000);[.$N$73];AND([.F280]<1000000;[.F280]>0);[.$N$74];[.F280]=0;" ") -> Б | H280: of:=VLOOKUP([.$B280];[.$I$71:.$L$81];4;0) -> 5
B281: 2 | C281: of:=VLOOKUP([.$B281];[.$I$71:.$J$81];2;0) -> Санкт-Петербург | D281: 62 | E281: 47168 | F281: of:=IF(ISBLANK([.E281]*[.D281]);"0";[.E281]*[.D281]) -> 2924416 | G281: of:=COM.MICROSOFT.IFS([.F281]>5000000;[.$N$72];AND([.F281]>=1000000;[.F281]<=5000000);[.$N$73];AND([.F281]<1000000;[.F281]>0);[.$N$74];[.F281]=0;" ") -> Б | H281: of:=VLOOKUP([.$B281];[.$I$71:.$L$81];4;0) -> 9
B282: 10 | C282: of:=VLOOKUP([.$B282];[.$I$71:.$J$81];2;0) -> Сочи | D282: 48 | E282: 23322 | F282: of:=IF(ISBLANK([.E282]*[.D282]);"0";[.E282]*[.D282]) -> 1119456 | G282: of:=COM.MICROSOFT.IFS([.F282]>5000000;[.$N$72];AND([.F282]>=1000000;[.F282]<=5000000);[.$N$73];AND([.F282]<1000000;[.F282]>0);[.$N$74];[.F282]=0;" ") -> Б | H282: of:=VLOOKUP([.$B282];[.$I$71:.$L$81];4;0) -> 6
B283: 10 | C283: of:=VLOOKUP([.$B283];[.$I$71:.$J$81];2;0) -> Сочи | D283: 44 | E283: 39867 | F283: of:=IF(ISBLANK([.E283]*[.D283]);"0";[.E283]*[.D283]) -> 1754148 | G283: of:=COM.MICROSOFT.IFS([.F283]>5000000;[.$N$72];AND([.F283]>=1000000;[.F283]<=5000000);[.$N$73];AND([.F283]<1000000;[.F283]>0);[.$N$74];[.F283]=0;" ") -> Б | H283: of:=VLOOKUP([.$B283];[.$I$71:.$L$81];4;0) -> 6
B284: 5 | C284: of:=VLOOKUP([.$B284];[.$I$71:.$J$81];2;0) -> Краснодар | D284: 15 | E284: 74772 | F284: of:=IF(ISBLANK([.E284]*[.D284]);"0";[.E284]*[.D284]) -> 1121580 | G284: of:=COM.MICROSOFT.IFS([.F284]>5000000;[.$N$72];AND([.F284]>=1000000;[.F284]<=5000000);[.$N$73];AND([.F284]<1000000;[.F284]>0);[.$N$74];[.F284]=0;" ") -> Б | H284: of:=VLOOKUP([.$B284];[.$I$71:.$L$81];4;0) -> 4
B285: 4 | C285: of:=VLOOKUP([.$B285];[.$I$71:.$J$81];2;0) -> Архангельск | D285: 72 | E285: 56748 | F285: of:=IF(ISBLANK([.E285]*[.D285]);"0";[.E285]*[.D285]) -> 4085856 | G285: of:=COM.MICROSOFT.IFS([.F285]>5000000;[.$N$72];AND([.F285]>=1000000;[.F285]<=5000000);[.$N$73];AND([.F285]<1000000;[.F285]>0);[.$N$74];[.F285]=0;" ") -> Б | H285: of:=VLOOKUP([.$B285];[.$I$71:.$L$81];4;0) -> 2
B286: 8 | C286: of:=VLOOKUP([.$B286];[.$I$71:.$J$81];2;0) -> Новосибирск | D286: 55 | E286: 17809 | F286: of:=IF(ISBLANK([.E286]*[.D286]);"0";[.E286]*[.D286]) -> 979495 | G286: of:=COM.MICROSOFT.IFS([.F286]>5000000;[.$N$72];AND([.F286]>=1000000;[.F286]<=5000000);[.$N$73];AND([.F286]<1000000;[.F286]>0);[.$N$74];[.F286]=0;" ") -> В | H286: of:=VLOOKUP([.$B286];[.$I$71:.$L$81];4;0) -> 5
B287: 10 | C287: of:=VLOOKUP([.$B287];[.$I$71:.$J$81];2;0) -> Сочи | D287: 40 | E287: 11473 | F287: of:=IF(ISBLANK([.E287]*[.D287]);"0";[.E287]*[.D287]) -> 458920 | G287: of:=COM.MICROSOFT.IFS([.F287]>5000000;[.$N$72];AND([.F287]>=1000000;[.F287]<=5000000);[.$N$73];AND([.F287]<1000000;[.F287]>0);[.$N$74];[.F287]=0;" ") -> В | H287: of:=VLOOKUP([.$B287];[.$I$71:.$L$81];4;0) -> 6
B288: 2 | C288: of:=VLOOKUP([.$B288];[.$I$71:.$J$81];2;0) -> Санкт-Петербург | D288: 100 | E288: 22499 | F288: of:=IF(ISBLANK([.E288]*[.D288]);"0";[.E288]*[.D288]) -> 2249900 | G288: of:=COM.MICROSOFT.IFS([.F288]>5000000;[.$N$72];AND([.F288]>=1000000;[.F288]<=5000000);[.$N$73];AND([.F288]<1000000;[.F288]>0);[.$N$74];[.F288]=0;" ") -> Б | H288: of:=VLOOKUP([.$B288];[.$I$71:.$L$81];4;0) -> 9
B289: 5 | C289: of:=VLOOKUP([.$B289];[.$I$71:.$J$81];2;0) -> Краснодар | D289: 23 | E289: 56680 | F289: of:=IF(ISBLANK([.E289]*[.D289]);"0";[.E289]*[.D289]) -> 1303640 | G289: of:=COM.MICROSOFT.IFS([.F289]>5000000;[.$N$72];AND([.F289]>=1000000;[.F289]<=5000000);[.$N$73];AND([.F289]<1000000;[.F289]>0);[.$N$74];[.F289]=0;" ") -> Б | H289: of:=VLOOKUP([.$B289];[.$I$71:.$L$81];4;0) -> 4
B290: 3 | C290: of:=VLOOKUP([.$B290];[.$I$71:.$J$81];2;0) -> Челябинск | D290: 15 | E290: 18424 | F290: of:=IF(ISBLANK([.E290]*[.D290]);"0";[.E290]*[.D290]) -> 276360 | G290: of:=COM.MICROSOFT.IFS([.F290]>5000000;[.$N$72];AND([.F290]>=1000000;[.F290]<=5000000);[.$N$73];AND([.F290]<1000000;[.F290]>0);[.$N$74];[.F290]=0;" ") -> В | H290: of:=VLOOKUP([.$B290];[.$I$71:.$L$81];4;0) -> 1
B291: 2 | C291: of:=VLOOKUP([.$B291];[.$I$71:.$J$81];2;0) -> Санкт-Петербург | D291: 46 | E291: 33146 | F291: of:=IF(ISBLANK([.E291]*[.D291]);"0";[.E291]*[.D291]) -> 1524716 | G291: of:=COM.MICROSOFT.IFS([.F291]>5000000;[.$N$72];AND([.F291]>=1000000;[.F291]<=5000000);[.$N$73];AND([.F291]<1000000;[.F291]>0);[.$N$74];[.F291]=0;" ") -> Б | H291: of:=VLOOKUP([.$B291];[.$I$71:.$L$81];4;0) -> 9
B292: 9 | C292: of:=VLOOKUP([.$B292];[.$I$71:.$J$81];2;0) -> Тюмень | D292: 49 | E292: 10677 | F292: of:=IF(ISBLANK([.E292]*[.D292]);"0";[.E292]*[.D292]) -> 523173 | G292: of:=COM.MICROSOFT.IFS([.F292]>5000000;[.$N$72];AND([.F292]>=1000000;[.F292]<=5000000);[.$N$73];AND([.F292]<1000000;[.F292]>0);[.$N$74];[.F292]=0;" ") -> В | H292: of:=VLOOKUP([.$B292];[.$I$71:.$L$81];4;0) -> 3
B293: 9 | C293: of:=VLOOKUP([.$B293];[.$I$71:.$J$81];2;0) -> Тюмень | D293: 2 | E293: 56299 | F293: of:=IF(ISBLANK([.E293]*[.D293]);"0";[.E293]*[.D293]) -> 112598 | G293: of:=COM.MICROSOFT.IFS([.F293]>5000000;[.$N$72];AND([.F293]>=1000000;[.F293]<=5000000);[.$N$73];AND([.F293]<1000000;[.F293]>0);[.$N$74];[.F293]=0;" ") -> В | H293: of:=VLOOKUP([.$B293];[.$I$71:.$L$81];4;0) -> 3
B294: 10 | C294: of:=VLOOKUP([.$B294];[.$I$71:.$J$81];2;0) -> Сочи | D294: 22 | E294: 52847 | F294: of:=IF(ISBLANK([.E294]*[.D294]);"0";[.E294]*[.D294]) -> 1162634 | G294: of:=COM.MICROSOFT.IFS([.F294]>5000000;[.$N$72];AND([.F294]>=1000000;[.F294]<=5000000);[.$N$73];AND([.F294]<1000000;[.F294]>0);[.$N$74];[.F294]=0;" ") -> Б | H294: of:=VLOOKUP([.$B294];[.$I$71:.$L$81];4;0) -> 6
B295: 3 | C295: of:=VLOOKUP([.$B295];[.$I$71:.$J$81];2;0) -> Челябинск | D295: 11 | E295: 52782 | F295: of:=IF(ISBLANK([.E295]*[.D295]);"0";[.E295]*[.D295]) -> 580602 | G295: of:=COM.MICROSOFT.IFS([.F295]>5000000;[.$N$72];AND([.F295]>=1000000;[.F295]<=5000000);[.$N$73];AND([.F295]<1000000;[.F295]>0);[.$N$74];[.F295]=0;" ") -> В | H295: of:=VLOOKUP([.$B295];[.$I$71:.$L$81];4;0) -> 1
B296: 5 | C296: of:=VLOOKUP([.$B296];[.$I$71:.$J$81];2;0) -> Краснодар | D296: 16 | E296: 3808 | F296: of:=IF(ISBLANK([.E296]*[.D296]);"0";[.E296]*[.D296]) -> 60928 | G296: of:=COM.MICROSOFT.IFS([.F296]>5000000;[.$N$72];AND([.F296]>=1000000;[.F296]<=5000000);[.$N$73];AND([.F296]<1000000;[.F296]>0);[.$N$74];[.F296]=0;" ") -> В | H296: of:=VLOOKUP([.$B296];[.$I$71:.$L$81];4;0) -> 4
B297: 4 | C297: of:=VLOOKUP([.$B297];[.$I$71:.$J$81];2;0) -> Архангельск | D297: 28 | E297: 44543 | F297: of:=IF(ISBLANK([.E297]*[.D297]);"0";[.E297]*[.D297]) -> 1247204 | G297: of:=COM.MICROSOFT.IFS([.F297]>5000000;[.$N$72];AND([.F297]>=1000000;[.F297]<=5000000);[.$N$73];AND([.F297]<1000000;[.F297]>0);[.$N$74];[.F297]=0;" ") -> Б | H297: of:=VLOOKUP([.$B297];[.$I$71:.$L$81];4;0) -> 2
B298: 2 | C298: of:=VLOOKUP([.$B298];[.$I$71:.$J$81];2;0) -> Санкт-Петербург | D298: 82 | E298: 11956 | F298: of:=IF(ISBLANK([.E298]*[.D298]);"0";[.E298]*[.D298]) -> 980392 | G298: of:=COM.MICROSOFT.IFS([.F298]>5000000;[.$N$72];AND([.F298]>=1000000;[.F298]<=5000000);[.$N$73];AND([.F298]<1000000;[.F298]>0);[.$N$74];[.F298]=0;" ") -> В | H298: of:=VLOOKUP([.$B298];[.$I$71:.$L$81];4;0) -> 9
B299: 4 | C299: of:=VLOOKUP([.$B299];[.$I$71:.$J$81];2;0) -> Архангельск | D299: 52 | E299: 32681 | F299: of:=IF(ISBLANK([.E299]*[.D299]);"0";[.E299]*[.D299]) -> 1699412 | G299: of:=COM.MICROSOFT.IFS([.F299]>5000000;[.$N$72];AND([.F299]>=1000000;[.F299]<=5000000);[.$N$73];AND([.F299]<1000000;[.F299]>0);[.$N$74];[.F299]=0;" ") -> Б | H299: of:=VLOOKUP([.$B299];[.$I$71:.$L$81];4;0) -> 2
B300: 10 | C300: of:=VLOOKUP([.$B300];[.$I$71:.$J$81];2;0) -> Сочи | D300: 65 | E300: 22176 | F300: of:=IF(ISBLANK([.E300]*[.D300]);"0";[.E300]*[.D300]) -> 1441440 | G300: of:=COM.MICROSOFT.IFS([.F300]>5000000;[.$N$72];AND([.F300]>=1000000;[.F300]<=5000000);[.$N$73];AND([.F300]<1000000;[.F300]>0);[.$N$74];[.F300]=0;" ") -> Б | H300: of:=VLOOKUP([.$B300];[.$I$71:.$L$81];4;0) -> 6
B301: 8 | C301: of:=VLOOKUP([.$B301];[.$I$71:.$J$81];2;0) -> Новосибирск | D301: 98 | E301: 40994 | F301: of:=IF(ISBLANK([.E301]*[.D301]);"0";[.E301]*[.D301]) -> 4017412 | G301: of:=COM.MICROSOFT.IFS([.F301]>5000000;[.$N$72];AND([.F301]>=1000000;[.F301]<=5000000);[.$N$73];AND([.F301]<1000000;[.F301]>0);[.$N$74];[.F301]=0;" ") -> Б | H301: of:=VLOOKUP([.$B301];[.$I$71:.$L$81];4;0) -> 5
B302: 8 | C302: of:=VLOOKUP([.$B302];[.$I$71:.$J$81];2;0) -> Новосибирск | D302: 56 | E302: 90690 | F302: of:=IF(ISBLANK([.E302]*[.D302]);"0";[.E302]*[.D302]) -> 5078640 | G302: of:=COM.MICROSOFT.IFS([.F302]>5000000;[.$N$72];AND([.F302]>=1000000;[.F302]<=5000000);[.$N$73];AND([.F302]<1000000;[.F302]>0);[.$N$74];[.F302]=0;" ") -> А | H302: of:=VLOOKUP([.$B302];[.$I$71:.$L$81];4;0) -> 5
B303: 5 | C303: of:=VLOOKUP([.$B303];[.$I$71:.$J$81];2;0) -> Краснодар | D303: 11 | E303: 12971 | F303: of:=IF(ISBLANK([.E303]*[.D303]);"0";[.E303]*[.D303]) -> 142681 | G303: of:=COM.MICROSOFT.IFS([.F303]>5000000;[.$N$72];AND([.F303]>=1000000;[.F303]<=5000000);[.$N$73];AND([.F303]<1000000;[.F303]>0);[.$N$74];[.F303]=0;" ") -> В | H303: of:=VLOOKUP([.$B303];[.$I$71:.$L$81];4;0) -> 4
B304: 4 | C304: of:=VLOOKUP([.$B304];[.$I$71:.$J$81];2;0) -> Архангельск | D304: 70 | E304: 50584 | F304: of:=IF(ISBLANK([.E304]*[.D304]);"0";[.E304]*[.D304]) -> 3540880 | G304: of:=COM.MICROSOFT.IFS([.F304]>5000000;[.$N$72];AND([.F304]>=1000000;[.F304]<=5000000);[.$N$73];AND([.F304]<1000000;[.F304]>0);[.$N$74];[.F304]=0;" ") -> Б | H304: of:=VLOOKUP([.$B304];[.$I$71:.$L$81];4;0) -> 2
B305: 7 | C305: of:=VLOOKUP([.$B305];[.$I$71:.$J$81];2;0) -> Мурманск | D305: 65 | E305: 72681 | F305: of:=IF(ISBLANK([.E305]*[.D305]);"0";[.E305]*[.D305]) -> 4724265 | G305: of:=COM.MICROSOFT.IFS([.F305]>5000000;[.$N$72];AND([.F305]>=1000000;[.F305]<=5000000);[.$N$73];AND([.F305]<1000000;[.F305]>0);[.$N$74];[.F305]=0;" ") -> Б | H305: of:=VLOOKUP([.$B305];[.$I$71:.$L$81];4;0) -> 10
B306: 6 | C306: of:=VLOOKUP([.$B306];[.$I$71:.$J$81];2;0) -> Владивосток | D306: 34 | E306: 65649 | F306: of:=IF(ISBLANK([.E306]*[.D306]);"0";[.E306]*[.D306]) -> 2232066 | G306: of:=COM.MICROSOFT.IFS([.F306]>5000000;[.$N$72];AND([.F306]>=1000000;[.F306]<=5000000);[.$N$73];AND([.F306]<1000000;[.F306]>0);[.$N$74];[.F306]=0;" ") -> Б | H306: of:=VLOOKUP([.$B306];[.$I$71:.$L$81];4;0) -> 7
B307: 4 | C307: of:=VLOOKUP([.$B307];[.$I$71:.$J$81];2;0) -> Архангельск | D307: 50 | E307: 1781 | F307: of:=IF(ISBLANK([.E307]*[.D307]);"0";[.E307]*[.D307]) -> 89050 | G307: of:=COM.MICROSOFT.IFS([.F307]>5000000;[.$N$72];AND([.F307]>=1000000;[.F307]<=5000000);[.$N$73];AND([.F307]<1000000;[.F307]>0);[.$N$74];[.F307]=0;" ") -> В | H307: of:=VLOOKUP([.$B307];[.$I$71:.$L$81];4;0) -> 2
B308: 3 | C308: of:=VLOOKUP([.$B308];[.$I$71:.$J$81];2;0) -> Челябинск | D308: 51 | E308: 70838 | F308: of:=IF(ISBLANK([.E308]*[.D308]);"0";[.E308]*[.D308]) -> 3612738 | G308: of:=COM.MICROSOFT.IFS([.F308]>5000000;[.$N$72];AND([.F308]>=1000000;[.F308]<=5000000);[.$N$73];AND([.F308]<1000000;[.F308]>0);[.$N$74];[.F308]=0;" ") -> Б | H308: of:=VLOOKUP([.$B308];[.$I$71:.$L$81];4;0) -> 1
B309: 4 | C309: of:=VLOOKUP([.$B309];[.$I$71:.$J$81];2;0) -> Архангельск | D309: 47 | E309: 76623 | F309: of:=IF(ISBLANK([.E309]*[.D309]);"0";[.E309]*[.D309]) -> 3601281 | G309: of:=COM.MICROSOFT.IFS([.F309]>5000000;[.$N$72];AND([.F309]>=1000000;[.F309]<=5000000);[.$N$73];AND([.F309]<1000000;[.F309]>0);[.$N$74];[.F309]=0;" ") -> Б | H309: of:=VLOOKUP([.$B309];[.$I$71:.$L$81];4;0) -> 2
B310: 3 | C310: of:=VLOOKUP([.$B310];[.$I$71:.$J$81];2;0) -> Челябинск | D310: 31 | E310: 82466 | F310: of:=IF(ISBLANK([.E310]*[.D310]);"0";[.E310]*[.D310]) -> 2556446 | G310: of:=COM.MICROSOFT.IFS([.F310]>5000000;[.$N$72];AND([.F310]>=1000000;[.F310]<=5000000);[.$N$73];AND([.F310]<1000000;[.F310]>0);[.$N$74];[.F310]=0;" ") -> Б | H310: of:=VLOOKUP([.$B310];[.$I$71:.$L$81];4;0) -> 1
B311: 10 | C311: of:=VLOOKUP([.$B311];[.$I$71:.$J$81];2;0) -> Сочи | D311: 62 | E311: 88158 | F311: of:=IF(ISBLANK([.E311]*[.D311]);"0";[.E311]*[.D311]) -> 5465796 | G311: of:=COM.MICROSOFT.IFS([.F311]>5000000;[.$N$72];AND([.F311]>=1000000;[.F311]<=5000000);[.$N$73];AND([.F311]<1000000;[.F311]>0);[.$N$74];[.F311]=0;" ") -> А | H311: of:=VLOOKUP([.$B311];[.$I$71:.$L$81];4;0) -> 6
B312: 1 | C312: of:=VLOOKUP([.$B312];[.$I$71:.$J$81];2;0) -> Москва | D312: 38 | E312: 19981 | F312: of:=IF(ISBLANK([.E312]*[.D312]);"0";[.E312]*[.D312]) -> 759278 | G312: of:=COM.MICROSOFT.IFS([.F312]>5000000;[.$N$72];AND([.F312]>=1000000;[.F312]<=5000000);[.$N$73];AND([.F312]<1000000;[.F312]>0);[.$N$74];[.F312]=0;" ") -> В | H312: of:=VLOOKUP([.$B312];[.$I$71:.$L$81];4;0) -> 8
B313: 4 | C313: of:=VLOOKUP([.$B313];[.$I$71:.$J$81];2;0) -> Архангельск | D313: 42 | E313: 25126 | F313: of:=IF(ISBLANK([.E313]*[.D313]);"0";[.E313]*[.D313]) -> 1055292 | G313: of:=COM.MICROSOFT.IFS([.F313]>5000000;[.$N$72];AND([.F313]>=1000000;[.F313]<=5000000);[.$N$73];AND([.F313]<1000000;[.F313]>0);[.$N$74];[.F313]=0;" ") -> Б | H313: of:=VLOOKUP([.$B313];[.$I$71:.$L$81];4;0) -> 2
B314: 1 | C314: of:=VLOOKUP([.$B314];[.$I$71:.$J$81];2;0) -> Москва | D314: 0 | E314: 81905 | F314: of:=IF(ISBLANK([.E314]*[.D314]);"0";[.E314]*[.D314]) -> 0 | G314: of:=COM.MICROSOFT.IFS([.F314]>5000000;[.$N$72];AND([.F314]>=1000000;[.F314]<=5000000);[.$N$73];AND([.F314]<1000000;[.F314]>0);[.$N$74];[.F314]=0;" ") ->   | H314: of:=VLOOKUP([.$B314];[.$I$71:.$L$81];4;0) -> 8
B315: 5 | C315: of:=VLOOKUP([.$B315];[.$I$71:.$J$81];2;0) -> Краснодар | D315: 11 | E315: 84742 | F315: of:=IF(ISBLANK([.E315]*[.D315]);"0";[.E315]*[.D315]) -> 932162 | G315: of:=COM.MICROSOFT.IFS([.F315]>5000000;[.$N$72];AND([.F315]>=1000000;[.F315]<=5000000);[.$N$73];AND([.F315]<1000000;[.F315]>0);[.$N$74];[.F315]=0;" ") -> В | H315: of:=VLOOKUP([.$B315];[.$I$71:.$L$81];4;0) -> 4
B316: 2 | C316: of:=VLOOKUP([.$B316];[.$I$71:.$J$81];2;0) -> Санкт-Петербург | D316: 45 | E316: 70279 | F316: of:=IF(ISBLANK([.E316]*[.D316]);"0";[.E316]*[.D316]) -> 3162555 | G316: of:=COM.MICROSOFT.IFS([.F316]>5000000;[.$N$72];AND([.F316]>=1000000;[.F316]<=5000000);[.$N$73];AND([.F316]<1000000;[.F316]>0);[.$N$74];[.F316]=0;" ") -> Б | H316: of:=VLOOKUP([.$B316];[.$I$71:.$L$81];4;0) -> 9
B317: 6 | C317: of:=VLOOKUP([.$B317];[.$I$71:.$J$81];2;0) -> Владивосток | D317: 89 | E317: 75835 | F317: of:=IF(ISBLANK([.E317]*[.D317]);"0";[.E317]*[.D317]) -> 6749315 | G317: of:=COM.MICROSOFT.IFS([.F317]>5000000;[.$N$72];AND([.F317]>=1000000;[.F317]<=5000000);[.$N$73];AND([.F317]<1000000;[.F317]>0);[.$N$74];[.F317]=0;" ") -> А | H317: of:=VLOOKUP([.$B317];[.$I$71:.$L$81];4;0) -> 7
B318: 6 | C318: of:=VLOOKUP([.$B318];[.$I$71:.$J$81];2;0) -> Владивосток | D318: 88 | E318: 42726 | F318: of:=IF(ISBLANK([.E318]*[.D318]);"0";[.E318]*[.D318]) -> 3759888 | G318: of:=COM.MICROSOFT.IFS([.F318]>5000000;[.$N$72];AND([.F318]>=1000000;[.F318]<=5000000);[.$N$73];AND([.F318]<1000000;[.F318]>0);[.$N$74];[.F318]=0;" ") -> Б | H318: of:=VLOOKUP([.$B318];[.$I$71:.$L$81];4;0) -> 7
B319: 3 | C319: of:=VLOOKUP([.$B319];[.$I$71:.$J$81];2;0) -> Челябинск | D319: 96 | E319: 86189 | F319: of:=IF(ISBLANK([.E319]*[.D319]);"0";[.E319]*[.D319]) -> 8274144 | G319: of:=COM.MICROSOFT.IFS([.F319]>5000000;[.$N$72];AND([.F319]>=1000000;[.F319]<=5000000);[.$N$73];AND([.F319]<1000000;[.F319]>0);[.$N$74];[.F319]=0;" ") -> А | H319: of:=VLOOKUP([.$B319];[.$I$71:.$L$81];4;0) -> 1
B320: 6 | C320: of:=VLOOKUP([.$B320];[.$I$71:.$J$81];2;0) -> Владивосток | D320: 81 | E320: 42952 | F320: of:=IF(ISBLANK([.E320]*[.D320]);"0";[.E320]*[.D320]) -> 3479112 | G320: of:=COM.MICROSOFT.IFS([.F320]>5000000;[.$N$72];AND([.F320]>=1000000;[.F320]<=5000000);[.$N$73];AND([.F320]<1000000;[.F320]>0);[.$N$74];[.F320]=0;" ") -> Б | H320: of:=VLOOKUP([.$B320];[.$I$71:.$L$81];4;0) -> 7
B321: 4 | C321: of:=VLOOKUP([.$B321];[.$I$71:.$J$81];2;0) -> Архангельск | D321: 38 | E321: 53521 | F321: of:=IF(ISBLANK([.E321]*[.D321]);"0";[.E321]*[.D321]) -> 2033798 | G321: of:=COM.MICROSOFT.IFS([.F321]>5000000;[.$N$72];AND([.F321]>=1000000;[.F321]<=5000000);[.$N$73];AND([.F321]<1000000;[.F321]>0);[.$N$74];[.F321]=0;" ") -> Б | H321: of:=VLOOKUP([.$B321];[.$I$71:.$L$81];4;0) -> 2
B322: 7 | C322: of:=VLOOKUP([.$B322];[.$I$71:.$J$81];2;0) -> Мурманск | D322: 95 | E322: 51296 | F322: of:=IF(ISBLANK([.E322]*[.D322]);"0";[.E322]*[.D322]) -> 4873120 | G322: of:=COM.MICROSOFT.IFS([.F322]>5000000;[.$N$72];AND([.F322]>=1000000;[.F322]<=5000000);[.$N$73];AND([.F322]<1000000;[.F322]>0);[.$N$74];[.F322]=0;" ") -> Б | H322: of:=VLOOKUP([.$B322];[.$I$71:.$L$81];4;0) -> 10
B323: 5 | C323: of:=VLOOKUP([.$B323];[.$I$71:.$J$81];2;0) -> Краснодар | D323: 38 | E323: 62341 | F323: of:=IF(ISBLANK([.E323]*[.D323]);"0";[.E323]*[.D323]) -> 2368958 | G323: of:=COM.MICROSOFT.IFS([.F323]>5000000;[.$N$72];AND([.F323]>=1000000;[.F323]<=5000000);[.$N$73];AND([.F323]<1000000;[.F323]>0);[.$N$74];[.F323]=0;" ") -> Б | H323: of:=VLOOKUP([.$B323];[.$I$71:.$L$81];4;0) -> 4
B324: 8 | C324: of:=VLOOKUP([.$B324];[.$I$71:.$J$81];2;0) -> Новосибирск | D324: 85 | E324: 34663 | F324: of:=IF(ISBLANK([.E324]*[.D324]);"0";[.E324]*[.D324]) -> 2946355 | G324: of:=COM.MICROSOFT.IFS([.F324]>5000000;[.$N$72];AND([.F324]>=1000000;[.F324]<=5000000);[.$N$73];AND([.F324]<1000000;[.F324]>0);[.$N$74];[.F324]=0;" ") -> Б | H324: of:=VLOOKUP([.$B324];[.$I$71:.$L$81];4;0) -> 5
B325: 3 | C325: of:=VLOOKUP([.$B325];[.$I$71:.$J$81];2;0) -> Челябинск | D325: 55 | E325: 45639 | F325: of:=IF(ISBLANK([.E325]*[.D325]);"0";[.E325]*[.D325]) -> 2510145 | G325: of:=COM.MICROSOFT.IFS([.F325]>5000000;[.$N$72];AND([.F325]>=1000000;[.F325]<=5000000);[.$N$73];AND([.F325]<1000000;[.F325]>0);[.$N$74];[.F325]=0;" ") -> Б | H325: of:=VLOOKUP([.$B325];[.$I$71:.$L$81];4;0) -> 1
B326: 9 | C326: of:=VLOOKUP([.$B326];[.$I$71:.$J$81];2;0) -> Тюмень | D326: 79 | E326: 98943 | F326: of:=IF(ISBLANK([.E326]*[.D326]);"0";[.E326]*[.D326]) -> 7816497 | G326: of:=COM.MICROSOFT.IFS([.F326]>5000000;[.$N$72];AND([.F326]>=1000000;[.F326]<=5000000);[.$N$73];AND([.F326]<1000000;[.F326]>0);[.$N$74];[.F326]=0;" ") -> А | H326: of:=VLOOKUP([.$B326];[.$I$71:.$L$81];4;0) -> 3
B327: 5 | C327: of:=VLOOKUP([.$B327];[.$I$71:.$J$81];2;0) -> Краснодар | D327: 100 | E327: 70148 | F327: of:=IF(ISBLANK([.E327]*[.D327]);"0";[.E327]*[.D327]) -> 7014800 | G327: of:=COM.MICROSOFT.IFS([.F327]>5000000;[.$N$72];AND([.F327]>=1000000;[.F327]<=5000000);[.$N$73];AND([.F327]<1000000;[.F327]>0);[.$N$74];[.F327]=0;" ") -> А | H327: of:=VLOOKUP([.$B327];[.$I$71:.$L$81];4;0) -> 4
B328: 10 | C328: of:=VLOOKUP([.$B328];[.$I$71:.$J$81];2;0) -> Сочи | D328: 82 | E328: 78747 | F328: of:=IF(ISBLANK([.E328]*[.D328]);"0";[.E328]*[.D328]) -> 6457254 | G328: of:=COM.MICROSOFT.IFS([.F328]>5000000;[.$N$72];AND([.F328]>=1000000;[.F328]<=5000000);[.$N$73];AND([.F328]<1000000;[.F328]>0);[.$N$74];[.F328]=0;" ") -> А | H328: of:=VLOOKUP([.$B328];[.$I$71:.$L$81];4;0) -> 6
B329: 5 | C329: of:=VLOOKUP([.$B329];[.$I$71:.$J$81];2;0) -> Краснодар | D329: 50 | E329: 32617 | F329: of:=IF(ISBLANK([.E329]*[.D329]);"0";[.E329]*[.D329]) -> 1630850 | G329: of:=COM.MICROSOFT.IFS([.F329]>5000000;[.$N$72];AND([.F329]>=1000000;[.F329]<=5000000);[.$N$73];AND([.F329]<1000000;[.F329]>0);[.$N$74];[.F329]=0;" ") -> Б | H329: of:=VLOOKUP([.$B329];[.$I$71:.$L$81];4;0) -> 4
B330: 2 | C330: of:=VLOOKUP([.$B330];[.$I$71:.$J$81];2;0) -> Санкт-Петербург | D330: 72 | E330: 3068 | F330: of:=IF(ISBLANK([.E330]*[.D330]);"0";[.E330]*[.D330]) -> 220896 | G330: of:=COM.MICROSOFT.IFS([.F330]>5000000;[.$N$72];AND([.F330]>=1000000;[.F330]<=5000000);[.$N$73];AND([.F330]<1000000;[.F330]>0);[.$N$74];[.F330]=0;" ") -> В | H330: of:=VLOOKUP([.$B330];[.$I$71:.$L$81];4;0) -> 9
B331: 10 | C331: of:=VLOOKUP([.$B331];[.$I$71:.$J$81];2;0) -> Сочи | D331: 17 | E331: 94342 | F331: of:=IF(ISBLANK([.E331]*[.D331]);"0";[.E331]*[.D331]) -> 1603814 | G331: of:=COM.MICROSOFT.IFS([.F331]>5000000;[.$N$72];AND([.F331]>=1000000;[.F331]<=5000000);[.$N$73];AND([.F331]<1000000;[.F331]>0);[.$N$74];[.F331]=0;" ") -> Б | H331: of:=VLOOKUP([.$B331];[.$I$71:.$L$81];4;0) -> 6
B332: 9 | C332: of:=VLOOKUP([.$B332];[.$I$71:.$J$81];2;0) -> Тюмень | D332: 63 | E332: 29200 | F332: of:=IF(ISBLANK([.E332]*[.D332]);"0";[.E332]*[.D332]) -> 1839600 | G332: of:=COM.MICROSOFT.IFS([.F332]>5000000;[.$N$72];AND([.F332]>=1000000;[.F332]<=5000000);[.$N$73];AND([.F332]<1000000;[.F332]>0);[.$N$74];[.F332]=0;" ") -> Б | H332: of:=VLOOKUP([.$B332];[.$I$71:.$L$81];4;0) -> 3
B333: 5 | C333: of:=VLOOKUP([.$B333];[.$I$71:.$J$81];2;0) -> Краснодар | D333: 23 | E333: 37905 | F333: of:=IF(ISBLANK([.E333]*[.D333]);"0";[.E333]*[.D333]) -> 871815 | G333: of:=COM.MICROSOFT.IFS([.F333]>5000000;[.$N$72];AND([.F333]>=1000000;[.F333]<=5000000);[.$N$73];AND([.F333]<1000000;[.F333]>0);[.$N$74];[.F333]=0;" ") -> В | H333: of:=VLOOKUP([.$B333];[.$I$71:.$L$81];4;0) -> 4
B334: 10 | C334: of:=VLOOKUP([.$B334];[.$I$71:.$J$81];2;0) -> Сочи | D334: 23 | E334: 46009 | F334: of:=IF(ISBLANK([.E334]*[.D334]);"0";[.E334]*[.D334]) -> 1058207 | G334: of:=COM.MICROSOFT.IFS([.F334]>5000000;[.$N$72];AND([.F334]>=1000000;[.F334]<=5000000);[.$N$73];AND([.F334]<1000000;[.F334]>0);[.$N$74];[.F334]=0;" ") -> Б | H334: of:=VLOOKUP([.$B334];[.$I$71:.$L$81];4;0) -> 6
B335: 9 | C335: of:=VLOOKUP([.$B335];[.$I$71:.$J$81];2;0) -> Тюмень | D335: 71 | E335: 11854 | F335: of:=IF(ISBLANK([.E335]*[.D335]);"0";[.E335]*[.D335]) -> 841634 | G335: of:=COM.MICROSOFT.IFS([.F335]>5000000;[.$N$72];AND([.F335]>=1000000;[.F335]<=5000000);[.$N$73];AND([.F335]<1000000;[.F335]>0);[.$N$74];[.F335]=0;" ") -> В | H335: of:=VLOOKUP([.$B335];[.$I$71:.$L$81];4;0) -> 3
B336: 2 | C336: of:=VLOOKUP([.$B336];[.$I$71:.$J$81];2;0) -> Санкт-Петербург | D336: 100 | E336: 63412 | F336: of:=IF(ISBLANK([.E336]*[.D336]);"0";[.E336]*[.D336]) -> 6341200 | G336: of:=COM.MICROSOFT.IFS([.F336]>5000000;[.$N$72];AND([.F336]>=1000000;[.F336]<=5000000);[.$N$73];AND([.F336]<1000000;[.F336]>0);[.$N$74];[.F336]=0;" ") -> А | H336: of:=VLOOKUP([.$B336];[.$I$71:.$L$81];4;0) -> 9
B337: 4 | C337: of:=VLOOKUP([.$B337];[.$I$71:.$J$81];2;0) -> Архангельск | D337: 47 | E337: 5774 | F337: of:=IF(ISBLANK([.E337]*[.D337]);"0";[.E337]*[.D337]) -> 271378 | G337: of:=COM.MICROSOFT.IFS([.F337]>5000000;[.$N$72];AND([.F337]>=1000000;[.F337]<=5000000);[.$N$73];AND([.F337]<1000000;[.F337]>0);[.$N$74];[.F337]=0;" ") -> В | H337: of:=VLOOKUP([.$B337];[.$I$71:.$L$81];4;0) -> 2
B338: 1 | C338: of:=VLOOKUP([.$B338];[.$I$71:.$J$81];2;0) -> Москва | D338: 76 | E338: 54641 | F338: of:=IF(ISBLANK([.E338]*[.D338]);"0";[.E338]*[.D338]) -> 4152716 | G338: of:=COM.MICROSOFT.IFS([.F338]>5000000;[.$N$72];AND([.F338]>=1000000;[.F338]<=5000000);[.$N$73];AND([.F338]<1000000;[.F338]>0);[.$N$74];[.F338]=0;" ") -> Б | H338: of:=VLOOKUP([.$B338];[.$I$71:.$L$81];4;0) -> 8
B339: 9 | C339: of:=VLOOKUP([.$B339];[.$I$71:.$J$81];2;0) -> Тюмень | D339: 69 | E339: 75992 | F339: of:=IF(ISBLANK([.E339]*[.D339]);"0";[.E339]*[.D339]) -> 5243448 | G339: of:=COM.MICROSOFT.IFS([.F339]>5000000;[.$N$72];AND([.F339]>=1000000;[.F339]<=5000000);[.$N$73];AND([.F339]<1000000;[.F339]>0);[.$N$74];[.F339]=0;" ") -> А | H339: of:=VLOOKUP([.$B339];[.$I$71:.$L$81];4;0) -> 3
B340: 3 | C340: of:=VLOOKUP([.$B340];[.$I$71:.$J$81];2;0) -> Челябинск | D340: 70 | E340: 21648 | F340: of:=IF(ISBLANK([.E340]*[.D340]);"0";[.E340]*[.D340]) -> 1515360 | G340: of:=COM.MICROSOFT.IFS([.F340]>5000000;[.$N$72];AND([.F340]>=1000000;[.F340]<=5000000);[.$N$73];AND([.F340]<1000000;[.F340]>0);[.$N$74];[.F340]=0;" ") -> Б | H340: of:=VLOOKUP([.$B340];[.$I$71:.$L$81];4;0) -> 1
B341: 5 | C341: of:=VLOOKUP([.$B341];[.$I$71:.$J$81];2;0) -> Краснодар | D341: 65 | E341: 99861 | F341: of:=IF(ISBLANK([.E341]*[.D341]);"0";[.E341]*[.D341]) -> 6490965 | G341: of:=COM.MICROSOFT.IFS([.F341]>5000000;[.$N$72];AND([.F341]>=1000000;[.F341]<=5000000);[.$N$73];AND([.F341]<1000000;[.F341]>0);[.$N$74];[.F341]=0;" ") -> А | H341: of:=VLOOKUP([.$B341];[.$I$71:.$L$81];4;0) -> 4
B342: 6 | C342: of:=VLOOKUP([.$B342];[.$I$71:.$J$81];2;0) -> Владивосток | D342: 53 | E342: 88742 | F342: of:=IF(ISBLANK([.E342]*[.D342]);"0";[.E342]*[.D342]) -> 4703326 | G342: of:=COM.MICROSOFT.IFS([.F342]>5000000;[.$N$72];AND([.F342]>=1000000;[.F342]<=5000000);[.$N$73];AND([.F342]<1000000;[.F342]>0);[.$N$74];[.F342]=0;" ") -> Б | H342: of:=VLOOKUP([.$B342];[.$I$71:.$L$81];4;0) -> 7
B343: 1 | C343: of:=VLOOKUP([.$B343];[.$I$71:.$J$81];2;0) -> Москва | D343: 65 | E343: 39359 | F343: of:=IF(ISBLANK([.E343]*[.D343]);"0";[.E343]*[.D343]) -> 2558335 | G343: of:=COM.MICROSOFT.IFS([.F343]>5000000;[.$N$72];AND([.F343]>=1000000;[.F343]<=5000000);[.$N$73];AND([.F343]<1000000;[.F343]>0);[.$N$74];[.F343]=0;" ") -> Б | H343: of:=VLOOKUP([.$B343];[.$I$71:.$L$81];4;0) -> 8
B344: 5 | C344: of:=VLOOKUP([.$B344];[.$I$71:.$J$81];2;0) -> Краснодар | D344: 22 | E344: 58290 | F344: of:=IF(ISBLANK([.E344]*[.D344]);"0";[.E344]*[.D344]) -> 1282380 | G344: of:=COM.MICROSOFT.IFS([.F344]>5000000;[.$N$72];AND([.F344]>=1000000;[.F344]<=5000000);[.$N$73];AND([.F344]<1000000;[.F344]>0);[.$N$74];[.F344]=0;" ") -> Б | H344: of:=VLOOKUP([.$B344];[.$I$71:.$L$81];4;0) -> 4
B345: 1 | C345: of:=VLOOKUP([.$B345];[.$I$71:.$J$81];2;0) -> Москва | D345: 18 | E345: 36464 | F345: of:=IF(ISBLANK([.E345]*[.D345]);"0";[.E345]*[.D345]) -> 656352 | G345: of:=COM.MICROSOFT.IFS([.F345]>5000000;[.$N$72];AND([.F345]>=1000000;[.F345]<=5000000);[.$N$73];AND([.F345]<1000000;[.F345]>0);[.$N$74];[.F345]=0;" ") -> В | H345: of:=VLOOKUP([.$B345];[.$I$71:.$L$81];4;0) -> 8
B346: 2 | C346: of:=VLOOKUP([.$B346];[.$I$71:.$J$81];2;0) -> Санкт-Петербург | D346: 89 | E346: 65102 | F346: of:=IF(ISBLANK([.E346]*[.D346]);"0";[.E346]*[.D346]) -> 5794078 | G346: of:=COM.MICROSOFT.IFS([.F346]>5000000;[.$N$72];AND([.F346]>=1000000;[.F346]<=5000000);[.$N$73];AND([.F346]<1000000;[.F346]>0);[.$N$74];[.F346]=0;" ") -> А | H346: of:=VLOOKUP([.$B346];[.$I$71:.$L$81];4;0) -> 9
B347: 10 | C347: of:=VLOOKUP([.$B347];[.$I$71:.$J$81];2;0) -> Сочи | D347: 95 | E347: 83524 | F347: of:=IF(ISBLANK([.E347]*[.D347]);"0";[.E347]*[.D347]) -> 7934780 | G347: of:=COM.MICROSOFT.IFS([.F347]>5000000;[.$N$72];AND([.F347]>=1000000;[.F347]<=5000000);[.$N$73];AND([.F347]<1000000;[.F347]>0);[.$N$74];[.F347]=0;" ") -> А | H347: of:=VLOOKUP([.$B347];[.$I$71:.$L$81];4;0) -> 6
B348: 3 | C348: of:=VLOOKUP([.$B348];[.$I$71:.$J$81];2;0) -> Челябинск | D348: 52 | E348: 30812 | F348: of:=IF(ISBLANK([.E348]*[.D348]);"0";[.E348]*[.D348]) -> 1602224 | G348: of:=COM.MICROSOFT.IFS([.F348]>5000000;[.$N$72];AND([.F348]>=1000000;[.F348]<=5000000);[.$N$73];AND([.F348]<1000000;[.F348]>0);[.$N$74];[.F348]=0;" ") -> Б | H348: of:=VLOOKUP([.$B348];[.$I$71:.$L$81];4;0) -> 1
B349: 10 | C349: of:=VLOOKUP([.$B349];[.$I$71:.$J$81];2;0) -> Сочи | D349: 100 | E349: 26593 | F349: of:=IF(ISBLANK([.E349]*[.D349]);"0";[.E349]*[.D349]) -> 2659300 | G349: of:=COM.MICROSOFT.IFS([.F349]>5000000;[.$N$72];AND([.F349]>=1000000;[.F349]<=5000000);[.$N$73];AND([.F349]<1000000;[.F349]>0);[.$N$74];[.F349]=0;" ") -> Б | H349: of:=VLOOKUP([.$B349];[.$I$71:.$L$81];4;0) -> 6
B350: 4 | C350: of:=VLOOKUP([.$B350];[.$I$71:.$J$81];2;0) -> Архангельск | D350: 64 | E350: 99379 | F350: of:=IF(ISBLANK([.E350]*[.D350]);"0";[.E350]*[.D350]) -> 6360256 | G350: of:=COM.MICROSOFT.IFS([.F350]>5000000;[.$N$72];AND([.F350]>=1000000;[.F350]<=5000000);[.$N$73];AND([.F350]<1000000;[.F350]>0);[.$N$74];[.F350]=0;" ") -> А | H350: of:=VLOOKUP([.$B350];[.$I$71:.$L$81];4;0) -> 2
B351: 1 | C351: of:=VLOOKUP([.$B351];[.$I$71:.$J$81];2;0) -> Москва | D351: 42 | E351: 90449 | F351: of:=IF(ISBLANK([.E351]*[.D351]);"0";[.E351]*[.D351]) -> 3798858 | G351: of:=COM.MICROSOFT.IFS([.F351]>5000000;[.$N$72];AND([.F351]>=1000000;[.F351]<=5000000);[.$N$73];AND([.F351]<1000000;[.F351]>0);[.$N$74];[.F351]=0;" ") -> Б | H351: of:=VLOOKUP([.$B351];[.$I$71:.$L$81];4;0) -> 8
B352: 8 | C352: of:=VLOOKUP([.$B352];[.$I$71:.$J$81];2;0) -> Новосибирск | D352: 13 | E352: 2521 | F352: of:=IF(ISBLANK([.E352]*[.D352]);"0";[.E352]*[.D352]) -> 32773 | G352: of:=COM.MICROSOFT.IFS([.F352]>5000000;[.$N$72];AND([.F352]>=1000000;[.F352]<=5000000);[.$N$73];AND([.F352]<1000000;[.F352]>0);[.$N$74];[.F352]=0;" ") -> В | H352: of:=VLOOKUP([.$B352];[.$I$71:.$L$81];4;0) -> 5
B353: 9 | C353: of:=VLOOKUP([.$B353];[.$I$71:.$J$81];2;0) -> Тюмень | D353: 24 | E353: 59765 | F353: of:=IF(ISBLANK([.E353]*[.D353]);"0";[.E353]*[.D353]) -> 1434360 | G353: of:=COM.MICROSOFT.IFS([.F353]>5000000;[.$N$72];AND([.F353]>=1000000;[.F353]<=5000000);[.$N$73];AND([.F353]<1000000;[.F353]>0);[.$N$74];[.F353]=0;" ") -> Б | H353: of:=VLOOKUP([.$B353];[.$I$71:.$L$81];4;0) -> 3
B354: 5 | C354: of:=VLOOKUP([.$B354];[.$I$71:.$J$81];2;0) -> Краснодар | D354: 83 | E354: 80712 | F354: of:=IF(ISBLANK([.E354]*[.D354]);"0";[.E354]*[.D354]) -> 6699096 | G354: of:=COM.MICROSOFT.IFS([.F354]>5000000;[.$N$72];AND([.F354]>=1000000;[.F354]<=5000000);[.$N$73];AND([.F354]<1000000;[.F354]>0);[.$N$74];[.F354]=0;" ") -> А | H354: of:=VLOOKUP([.$B354];[.$I$71:.$L$81];4;0) -> 4
B355: 2 | C355: of:=VLOOKUP([.$B355];[.$I$71:.$J$81];2;0) -> Санкт-Петербург | D355: 28 | E355: 27654 | F355: of:=IF(ISBLANK([.E355]*[.D355]);"0";[.E355]*[.D355]) -> 774312 | G355: of:=COM.MICROSOFT.IFS([.F355]>5000000;[.$N$72];AND([.F355]>=1000000;[.F355]<=5000000);[.$N$73];AND([.F355]<1000000;[.F355]>0);[.$N$74];[.F355]=0;" ") -> В | H355: of:=VLOOKUP([.$B355];[.$I$71:.$L$81];4;0) -> 9
B356: 1 | C356: of:=VLOOKUP([.$B356];[.$I$71:.$J$81];2;0) -> Москва | D356: 53 | E356: 77042 | F356: of:=IF(ISBLANK([.E356]*[.D356]);"0";[.E356]*[.D356]) -> 4083226 | G356: of:=COM.MICROSOFT.IFS([.F356]>5000000;[.$N$72];AND([.F356]>=1000000;[.F356]<=5000000);[.$N$73];AND([.F356]<1000000;[.F356]>0);[.$N$74];[.F356]=0;" ") -> Б | H356: of:=VLOOKUP([.$B356];[.$I$71:.$L$81];4;0) -> 8
B357: 6 | C357: of:=VLOOKUP([.$B357];[.$I$71:.$J$81];2;0) -> Владивосток | D357: 39 | E357: 4549 | F357: of:=IF(ISBLANK([.E357]*[.D357]);"0";[.E357]*[.D357]) -> 177411 | G357: of:=COM.MICROSOFT.IFS([.F357]>5000000;[.$N$72];AND([.F357]>=1000000;[.F357]<=5000000);[.$N$73];AND([.F357]<1000000;[.F357]>0);[.$N$74];[.F357]=0;" ") -> В | H357: of:=VLOOKUP([.$B357];[.$I$71:.$L$81];4;0) -> 7
B358: 1 | C358: of:=VLOOKUP([.$B358];[.$I$71:.$J$81];2;0) -> Москва | D358: 65 | E358: 63079 | F358: of:=IF(ISBLANK([.E358]*[.D358]);"0";[.E358]*[.D358]) -> 4100135 | G358: of:=COM.MICROSOFT.IFS([.F358]>5000000;[.$N$72];AND([.F358]>=1000000;[.F358]<=5000000);[.$N$73];AND([.F358]<1000000;[.F358]>0);[.$N$74];[.F358]=0;" ") -> Б | H358: of:=VLOOKUP([.$B358];[.$I$71:.$L$81];4;0) -> 8
B359: 2 | C359: of:=VLOOKUP([.$B359];[.$I$71:.$J$81];2;0) -> Санкт-Петербург | D359: 23 | E359: 61145 | F359: of:=IF(ISBLANK([.E359]*[.D359]);"0";[.E359]*[.D359]) -> 1406335 | G359: of:=COM.MICROSOFT.IFS([.F359]>5000000;[.$N$72];AND([.F359]>=1000000;[.F359]<=5000000);[.$N$73];AND([.F359]<1000000;[.F359]>0);[.$N$74];[.F359]=0;" ") -> Б | H359: of:=VLOOKUP([.$B359];[.$I$71:.$L$81];4;0) -> 9
B360: 5 | C360: of:=VLOOKUP([.$B360];[.$I$71:.$J$81];2;0) -> Краснодар | D360: 63 | E360: 59544 | F360: of:=IF(ISBLANK([.E360]*[.D360]);"0";[.E360]*[.D360]) -> 3751272 | G360: of:=COM.MICROSOFT.IFS([.F360]>5000000;[.$N$72];AND([.F360]>=1000000;[.F360]<=5000000);[.$N$73];AND([.F360]<1000000;[.F360]>0);[.$N$74];[.F360]=0;" ") -> Б | H360: of:=VLOOKUP([.$B360];[.$I$71:.$L$81];4;0) -> 4
B361: 8 | C361: of:=VLOOKUP([.$B361];[.$I$71:.$J$81];2;0) -> Новосибирск | D361: 44 | E361: 30866 | F361: of:=IF(ISBLANK([.E361]*[.D361]);"0";[.E361]*[.D361]) -> 1358104 | G361: of:=COM.MICROSOFT.IFS([.F361]>5000000;[.$N$72];AND([.F361]>=1000000;[.F361]<=5000000);[.$N$73];AND([.F361]<1000000;[.F361]>0);[.$N$74];[.F361]=0;" ") -> Б | H361: of:=VLOOKUP([.$B361];[.$I$71:.$L$81];4;0) -> 5
B362: 10 | C362: of:=VLOOKUP([.$B362];[.$I$71:.$J$81];2;0) -> Сочи | D362: 68 | E362: 87405 | F362: of:=IF(ISBLANK([.E362]*[.D362]);"0";[.E362]*[.D362]) -> 5943540 | G362: of:=COM.MICROSOFT.IFS([.F362]>5000000;[.$N$72];AND([.F362]>=1000000;[.F362]<=5000000);[.$N$73];AND([.F362]<1000000;[.F362]>0);[.$N$74];[.F362]=0;" ") -> А | H362: of:=VLOOKUP([.$B362];[.$I$71:.$L$81];4;0) -> 6
B363: 5 | C363: of:=VLOOKUP([.$B363];[.$I$71:.$J$81];2;0) -> Краснодар | D363: 88 | E363: 99083 | F363: of:=IF(ISBLANK([.E363]*[.D363]);"0";[.E363]*[.D363]) -> 8719304 | G363: of:=COM.MICROSOFT.IFS([.F363]>5000000;[.$N$72];AND([.F363]>=1000000;[.F363]<=5000000);[.$N$73];AND([.F363]<1000000;[.F363]>0);[.$N$74];[.F363]=0;" ") -> А | H363: of:=VLOOKUP([.$B363];[.$I$71:.$L$81];4;0) -> 4
B364: 6 | C364: of:=VLOOKUP([.$B364];[.$I$71:.$J$81];2;0) -> Владивосток | D364: 70 | E364: 33735 | F364: of:=IF(ISBLANK([.E364]*[.D364]);"0";[.E364]*[.D364]) -> 2361450 | G364: of:=COM.MICROSOFT.IFS([.F364]>5000000;[.$N$72];AND([.F364]>=1000000;[.F364]<=5000000);[.$N$73];AND([.F364]<1000000;[.F364]>0);[.$N$74];[.F364]=0;" ") -> Б | H364: of:=VLOOKUP([.$B364];[.$I$71:.$L$81];4;0) -> 7
B365: 3 | C365: of:=VLOOKUP([.$B365];[.$I$71:.$J$81];2;0) -> Челябинск | D365: 44 | E365: 67035 | F365: of:=IF(ISBLANK([.E365]*[.D365]);"0";[.E365]*[.D365]) -> 2949540 | G365: of:=COM.MICROSOFT.IFS([.F365]>5000000;[.$N$72];AND([.F365]>=1000000;[.F365]<=5000000);[.$N$73];AND([.F365]<1000000;[.F365]>0);[.$N$74];[.F365]=0;" ") -> Б | H365: of:=VLOOKUP([.$B365];[.$I$71:.$L$81];4;0) -> 1
B366: 10 | C366: of:=VLOOKUP([.$B366];[.$I$71:.$J$81];2;0) -> Сочи | D366: 31 | E366: 28423 | F366: of:=IF(ISBLANK([.E366]*[.D366]);"0";[.E366]*[.D366]) -> 881113 | G366: of:=COM.MICROSOFT.IFS([.F366]>5000000;[.$N$72];AND([.F366]>=1000000;[.F366]<=5000000);[.$N$73];AND([.F366]<1000000;[.F366]>0);[.$N$74];[.F366]=0;" ") -> В | H366: of:=VLOOKUP([.$B366];[.$I$71:.$L$81];4;0) -> 6
B367: 9 | C367: of:=VLOOKUP([.$B367];[.$I$71:.$J$81];2;0) -> Тюмень | D367: 36 | E367: 53203 | F367: of:=IF(ISBLANK([.E367]*[.D367]);"0";[.E367]*[.D367]) -> 1915308 | G367: of:=COM.MICROSOFT.IFS([.F367]>5000000;[.$N$72];AND([.F367]>=1000000;[.F367]<=5000000);[.$N$73];AND([.F367]<1000000;[.F367]>0);[.$N$74];[.F367]=0;" ") -> Б | H367: of:=VLOOKUP([.$B367];[.$I$71:.$L$81];4;0) -> 3
B368: 4 | C368: of:=VLOOKUP([.$B368];[.$I$71:.$J$81];2;0) -> Архангельск | D368: 38 | E368: 72590 | F368: of:=IF(ISBLANK([.E368]*[.D368]);"0";[.E368]*[.D368]) -> 2758420 | G368: of:=COM.MICROSOFT.IFS([.F368]>5000000;[.$N$72];AND([.F368]>=1000000;[.F368]<=5000000);[.$N$73];AND([.F368]<1000000;[.F368]>0);[.$N$74];[.F368]=0;" ") -> Б | H368: of:=VLOOKUP([.$B368];[.$I$71:.$L$81];4;0) -> 2
B369: 1 | C369: of:=VLOOKUP([.$B369];[.$I$71:.$J$81];2;0) -> Москва | D369: 27 | E369: 73567 | F369: of:=IF(ISBLANK([.E369]*[.D369]);"0";[.E369]*[.D369]) -> 1986309 | G369: of:=COM.MICROSOFT.IFS([.F369]>5000000;[.$N$72];AND([.F369]>=1000000;[.F369]<=5000000);[.$N$73];AND([.F369]<1000000;[.F369]>0);[.$N$74];[.F369]=0;" ") -> Б | H369: of:=VLOOKUP([.$B369];[.$I$71:.$L$81];4;0) -> 8
B370: 10 | C370: of:=VLOOKUP([.$B370];[.$I$71:.$J$81];2;0) -> Сочи | D370: 46 | E370: 60286 | F370: of:=IF(ISBLANK([.E370]*[.D370]);"0";[.E370]*[.D370]) -> 2773156 | G370: of:=COM.MICROSOFT.IFS([.F370]>5000000;[.$N$72];AND([.F370]>=1000000;[.F370]<=5000000);[.$N$73];AND([.F370]<1000000;[.F370]>0);[.$N$74];[.F370]=0;" ") -> Б | H370: of:=VLOOKUP([.$B370];[.$I$71:.$L$81];4;0) -> 6
B371: 2 | C371: of:=VLOOKUP([.$B371];[.$I$71:.$J$81];2;0) -> Санкт-Петербург | D371: 25 | E371: 25994 | F371: of:=IF(ISBLANK([.E371]*[.D371]);"0";[.E371]*[.D371]) -> 649850 | G371: of:=COM.MICROSOFT.IFS([.F371]>5000000;[.$N$72];AND([.F371]>=1000000;[.F371]<=5000000);[.$N$73];AND([.F371]<1000000;[.F371]>0);[.$N$74];[.F371]=0;" ") -> В | H371: of:=VLOOKUP([.$B371];[.$I$71:.$L$81];4;0) -> 9
B372: 6 | C372: of:=VLOOKUP([.$B372];[.$I$71:.$J$81];2;0) -> Владивосток | D372: 2 | E372: 72837 | F372: of:=IF(ISBLANK([.E372]*[.D372]);"0";[.E372]*[.D372]) -> 145674 | G372: of:=COM.MICROSOFT.IFS([.F372]>5000000;[.$N$72];AND([.F372]>=1000000;[.F372]<=5000000);[.$N$73];AND([.F372]<1000000;[.F372]>0);[.$N$74];[.F372]=0;" ") -> В | H372: of:=VLOOKUP([.$B372];[.$I$71:.$L$81];4;0) -> 7
B373: 1 | C373: of:=VLOOKUP([.$B373];[.$I$71:.$J$81];2;0) -> Москва | D373: 67 | E373: 44716 | F373: of:=IF(ISBLANK([.E373]*[.D373]);"0";[.E373]*[.D373]) -> 2995972 | G373: of:=COM.MICROSOFT.IFS([.F373]>5000000;[.$N$72];AND([.F373]>=1000000;[.F373]<=5000000);[.$N$73];AND([.F373]<1000000;[.F373]>0);[.$N$74];[.F373]=0;" ") -> Б | H373: of:=VLOOKUP([.$B373];[.$I$71:.$L$81];4;0) -> 8
B374: 6 | C374: of:=VLOOKUP([.$B374];[.$I$71:.$J$81];2;0) -> Владивосток | D374: 51 | E374: 57917 | F374: of:=IF(ISBLANK([.E374]*[.D374]);"0";[.E374]*[.D374]) -> 2953767 | G374: of:=COM.MICROSOFT.IFS([.F374]>5000000;[.$N$72];AND([.F374]>=1000000;[.F374]<=5000000);[.$N$73];AND([.F374]<1000000;[.F374]>0);[.$N$74];[.F374]=0;" ") -> Б | H374: of:=VLOOKUP([.$B374];[.$I$71:.$L$81];4;0) -> 7
B375: 3 | C375: of:=VLOOKUP([.$B375];[.$I$71:.$J$81];2;0) -> Челябинск | D375: 67 | E375: 27612 | F375: of:=IF(ISBLANK([.E375]*[.D375]);"0";[.E375]*[.D375]) -> 1850004 | G375: of:=COM.MICROSOFT.IFS([.F375]>5000000;[.$N$72];AND([.F375]>=1000000;[.F375]<=5000000);[.$N$73];AND([.F375]<1000000;[.F375]>0);[.$N$74];[.F375]=0;" ") -> Б | H375: of:=VLOOKUP([.$B375];[.$I$71:.$L$81];4;0) -> 1
B376: 9 | C376: of:=VLOOKUP([.$B376];[.$I$71:.$J$81];2;0) -> Тюмень | D376: 31 | E376: 10191 | F376: of:=IF(ISBLANK([.E376]*[.D376]);"0";[.E376]*[.D376]) -> 315921 | G376: of:=COM.MICROSOFT.IFS([.F376]>5000000;[.$N$72];AND([.F376]>=1000000;[.F376]<=5000000);[.$N$73];AND([.F376]<1000000;[.F376]>0);[.$N$74];[.F376]=0;" ") -> В | H376: of:=VLOOKUP([.$B376];[.$I$71:.$L$81];4;0) -> 3
B377: 6 | C377: of:=VLOOKUP([.$B377];[.$I$71:.$J$81];2;0) -> Владивосток | D377: 44 | E377: 34773 | F377: of:=IF(ISBLANK([.E377]*[.D377]);"0";[.E377]*[.D377]) -> 1530012 | G377: of:=COM.MICROSOFT.IFS([.F377]>5000000;[.$N$72];AND([.F377]>=1000000;[.F377]<=5000000);[.$N$73];AND([.F377]<1000000;[.F377]>0);[.$N$74];[.F377]=0;" ") -> Б | H377: of:=VLOOKUP([.$B377];[.$I$71:.$L$81];4;0) -> 7
B378: 8 | C378: of:=VLOOKUP([.$B378];[.$I$71:.$J$81];2;0) -> Новосибирск | D378: 54 | E378: 13131 | F378: of:=IF(ISBLANK([.E378]*[.D378]);"0";[.E378]*[.D378]) -> 709074 | G378: of:=COM.MICROSOFT.IFS([.F378]>5000000;[.$N$72];AND([.F378]>=1000000;[.F378]<=5000000);[.$N$73];AND([.F378]<1000000;[.F378]>0);[.$N$74];[.F378]=0;" ") -> В | H378: of:=VLOOKUP([.$B378];[.$I$71:.$L$81];4;0) -> 5
B379: 2 | C379: of:=VLOOKUP([.$B379];[.$I$71:.$J$81];2;0) -> Санкт-Петербург | D379: 72 | E379: 14558 | F379: of:=IF(ISBLANK([.E379]*[.D379]);"0";[.E379]*[.D379]) -> 1048176 | G379: of:=COM.MICROSOFT.IFS([.F379]>5000000;[.$N$72];AND([.F379]>=1000000;[.F379]<=5000000);[.$N$73];AND([.F379]<1000000;[.F379]>0);[.$N$74];[.F379]=0;" ") -> Б | H379: of:=VLOOKUP([.$B379];[.$I$71:.$L$81];4;0) -> 9
B380: 4 | C380: of:=VLOOKUP([.$B380];[.$I$71:.$J$81];2;0) -> Архангельск | D380: 1 | E380: 21339 | F380: of:=IF(ISBLANK([.E380]*[.D380]);"0";[.E380]*[.D380]) -> 21339 | G380: of:=COM.MICROSOFT.IFS([.F380]>5000000;[.$N$72];AND([.F380]>=1000000;[.F380]<=5000000);[.$N$73];AND([.F380]<1000000;[.F380]>0);[.$N$74];[.F380]=0;" ") -> В | H380: of:=VLOOKUP([.$B380];[.$I$71:.$L$81];4;0) -> 2
B381: 6 | C381: of:=VLOOKUP([.$B381];[.$I$71:.$J$81];2;0) -> Владивосток | D381: 6 | E381: 11117 | F381: of:=IF(ISBLANK([.E381]*[.D381]);"0";[.E381]*[.D381]) -> 66702 | G381: of:=COM.MICROSOFT.IFS([.F381]>5000000;[.$N$72];AND([.F381]>=1000000;[.F381]<=5000000);[.$N$73];AND([.F381]<1000000;[.F381]>0);[.$N$74];[.F381]=0;" ") -> В | H381: of:=VLOOKUP([.$B381];[.$I$71:.$L$81];4;0) -> 7
B382: 10 | C382: of:=VLOOKUP([.$B382];[.$I$71:.$J$81];2;0) -> Сочи | D382: 76 | E382: 79485 | F382: of:=IF(ISBLANK([.E382]*[.D382]);"0";[.E382]*[.D382]) -> 6040860 | G382: of:=COM.MICROSOFT.IFS([.F382]>5000000;[.$N$72];AND([.F382]>=1000000;[.F382]<=5000000);[.$N$73];AND([.F382]<1000000;[.F382]>0);[.$N$74];[.F382]=0;" ") -> А | H382: of:=VLOOKUP([.$B382];[.$I$71:.$L$81];4;0) -> 6
B383: 6 | C383: of:=VLOOKUP([.$B383];[.$I$71:.$J$81];2;0) -> Владивосток | D383: 7 | E383: 52097 | F383: of:=IF(ISBLANK([.E383]*[.D383]);"0";[.E383]*[.D383]) -> 364679 | G383: of:=COM.MICROSOFT.IFS([.F383]>5000000;[.$N$72];AND([.F383]>=1000000;[.F383]<=5000000);[.$N$73];AND([.F383]<1000000;[.F383]>0);[.$N$74];[.F383]=0;" ") -> В | H383: of:=VLOOKUP([.$B383];[.$I$71:.$L$81];4;0) -> 7
B384: 1 | C384: of:=VLOOKUP([.$B384];[.$I$71:.$J$81];2;0) -> Москва | D384: 12 | E384: 15675 | F384: of:=IF(ISBLANK([.E384]*[.D384]);"0";[.E384]*[.D384]) -> 188100 | G384: of:=COM.MICROSOFT.IFS([.F384]>5000000;[.$N$72];AND([.F384]>=1000000;[.F384]<=5000000);[.$N$73];AND([.F384]<1000000;[.F384]>0);[.$N$74];[.F384]=0;" ") -> В | H384: of:=VLOOKUP([.$B384];[.$I$71:.$L$81];4;0) -> 8
B385: 6 | C385: of:=VLOOKUP([.$B385];[.$I$71:.$J$81];2;0) -> Владивосток | D385: 36 | E385: 29004 | F385: of:=IF(ISBLANK([.E385]*[.D385]);"0";[.E385]*[.D385]) -> 1044144 | G385: of:=COM.MICROSOFT.IFS([.F385]>5000000;[.$N$72];AND([.F385]>=1000000;[.F385]<=5000000);[.$N$73];AND([.F385]<1000000;[.F385]>0);[.$N$74];[.F385]=0;" ") -> Б | H385: of:=VLOOKUP([.$B385];[.$I$71:.$L$81];4;0) -> 7
B386: 9 | C386: of:=VLOOKUP([.$B386];[.$I$71:.$J$81];2;0) -> Тюмень | D386: 20 | E386: 47890 | F386: of:=IF(ISBLANK([.E386]*[.D386]);"0";[.E386]*[.D386]) -> 957800 | G386: of:=COM.MICROSOFT.IFS([.F386]>5000000;[.$N$72];AND([.F386]>=1000000;[.F386]<=5000000);[.$N$73];AND([.F386]<1000000;[.F386]>0);[.$N$74];[.F386]=0;" ") -> В | H386: of:=VLOOKUP([.$B386];[.$I$71:.$L$81];4;0) -> 3
B387: 9 | C387: of:=VLOOKUP([.$B387];[.$I$71:.$J$81];2;0) -> Тюмень | D387: 95 | E387: 6429 | F387: of:=IF(ISBLANK([.E387]*[.D387]);"0";[.E387]*[.D387]) -> 610755 | G387: of:=COM.MICROSOFT.IFS([.F387]>5000000;[.$N$72];AND([.F387]>=1000000;[.F387]<=5000000);[.$N$73];AND([.F387]<1000000;[.F387]>0);[.$N$74];[.F387]=0;" ") -> В | H387: of:=VLOOKUP([.$B387];[.$I$71:.$L$81];4;0) -> 3
B388: 5 | C388: of:=VLOOKUP([.$B388];[.$I$71:.$J$81];2;0) -> Краснодар | D388: 16 | E388: 4781 | F388: of:=IF(ISBLANK([.E388]*[.D388]);"0";[.E388]*[.D388]) -> 76496 | G388: of:=COM.MICROSOFT.IFS([.F388]>5000000;[.$N$72];AND([.F388]>=1000000;[.F388]<=5000000);[.$N$73];AND([.F388]<1000000;[.F388]>0);[.$N$74];[.F388]=0;" ") -> В | H388: of:=VLOOKUP([.$B388];[.$I$71:.$L$81];4;0) -> 4
B389: 10 | C389: of:=VLOOKUP([.$B389];[.$I$71:.$J$81];2;0) -> Сочи | D389: 59 | E389: 35122 | F389: of:=IF(ISBLANK([.E389]*[.D389]);"0";[.E389]*[.D389]) -> 2072198 | G389: of:=COM.MICROSOFT.IFS([.F389]>5000000;[.$N$72];AND([.F389]>=1000000;[.F389]<=5000000);[.$N$73];AND([.F389]<1000000;[.F389]>0);[.$N$74];[.F389]=0;" ") -> Б | H389: of:=VLOOKUP([.$B389];[.$I$71:.$L$81];4;0) -> 6
B390: 5 | C390: of:=VLOOKUP([.$B390];[.$I$71:.$J$81];2;0) -> Краснодар | D390: 72 | E390: 34973 | F390: of:=IF(ISBLANK([.E390]*[.D390]);"0";[.E390]*[.D390]) -> 2518056 | G390: of:=COM.MICROSOFT.IFS([.F390]>5000000;[.$N$72];AND([.F390]>=1000000;[.F390]<=5000000);[.$N$73];AND([.F390]<1000000;[.F390]>0);[.$N$74];[.F390]=0;" ") -> Б | H390: of:=VLOOKUP([.$B390];[.$I$71:.$L$81];4;0) -> 4
B391: 5 | C391: of:=VLOOKUP([.$B391];[.$I$71:.$J$81];2;0) -> Краснодар | D391: 11 | E391: 53616 | F391: of:=IF(ISBLANK([.E391]*[.D391]);"0";[.E391]*[.D391]) -> 589776 | G391: of:=COM.MICROSOFT.IFS([.F391]>5000000;[.$N$72];AND([.F391]>=1000000;[.F391]<=5000000);[.$N$73];AND([.F391]<1000000;[.F391]>0);[.$N$74];[.F391]=0;" ") -> В | H391: of:=VLOOKUP([.$B391];[.$I$71:.$L$81];4;0) -> 4
B392: 1 | C392: of:=VLOOKUP([.$B392];[.$I$71:.$J$81];2;0) -> Москва | D392: 78 | E392: 60667 | F392: of:=IF(ISBLANK([.E392]*[.D392]);"0";[.E392]*[.D392]) -> 4732026 | G392: of:=COM.MICROSOFT.IFS([.F392]>5000000;[.$N$72];AND([.F392]>=1000000;[.F392]<=5000000);[.$N$73];AND([.F392]<1000000;[.F392]>0);[.$N$74];[.F392]=0;" ") -> Б | H392: of:=VLOOKUP([.$B392];[.$I$71:.$L$81];4;0) -> 8
B393: 7 | C393: of:=VLOOKUP([.$B393];[.$I$71:.$J$81];2;0) -> Мурманск | D393: 65 | E393: 91885 | F393: of:=IF(ISBLANK([.E393]*[.D393]);"0";[.E393]*[.D393]) -> 5972525 | G393: of:=COM.MICROSOFT.IFS([.F393]>5000000;[.$N$72];AND([.F393]>=1000000;[.F393]<=5000000);[.$N$73];AND([.F393]<1000000;[.F393]>0);[.$N$74];[.F393]=0;" ") -> А | H393: of:=VLOOKUP([.$B393];[.$I$71:.$L$81];4;0) -> 10
B394: 1 | C394: of:=VLOOKUP([.$B394];[.$I$71:.$J$81];2;0) -> Москва | D394: 12 | E394: 8182 | F394: of:=IF(ISBLANK([.E394]*[.D394]);"0";[.E394]*[.D394]) -> 98184 | G394: of:=COM.MICROSOFT.IFS([.F394]>5000000;[.$N$72];AND([.F394]>=1000000;[.F394]<=5000000);[.$N$73];AND([.F394]<1000000;[.F394]>0);[.$N$74];[.F394]=0;" ") -> В | H394: of:=VLOOKUP([.$B394];[.$I$71:.$L$81];4;0) -> 8
B395: 6 | C395: of:=VLOOKUP([.$B395];[.$I$71:.$J$81];2;0) -> Владивосток | D395: 42 | E395: 25246 | F395: of:=IF(ISBLANK([.E395]*[.D395]);"0";[.E395]*[.D395]) -> 1060332 | G395: of:=COM.MICROSOFT.IFS([.F395]>5000000;[.$N$72];AND([.F395]>=1000000;[.F395]<=5000000);[.$N$73];AND([.F395]<1000000;[.F395]>0);[.$N$74];[.F395]=0;" ") -> Б | H395: of:=VLOOKUP([.$B395];[.$I$71:.$L$81];4;0) -> 7
B396: 6 | C396: of:=VLOOKUP([.$B396];[.$I$71:.$J$81];2;0) -> Владивосток | D396: 53 | E396: 1748 | F396: of:=IF(ISBLANK([.E396]*[.D396]);"0";[.E396]*[.D396]) -> 92644 | G396: of:=COM.MICROSOFT.IFS([.F396]>5000000;[.$N$72];AND([.F396]>=1000000;[.F396]<=5000000);[.$N$73];AND([.F396]<1000000;[.F396]>0);[.$N$74];[.F396]=0;" ") -> В | H396: of:=VLOOKUP([.$B396];[.$I$71:.$L$81];4;0) -> 7
B397: 3 | C397: of:=VLOOKUP([.$B397];[.$I$71:.$J$81];2;0) -> Челябинск | D397: 63 | E397: 32476 | F397: of:=IF(ISBLANK([.E397]*[.D397]);"0";[.E397]*[.D397]) -> 2045988 | G397: of:=COM.MICROSOFT.IFS([.F397]>5000000;[.$N$72];AND([.F397]>=1000000;[.F397]<=5000000);[.$N$73];AND([.F397]<1000000;[.F397]>0);[.$N$74];[.F397]=0;" ") -> Б | H397: of:=VLOOKUP([.$B397];[.$I$71:.$L$81];4;0) -> 1
B398: 9 | C398: of:=VLOOKUP([.$B398];[.$I$71:.$J$81];2;0) -> Тюмень | D398: 70 | E398: 28651 | F398: of:=IF(ISBLANK([.E398]*[.D398]);"0";[.E398]*[.D398]) -> 2005570 | G398: of:=COM.MICROSOFT.IFS([.F398]>5000000;[.$N$72];AND([.F398]>=1000000;[.F398]<=5000000);[.$N$73];AND([.F398]<1000000;[.F398]>0);[.$N$74];[.F398]=0;" ") -> Б | H398: of:=VLOOKUP([.$B398];[.$I$71:.$L$81];4;0) -> 3
B399: 8 | C399: of:=VLOOKUP([.$B399];[.$I$71:.$J$81];2;0) -> Новосибирск | D399: 35 | E399: 65862 | F399: of:=IF(ISBLANK([.E399]*[.D399]);"0";[.E399]*[.D399]) -> 2305170 | G399: of:=COM.MICROSOFT.IFS([.F399]>5000000;[.$N$72];AND([.F399]>=1000000;[.F399]<=5000000);[.$N$73];AND([.F399]<1000000;[.F399]>0);[.$N$74];[.F399]=0;" ") -> Б | H399: of:=VLOOKUP([.$B399];[.$I$71:.$L$81];4;0) -> 5
B400: 2 | C400: of:=VLOOKUP([.$B400];[.$I$71:.$J$81];2;0) -> Санкт-Петербург | D400: 1 | E400: 93587 | F400: of:=IF(ISBLANK([.E400]*[.D400]);"0";[.E400]*[.D400]) -> 93587 | G400: of:=COM.MICROSOFT.IFS([.F400]>5000000;[.$N$72];AND([.F400]>=1000000;[.F400]<=5000000);[.$N$73];AND([.F400]<1000000;[.F400]>0);[.$N$74];[.F400]=0;" ") -> В | H400: of:=VLOOKUP([.$B400];[.$I$71:.$L$81];4;0) -> 9
B401: 2 | C401: of:=VLOOKUP([.$B401];[.$I$71:.$J$81];2;0) -> Санкт-Петербург | D401: 59 | E401: 31651 | F401: of:=IF(ISBLANK([.E401]*[.D401]);"0";[.E401]*[.D401]) -> 1867409 | G401: of:=COM.MICROSOFT.IFS([.F401]>5000000;[.$N$72];AND([.F401]>=1000000;[.F401]<=5000000);[.$N$73];AND([.F401]<1000000;[.F401]>0);[.$N$74];[.F401]=0;" ") -> Б | H401: of:=VLOOKUP([.$B401];[.$I$71:.$L$81];4;0) -> 9
B402: 9 | C402: of:=VLOOKUP([.$B402];[.$I$71:.$J$81];2;0) -> Тюмень | D402: 86 | E402: 23802 | F402: of:=IF(ISBLANK([.E402]*[.D402]);"0";[.E402]*[.D402]) -> 2046972 | G402: of:=COM.MICROSOFT.IFS([.F402]>5000000;[.$N$72];AND([.F402]>=1000000;[.F402]<=5000000);[.$N$73];AND([.F402]<1000000;[.F402]>0);[.$N$74];[.F402]=0;" ") -> Б | H402: of:=VLOOKUP([.$B402];[.$I$71:.$L$81];4;0) -> 3
B403: 8 | C403: of:=VLOOKUP([.$B403];[.$I$71:.$J$81];2;0) -> Новосибирск | D403: 96 | E403: 28130 | F403: of:=IF(ISBLANK([.E403]*[.D403]);"0";[.E403]*[.D403]) -> 2700480 | G403: of:=COM.MICROSOFT.IFS([.F403]>5000000;[.$N$72];AND([.F403]>=1000000;[.F403]<=5000000);[.$N$73];AND([.F403]<1000000;[.F403]>0);[.$N$74];[.F403]=0;" ") -> Б | H403: of:=VLOOKUP([.$B403];[.$I$71:.$L$81];4;0) -> 5
B404: 7 | C404: of:=VLOOKUP([.$B404];[.$I$71:.$J$81];2;0) -> Мурманск | D404: 15 | E404: 91372 | F404: of:=IF(ISBLANK([.E404]*[.D404]);"0";[.E404]*[.D404]) -> 1370580 | G404: of:=COM.MICROSOFT.IFS([.F404]>5000000;[.$N$72];AND([.F404]>=1000000;[.F404]<=5000000);[.$N$73];AND([.F404]<1000000;[.F404]>0);[.$N$74];[.F404]=0;" ") -> Б | H404: of:=VLOOKUP([.$B404];[.$I$71:.$L$81];4;0) -> 10
B405: 3 | C405: of:=VLOOKUP([.$B405];[.$I$71:.$J$81];2;0) -> Челябинск | D405: 54 | E405: 13281 | F405: of:=IF(ISBLANK([.E405]*[.D405]);"0";[.E405]*[.D405]) -> 717174 | G405: of:=COM.MICROSOFT.IFS([.F405]>5000000;[.$N$72];AND([.F405]>=1000000;[.F405]<=5000000);[.$N$73];AND([.F405]<1000000;[.F405]>0);[.$N$74];[.F405]=0;" ") -> В | H405: of:=VLOOKUP([.$B405];[.$I$71:.$L$81];4;0) -> 1
B406: 3 | C406: of:=VLOOKUP([.$B406];[.$I$71:.$J$81];2;0) -> Челябинск | D406: 13 | E406: 79711 | F406: of:=IF(ISBLANK([.E406]*[.D406]);"0";[.E406]*[.D406]) -> 1036243 | G406: of:=COM.MICROSOFT.IFS([.F406]>5000000;[.$N$72];AND([.F406]>=1000000;[.F406]<=5000000);[.$N$73];AND([.F406]<1000000;[.F406]>0);[.$N$74];[.F406]=0;" ") -> Б | H406: of:=VLOOKUP([.$B406];[.$I$71:.$L$81];4;0) -> 1
B407: 9 | C407: of:=VLOOKUP([.$B407];[.$I$71:.$J$81];2;0) -> Тюмень | D407: 98 | E407: 80762 | F407: of:=IF(ISBLANK([.E407]*[.D407]);"0";[.E407]*[.D407]) -> 7914676 | G407: of:=COM.MICROSOFT.IFS([.F407]>5000000;[.$N$72];AND([.F407]>=1000000;[.F407]<=5000000);[.$N$73];AND([.F407]<1000000;[.F407]>0);[.$N$74];[.F407]=0;" ") -> А | H407: of:=VLOOKUP([.$B407];[.$I$71:.$L$81];4;0) -> 3
B408: 6 | C408: of:=VLOOKUP([.$B408];[.$I$71:.$J$81];2;0) -> Владивосток | D408: 81 | E408: 89154 | F408: of:=IF(ISBLANK([.E408]*[.D408]);"0";[.E408]*[.D408]) -> 7221474 | G408: of:=COM.MICROSOFT.IFS([.F408]>5000000;[.$N$72];AND([.F408]>=1000000;[.F408]<=5000000);[.$N$73];AND([.F408]<1000000;[.F408]>0);[.$N$74];[.F408]=0;" ") -> А | H408: of:=VLOOKUP([.$B408];[.$I$71:.$L$81];4;0) -> 7
B409: 6 | C409: of:=VLOOKUP([.$B409];[.$I$71:.$J$81];2;0) -> Владивосток | D409: 73 | E409: 72650 | F409: of:=IF(ISBLANK([.E409]*[.D409]);"0";[.E409]*[.D409]) -> 5303450 | G409: of:=COM.MICROSOFT.IFS([.F409]>5000000;[.$N$72];AND([.F409]>=1000000;[.F409]<=5000000);[.$N$73];AND([.F409]<1000000;[.F409]>0);[.$N$74];[.F409]=0;" ") -> А | H409: of:=VLOOKUP([.$B409];[.$I$71:.$L$81];4;0) -> 7
B410: 4 | C410: of:=VLOOKUP([.$B410];[.$I$71:.$J$81];2;0) -> Архангельск | D410: 36 | E410: 65212 | F410: of:=IF(ISBLANK([.E410]*[.D410]);"0";[.E410]*[.D410]) -> 2347632 | G410: of:=COM.MICROSOFT.IFS([.F410]>5000000;[.$N$72];AND([.F410]>=1000000;[.F410]<=5000000);[.$N$73];AND([.F410]<1000000;[.F410]>0);[.$N$74];[.F410]=0;" ") -> Б | H410: of:=VLOOKUP([.$B410];[.$I$71:.$L$81];4;0) -> 2
B411: 9 | C411: of:=VLOOKUP([.$B411];[.$I$71:.$J$81];2;0) -> Тюмень | D411: 21 | E411: 54188 | F411: of:=IF(ISBLANK([.E411]*[.D411]);"0";[.E411]*[.D411]) -> 1137948 | G411: of:=COM.MICROSOFT.IFS([.F411]>5000000;[.$N$72];AND([.F411]>=1000000;[.F411]<=5000000);[.$N$73];AND([.F411]<1000000;[.F411]>0);[.$N$74];[.F411]=0;" ") -> Б | H411: of:=VLOOKUP([.$B411];[.$I$71:.$L$81];4;0) -> 3
B412: 2 | C412: of:=VLOOKUP([.$B412];[.$I$71:.$J$81];2;0) -> Санкт-Петербург | D412: 59 | E412: 7831 | F412: of:=IF(ISBLANK([.E412]*[.D412]);"0";[.E412]*[.D412]) -> 462029 | G412: of:=COM.MICROSOFT.IFS([.F412]>5000000;[.$N$72];AND([.F412]>=1000000;[.F412]<=5000000);[.$N$73];AND([.F412]<1000000;[.F412]>0);[.$N$74];[.F412]=0;" ") -> В | H412: of:=VLOOKUP([.$B412];[.$I$71:.$L$81];4;0) -> 9
B413: 3 | C413: of:=VLOOKUP([.$B413];[.$I$71:.$J$81];2;0) -> Челябинск | D413: 13 | E413: 32500 | F413: of:=IF(ISBLANK([.E413]*[.D413]);"0";[.E413]*[.D413]) -> 422500 | G413: of:=COM.MICROSOFT.IFS([.F413]>5000000;[.$N$72];AND([.F413]>=1000000;[.F413]<=5000000);[.$N$73];AND([.F413]<1000000;[.F413]>0);[.$N$74];[.F413]=0;" ") -> В | H413: of:=VLOOKUP([.$B413];[.$I$71:.$L$81];4;0) -> 1
B414: 4 | C414: of:=VLOOKUP([.$B414];[.$I$71:.$J$81];2;0) -> Архангельск | D414: 12 | E414: 72763 | F414: of:=IF(ISBLANK([.E414]*[.D414]);"0";[.E414]*[.D414]) -> 873156 | G414: of:=COM.MICROSOFT.IFS([.F414]>5000000;[.$N$72];AND([.F414]>=1000000;[.F414]<=5000000);[.$N$73];AND([.F414]<1000000;[.F414]>0);[.$N$74];[.F414]=0;" ") -> В | H414: of:=VLOOKUP([.$B414];[.$I$71:.$L$81];4;0) -> 2
B415: 2 | C415: of:=VLOOKUP([.$B415];[.$I$71:.$J$81];2;0) -> Санкт-Петербург | D415: 21 | E415: 97978 | F415: of:=IF(ISBLANK([.E415]*[.D415]);"0";[.E415]*[.D415]) -> 2057538 | G415: of:=COM.MICROSOFT.IFS([.F415]>5000000;[.$N$72];AND([.F415]>=1000000;[.F415]<=5000000);[.$N$73];AND([.F415]<1000000;[.F415]>0);[.$N$74];[.F415]=0;" ") -> Б | H415: of:=VLOOKUP([.$B415];[.$I$71:.$L$81];4;0) -> 9
B416: 5 | C416: of:=VLOOKUP([.$B416];[.$I$71:.$J$81];2;0) -> Краснодар | D416: 94 | E416: 97883 | F416: of:=IF(ISBLANK([.E416]*[.D416]);"0";[.E416]*[.D416]) -> 9201002 | G416: of:=COM.MICROSOFT.IFS([.F416]>5000000;[.$N$72];AND([.F416]>=1000000;[.F416]<=5000000);[.$N$73];AND([.F416]<1000000;[.F416]>0);[.$N$74];[.F416]=0;" ") -> А | H416: of:=VLOOKUP([.$B416];[.$I$71:.$L$81];4;0) -> 4
B417: 10 | C417: of:=VLOOKUP([.$B417];[.$I$71:.$J$81];2;0) -> Сочи | D417: 27 | E417: 13833 | F417: of:=IF(ISBLANK([.E417]*[.D417]);"0";[.E417]*[.D417]) -> 373491 | G417: of:=COM.MICROSOFT.IFS([.F417]>5000000;[.$N$72];AND([.F417]>=1000000;[.F417]<=5000000);[.$N$73];AND([.F417]<1000000;[.F417]>0);[.$N$74];[.F417]=0;" ") -> В | H417: of:=VLOOKUP([.$B417];[.$I$71:.$L$81];4;0) -> 6
B418: 6 | C418: of:=VLOOKUP([.$B418];[.$I$71:.$J$81];2;0) -> Владивосток | D418: 48 | E418: 92050 | F418: of:=IF(ISBLANK([.E418]*[.D418]);"0";[.E418]*[.D418]) -> 4418400 | G418: of:=COM.MICROSOFT.IFS([.F418]>5000000;[.$N$72];AND([.F418]>=1000000;[.F418]<=5000000);[.$N$73];AND([.F418]<1000000;[.F418]>0);[.$N$74];[.F418]=0;" ") -> Б | H418: of:=VLOOKUP([.$B418];[.$I$71:.$L$81];4;0) -> 7
B419: 5 | C419: of:=VLOOKUP([.$B419];[.$I$71:.$J$81];2;0) -> Краснодар | D419: 14 | E419: 76012 | F419: of:=IF(ISBLANK([.E419]*[.D419]);"0";[.E419]*[.D419]) -> 1064168 | G419: of:=COM.MICROSOFT.IFS([.F419]>5000000;[.$N$72];AND([.F419]>=1000000;[.F419]<=5000000);[.$N$73];AND([.F419]<1000000;[.F419]>0);[.$N$74];[.F419]=0;" ") -> Б | H419: of:=VLOOKUP([.$B419];[.$I$71:.$L$81];4;0) -> 4
B420: 6 | C420: of:=VLOOKUP([.$B420];[.$I$71:.$J$81];2;0) -> Владивосток | D420: 43 | E420: 80853 | F420: of:=IF(ISBLANK([.E420]*[.D420]);"0";[.E420]*[.D420]) -> 3476679 | G420: of:=COM.MICROSOFT.IFS([.F420]>5000000;[.$N$72];AND([.F420]>=1000000;[.F420]<=5000000);[.$N$73];AND([.F420]<1000000;[.F420]>0);[.$N$74];[.F420]=0;" ") -> Б | H420: of:=VLOOKUP([.$B420];[.$I$71:.$L$81];4;0) -> 7
B421: 4 | C421: of:=VLOOKUP([.$B421];[.$I$71:.$J$81];2;0) -> Архангельск | D421: 16 | E421: 41454 | F421: of:=IF(ISBLANK([.E421]*[.D421]);"0";[.E421]*[.D421]) -> 663264 | G421: of:=COM.MICROSOFT.IFS([.F421]>5000000;[.$N$72];AND([.F421]>=1000000;[.F421]<=5000000);[.$N$73];AND([.F421]<1000000;[.F421]>0);[.$N$74];[.F421]=0;" ") -> В | H421: of:=VLOOKUP([.$B421];[.$I$71:.$L$81];4;0) -> 2
B422: 10 | C422: of:=VLOOKUP([.$B422];[.$I$71:.$J$81];2;0) -> Сочи | D422: 89 | E422: 5344 | F422: of:=IF(ISBLANK([.E422]*[.D422]);"0";[.E422]*[.D422]) -> 475616 | G422: of:=COM.MICROSOFT.IFS([.F422]>5000000;[.$N$72];AND([.F422]>=1000000;[.F422]<=5000000);[.$N$73];AND([.F422]<1000000;[.F422]>0);[.$N$74];[.F422]=0;" ") -> В | H422: of:=VLOOKUP([.$B422];[.$I$71:.$L$81];4;0) -> 6
B423: 8 | C423: of:=VLOOKUP([.$B423];[.$I$71:.$J$81];2;0) -> Новосибирск | D423: 91 | E423: 75406 | F423: of:=IF(ISBLANK([.E423]*[.D423]);"0";[.E423]*[.D423]) -> 6861946 | G423: of:=COM.MICROSOFT.IFS([.F423]>5000000;[.$N$72];AND([.F423]>=1000000;[.F423]<=5000000);[.$N$73];AND([.F423]<1000000;[.F423]>0);[.$N$74];[.F423]=0;" ") -> А | H423: of:=VLOOKUP([.$B423];[.$I$71:.$L$81];4;0) -> 5
B424: 2 | C424: of:=VLOOKUP([.$B424];[.$I$71:.$J$81];2;0) -> Санкт-Петербург | D424: 41 | E424: 97586 | F424: of:=IF(ISBLANK([.E424]*[.D424]);"0";[.E424]*[.D424]) -> 4001026 | G424: of:=COM.MICROSOFT.IFS([.F424]>5000000;[.$N$72];AND([.F424]>=1000000;[.F424]<=5000000);[.$N$73];AND([.F424]<1000000;[.F424]>0);[.$N$74];[.F424]=0;" ") -> Б | H424: of:=VLOOKUP([.$B424];[.$I$71:.$L$81];4;0) -> 9
B425: 9 | C425: of:=VLOOKUP([.$B425];[.$I$71:.$J$81];2;0) -> Тюмень | D425: 64 | E425: 70267 | F425: of:=IF(ISBLANK([.E425]*[.D425]);"0";[.E425]*[.D425]) -> 4497088 | G425: of:=COM.MICROSOFT.IFS([.F425]>5000000;[.$N$72];AND([.F425]>=1000000;[.F425]<=5000000);[.$N$73];AND([.F425]<1000000;[.F425]>0);[.$N$74];[.F425]=0;" ") -> Б | H425: of:=VLOOKUP([.$B425];[.$I$71:.$L$81];4;0) -> 3
B426: 7 | C426: of:=VLOOKUP([.$B426];[.$I$71:.$J$81];2;0) -> Мурманск | D426: 44 | E426: 3621 | F426: of:=IF(ISBLANK([.E426]*[.D426]);"0";[.E426]*[.D426]) -> 159324 | G426: of:=COM.MICROSOFT.IFS([.F426]>5000000;[.$N$72];AND([.F426]>=1000000;[.F426]<=5000000);[.$N$73];AND([.F426]<1000000;[.F426]>0);[.$N$74];[.F426]=0;" ") -> В | H426: of:=VLOOKUP([.$B426];[.$I$71:.$L$81];4;0) -> 10
B427: 1 | C427: of:=VLOOKUP([.$B427];[.$I$71:.$J$81];2;0) -> Москва | D427: 57 | E427: 49178 | F427: of:=IF(ISBLANK([.E427]*[.D427]);"0";[.E427]*[.D427]) -> 2803146 | G427: of:=COM.MICROSOFT.IFS([.F427]>5000000;[.$N$72];AND([.F427]>=1000000;[.F427]<=5000000);[.$N$73];AND([.F427]<1000000;[.F427]>0);[.$N$74];[.F427]=0;" ") -> Б | H427: of:=VLOOKUP([.$B427];[.$I$71:.$L$81];4;0) -> 8
B428: 6 | C428: of:=VLOOKUP([.$B428];[.$I$71:.$J$81];2;0) -> Владивосток | D428: 78 | E428: 97210 | F428: of:=IF(ISBLANK([.E428]*[.D428]);"0";[.E428]*[.D428]) -> 7582380 | G428: of:=COM.MICROSOFT.IFS([.F428]>5000000;[.$N$72];AND([.F428]>=1000000;[.F428]<=5000000);[.$N$73];AND([.F428]<1000000;[.F428]>0);[.$N$74];[.F428]=0;" ") -> А | H428: of:=VLOOKUP([.$B428];[.$I$71:.$L$81];4;0) -> 7
B429: 5 | C429: of:=VLOOKUP([.$B429];[.$I$71:.$J$81];2;0) -> Краснодар | D429: 84 | E429: 36324 | F429: of:=IF(ISBLANK([.E429]*[.D429]);"0";[.E429]*[.D429]) -> 3051216 | G429: of:=COM.MICROSOFT.IFS([.F429]>5000000;[.$N$72];AND([.F429]>=1000000;[.F429]<=5000000);[.$N$73];AND([.F429]<1000000;[.F429]>0);[.$N$74];[.F429]=0;" ") -> Б | H429: of:=VLOOKUP([.$B429];[.$I$71:.$L$81];4;0) -> 4
B430: 5 | C430: of:=VLOOKUP([.$B430];[.$I$71:.$J$81];2;0) -> Краснодар | D430: 29 | E430: 37410 | F430: of:=IF(ISBLANK([.E430]*[.D430]);"0";[.E430]*[.D430]) -> 1084890 | G430: of:=COM.MICROSOFT.IFS([.F430]>5000000;[.$N$72];AND([.F430]>=1000000;[.F430]<=5000000);[.$N$73];AND([.F430]<1000000;[.F430]>0);[.$N$74];[.F430]=0;" ") -> Б | H430: of:=VLOOKUP([.$B430];[.$I$71:.$L$81];4;0) -> 4
B431: 8 | C431: of:=VLOOKUP([.$B431];[.$I$71:.$J$81];2;0) -> Новосибирск | D431: 96 | E431: 77676 | F431: of:=IF(ISBLANK([.E431]*[.D431]);"0";[.E431]*[.D431]) -> 7456896 | G431: of:=COM.MICROSOFT.IFS([.F431]>5000000;[.$N$72];AND([.F431]>=1000000;[.F431]<=5000000);[.$N$73];AND([.F431]<1000000;[.F431]>0);[.$N$74];[.F431]=0;" ") -> А | H431: of:=VLOOKUP([.$B431];[.$I$71:.$L$81];4;0) -> 5
B432: 8 | C432: of:=VLOOKUP([.$B432];[.$I$71:.$J$81];2;0) -> Новосибирск | D432: 4 | E432: 42872 | F432: of:=IF(ISBLANK([.E432]*[.D432]);"0";[.E432]*[.D432]) -> 171488 | G432: of:=COM.MICROSOFT.IFS([.F432]>5000000;[.$N$72];AND([.F432]>=1000000;[.F432]<=5000000);[.$N$73];AND([.F432]<1000000;[.F432]>0);[.$N$74];[.F432]=0;" ") -> В | H432: of:=VLOOKUP([.$B432];[.$I$71:.$L$81];4;0) -> 5
B433: 3 | C433: of:=VLOOKUP([.$B433];[.$I$71:.$J$81];2;0) -> Челябинск | D433: 96 | E433: 31623 | F433: of:=IF(ISBLANK([.E433]*[.D433]);"0";[.E433]*[.D433]) -> 3035808 | G433: of:=COM.MICROSOFT.IFS([.F433]>5000000;[.$N$72];AND([.F433]>=1000000;[.F433]<=5000000);[.$N$73];AND([.F433]<1000000;[.F433]>0);[.$N$74];[.F433]=0;" ") -> Б | H433: of:=VLOOKUP([.$B433];[.$I$71:.$L$81];4;0) -> 1
B434: 1 | C434: of:=VLOOKUP([.$B434];[.$I$71:.$J$81];2;0) -> Москва | D434: 37 | E434: 84409 | F434: of:=IF(ISBLANK([.E434]*[.D434]);"0";[.E434]*[.D434]) -> 3123133 | G434: of:=COM.MICROSOFT.IFS([.F434]>5000000;[.$N$72];AND([.F434]>=1000000;[.F434]<=5000000);[.$N$73];AND([.F434]<1000000;[.F434]>0);[.$N$74];[.F434]=0;" ") -> Б | H434: of:=VLOOKUP([.$B434];[.$I$71:.$L$81];4;0) -> 8
B435: 7 | C435: of:=VLOOKUP([.$B435];[.$I$71:.$J$81];2;0) -> Мурманск | D435: 60 | E435: 60745 | F435: of:=IF(ISBLANK([.E435]*[.D435]);"0";[.E435]*[.D435]) -> 3644700 | G435: of:=COM.MICROSOFT.IFS([.F435]>5000000;[.$N$72];AND([.F435]>=1000000;[.F435]<=5000000);[.$N$73];AND([.F435]<1000000;[.F435]>0);[.$N$74];[.F435]=0;" ") -> Б | H435: of:=VLOOKUP([.$B435];[.$I$71:.$L$81];4;0) -> 10
B436: 4 | C436: of:=VLOOKUP([.$B436];[.$I$71:.$J$81];2;0) -> Архангельск | D436: 73 | E436: 43222 | F436: of:=IF(ISBLANK([.E436]*[.D436]);"0";[.E436]*[.D436]) -> 3155206 | G436: of:=COM.MICROSOFT.IFS([.F436]>5000000;[.$N$72];AND([.F436]>=1000000;[.F436]<=5000000);[.$N$73];AND([.F436]<1000000;[.F436]>0);[.$N$74];[.F436]=0;" ") -> Б | H436: of:=VLOOKUP([.$B436];[.$I$71:.$L$81];4;0) -> 2
B437: 10 | C437: of:=VLOOKUP([.$B437];[.$I$71:.$J$81];2;0) -> Сочи | D437: 32 | E437: 8651 | F437: of:=IF(ISBLANK([.E437]*[.D437]);"0";[.E437]*[.D437]) -> 276832 | G437: of:=COM.MICROSOFT.IFS([.F437]>5000000;[.$N$72];AND([.F437]>=1000000;[.F437]<=5000000);[.$N$73];AND([.F437]<1000000;[.F437]>0);[.$N$74];[.F437]=0;" ") -> В | H437: of:=VLOOKUP([.$B437];[.$I$71:.$L$81];4;0) -> 6
B438: 6 | C438: of:=VLOOKUP([.$B438];[.$I$71:.$J$81];2;0) -> Владивосток | D438: 33 | E438: 45840 | F438: of:=IF(ISBLANK([.E438]*[.D438]);"0";[.E438]*[.D438]) -> 1512720 | G438: of:=COM.MICROSOFT.IFS([.F438]>5000000;[.$N$72];AND([.F438]>=1000000;[.F438]<=5000000);[.$N$73];AND([.F438]<1000000;[.F438]>0);[.$N$74];[.F438]=0;" ") -> Б | H438: of:=VLOOKUP([.$B438];[.$I$71:.$L$81];4;0) -> 7
B439: 10 | C439: of:=VLOOKUP([.$B439];[.$I$71:.$J$81];2;0) -> Сочи | D439: 84 | E439: 28652 | F439: of:=IF(ISBLANK([.E439]*[.D439]);"0";[.E439]*[.D439]) -> 2406768 | G439: of:=COM.MICROSOFT.IFS([.F439]>5000000;[.$N$72];AND([.F439]>=1000000;[.F439]<=5000000);[.$N$73];AND([.F439]<1000000;[.F439]>0);[.$N$74];[.F439]=0;" ") -> Б | H439: of:=VLOOKUP([.$B439];[.$I$71:.$L$81];4;0) -> 6
B440: 8 | C440: of:=VLOOKUP([.$B440];[.$I$71:.$J$81];2;0) -> Новосибирск | D440: 87 | E440: 13646 | F440: of:=IF(ISBLANK([.E440]*[.D440]);"0";[.E440]*[.D440]) -> 1187202 | G440: of:=COM.MICROSOFT.IFS([.F440]>5000000;[.$N$72];AND([.F440]>=1000000;[.F440]<=5000000);[.$N$73];AND([.F440]<1000000;[.F440]>0);[.$N$74];[.F440]=0;" ") -> Б | H440: of:=VLOOKUP([.$B440];[.$I$71:.$L$81];4;0) -> 5
B441: 6 | C441: of:=VLOOKUP([.$B441];[.$I$71:.$J$81];2;0) -> Владивосток | D441: 57 | E441: 4685 | F441: of:=IF(ISBLANK([.E441]*[.D441]);"0";[.E441]*[.D441]) -> 267045 | G441: of:=COM.MICROSOFT.IFS([.F441]>5000000;[.$N$72];AND([.F441]>=1000000;[.F441]<=5000000);[.$N$73];AND([.F441]<1000000;[.F441]>0);[.$N$74];[.F441]=0;" ") -> В | H441: of:=VLOOKUP([.$B441];[.$I$71:.$L$81];4;0) -> 7
B442: 3 | C442: of:=VLOOKUP([.$B442];[.$I$71:.$J$81];2;0) -> Челябинск | D442: 78 | E442: 63564 | F442: of:=IF(ISBLANK([.E442]*[.D442]);"0";[.E442]*[.D442]) -> 4957992 | G442: of:=COM.MICROSOFT.IFS([.F442]>5000000;[.$N$72];AND([.F442]>=1000000;[.F442]<=5000000);[.$N$73];AND([.F442]<1000000;[.F442]>0);[.$N$74];[.F442]=0;" ") -> Б | H442: of:=VLOOKUP([.$B442];[.$I$71:.$L$81];4;0) -> 1
B443: 9 | C443: of:=VLOOKUP([.$B443];[.$I$71:.$J$81];2;0) -> Тюмень | D443: 20 | E443: 81758 | F443: of:=IF(ISBLANK([.E443]*[.D443]);"0";[.E443]*[.D443]) -> 1635160 | G443: of:=COM.MICROSOFT.IFS([.F443]>5000000;[.$N$72];AND([.F443]>=1000000;[.F443]<=5000000);[.$N$73];AND([.F443]<1000000;[.F443]>0);[.$N$74];[.F443]=0;" ") -> Б | H443: of:=VLOOKUP([.$B443];[.$I$71:.$L$81];4;0) -> 3
B444: 4 | C444: of:=VLOOKUP([.$B444];[.$I$71:.$J$81];2;0) -> Архангельск | D444: 92 | E444: 55255 | F444: of:=IF(ISBLANK([.E444]*[.D444]);"0";[.E444]*[.D444]) -> 5083460 | G444: of:=COM.MICROSOFT.IFS([.F444]>5000000;[.$N$72];AND([.F444]>=1000000;[.F444]<=5000000);[.$N$73];AND([.F444]<1000000;[.F444]>0);[.$N$74];[.F444]=0;" ") -> А | H444: of:=VLOOKUP([.$B444];[.$I$71:.$L$81];4;0) -> 2
B445: 2 | C445: of:=VLOOKUP([.$B445];[.$I$71:.$J$81];2;0) -> Санкт-Петербург | D445: 23 | E445: 93836 | F445: of:=IF(ISBLANK([.E445]*[.D445]);"0";[.E445]*[.D445]) -> 2158228 | G445: of:=COM.MICROSOFT.IFS([.F445]>5000000;[.$N$72];AND([.F445]>=1000000;[.F445]<=5000000);[.$N$73];AND([.F445]<1000000;[.F445]>0);[.$N$74];[.F445]=0;" ") -> Б | H445: of:=VLOOKUP([.$B445];[.$I$71:.$L$81];4;0) -> 9
B446: 4 | C446: of:=VLOOKUP([.$B446];[.$I$71:.$J$81];2;0) -> Архангельск | D446: 67 | E446: 69933 | F446: of:=IF(ISBLANK([.E446]*[.D446]);"0";[.E446]*[.D446]) -> 4685511 | G446: of:=COM.MICROSOFT.IFS([.F446]>5000000;[.$N$72];AND([.F446]>=1000000;[.F446]<=5000000);[.$N$73];AND([.F446]<1000000;[.F446]>0);[.$N$74];[.F446]=0;" ") -> Б | H446: of:=VLOOKUP([.$B446];[.$I$71:.$L$81];4;0) -> 2
B447: 10 | C447: of:=VLOOKUP([.$B447];[.$I$71:.$J$81];2;0) -> Сочи | D447: 10 | E447: 57935 | F447: of:=IF(ISBLANK([.E447]*[.D447]);"0";[.E447]*[.D447]) -> 579350 | G447: of:=COM.MICROSOFT.IFS([.F447]>5000000;[.$N$72];AND([.F447]>=1000000;[.F447]<=5000000);[.$N$73];AND([.F447]<1000000;[.F447]>0);[.$N$74];[.F447]=0;" ") -> В | H447: of:=VLOOKUP([.$B447];[.$I$71:.$L$81];4;0) -> 6
B448: 3 | C448: of:=VLOOKUP([.$B448];[.$I$71:.$J$81];2;0) -> Челябинск | D448: 73 | E448: 66613 | F448: of:=IF(ISBLANK([.E448]*[.D448]);"0";[.E448]*[.D448]) -> 4862749 | G448: of:=COM.MICROSOFT.IFS([.F448]>5000000;[.$N$72];AND([.F448]>=1000000;[.F448]<=5000000);[.$N$73];AND([.F448]<1000000;[.F448]>0);[.$N$74];[.F448]=0;" ") -> Б | H448: of:=VLOOKUP([.$B448];[.$I$71:.$L$81];4;0) -> 1
B449: 7 | C449: of:=VLOOKUP([.$B449];[.$I$71:.$J$81];2;0) -> Мурманск | D449: 48 | E449: 66846 | F449: of:=IF(ISBLANK([.E449]*[.D449]);"0";[.E449]*[.D449]) -> 3208608 | G449: of:=COM.MICROSOFT.IFS([.F449]>5000000;[.$N$72];AND([.F449]>=1000000;[.F449]<=5000000);[.$N$73];AND([.F449]<1000000;[.F449]>0);[.$N$74];[.F449]=0;" ") -> Б | H449: of:=VLOOKUP([.$B449];[.$I$71:.$L$81];4;0) -> 10
B450: 7 | C450: of:=VLOOKUP([.$B450];[.$I$71:.$J$81];2;0) -> Мурманск | D450: 6 | E450: 55409 | F450: of:=IF(ISBLANK([.E450]*[.D450]);"0";[.E450]*[.D450]) -> 332454 | G450: of:=COM.MICROSOFT.IFS([.F450]>5000000;[.$N$72];AND([.F450]>=1000000;[.F450]<=5000000);[.$N$73];AND([.F450]<1000000;[.F450]>0);[.$N$74];[.F450]=0;" ") -> В | H450: of:=VLOOKUP([.$B450];[.$I$71:.$L$81];4;0) -> 10
B451: 6 | C451: of:=VLOOKUP([.$B451];[.$I$71:.$J$81];2;0) -> Владивосток | D451: 67 | E451: 16744 | F451: of:=IF(ISBLANK([.E451]*[.D451]);"0";[.E451]*[.D451]) -> 1121848 | G451: of:=COM.MICROSOFT.IFS([.F451]>5000000;[.$N$72];AND([.F451]>=1000000;[.F451]<=5000000);[.$N$73];AND([.F451]<1000000;[.F451]>0);[.$N$74];[.F451]=0;" ") -> Б | H451: of:=VLOOKUP([.$B451];[.$I$71:.$L$81];4;0) -> 7
B452: 10 | C452: of:=VLOOKUP([.$B452];[.$I$71:.$J$81];2;0) -> Сочи | D452: 98 | E452: 73224 | F452: of:=IF(ISBLANK([.E452]*[.D452]);"0";[.E452]*[.D452]) -> 7175952 | G452: of:=COM.MICROSOFT.IFS([.F452]>5000000;[.$N$72];AND([.F452]>=1000000;[.F452]<=5000000);[.$N$73];AND([.F452]<1000000;[.F452]>0);[.$N$74];[.F452]=0;" ") -> А | H452: of:=VLOOKUP([.$B452];[.$I$71:.$L$81];4;0) -> 6
B453: 9 | C453: of:=VLOOKUP([.$B453];[.$I$71:.$J$81];2;0) -> Тюмень | D453: 14 | E453: 26636 | F453: of:=IF(ISBLANK([.E453]*[.D453]);"0";[.E453]*[.D453]) -> 372904 | G453: of:=COM.MICROSOFT.IFS([.F453]>5000000;[.$N$72];AND([.F453]>=1000000;[.F453]<=5000000);[.$N$73];AND([.F453]<1000000;[.F453]>0);[.$N$74];[.F453]=0;" ") -> В | H453: of:=VLOOKUP([.$B453];[.$I$71:.$L$81];4;0) -> 3
B454: 4 | C454: of:=VLOOKUP([.$B454];[.$I$71:.$J$81];2;0) -> Архангельск | D454: 8 | E454: 63912 | F454: of:=IF(ISBLANK([.E454]*[.D454]);"0";[.E454]*[.D454]) -> 511296 | G454: of:=COM.MICROSOFT.IFS([.F454]>5000000;[.$N$72];AND([.F454]>=1000000;[.F454]<=5000000);[.$N$73];AND([.F454]<1000000;[.F454]>0);[.$N$74];[.F454]=0;" ") -> В | H454: of:=VLOOKUP([.$B454];[.$I$71:.$L$81];4;0) -> 2
B455: 3 | C455: of:=VLOOKUP([.$B455];[.$I$71:.$J$81];2;0) -> Челябинск | D455: 92 | E455: 55357 | F455: of:=IF(ISBLANK([.E455]*[.D455]);"0";[.E455]*[.D455]) -> 5092844 | G455: of:=COM.MICROSOFT.IFS([.F455]>5000000;[.$N$72];AND([.F455]>=1000000;[.F455]<=5000000);[.$N$73];AND([.F455]<1000000;[.F455]>0);[.$N$74];[.F455]=0;" ") -> А | H455: of:=VLOOKUP([.$B455];[.$I$71:.$L$81];4;0) -> 1
B456: 7 | C456: of:=VLOOKUP([.$B456];[.$I$71:.$J$81];2;0) -> Мурманск | D456: 70 | E456: 86770 | F456: of:=IF(ISBLANK([.E456]*[.D456]);"0";[.E456]*[.D456]) -> 6073900 | G456: of:=COM.MICROSOFT.IFS([.F456]>5000000;[.$N$72];AND([.F456]>=1000000;[.F456]<=5000000);[.$N$73];AND([.F456]<1000000;[.F456]>0);[.$N$74];[.F456]=0;" ") -> А | H456: of:=VLOOKUP([.$B456];[.$I$71:.$L$81];4;0) -> 10
B457: 8 | C457: of:=VLOOKUP([.$B457];[.$I$71:.$J$81];2;0) -> Новосибирск | D457: 96 | E457: 18605 | F457: of:=IF(ISBLANK([.E457]*[.D457]);"0";[.E457]*[.D457]) -> 1786080 | G457: of:=COM.MICROSOFT.IFS([.F457]>5000000;[.$N$72];AND([.F457]>=1000000;[.F457]<=5000000);[.$N$73];AND([.F457]<1000000;[.F457]>0);[.$N$74];[.F457]=0;" ") -> Б | H457: of:=VLOOKUP([.$B457];[.$I$71:.$L$81];4;0) -> 5
B458: 4 | C458: of:=VLOOKUP([.$B458];[.$I$71:.$J$81];2;0) -> Архангельск | D458: 4 | E458: 14940 | F458: of:=IF(ISBLANK([.E458]*[.D458]);"0";[.E458]*[.D458]) -> 59760 | G458: of:=COM.MICROSOFT.IFS([.F458]>5000000;[.$N$72];AND([.F458]>=1000000;[.F458]<=5000000);[.$N$73];AND([.F458]<1000000;[.F458]>0);[.$N$74];[.F458]=0;" ") -> В | H458: of:=VLOOKUP([.$B458];[.$I$71:.$L$81];4;0) -> 2
B459: 8 | C459: of:=VLOOKUP([.$B459];[.$I$71:.$J$81];2;0) -> Новосибирск | D459: 10 | E459: 50220 | F459: of:=IF(ISBLANK([.E459]*[.D459]);"0";[.E459]*[.D459]) -> 502200 | G459: of:=COM.MICROSOFT.IFS([.F459]>5000000;[.$N$72];AND([.F459]>=1000000;[.F459]<=5000000);[.$N$73];AND([.F459]<1000000;[.F459]>0);[.$N$74];[.F459]=0;" ") -> В | H459: of:=VLOOKUP([.$B459];[.$I$71:.$L$81];4;0) -> 5
B460: 4 | C460: of:=VLOOKUP([.$B460];[.$I$71:.$J$81];2;0) -> Архангельск | D460: 8 | E460: 88089 | F460: of:=IF(ISBLANK([.E460]*[.D460]);"0";[.E460]*[.D460]) -> 704712 | G460: of:=COM.MICROSOFT.IFS([.F460]>5000000;[.$N$72];AND([.F460]>=1000000;[.F460]<=5000000);[.$N$73];AND([.F460]<1000000;[.F460]>0);[.$N$74];[.F460]=0;" ") -> В | H460: of:=VLOOKUP([.$B460];[.$I$71:.$L$81];4;0) -> 2
B461: 9 | C461: of:=VLOOKUP([.$B461];[.$I$71:.$J$81];2;0) -> Тюмень | D461: 8 | E461: 81672 | F461: of:=IF(ISBLANK([.E461]*[.D461]);"0";[.E461]*[.D461]) -> 653376 | G461: of:=COM.MICROSOFT.IFS([.F461]>5000000;[.$N$72];AND([.F461]>=1000000;[.F461]<=5000000);[.$N$73];AND([.F461]<1000000;[.F461]>0);[.$N$74];[.F461]=0;" ") -> В | H461: of:=VLOOKUP([.$B461];[.$I$71:.$L$81];4;0) -> 3
B462: 7 | C462: of:=VLOOKUP([.$B462];[.$I$71:.$J$81];2;0) -> Мурманск | D462: 100 | E462: 45421 | F462: of:=IF(ISBLANK([.E462]*[.D462]);"0";[.E462]*[.D462]) -> 4542100 | G462: of:=COM.MICROSOFT.IFS([.F462]>5000000;[.$N$72];AND([.F462]>=1000000;[.F462]<=5000000);[.$N$73];AND([.F462]<1000000;[.F462]>0);[.$N$74];[.F462]=0;" ") -> Б | H462: of:=VLOOKUP([.$B462];[.$I$71:.$L$81];4;0) -> 10
B463: 3 | C463: of:=VLOOKUP([.$B463];[.$I$71:.$J$81];2;0) -> Челябинск | D463: 46 | E463: 17486 | F463: of:=IF(ISBLANK([.E463]*[.D463]);"0";[.E463]*[.D463]) -> 804356 | G463: of:=COM.MICROSOFT.IFS([.F463]>5000000;[.$N$72];AND([.F463]>=1000000;[.F463]<=5000000);[.$N$73];AND([.F463]<1000000;[.F463]>0);[.$N$74];[.F463]=0;" ") -> В | H463: of:=VLOOKUP([.$B463];[.$I$71:.$L$81];4;0) -> 1
B464: 3 | C464: of:=VLOOKUP([.$B464];[.$I$71:.$J$81];2;0) -> Челябинск | D464: 63 | E464: 34913 | F464: of:=IF(ISBLANK([.E464]*[.D464]);"0";[.E464]*[.D464]) -> 2199519 | G464: of:=COM.MICROSOFT.IFS([.F464]>5000000;[.$N$72];AND([.F464]>=1000000;[.F464]<=5000000);[.$N$73];AND([.F464]<1000000;[.F464]>0);[.$N$74];[.F464]=0;" ") -> Б | H464: of:=VLOOKUP([.$B464];[.$I$71:.$L$81];4;0) -> 1
B465: 9 | C465: of:=VLOOKUP([.$B465];[.$I$71:.$J$81];2;0) -> Тюмень | D465: 91 | E465: 27075 | F465: of:=IF(ISBLANK([.E465]*[.D465]);"0";[.E465]*[.D465]) -> 2463825 | G465: of:=COM.MICROSOFT.IFS([.F465]>5000000;[.$N$72];AND([.F465]>=1000000;[.F465]<=5000000);[.$N$73];AND([.F465]<1000000;[.F465]>0);[.$N$74];[.F465]=0;" ") -> Б | H465: of:=VLOOKUP([.$B465];[.$I$71:.$L$81];4;0) -> 3
B466: 1 | C466: of:=VLOOKUP([.$B466];[.$I$71:.$J$81];2;0) -> Москва | D466: 39 | E466: 84326 | F466: of:=IF(ISBLANK([.E466]*[.D466]);"0";[.E466]*[.D466]) -> 3288714 | G466: of:=COM.MICROSOFT.IFS([.F466]>5000000;[.$N$72];AND([.F466]>=1000000;[.F466]<=5000000);[.$N$73];AND([.F466]<1000000;[.F466]>0);[.$N$74];[.F466]=0;" ") -> Б | H466: of:=VLOOKUP([.$B466];[.$I$71:.$L$81];4;0) -> 8
B467: 6 | C467: of:=VLOOKUP([.$B467];[.$I$71:.$J$81];2;0) -> Владивосток | D467: 96 | E467: 3180 | F467: of:=IF(ISBLANK([.E467]*[.D467]);"0";[.E467]*[.D467]) -> 305280 | G467: of:=COM.MICROSOFT.IFS([.F467]>5000000;[.$N$72];AND([.F467]>=1000000;[.F467]<=5000000);[.$N$73];AND([.F467]<1000000;[.F467]>0);[.$N$74];[.F467]=0;" ") -> В | H467: of:=VLOOKUP([.$B467];[.$I$71:.$L$81];4;0) -> 7
B468: 4 | C468: of:=VLOOKUP([.$B468];[.$I$71:.$J$81];2;0) -> Архангельск | D468: 40 | E468: 92356 | F468: of:=IF(ISBLANK([.E468]*[.D468]);"0";[.E468]*[.D468]) -> 3694240 | G468: of:=COM.MICROSOFT.IFS([.F468]>5000000;[.$N$72];AND([.F468]>=1000000;[.F468]<=5000000);[.$N$73];AND([.F468]<1000000;[.F468]>0);[.$N$74];[.F468]=0;" ") -> Б | H468: of:=VLOOKUP([.$B468];[.$I$71:.$L$81];4;0) -> 2
B469: 3 | C469: of:=VLOOKUP([.$B469];[.$I$71:.$J$81];2;0) -> Челябинск | D469: 1 | E469: 33920 | F469: of:=IF(ISBLANK([.E469]*[.D469]);"0";[.E469]*[.D469]) -> 33920 | G469: of:=COM.MICROSOFT.IFS([.F469]>5000000;[.$N$72];AND([.F469]>=1000000;[.F469]<=5000000);[.$N$73];AND([.F469]<1000000;[.F469]>0);[.$N$74];[.F469]=0;" ") -> В | H469: of:=VLOOKUP([.$B469];[.$I$71:.$L$81];4;0) -> 1
B470: 2 | C470: of:=VLOOKUP([.$B470];[.$I$71:.$J$81];2;0) -> Санкт-Петербург | D470: 100 | E470: 46025 | F470: of:=IF(ISBLANK([.E470]*[.D470]);"0";[.E470]*[.D470]) -> 4602500 | G470: of:=COM.MICROSOFT.IFS([.F470]>5000000;[.$N$72];AND([.F470]>=1000000;[.F470]<=5000000);[.$N$73];AND([.F470]<1000000;[.F470]>0);[.$N$74];[.F470]=0;" ") -> Б | H470: of:=VLOOKUP([.$B470];[.$I$71:.$L$81];4;0) -> 9
B471: 10 | C471: of:=VLOOKUP([.$B471];[.$I$71:.$J$81];2;0) -> Сочи | D471: 54 | E471: 97126 | F471: of:=IF(ISBLANK([.E471]*[.D471]);"0";[.E471]*[.D471]) -> 5244804 | G471: of:=COM.MICROSOFT.IFS([.F471]>5000000;[.$N$72];AND([.F471]>=1000000;[.F471]<=5000000);[.$N$73];AND([.F471]<1000000;[.F471]>0);[.$N$74];[.F471]=0;" ") -> А | H471: of:=VLOOKUP([.$B471];[.$I$71:.$L$81];4;0) -> 6
B472: 5 | C472: of:=VLOOKUP([.$B472];[.$I$71:.$J$81];2;0) -> Краснодар | D472: 66 | E472: 96138 | F472: of:=IF(ISBLANK([.E472]*[.D472]);"0";[.E472]*[.D472]) -> 6345108 | G472: of:=COM.MICROSOFT.IFS([.F472]>5000000;[.$N$72];AND([.F472]>=1000000;[.F472]<=5000000);[.$N$73];AND([.F472]<1000000;[.F472]>0);[.$N$74];[.F472]=0;" ") -> А | H472: of:=VLOOKUP([.$B472];[.$I$71:.$L$81];4;0) -> 4
B473: 1 | C473: of:=VLOOKUP([.$B473];[.$I$71:.$J$81];2;0) -> Москва | D473: 49 | E473: 81475 | F473: of:=IF(ISBLANK([.E473]*[.D473]);"0";[.E473]*[.D473]) -> 3992275 | G473: of:=COM.MICROSOFT.IFS([.F473]>5000000;[.$N$72];AND([.F473]>=1000000;[.F473]<=5000000);[.$N$73];AND([.F473]<1000000;[.F473]>0);[.$N$74];[.F473]=0;" ") -> Б | H473: of:=VLOOKUP([.$B473];[.$I$71:.$L$81];4;0) -> 8
B474: 9 | C474: of:=VLOOKUP([.$B474];[.$I$71:.$J$81];2;0) -> Тюмень | D474: 17 | E474: 48404 | F474: of:=IF(ISBLANK([.E474]*[.D474]);"0";[.E474]*[.D474]) -> 822868 | G474: of:=COM.MICROSOFT.IFS([.F474]>5000000;[.$N$72];AND([.F474]>=1000000;[.F474]<=5000000);[.$N$73];AND([.F474]<1000000;[.F474]>0);[.$N$74];[.F474]=0;" ") -> В | H474: of:=VLOOKUP([.$B474];[.$I$71:.$L$81];4;0) -> 3
B475: 9 | C475: of:=VLOOKUP([.$B475];[.$I$71:.$J$81];2;0) -> Тюмень | D475: 49 | E475: 75609 | F475: of:=IF(ISBLANK([.E475]*[.D475]);"0";[.E475]*[.D475]) -> 3704841 | G475: of:=COM.MICROSOFT.IFS([.F475]>5000000;[.$N$72];AND([.F475]>=1000000;[.F475]<=5000000);[.$N$73];AND([.F475]<1000000;[.F475]>0);[.$N$74];[.F475]=0;" ") -> Б | H475: of:=VLOOKUP([.$B475];[.$I$71:.$L$81];4;0) -> 3
B476: 6 | C476: of:=VLOOKUP([.$B476];[.$I$71:.$J$81];2;0) -> Владивосток | D476: 63 | E476: 30580 | F476: of:=IF(ISBLANK([.E476]*[.D476]);"0";[.E476]*[.D476]) -> 1926540 | G476: of:=COM.MICROSOFT.IFS([.F476]>5000000;[.$N$72];AND([.F476]>=1000000;[.F476]<=5000000);[.$N$73];AND([.F476]<1000000;[.F476]>0);[.$N$74];[.F476]=0;" ") -> Б | H476: of:=VLOOKUP([.$B476];[.$I$71:.$L$81];4;0) -> 7
B477: 3 | C477: of:=VLOOKUP([.$B477];[.$I$71:.$J$81];2;0) -> Челябинск | D477: 39 | E477: 99219 | F477: of:=IF(ISBLANK([.E477]*[.D477]);"0";[.E477]*[.D477]) -> 3869541 | G477: of:=COM.MICROSOFT.IFS([.F477]>5000000;[.$N$72];AND([.F477]>=1000000;[.F477]<=5000000);[.$N$73];AND([.F477]<1000000;[.F477]>0);[.$N$74];[.F477]=0;" ") -> Б | H477: of:=VLOOKUP([.$B477];[.$I$71:.$L$81];4;0) -> 1
B478: 10 | C478: of:=VLOOKUP([.$B478];[.$I$71:.$J$81];2;0) -> Сочи | D478: 27 | E478: 61713 | F478: of:=IF(ISBLANK([.E478]*[.D478]);"0";[.E478]*[.D478]) -> 1666251 | G478: of:=COM.MICROSOFT.IFS([.F478]>5000000;[.$N$72];AND([.F478]>=1000000;[.F478]<=5000000);[.$N$73];AND([.F478]<1000000;[.F478]>0);[.$N$74];[.F478]=0;" ") -> Б | H478: of:=VLOOKUP([.$B478];[.$I$71:.$L$81];4;0) -> 6
B479: 5 | C479: of:=VLOOKUP([.$B479];[.$I$71:.$J$81];2;0) -> Краснодар | D479: 4 | E479: 58811 | F479: of:=IF(ISBLANK([.E479]*[.D479]);"0";[.E479]*[.D479]) -> 235244 | G479: of:=COM.MICROSOFT.IFS([.F479]>5000000;[.$N$72];AND([.F479]>=1000000;[.F479]<=5000000);[.$N$73];AND([.F479]<1000000;[.F479]>0);[.$N$74];[.F479]=0;" ") -> В | H479: of:=VLOOKUP([.$B479];[.$I$71:.$L$81];4;0) -> 4
B480: 5 | C480: of:=VLOOKUP([.$B480];[.$I$71:.$J$81];2;0) -> Краснодар | D480: 65 | E480: 36333 | F480: of:=IF(ISBLANK([.E480]*[.D480]);"0";[.E480]*[.D480]) -> 2361645 | G480: of:=COM.MICROSOFT.IFS([.F480]>5000000;[.$N$72];AND([.F480]>=1000000;[.F480]<=5000000);[.$N$73];AND([.F480]<1000000;[.F480]>0);[.$N$74];[.F480]=0;" ") -> Б | H480: of:=VLOOKUP([.$B480];[.$I$71:.$L$81];4;0) -> 4
B481: 1 | C481: of:=VLOOKUP([.$B481];[.$I$71:.$J$81];2;0) -> Москва | D481: 55 | E481: 42635 | F481: of:=IF(ISBLANK([.E481]*[.D481]);"0";[.E481]*[.D481]) -> 2344925 | G481: of:=COM.MICROSOFT.IFS([.F481]>5000000;[.$N$72];AND([.F481]>=1000000;[.F481]<=5000000);[.$N$73];AND([.F481]<1000000;[.F481]>0);[.$N$74];[.F481]=0;" ") -> Б | H481: of:=VLOOKUP([.$B481];[.$I$71:.$L$81];4;0) -> 8
B482: 9 | C482: of:=VLOOKUP([.$B482];[.$I$71:.$J$81];2;0) -> Тюмень | D482: 37 | E482: 77187 | F482: of:=IF(ISBLANK([.E482]*[.D482]);"0";[.E482]*[.D482]) -> 2855919 | G482: of:=COM.MICROSOFT.IFS([.F482]>5000000;[.$N$72];AND([.F482]>=1000000;[.F482]<=5000000);[.$N$73];AND([.F482]<1000000;[.F482]>0);[.$N$74];[.F482]=0;" ") -> Б | H482: of:=VLOOKUP([.$B482];[.$I$71:.$L$81];4;0) -> 3
B483: 2 | C483: of:=VLOOKUP([.$B483];[.$I$71:.$J$81];2;0) -> Санкт-Петербург | D483: 30 | E483: 4971 | F483: of:=IF(ISBLANK([.E483]*[.D483]);"0";[.E483]*[.D483]) -> 149130 | G483: of:=COM.MICROSOFT.IFS([.F483]>5000000;[.$N$72];AND([.F483]>=1000000;[.F483]<=5000000);[.$N$73];AND([.F483]<1000000;[.F483]>0);[.$N$74];[.F483]=0;" ") -> В | H483: of:=VLOOKUP([.$B483];[.$I$71:.$L$81];4;0) -> 9
B484: 6 | C484: of:=VLOOKUP([.$B484];[.$I$71:.$J$81];2;0) -> Владивосток | D484: 46 | E484: 46863 | F484: of:=IF(ISBLANK([.E484]*[.D484]);"0";[.E484]*[.D484]) -> 2155698 | G484: of:=COM.MICROSOFT.IFS([.F484]>5000000;[.$N$72];AND([.F484]>=1000000;[.F484]<=5000000);[.$N$73];AND([.F484]<1000000;[.F484]>0);[.$N$74];[.F484]=0;" ") -> Б | H484: of:=VLOOKUP([.$B484];[.$I$71:.$L$81];4;0) -> 7
B485: 6 | C485: of:=VLOOKUP([.$B485];[.$I$71:.$J$81];2;0) -> Владивосток | D485: 57 | E485: 92764 | F485: of:=IF(ISBLANK([.E485]*[.D485]);"0";[.E485]*[.D485]) -> 5287548 | G485: of:=COM.MICROSOFT.IFS([.F485]>5000000;[.$N$72];AND([.F485]>=1000000;[.F485]<=5000000);[.$N$73];AND([.F485]<1000000;[.F485]>0);[.$N$74];[.F485]=0;" ") -> А | H485: of:=VLOOKUP([.$B485];[.$I$71:.$L$81];4;0) -> 7
B486: 8 | C486: of:=VLOOKUP([.$B486];[.$I$71:.$J$81];2;0) -> Новосибирск | D486: 19 | E486: 3394 | F486: of:=IF(ISBLANK([.E486]*[.D486]);"0";[.E486]*[.D486]) -> 64486 | G486: of:=COM.MICROSOFT.IFS([.F486]>5000000;[.$N$72];AND([.F486]>=1000000;[.F486]<=5000000);[.$N$73];AND([.F486]<1000000;[.F486]>0);[.$N$74];[.F486]=0;" ") -> В | H486: of:=VLOOKUP([.$B486];[.$I$71:.$L$81];4;0) -> 5
B487: 4 | C487: of:=VLOOKUP([.$B487];[.$I$71:.$J$81];2;0) -> Архангельск | D487: 40 | E487: 21313 | F487: of:=IF(ISBLANK([.E487]*[.D487]);"0";[.E487]*[.D487]) -> 852520 | G487: of:=COM.MICROSOFT.IFS([.F487]>5000000;[.$N$72];AND([.F487]>=1000000;[.F487]<=5000000);[.$N$73];AND([.F487]<1000000;[.F487]>0);[.$N$74];[.F487]=0;" ") -> В | H487: of:=VLOOKUP([.$B487];[.$I$71:.$L$81];4;0) -> 2
B488: 9 | C488: of:=VLOOKUP([.$B488];[.$I$71:.$J$81];2;0) -> Тюмень | D488: 77 | E488: 43686 | F488: of:=IF(ISBLANK([.E488]*[.D488]);"0";[.E488]*[.D488]) -> 3363822 | G488: of:=COM.MICROSOFT.IFS([.F488]>5000000;[.$N$72];AND([.F488]>=1000000;[.F488]<=5000000);[.$N$73];AND([.F488]<1000000;[.F488]>0);[.$N$74];[.F488]=0;" ") -> Б | H488: of:=VLOOKUP([.$B488];[.$I$71:.$L$81];4;0) -> 3
B489: 10 | C489: of:=VLOOKUP([.$B489];[.$I$71:.$J$81];2;0) -> Сочи | D489: 12 | E489: 88495 | F489: of:=IF(ISBLANK([.E489]*[.D489]);"0";[.E489]*[.D489]) -> 1061940 | G489: of:=COM.MICROSOFT.IFS([.F489]>5000000;[.$N$72];AND([.F489]>=1000000;[.F489]<=5000000);[.$N$73];AND([.F489]<1000000;[.F489]>0);[.$N$74];[.F489]=0;" ") -> Б | H489: of:=VLOOKUP([.$B489];[.$I$71:.$L$81];4;0) -> 6
B490: 5 | C490: of:=VLOOKUP([.$B490];[.$I$71:.$J$81];2;0) -> Краснодар | D490: 34 | E490: 82357 | F490: of:=IF(ISBLANK([.E490]*[.D490]);"0";[.E490]*[.D490]) -> 2800138 | G490: of:=COM.MICROSOFT.IFS([.F490]>5000000;[.$N$72];AND([.F490]>=1000000;[.F490]<=5000000);[.$N$73];AND([.F490]<1000000;[.F490]>0);[.$N$74];[.F490]=0;" ") -> Б | H490: of:=VLOOKUP([.$B490];[.$I$71:.$L$81];4;0) -> 4
B491: 5 | C491: of:=VLOOKUP([.$B491];[.$I$71:.$J$81];2;0) -> Краснодар | D491: 83 | E491: 6717 | F491: of:=IF(ISBLANK([.E491]*[.D491]);"0";[.E491]*[.D491]) -> 557511 | G491: of:=COM.MICROSOFT.IFS([.F491]>5000000;[.$N$72];AND([.F491]>=1000000;[.F491]<=5000000);[.$N$73];AND([.F491]<1000000;[.F491]>0);[.$N$74];[.F491]=0;" ") -> В | H491: of:=VLOOKUP([.$B491];[.$I$71:.$L$81];4;0) -> 4
B492: 4 | C492: of:=VLOOKUP([.$B492];[.$I$71:.$J$81];2;0) -> Архангельск | D492: 12 | E492: 39352 | F492: of:=IF(ISBLANK([.E492]*[.D492]);"0";[.E492]*[.D492]) -> 472224 | G492: of:=COM.MICROSOFT.IFS([.F492]>5000000;[.$N$72];AND([.F492]>=1000000;[.F492]<=5000000);[.$N$73];AND([.F492]<1000000;[.F492]>0);[.$N$74];[.F492]=0;" ") -> В | H492: of:=VLOOKUP([.$B492];[.$I$71:.$L$81];4;0) -> 2
B493: 5 | C493: of:=VLOOKUP([.$B493];[.$I$71:.$J$81];2;0) -> Краснодар | D493: 40 | E493: 72613 | F493: of:=IF(ISBLANK([.E493]*[.D493]);"0";[.E493]*[.D493]) -> 2904520 | G493: of:=COM.MICROSOFT.IFS([.F493]>5000000;[.$N$72];AND([.F493]>=1000000;[.F493]<=5000000);[.$N$73];AND([.F493]<1000000;[.F493]>0);[.$N$74];[.F493]=0;" ") -> Б | H493: of:=VLOOKUP([.$B493];[.$I$71:.$L$81];4;0) -> 4
B494: 3 | C494: of:=VLOOKUP([.$B494];[.$I$71:.$J$81];2;0) -> Челябинск | D494: 74 | E494: 43401 | F494: of:=IF(ISBLANK([.E494]*[.D494]);"0";[.E494]*[.D494]) -> 3211674 | G494: of:=COM.MICROSOFT.IFS([.F494]>5000000;[.$N$72];AND([.F494]>=1000000;[.F494]<=5000000);[.$N$73];AND([.F494]<1000000;[.F494]>0);[.$N$74];[.F494]=0;" ") -> Б | H494: of:=VLOOKUP([.$B494];[.$I$71:.$L$81];4;0) -> 1
B495: 5 | C495: of:=VLOOKUP([.$B495];[.$I$71:.$J$81];2;0) -> Краснодар | D495: 14 | E495: 12139 | F495: of:=IF(ISBLANK([.E495]*[.D495]);"0";[.E495]*[.D495]) -> 169946 | G495: of:=COM.MICROSOFT.IFS([.F495]>5000000;[.$N$72];AND([.F495]>=1000000;[.F495]<=5000000);[.$N$73];AND([.F495]<1000000;[.F495]>0);[.$N$74];[.F495]=0;" ") -> В | H495: of:=VLOOKUP([.$B495];[.$I$71:.$L$81];4;0) -> 4
B496: 9 | C496: of:=VLOOKUP([.$B496];[.$I$71:.$J$81];2;0) -> Тюмень | D496: 94 | E496: 85180 | F496: of:=IF(ISBLANK([.E496]*[.D496]);"0";[.E496]*[.D496]) -> 8006920 | G496: of:=COM.MICROSOFT.IFS([.F496]>5000000;[.$N$72];AND([.F496]>=1000000;[.F496]<=5000000);[.$N$73];AND([.F496]<1000000;[.F496]>0);[.$N$74];[.F496]=0;" ") -> А | H496: of:=VLOOKUP([.$B496];[.$I$71:.$L$81];4;0) -> 3
B497: 5 | C497: of:=VLOOKUP([.$B497];[.$I$71:.$J$81];2;0) -> Краснодар | D497: 97 | E497: 70601 | F497: of:=IF(ISBLANK([.E497]*[.D497]);"0";[.E497]*[.D497]) -> 6848297 | G497: of:=COM.MICROSOFT.IFS([.F497]>5000000;[.$N$72];AND([.F497]>=1000000;[.F497]<=5000000);[.$N$73];AND([.F497]<1000000;[.F497]>0);[.$N$74];[.F497]=0;" ") -> А | H497: of:=VLOOKUP([.$B497];[.$I$71:.$L$81];4;0) -> 4
B498: 2 | C498: of:=VLOOKUP([.$B498];[.$I$71:.$J$81];2;0) -> Санкт-Петербург | D498: 32 | E498: 63770 | F498: of:=IF(ISBLANK([.E498]*[.D498]);"0";[.E498]*[.D498]) -> 2040640 | G498: of:=COM.MICROSOFT.IFS([.F498]>5000000;[.$N$72];AND([.F498]>=1000000;[.F498]<=5000000);[.$N$73];AND([.F498]<1000000;[.F498]>0);[.$N$74];[.F498]=0;" ") -> Б | H498: of:=VLOOKUP([.$B498];[.$I$71:.$L$81];4;0) -> 9
B499: 3 | C499: of:=VLOOKUP([.$B499];[.$I$71:.$J$81];2;0) -> Челябинск | D499: 81 | E499: 31783 | F499: of:=IF(ISBLANK([.E499]*[.D499]);"0";[.E499]*[.D499]) -> 2574423 | G499: of:=COM.MICROSOFT.IFS([.F499]>5000000;[.$N$72];AND([.F499]>=1000000;[.F499]<=5000000);[.$N$73];AND([.F499]<1000000;[.F499]>0);[.$N$74];[.F499]=0;" ") -> Б | H499: of:=VLOOKUP([.$B499];[.$I$71:.$L$81];4;0) -> 1
B500: 2 | C500: of:=VLOOKUP([.$B500];[.$I$71:.$J$81];2;0) -> Санкт-Петербург | D500: 85 | E500: 6742 | F500: of:=IF(ISBLANK([.E500]*[.D500]);"0";[.E500]*[.D500]) -> 573070 | G500: of:=COM.MICROSOFT.IFS([.F500]>5000000;[.$N$72];AND([.F500]>=1000000;[.F500]<=5000000);[.$N$73];AND([.F500]<1000000;[.F500]>0);[.$N$74];[.F500]=0;" ") -> В | H500: of:=VLOOKUP([.$B500];[.$I$71:.$L$81];4;0) -> 9
B501: 3 | C501: of:=VLOOKUP([.$B501];[.$I$71:.$J$81];2;0) -> Челябинск | D501: 68 | E501: 92181 | F501: of:=IF(ISBLANK([.E501]*[.D501]);"0";[.E501]*[.D501]) -> 6268308 | G501: of:=COM.MICROSOFT.IFS([.F501]>5000000;[.$N$72];AND([.F501]>=1000000;[.F501]<=5000000);[.$N$73];AND([.F501]<1000000;[.F501]>0);[.$N$74];[.F501]=0;" ") -> А | H501: of:=VLOOKUP([.$B501];[.$I$71:.$L$81];4;0) -> 1
B502: 3 | C502: of:=VLOOKUP([.$B502];[.$I$71:.$J$81];2;0) -> Челябинск | D502: 3 | E502: 70985 | F502: of:=IF(ISBLANK([.E502]*[.D502]);"0";[.E502]*[.D502]) -> 212955 | G502: of:=COM.MICROSOFT.IFS([.F502]>5000000;[.$N$72];AND([.F502]>=1000000;[.F502]<=5000000);[.$N$73];AND([.F502]<1000000;[.F502]>0);[.$N$74];[.F502]=0;" ") -> В | H502: of:=VLOOKUP([.$B502];[.$I$71:.$L$81];4;0) -> 1
B503: 2 | C503: of:=VLOOKUP([.$B503];[.$I$71:.$J$81];2;0) -> Санкт-Петербург | D503: 38 | E503: 17026 | F503: of:=IF(ISBLANK([.E503]*[.D503]);"0";[.E503]*[.D503]) -> 646988 | G503: of:=COM.MICROSOFT.IFS([.F503]>5000000;[.$N$72];AND([.F503]>=1000000;[.F503]<=5000000);[.$N$73];AND([.F503]<1000000;[.F503]>0);[.$N$74];[.F503]=0;" ") -> В | H503: of:=VLOOKUP([.$B503];[.$I$71:.$L$81];4;0) -> 9
B504: 10 | C504: of:=VLOOKUP([.$B504];[.$I$71:.$J$81];2;0) -> Сочи | D504: 31 | E504: 55097 | F504: of:=IF(ISBLANK([.E504]*[.D504]);"0";[.E504]*[.D504]) -> 1708007 | G504: of:=COM.MICROSOFT.IFS([.F504]>5000000;[.$N$72];AND([.F504]>=1000000;[.F504]<=5000000);[.$N$73];AND([.F504]<1000000;[.F504]>0);[.$N$74];[.F504]=0;" ") -> Б | H504: of:=VLOOKUP([.$B504];[.$I$71:.$L$81];4;0) -> 6
B505: 6 | C505: of:=VLOOKUP([.$B505];[.$I$71:.$J$81];2;0) -> Владивосток | D505: 3 | E505: 58612 | F505: of:=IF(ISBLANK([.E505]*[.D505]);"0";[.E505]*[.D505]) -> 175836 | G505: of:=COM.MICROSOFT.IFS([.F505]>5000000;[.$N$72];AND([.F505]>=1000000;[.F505]<=5000000);[.$N$73];AND([.F505]<1000000;[.F505]>0);[.$N$74];[.F505]=0;" ") -> В | H505: of:=VLOOKUP([.$B505];[.$I$71:.$L$81];4;0) -> 7
B506: 6 | C506: of:=VLOOKUP([.$B506];[.$I$71:.$J$81];2;0) -> Владивосток | D506: 97 | E506: 59952 | F506: of:=IF(ISBLANK([.E506]*[.D506]);"0";[.E506]*[.D506]) -> 5815344 | G506: of:=COM.MICROSOFT.IFS([.F506]>5000000;[.$N$72];AND([.F506]>=1000000;[.F506]<=5000000);[.$N$73];AND([.F506]<1000000;[.F506]>0);[.$N$74];[.F506]=0;" ") -> А | H506: of:=VLOOKUP([.$B506];[.$I$71:.$L$81];4;0) -> 7
B507: 9 | C507: of:=VLOOKUP([.$B507];[.$I$71:.$J$81];2;0) -> Тюмень | D507: 84 | E507: 14088 | F507: of:=IF(ISBLANK([.E507]*[.D507]);"0";[.E507]*[.D507]) -> 1183392 | G507: of:=COM.MICROSOFT.IFS([.F507]>5000000;[.$N$72];AND([.F507]>=1000000;[.F507]<=5000000);[.$N$73];AND([.F507]<1000000;[.F507]>0);[.$N$74];[.F507]=0;" ") -> Б | H507: of:=VLOOKUP([.$B507];[.$I$71:.$L$81];4;0) -> 3
B508: 4 | C508: of:=VLOOKUP([.$B508];[.$I$71:.$J$81];2;0) -> Архангельск | D508: 40 | E508: 97775 | F508: of:=IF(ISBLANK([.E508]*[.D508]);"0";[.E508]*[.D508]) -> 3911000 | G508: of:=COM.MICROSOFT.IFS([.F508]>5000000;[.$N$72];AND([.F508]>=1000000;[.F508]<=5000000);[.$N$73];AND([.F508]<1000000;[.F508]>0);[.$N$74];[.F508]=0;" ") -> Б | H508: of:=VLOOKUP([.$B508];[.$I$71:.$L$81];4;0) -> 2
B509: 7 | C509: of:=VLOOKUP([.$B509];[.$I$71:.$J$81];2;0) -> Мурманск | D509: 64 | E509: 51741 | F509: of:=IF(ISBLANK([.E509]*[.D509]);"0";[.E509]*[.D509]) -> 3311424 | G509: of:=COM.MICROSOFT.IFS([.F509]>5000000;[.$N$72];AND([.F509]>=1000000;[.F509]<=5000000);[.$N$73];AND([.F509]<1000000;[.F509]>0);[.$N$74];[.F509]=0;" ") -> Б | H509: of:=VLOOKUP([.$B509];[.$I$71:.$L$81];4;0) -> 10
B510: 10 | C510: of:=VLOOKUP([.$B510];[.$I$71:.$J$81];2;0) -> Сочи | D510: 87 | E510: 38822 | F510: of:=IF(ISBLANK([.E510]*[.D510]);"0";[.E510]*[.D510]) -> 3377514 | G510: of:=COM.MICROSOFT.IFS([.F510]>5000000;[.$N$72];AND([.F510]>=1000000;[.F510]<=5000000);[.$N$73];AND([.F510]<1000000;[.F510]>0);[.$N$74];[.F510]=0;" ") -> Б | H510: of:=VLOOKUP([.$B510];[.$I$71:.$L$81];4;0) -> 6
B511: 8 | C511: of:=VLOOKUP([.$B511];[.$I$71:.$J$81];2;0) -> Новосибирск | D511: 29 | E511: 29451 | F511: of:=IF(ISBLANK([.E511]*[.D511]);"0";[.E511]*[.D511]) -> 854079 | G511: of:=COM.MICROSOFT.IFS([.F511]>5000000;[.$N$72];AND([.F511]>=1000000;[.F511]<=5000000);[.$N$73];AND([.F511]<1000000;[.F511]>0);[.$N$74];[.F511]=0;" ") -> В | H511: of:=VLOOKUP([.$B511];[.$I$71:.$L$81];4;0) -> 5
B512: 5 | C512: of:=VLOOKUP([.$B512];[.$I$71:.$J$81];2;0) -> Краснодар | D512: 87 | E512: 22513 | F512: of:=IF(ISBLANK([.E512]*[.D512]);"0";[.E512]*[.D512]) -> 1958631 | G512: of:=COM.MICROSOFT.IFS([.F512]>5000000;[.$N$72];AND([.F512]>=1000000;[.F512]<=5000000);[.$N$73];AND([.F512]<1000000;[.F512]>0);[.$N$74];[.F512]=0;" ") -> Б | H512: of:=VLOOKUP([.$B512];[.$I$71:.$L$81];4;0) -> 4
B513: 8 | C513: of:=VLOOKUP([.$B513];[.$I$71:.$J$81];2;0) -> Новосибирск | D513: 99 | E513: 92796 | F513: of:=IF(ISBLANK([.E513]*[.D513]);"0";[.E513]*[.D513]) -> 9186804 | G513: of:=COM.MICROSOFT.IFS([.F513]>5000000;[.$N$72];AND([.F513]>=1000000;[.F513]<=5000000);[.$N$73];AND([.F513]<1000000;[.F513]>0);[.$N$74];[.F513]=0;" ") -> А | H513: of:=VLOOKUP([.$B513];[.$I$71:.$L$81];4;0) -> 5
B514: 3 | C514: of:=VLOOKUP([.$B514];[.$I$71:.$J$81];2;0) -> Челябинск | D514: 80 | E514: 98603 | F514: of:=IF(ISBLANK([.E514]*[.D514]);"0";[.E514]*[.D514]) -> 7888240 | G514: of:=COM.MICROSOFT.IFS([.F514]>5000000;[.$N$72];AND([.F514]>=1000000;[.F514]<=5000000);[.$N$73];AND([.F514]<1000000;[.F514]>0);[.$N$74];[.F514]=0;" ") -> А | H514: of:=VLOOKUP([.$B514];[.$I$71:.$L$81];4;0) -> 1
B515: 10 | C515: of:=VLOOKUP([.$B515];[.$I$71:.$J$81];2;0) -> Сочи | D515: 83 | E515: 19035 | F515: of:=IF(ISBLANK([.E515]*[.D515]);"0";[.E515]*[.D515]) -> 1579905 | G515: of:=COM.MICROSOFT.IFS([.F515]>5000000;[.$N$72];AND([.F515]>=1000000;[.F515]<=5000000);[.$N$73];AND([.F515]<1000000;[.F515]>0);[.$N$74];[.F515]=0;" ") -> Б | H515: of:=VLOOKUP([.$B515];[.$I$71:.$L$81];4;0) -> 6
B516: 8 | C516: of:=VLOOKUP([.$B516];[.$I$71:.$J$81];2;0) -> Новосибирск | D516: 53 | E516: 66739 | F516: of:=IF(ISBLANK([.E516]*[.D516]);"0";[.E516]*[.D516]) -> 3537167 | G516: of:=COM.MICROSOFT.IFS([.F516]>5000000;[.$N$72];AND([.F516]>=1000000;[.F516]<=5000000);[.$N$73];AND([.F516]<1000000;[.F516]>0);[.$N$74];[.F516]=0;" ") -> Б | H516: of:=VLOOKUP([.$B516];[.$I$71:.$L$81];4;0) -> 5
B517: 4 | C517: of:=VLOOKUP([.$B517];[.$I$71:.$J$81];2;0) -> Архангельск | D517: 47 | E517: 44930 | F517: of:=IF(ISBLANK([.E517]*[.D517]);"0";[.E517]*[.D517]) -> 2111710 | G517: of:=COM.MICROSOFT.IFS([.F517]>5000000;[.$N$72];AND([.F517]>=1000000;[.F517]<=5000000);[.$N$73];AND([.F517]<1000000;[.F517]>0);[.$N$74];[.F517]=0;" ") -> Б | H517: of:=VLOOKUP([.$B517];[.$I$71:.$L$81];4;0) -> 2
B518: 10 | C518: of:=VLOOKUP([.$B518];[.$I$71:.$J$81];2;0) -> Сочи | D518: 13 | E518: 12510 | F518: of:=IF(ISBLANK([.E518]*[.D518]);"0";[.E518]*[.D518]) -> 162630 | G518: of:=COM.MICROSOFT.IFS([.F518]>5000000;[.$N$72];AND([.F518]>=1000000;[.F518]<=5000000);[.$N$73];AND([.F518]<1000000;[.F518]>0);[.$N$74];[.F518]=0;" ") -> В | H518: of:=VLOOKUP([.$B518];[.$I$71:.$L$81];4;0) -> 6
B519: 3 | C519: of:=VLOOKUP([.$B519];[.$I$71:.$J$81];2;0) -> Челябинск | D519: 65 | E519: 1119 | F519: of:=IF(ISBLANK([.E519]*[.D519]);"0";[.E519]*[.D519]) -> 72735 | G519: of:=COM.MICROSOFT.IFS([.F519]>5000000;[.$N$72];AND([.F519]>=1000000;[.F519]<=5000000);[.$N$73];AND([.F519]<1000000;[.F519]>0);[.$N$74];[.F519]=0;" ") -> В | H519: of:=VLOOKUP([.$B519];[.$I$71:.$L$81];4;0) -> 1
B520: 9 | C520: of:=VLOOKUP([.$B520];[.$I$71:.$J$81];2;0) -> Тюмень | D520: 81 | E520: 82805 | F520: of:=IF(ISBLANK([.E520]*[.D520]);"0";[.E520]*[.D520]) -> 6707205 | G520: of:=COM.MICROSOFT.IFS([.F520]>5000000;[.$N$72];AND([.F520]>=1000000;[.F520]<=5000000);[.$N$73];AND([.F520]<1000000;[.F520]>0);[.$N$74];[.F520]=0;" ") -> А | H520: of:=VLOOKUP([.$B520];[.$I$71:.$L$81];4;0) -> 3
B521: 10 | C521: of:=VLOOKUP([.$B521];[.$I$71:.$J$81];2;0) -> Сочи | D521: 67 | E521: 35527 | F521: of:=IF(ISBLANK([.E521]*[.D521]);"0";[.E521]*[.D521]) -> 2380309 | G521: of:=COM.MICROSOFT.IFS([.F521]>5000000;[.$N$72];AND([.F521]>=1000000;[.F521]<=5000000);[.$N$73];AND([.F521]<1000000;[.F521]>0);[.$N$74];[.F521]=0;" ") -> Б | H521: of:=VLOOKUP([.$B521];[.$I$71:.$L$81];4;0) -> 6
B522: 4 | C522: of:=VLOOKUP([.$B522];[.$I$71:.$J$81];2;0) -> Архангельск | D522: 73 | E522: 48091 | F522: of:=IF(ISBLANK([.E522]*[.D522]);"0";[.E522]*[.D522]) -> 3510643 | G522: of:=COM.MICROSOFT.IFS([.F522]>5000000;[.$N$72];AND([.F522]>=1000000;[.F522]<=5000000);[.$N$73];AND([.F522]<1000000;[.F522]>0);[.$N$74];[.F522]=0;" ") -> Б | H522: of:=VLOOKUP([.$B522];[.$I$71:.$L$81];4;0) -> 2
B523: 9 | C523: of:=VLOOKUP([.$B523];[.$I$71:.$J$81];2;0) -> Тюмень | D523: 50 | E523: 95014 | F523: of:=IF(ISBLANK([.E523]*[.D523]);"0";[.E523]*[.D523]) -> 4750700 | G523: of:=COM.MICROSOFT.IFS([.F523]>5000000;[.$N$72];AND([.F523]>=1000000;[.F523]<=5000000);[.$N$73];AND([.F523]<1000000;[.F523]>0);[.$N$74];[.F523]=0;" ") -> Б | H523: of:=VLOOKUP([.$B523];[.$I$71:.$L$81];4;0) -> 3
B524: 5 | C524: of:=VLOOKUP([.$B524];[.$I$71:.$J$81];2;0) -> Краснодар | D524: 54 | E524: 15970 | F524: of:=IF(ISBLANK([.E524]*[.D524]);"0";[.E524]*[.D524]) -> 862380 | G524: of:=COM.MICROSOFT.IFS([.F524]>5000000;[.$N$72];AND([.F524]>=1000000;[.F524]<=5000000);[.$N$73];AND([.F524]<1000000;[.F524]>0);[.$N$74];[.F524]=0;" ") -> В | H524: of:=VLOOKUP([.$B524];[.$I$71:.$L$81];4;0) -> 4
B525: 4 | C525: of:=VLOOKUP([.$B525];[.$I$71:.$J$81];2;0) -> Архангельск | D525: 84 | E525: 12241 | F525: of:=IF(ISBLANK([.E525]*[.D525]);"0";[.E525]*[.D525]) -> 1028244 | G525: of:=COM.MICROSOFT.IFS([.F525]>5000000;[.$N$72];AND([.F525]>=1000000;[.F525]<=5000000);[.$N$73];AND([.F525]<1000000;[.F525]>0);[.$N$74];[.F525]=0;" ") -> Б | H525: of:=VLOOKUP([.$B525];[.$I$71:.$L$81];4;0) -> 2
B526: 4 | C526: of:=VLOOKUP([.$B526];[.$I$71:.$J$81];2;0) -> Архангельск | D526: 40 | E526: 22068 | F526: of:=IF(ISBLANK([.E526]*[.D526]);"0";[.E526]*[.D526]) -> 882720 | G526: of:=COM.MICROSOFT.IFS([.F526]>5000000;[.$N$72];AND([.F526]>=1000000;[.F526]<=5000000);[.$N$73];AND([.F526]<1000000;[.F526]>0);[.$N$74];[.F526]=0;" ") -> В | H526: of:=VLOOKUP([.$B526];[.$I$71:.$L$81];4;0) -> 2
B527: 8 | C527: of:=VLOOKUP([.$B527];[.$I$71:.$J$81];2;0) -> Новосибирск | D527: 28 | E527: 89477 | F527: of:=IF(ISBLANK([.E527]*[.D527]);"0";[.E527]*[.D527]) -> 2505356 | G527: of:=COM.MICROSOFT.IFS([.F527]>5000000;[.$N$72];AND([.F527]>=1000000;[.F527]<=5000000);[.$N$73];AND([.F527]<1000000;[.F527]>0);[.$N$74];[.F527]=0;" ") -> Б | H527: of:=VLOOKUP([.$B527];[.$I$71:.$L$81];4;0) -> 5
B528: 7 | C528: of:=VLOOKUP([.$B528];[.$I$71:.$J$81];2;0) -> Мурманск | D528: 10 | E528: 11141 | F528: of:=IF(ISBLANK([.E528]*[.D528]);"0";[.E528]*[.D528]) -> 111410 | G528: of:=COM.MICROSOFT.IFS([.F528]>5000000;[.$N$72];AND([.F528]>=1000000;[.F528]<=5000000);[.$N$73];AND([.F528]<1000000;[.F528]>0);[.$N$74];[.F528]=0;" ") -> В | H528: of:=VLOOKUP([.$B528];[.$I$71:.$L$81];4;0) -> 10
B529: 7 | C529: of:=VLOOKUP([.$B529];[.$I$71:.$J$81];2;0) -> Мурманск | D529: 67 | E529: 16794 | F529: of:=IF(ISBLANK([.E529]*[.D529]);"0";[.E529]*[.D529]) -> 1125198 | G529: of:=COM.MICROSOFT.IFS([.F529]>5000000;[.$N$72];AND([.F529]>=1000000;[.F529]<=5000000);[.$N$73];AND([.F529]<1000000;[.F529]>0);[.$N$74];[.F529]=0;" ") -> Б | H529: of:=VLOOKUP([.$B529];[.$I$71:.$L$81];4;0) -> 10
B530: 8 | C530: of:=VLOOKUP([.$B530];[.$I$71:.$J$81];2;0) -> Новосибирск | D530: 59 | E530: 62961 | F530: of:=IF(ISBLANK([.E530]*[.D530]);"0";[.E530]*[.D530]) -> 3714699 | G530: of:=COM.MICROSOFT.IFS([.F530]>5000000;[.$N$72];AND([.F530]>=1000000;[.F530]<=5000000);[.$N$73];AND([.F530]<1000000;[.F530]>0);[.$N$74];[.F530]=0;" ") -> Б | H530: of:=VLOOKUP([.$B530];[.$I$71:.$L$81];4;0) -> 5
B531: 5 | C531: of:=VLOOKUP([.$B531];[.$I$71:.$J$81];2;0) -> Краснодар | D531: 94 | E531: 25895 | F531: of:=IF(ISBLANK([.E531]*[.D531]);"0";[.E531]*[.D531]) -> 2434130 | G531: of:=COM.MICROSOFT.IFS([.F531]>5000000;[.$N$72];AND([.F531]>=1000000;[.F531]<=5000000);[.$N$73];AND([.F531]<1000000;[.F531]>0);[.$N$74];[.F531]=0;" ") -> Б | H531: of:=VLOOKUP([.$B531];[.$I$71:.$L$81];4;0) -> 4
B532: 5 | C532: of:=VLOOKUP([.$B532];[.$I$71:.$J$81];2;0) -> Краснодар | D532: 72 | E532: 49350 | F532: of:=IF(ISBLANK([.E532]*[.D532]);"0";[.E532]*[.D532]) -> 3553200 | G532: of:=COM.MICROSOFT.IFS([.F532]>5000000;[.$N$72];AND([.F532]>=1000000;[.F532]<=5000000);[.$N$73];AND([.F532]<1000000;[.F532]>0);[.$N$74];[.F532]=0;" ") -> Б | H532: of:=VLOOKUP([.$B532];[.$I$71:.$L$81];4;0) -> 4
B533: 9 | C533: of:=VLOOKUP([.$B533];[.$I$71:.$J$81];2;0) -> Тюмень | D533: 33 | E533: 87526 | F533: of:=IF(ISBLANK([.E533]*[.D533]);"0";[.E533]*[.D533]) -> 2888358 | G533: of:=COM.MICROSOFT.IFS([.F533]>5000000;[.$N$72];AND([.F533]>=1000000;[.F533]<=5000000);[.$N$73];AND([.F533]<1000000;[.F533]>0);[.$N$74];[.F533]=0;" ") -> Б | H533: of:=VLOOKUP([.$B533];[.$I$71:.$L$81];4;0) -> 3
B534: 6 | C534: of:=VLOOKUP([.$B534];[.$I$71:.$J$81];2;0) -> Владивосток | D534: 35 | E534: 12437 | F534: of:=IF(ISBLANK([.E534]*[.D534]);"0";[.E534]*[.D534]) -> 435295 | G534: of:=COM.MICROSOFT.IFS([.F534]>5000000;[.$N$72];AND([.F534]>=1000000;[.F534]<=5000000);[.$N$73];AND([.F534]<1000000;[.F534]>0);[.$N$74];[.F534]=0;" ") -> В | H534: of:=VLOOKUP([.$B534];[.$I$71:.$L$81];4;0) -> 7
B535: 8 | C535: of:=VLOOKUP([.$B535];[.$I$71:.$J$81];2;0) -> Новосибирск | D535: 62 | E535: 14199 | F535: of:=IF(ISBLANK([.E535]*[.D535]);"0";[.E535]*[.D535]) -> 880338 | G535: of:=COM.MICROSOFT.IFS([.F535]>5000000;[.$N$72];AND([.F535]>=1000000;[.F535]<=5000000);[.$N$73];AND([.F535]<1000000;[.F535]>0);[.$N$74];[.F535]=0;" ") -> В | H535: of:=VLOOKUP([.$B535];[.$I$71:.$L$81];4;0) -> 5
B536: 3 | C536: of:=VLOOKUP([.$B536];[.$I$71:.$J$81];2;0) -> Челябинск | D536: 0 | E536: 4991 | F536: of:=IF(ISBLANK([.E536]*[.D536]);"0";[.E536]*[.D536]) -> 0 | G536: of:=COM.MICROSOFT.IFS([.F536]>5000000;[.$N$72];AND([.F536]>=1000000;[.F536]<=5000000);[.$N$73];AND([.F536]<1000000;[.F536]>0);[.$N$74];[.F536]=0;" ") ->   | H536: of:=VLOOKUP([.$B536];[.$I$71:.$L$81];4;0) -> 1
B537: 7 | C537: of:=VLOOKUP([.$B537];[.$I$71:.$J$81];2;0) -> Мурманск | D537: 73 | E537: 87690 | F537: of:=IF(ISBLANK([.E537]*[.D537]);"0";[.E537]*[.D537]) -> 6401370 | G537: of:=COM.MICROSOFT.IFS([.F537]>5000000;[.$N$72];AND([.F537]>=1000000;[.F537]<=5000000);[.$N$73];AND([.F537]<1000000;[.F537]>0);[.$N$74];[.F537]=0;" ") -> А | H537: of:=VLOOKUP([.$B537];[.$I$71:.$L$81];4;0) -> 10
B538: 8 | C538: of:=VLOOKUP([.$B538];[.$I$71:.$J$81];2;0) -> Новосибирск | D538: 56 | E538: 39426 | F538: of:=IF(ISBLANK([.E538]*[.D538]);"0";[.E538]*[.D538]) -> 2207856 | G538: of:=COM.MICROSOFT.IFS([.F538]>5000000;[.$N$72];AND([.F538]>=1000000;[.F538]<=5000000);[.$N$73];AND([.F538]<1000000;[.F538]>0);[.$N$74];[.F538]=0;" ") -> Б | H538: of:=VLOOKUP([.$B538];[.$I$71:.$L$81];4;0) -> 5
B539: 5 | C539: of:=VLOOKUP([.$B539];[.$I$71:.$J$81];2;0) -> Краснодар | D539: 3 | E539: 73537 | F539: of:=IF(ISBLANK([.E539]*[.D539]);"0";[.E539]*[.D539]) -> 220611 | G539: of:=COM.MICROSOFT.IFS([.F539]>5000000;[.$N$72];AND([.F539]>=1000000;[.F539]<=5000000);[.$N$73];AND([.F539]<1000000;[.F539]>0);[.$N$74];[.F539]=0;" ") -> В | H539: of:=VLOOKUP([.$B539];[.$I$71:.$L$81];4;0) -> 4
B540: 6 | C540: of:=VLOOKUP([.$B540];[.$I$71:.$J$81];2;0) -> Владивосток | D540: 88 | E540: 24808 | F540: of:=IF(ISBLANK([.E540]*[.D540]);"0";[.E540]*[.D540]) -> 2183104 | G540: of:=COM.MICROSOFT.IFS([.F540]>5000000;[.$N$72];AND([.F540]>=1000000;[.F540]<=5000000);[.$N$73];AND([.F540]<1000000;[.F540]>0);[.$N$74];[.F540]=0;" ") -> Б | H540: of:=VLOOKUP([.$B540];[.$I$71:.$L$81];4;0) -> 7
B541: 4 | C541: of:=VLOOKUP([.$B541];[.$I$71:.$J$81];2;0) -> Архангельск | D541: 0 | E541: 53498 | F541: of:=IF(ISBLANK([.E541]*[.D541]);"0";[.E541]*[.D541]) -> 0 | G541: of:=COM.MICROSOFT.IFS([.F541]>5000000;[.$N$72];AND([.F541]>=1000000;[.F541]<=5000000);[.$N$73];AND([.F541]<1000000;[.F541]>0);[.$N$74];[.F541]=0;" ") ->   | H541: of:=VLOOKUP([.$B541];[.$I$71:.$L$81];4;0) -> 2
B542: 4 | C542: of:=VLOOKUP([.$B542];[.$I$71:.$J$81];2;0) -> Архангельск | D542: 33 | E542: 90979 | F542: of:=IF(ISBLANK([.E542]*[.D542]);"0";[.E542]*[.D542]) -> 3002307 | G542: of:=COM.MICROSOFT.IFS([.F542]>5000000;[.$N$72];AND([.F542]>=1000000;[.F542]<=5000000);[.$N$73];AND([.F542]<1000000;[.F542]>0);[.$N$74];[.F542]=0;" ") -> Б | H542: of:=VLOOKUP([.$B542];[.$I$71:.$L$81];4;0) -> 2
B543: 2 | C543: of:=VLOOKUP([.$B543];[.$I$71:.$J$81];2;0) -> Санкт-Петербург | D543: 14 | E543: 96698 | F543: of:=IF(ISBLANK([.E543]*[.D543]);"0";[.E543]*[.D543]) -> 1353772 | G543: of:=COM.MICROSOFT.IFS([.F543]>5000000;[.$N$72];AND([.F543]>=1000000;[.F543]<=5000000);[.$N$73];AND([.F543]<1000000;[.F543]>0);[.$N$74];[.F543]=0;" ") -> Б | H543: of:=VLOOKUP([.$B543];[.$I$71:.$L$81];4;0) -> 9
B544: 2 | C544: of:=VLOOKUP([.$B544];[.$I$71:.$J$81];2;0) -> Санкт-Петербург | D544: 53 | E544: 40622 | F544: of:=IF(ISBLANK([.E544]*[.D544]);"0";[.E544]*[.D544]) -> 2152966 | G544: of:=COM.MICROSOFT.IFS([.F544]>5000000;[.$N$72];AND([.F544]>=1000000;[.F544]<=5000000);[.$N$73];AND([.F544]<1000000;[.F544]>0);[.$N$74];[.F544]=0;" ") -> Б | H544: of:=VLOOKUP([.$B544];[.$I$71:.$L$81];4;0) -> 9
B545: 4 | C545: of:=VLOOKUP([.$B545];[.$I$71:.$J$81];2;0) -> Архангельск | D545: 33 | E545: 71921 | F545: of:=IF(ISBLANK([.E545]*[.D545]);"0";[.E545]*[.D545]) -> 2373393 | G545: of:=COM.MICROSOFT.IFS([.F545]>5000000;[.$N$72];AND([.F545]>=1000000;[.F545]<=5000000);[.$N$73];AND([.F545]<1000000;[.F545]>0);[.$N$74];[.F545]=0;" ") -> Б | H545: of:=VLOOKUP([.$B545];[.$I$71:.$L$81];4;0) -> 2
B546: 6 | C546: of:=VLOOKUP([.$B546];[.$I$71:.$J$81];2;0) -> Владивосток | D546: 75 | E546: 60874 | F546: of:=IF(ISBLANK([.E546]*[.D546]);"0";[.E546]*[.D546]) -> 4565550 | G546: of:=COM.MICROSOFT.IFS([.F546]>5000000;[.$N$72];AND([.F546]>=1000000;[.F546]<=5000000);[.$N$73];AND([.F546]<1000000;[.F546]>0);[.$N$74];[.F546]=0;" ") -> Б | H546: of:=VLOOKUP([.$B546];[.$I$71:.$L$81];4;0) -> 7
B547: 7 | C547: of:=VLOOKUP([.$B547];[.$I$71:.$J$81];2;0) -> Мурманск | D547: 0 | E547: 37281 | F547: of:=IF(ISBLANK([.E547]*[.D547]);"0";[.E547]*[.D547]) -> 0 | G547: of:=COM.MICROSOFT.IFS([.F547]>5000000;[.$N$72];AND([.F547]>=1000000;[.F547]<=5000000);[.$N$73];AND([.F547]<1000000;[.F547]>0);[.$N$74];[.F547]=0;" ") ->   | H547: of:=VLOOKUP([.$B547];[.$I$71:.$L$81];4;0) -> 10
B548: 4 | C548: of:=VLOOKUP([.$B548];[.$I$71:.$J$81];2;0) -> Архангельск | D548: 86 | E548: 98822 | F548: of:=IF(ISBLANK([.E548]*[.D548]);"0";[.E548]*[.D548]) -> 8498692 | G548: of:=COM.MICROSOFT.IFS([.F548]>5000000;[.$N$72];AND([.F548]>=1000000;[.F548]<=5000000);[.$N$73];AND([.F548]<1000000;[.F548]>0);[.$N$74];[.F548]=0;" ") -> А | H548: of:=VLOOKUP([.$B548];[.$I$71:.$L$81];4;0) -> 2
B549: 3 | C549: of:=VLOOKUP([.$B549];[.$I$71:.$J$81];2;0) -> Челябинск | D549: 88 | E549: 84230 | F549: of:=IF(ISBLANK([.E549]*[.D549]);"0";[.E549]*[.D549]) -> 7412240 | G549: of:=COM.MICROSOFT.IFS([.F549]>5000000;[.$N$72];AND([.F549]>=1000000;[.F549]<=5000000);[.$N$73];AND([.F549]<1000000;[.F549]>0);[.$N$74];[.F549]=0;" ") -> А | H549: of:=VLOOKUP([.$B549];[.$I$71:.$L$81];4;0) -> 1
B550: 9 | C550: of:=VLOOKUP([.$B550];[.$I$71:.$J$81];2;0) -> Тюмень | D550: 81 | E550: 81979 | F550: of:=IF(ISBLANK([.E550]*[.D550]);"0";[.E550]*[.D550]) -> 6640299 | G550: of:=COM.MICROSOFT.IFS([.F550]>5000000;[.$N$72];AND([.F550]>=1000000;[.F550]<=5000000);[.$N$73];AND([.F550]<1000000;[.F550]>0);[.$N$74];[.F550]=0;" ") -> А | H550: of:=VLOOKUP([.$B550];[.$I$71:.$L$81];4;0) -> 3
B551: 3 | C551: of:=VLOOKUP([.$B551];[.$I$71:.$J$81];2;0) -> Челябинск | D551: 95 | E551: 22619 | F551: of:=IF(ISBLANK([.E551]*[.D551]);"0";[.E551]*[.D551]) -> 2148805 | G551: of:=COM.MICROSOFT.IFS([.F551]>5000000;[.$N$72];AND([.F551]>=1000000;[.F551]<=5000000);[.$N$73];AND([.F551]<1000000;[.F551]>0);[.$N$74];[.F551]=0;" ") -> Б | H551: of:=VLOOKUP([.$B551];[.$I$71:.$L$81];4;0) -> 1
B552: 9 | C552: of:=VLOOKUP([.$B552];[.$I$71:.$J$81];2;0) -> Тюмень | D552: 95 | E552: 21593 | F552: of:=IF(ISBLANK([.E552]*[.D552]);"0";[.E552]*[.D552]) -> 2051335 | G552: of:=COM.MICROSOFT.IFS([.F552]>5000000;[.$N$72];AND([.F552]>=1000000;[.F552]<=5000000);[.$N$73];AND([.F552]<1000000;[.F552]>0);[.$N$74];[.F552]=0;" ") -> Б | H552: of:=VLOOKUP([.$B552];[.$I$71:.$L$81];4;0) -> 3
B553: 4 | C553: of:=VLOOKUP([.$B553];[.$I$71:.$J$81];2;0) -> Архангельск | D553: 14 | E553: 11298 | F553: of:=IF(ISBLANK([.E553]*[.D553]);"0";[.E553]*[.D553]) -> 158172 | G553: of:=COM.MICROSOFT.IFS([.F553]>5000000;[.$N$72];AND([.F553]>=1000000;[.F553]<=5000000);[.$N$73];AND([.F553]<1000000;[.F553]>0);[.$N$74];[.F553]=0;" ") -> В | H553: of:=VLOOKUP([.$B553];[.$I$71:.$L$81];4;0) -> 2
B554: 6 | C554: of:=VLOOKUP([.$B554];[.$I$71:.$J$81];2;0) -> Владивосток | D554: 63 | E554: 51361 | F554: of:=IF(ISBLANK([.E554]*[.D554]);"0";[.E554]*[.D554]) -> 3235743 | G554: of:=COM.MICROSOFT.IFS([.F554]>5000000;[.$N$72];AND([.F554]>=1000000;[.F554]<=5000000);[.$N$73];AND([.F554]<1000000;[.F554]>0);[.$N$74];[.F554]=0;" ") -> Б | H554: of:=VLOOKUP([.$B554];[.$I$71:.$L$81];4;0) -> 7
B555: 9 | C555: of:=VLOOKUP([.$B555];[.$I$71:.$J$81];2;0) -> Тюмень | D555: 92 | E555: 95452 | F555: of:=IF(ISBLANK([.E555]*[.D555]);"0";[.E555]*[.D555]) -> 8781584 | G555: of:=COM.MICROSOFT.IFS([.F555]>5000000;[.$N$72];AND([.F555]>=1000000;[.F555]<=5000000);[.$N$73];AND([.F555]<1000000;[.F555]>0);[.$N$74];[.F555]=0;" ") -> А | H555: of:=VLOOKUP([.$B555];[.$I$71:.$L$81];4;0) -> 3
B556: 2 | C556: of:=VLOOKUP([.$B556];[.$I$71:.$J$81];2;0) -> Санкт-Петербург | D556: 100 | E556: 82911 | F556: of:=IF(ISBLANK([.E556]*[.D556]);"0";[.E556]*[.D556]) -> 8291100 | G556: of:=COM.MICROSOFT.IFS([.F556]>5000000;[.$N$72];AND([.F556]>=1000000;[.F556]<=5000000);[.$N$73];AND([.F556]<1000000;[.F556]>0);[.$N$74];[.F556]=0;" ") -> А | H556: of:=VLOOKUP([.$B556];[.$I$71:.$L$81];4;0) -> 9
B557: 6 | C557: of:=VLOOKUP([.$B557];[.$I$71:.$J$81];2;0) -> Владивосток | D557: 40 | E557: 2650 | F557: of:=IF(ISBLANK([.E557]*[.D557]);"0";[.E557]*[.D557]) -> 106000 | G557: of:=COM.MICROSOFT.IFS([.F557]>5000000;[.$N$72];AND([.F557]>=1000000;[.F557]<=5000000);[.$N$73];AND([.F557]<1000000;[.F557]>0);[.$N$74];[.F557]=0;" ") -> В | H557: of:=VLOOKUP([.$B557];[.$I$71:.$L$81];4;0) -> 7
B558: 9 | C558: of:=VLOOKUP([.$B558];[.$I$71:.$J$81];2;0) -> Тюмень | D558: 90 | E558: 71144 | F558: of:=IF(ISBLANK([.E558]*[.D558]);"0";[.E558]*[.D558]) -> 6402960 | G558: of:=COM.MICROSOFT.IFS([.F558]>5000000;[.$N$72];AND([.F558]>=1000000;[.F558]<=5000000);[.$N$73];AND([.F558]<1000000;[.F558]>0);[.$N$74];[.F558]=0;" ") -> А | H558: of:=VLOOKUP([.$B558];[.$I$71:.$L$81];4;0) -> 3
B559: 3 | C559: of:=VLOOKUP([.$B559];[.$I$71:.$J$81];2;0) -> Челябинск | D559: 16 | E559: 79344 | F559: of:=IF(ISBLANK([.E559]*[.D559]);"0";[.E559]*[.D559]) -> 1269504 | G559: of:=COM.MICROSOFT.IFS([.F559]>5000000;[.$N$72];AND([.F559]>=1000000;[.F559]<=5000000);[.$N$73];AND([.F559]<1000000;[.F559]>0);[.$N$74];[.F559]=0;" ") -> Б | H559: of:=VLOOKUP([.$B559];[.$I$71:.$L$81];4;0) -> 1
B560: 9 | C560: of:=VLOOKUP([.$B560];[.$I$71:.$J$81];2;0) -> Тюмень | D560: 30 | E560: 26265 | F560: of:=IF(ISBLANK([.E560]*[.D560]);"0";[.E560]*[.D560]) -> 787950 | G560: of:=COM.MICROSOFT.IFS([.F560]>5000000;[.$N$72];AND([.F560]>=1000000;[.F560]<=5000000);[.$N$73];AND([.F560]<1000000;[.F560]>0);[.$N$74];[.F560]=0;" ") -> В | H560: of:=VLOOKUP([.$B560];[.$I$71:.$L$81];4;0) -> 3
B561: 10 | C561: of:=VLOOKUP([.$B561];[.$I$71:.$J$81];2;0) -> Сочи | D561: 54 | E561: 17249 | F561: of:=IF(ISBLANK([.E561]*[.D561]);"0";[.E561]*[.D561]) -> 931446 | G561: of:=COM.MICROSOFT.IFS([.F561]>5000000;[.$N$72];AND([.F561]>=1000000;[.F561]<=5000000);[.$N$73];AND([.F561]<1000000;[.F561]>0);[.$N$74];[.F561]=0;" ") -> В | H561: of:=VLOOKUP([.$B561];[.$I$71:.$L$81];4;0) -> 6
B562: 5 | C562: of:=VLOOKUP([.$B562];[.$I$71:.$J$81];2;0) -> Краснодар | D562: 58 | E562: 23118 | F562: of:=IF(ISBLANK([.E562]*[.D562]);"0";[.E562]*[.D562]) -> 1340844 | G562: of:=COM.MICROSOFT.IFS([.F562]>5000000;[.$N$72];AND([.F562]>=1000000;[.F562]<=5000000);[.$N$73];AND([.F562]<1000000;[.F562]>0);[.$N$74];[.F562]=0;" ") -> Б | H562: of:=VLOOKUP([.$B562];[.$I$71:.$L$81];4;0) -> 4
B563: 2 | C563: of:=VLOOKUP([.$B563];[.$I$71:.$J$81];2;0) -> Санкт-Петербург | D563: 12 | E563: 62860 | F563: of:=IF(ISBLANK([.E563]*[.D563]);"0";[.E563]*[.D563]) -> 754320 | G563: of:=COM.MICROSOFT.IFS([.F563]>5000000;[.$N$72];AND([.F563]>=1000000;[.F563]<=5000000);[.$N$73];AND([.F563]<1000000;[.F563]>0);[.$N$74];[.F563]=0;" ") -> В | H563: of:=VLOOKUP([.$B563];[.$I$71:.$L$81];4;0) -> 9
B564: 10 | C564: of:=VLOOKUP([.$B564];[.$I$71:.$J$81];2;0) -> Сочи | D564: 66 | E564: 87149 | F564: of:=IF(ISBLANK([.E564]*[.D564]);"0";[.E564]*[.D564]) -> 5751834 | G564: of:=COM.MICROSOFT.IFS([.F564]>5000000;[.$N$72];AND([.F564]>=1000000;[.F564]<=5000000);[.$N$73];AND([.F564]<1000000;[.F564]>0);[.$N$74];[.F564]=0;" ") -> А | H564: of:=VLOOKUP([.$B564];[.$I$71:.$L$81];4;0) -> 6
B565: 2 | C565: of:=VLOOKUP([.$B565];[.$I$71:.$J$81];2;0) -> Санкт-Петербург | D565: 100 | E565: 23051 | F565: of:=IF(ISBLANK([.E565]*[.D565]);"0";[.E565]*[.D565]) -> 2305100 | G565: of:=COM.MICROSOFT.IFS([.F565]>5000000;[.$N$72];AND([.F565]>=1000000;[.F565]<=5000000);[.$N$73];AND([.F565]<1000000;[.F565]>0);[.$N$74];[.F565]=0;" ") -> Б | H565: of:=VLOOKUP([.$B565];[.$I$71:.$L$81];4;0) -> 9
B566: 1 | C566: of:=VLOOKUP([.$B566];[.$I$71:.$J$81];2;0) -> Москва | D566: 86 | E566: 59101 | F566: of:=IF(ISBLANK([.E566]*[.D566]);"0";[.E566]*[.D566]) -> 5082686 | G566: of:=COM.MICROSOFT.IFS([.F566]>5000000;[.$N$72];AND([.F566]>=1000000;[.F566]<=5000000);[.$N$73];AND([.F566]<1000000;[.F566]>0);[.$N$74];[.F566]=0;" ") -> А | H566: of:=VLOOKUP([.$B566];[.$I$71:.$L$81];4;0) -> 8
B567: 2 | C567: of:=VLOOKUP([.$B567];[.$I$71:.$J$81];2;0) -> Санкт-Петербург | D567: 54 | E567: 17486 | F567: of:=IF(ISBLANK([.E567]*[.D567]);"0";[.E567]*[.D567]) -> 944244 | G567: of:=COM.MICROSOFT.IFS([.F567]>5000000;[.$N$72];AND([.F567]>=1000000;[.F567]<=5000000);[.$N$73];AND([.F567]<1000000;[.F567]>0);[.$N$74];[.F567]=0;" ") -> В | H567: of:=VLOOKUP([.$B567];[.$I$71:.$L$81];4;0) -> 9
B568: 7 | C568: of:=VLOOKUP([.$B568];[.$I$71:.$J$81];2;0) -> Мурманск | D568: 90 | E568: 60292 | F568: of:=IF(ISBLANK([.E568]*[.D568]);"0";[.E568]*[.D568]) -> 5426280 | G568: of:=COM.MICROSOFT.IFS([.F568]>5000000;[.$N$72];AND([.F568]>=1000000;[.F568]<=5000000);[.$N$73];AND([.F568]<1000000;[.F568]>0);[.$N$74];[.F568]=0;" ") -> А | H568: of:=VLOOKUP([.$B568];[.$I$71:.$L$81];4;0) -> 10
B569: 9 | C569: of:=VLOOKUP([.$B569];[.$I$71:.$J$81];2;0) -> Тюмень | D569: 10 | E569: 23303 | F569: of:=IF(ISBLANK([.E569]*[.D569]);"0";[.E569]*[.D569]) -> 233030 | G569: of:=COM.MICROSOFT.IFS([.F569]>5000000;[.$N$72];AND([.F569]>=1000000;[.F569]<=5000000);[.$N$73];AND([.F569]<1000000;[.F569]>0);[.$N$74];[.F569]=0;" ") -> В | H569: of:=VLOOKUP([.$B569];[.$I$71:.$L$81];4;0) -> 3
B570: 10 | C570: of:=VLOOKUP([.$B570];[.$I$71:.$J$81];2;0) -> Сочи | D570: 36 | E570: 27046 | F570: of:=IF(ISBLANK([.E570]*[.D570]);"0";[.E570]*[.D570]) -> 973656 | G570: of:=COM.MICROSOFT.IFS([.F570]>5000000;[.$N$72];AND([.F570]>=1000000;[.F570]<=5000000);[.$N$73];AND([.F570]<1000000;[.F570]>0);[.$N$74];[.F570]=0;" ") -> В | H570: of:=VLOOKUP([.$B570];[.$I$71:.$L$81];4;0) -> 6
B571: 5 | C571: of:=VLOOKUP([.$B571];[.$I$71:.$J$81];2;0) -> Краснодар | D571: 86 | E571: 34300 | F571: of:=IF(ISBLANK([.E571]*[.D571]);"0";[.E571]*[.D571]) -> 2949800 | G571: of:=COM.MICROSOFT.IFS([.F571]>5000000;[.$N$72];AND([.F571]>=1000000;[.F571]<=5000000);[.$N$73];AND([.F571]<1000000;[.F571]>0);[.$N$74];[.F571]=0;" ") -> Б | H571: of:=VLOOKUP([.$B571];[.$I$71:.$L$81];4;0) -> 4
B572: 7 | C572: of:=VLOOKUP([.$B572];[.$I$71:.$J$81];2;0) -> Мурманск | D572: 72 | E572: 74649 | F572: of:=IF(ISBLANK([.E572]*[.D572]);"0";[.E572]*[.D572]) -> 5374728 | G572: of:=COM.MICROSOFT.IFS([.F572]>5000000;[.$N$72];AND([.F572]>=1000000;[.F572]<=5000000);[.$N$73];AND([.F572]<1000000;[.F572]>0);[.$N$74];[.F572]=0;" ") -> А | H572: of:=VLOOKUP([.$B572];[.$I$71:.$L$81];4;0) -> 10
B573: 4 | C573: of:=VLOOKUP([.$B573];[.$I$71:.$J$81];2;0) -> Архангельск | D573: 53 | E573: 8583 | F573: of:=IF(ISBLANK([.E573]*[.D573]);"0";[.E573]*[.D573]) -> 454899 | G573: of:=COM.MICROSOFT.IFS([.F573]>5000000;[.$N$72];AND([.F573]>=1000000;[.F573]<=5000000);[.$N$73];AND([.F573]<1000000;[.F573]>0);[.$N$74];[.F573]=0;" ") -> В | H573: of:=VLOOKUP([.$B573];[.$I$71:.$L$81];4;0) -> 2
B574: 1 | C574: of:=VLOOKUP([.$B574];[.$I$71:.$J$81];2;0) -> Москва | D574: 59 | E574: 10902 | F574: of:=IF(ISBLANK([.E574]*[.D574]);"0";[.E574]*[.D574]) -> 643218 | G574: of:=COM.MICROSOFT.IFS([.F574]>5000000;[.$N$72];AND([.F574]>=1000000;[.F574]<=5000000);[.$N$73];AND([.F574]<1000000;[.F574]>0);[.$N$74];[.F574]=0;" ") -> В | H574: of:=VLOOKUP([.$B574];[.$I$71:.$L$81];4;0) -> 8
B575: 1 | C575: of:=VLOOKUP([.$B575];[.$I$71:.$J$81];2;0) -> Москва | D575: 88 | E575: 90396 | F575: of:=IF(ISBLANK([.E575]*[.D575]);"0";[.E575]*[.D575]) -> 7954848 | G575: of:=COM.MICROSOFT.IFS([.F575]>5000000;[.$N$72];AND([.F575]>=1000000;[.F575]<=5000000);[.$N$73];AND([.F575]<1000000;[.F575]>0);[.$N$74];[.F575]=0;" ") -> А | H575: of:=VLOOKUP([.$B575];[.$I$71:.$L$81];4;0) -> 8
B576: 9 | C576: of:=VLOOKUP([.$B576];[.$I$71:.$J$81];2;0) -> Тюмень | D576: 80 | E576: 7128 | F576: of:=IF(ISBLANK([.E576]*[.D576]);"0";[.E576]*[.D576]) -> 570240 | G576: of:=COM.MICROSOFT.IFS([.F576]>5000000;[.$N$72];AND([.F576]>=1000000;[.F576]<=5000000);[.$N$73];AND([.F576]<1000000;[.F576]>0);[.$N$74];[.F576]=0;" ") -> В | H576: of:=VLOOKUP([.$B576];[.$I$71:.$L$81];4;0) -> 3
B577: 3 | C577: of:=VLOOKUP([.$B577];[.$I$71:.$J$81];2;0) -> Челябинск | D577: 11 | E577: 32603 | F577: of:=IF(ISBLANK([.E577]*[.D577]);"0";[.E577]*[.D577]) -> 358633 | G577: of:=COM.MICROSOFT.IFS([.F577]>5000000;[.$N$72];AND([.F577]>=1000000;[.F577]<=5000000);[.$N$73];AND([.F577]<1000000;[.F577]>0);[.$N$74];[.F577]=0;" ") -> В | H577: of:=VLOOKUP([.$B577];[.$I$71:.$L$81];4;0) -> 1
B578: 10 | C578: of:=VLOOKUP([.$B578];[.$I$71:.$J$81];2;0) -> Сочи | D578: 63 | E578: 4220 | F578: of:=IF(ISBLANK([.E578]*[.D578]);"0";[.E578]*[.D578]) -> 265860 | G578: of:=COM.MICROSOFT.IFS([.F578]>5000000;[.$N$72];AND([.F578]>=1000000;[.F578]<=5000000);[.$N$73];AND([.F578]<1000000;[.F578]>0);[.$N$74];[.F578]=0;" ") -> В | H578: of:=VLOOKUP([.$B578];[.$I$71:.$L$81];4;0) -> 6
B579: 1 | C579: of:=VLOOKUP([.$B579];[.$I$71:.$J$81];2;0) -> Москва | D579: 64 | E579: 38051 | F579: of:=IF(ISBLANK([.E579]*[.D579]);"0";[.E579]*[.D579]) -> 2435264 | G579: of:=COM.MICROSOFT.IFS([.F579]>5000000;[.$N$72];AND([.F579]>=1000000;[.F579]<=5000000);[.$N$73];AND([.F579]<1000000;[.F579]>0);[.$N$74];[.F579]=0;" ") -> Б | H579: of:=VLOOKUP([.$B579];[.$I$71:.$L$81];4;0) -> 8
B580: 10 | C580: of:=VLOOKUP([.$B580];[.$I$71:.$J$81];2;0) -> Сочи | D580: 7 | E580: 10077 | F580: of:=IF(ISBLANK([.E580]*[.D580]);"0";[.E580]*[.D580]) -> 70539 | G580: of:=COM.MICROSOFT.IFS([.F580]>5000000;[.$N$72];AND([.F580]>=1000000;[.F580]<=5000000);[.$N$73];AND([.F580]<1000000;[.F580]>0);[.$N$74];[.F580]=0;" ") -> В | H580: of:=VLOOKUP([.$B580];[.$I$71:.$L$81];4;0) -> 6
B581: 5 | C581: of:=VLOOKUP([.$B581];[.$I$71:.$J$81];2;0) -> Краснодар | D581: 82 | E581: 15754 | F581: of:=IF(ISBLANK([.E581]*[.D581]);"0";[.E581]*[.D581]) -> 1291828 | G581: of:=COM.MICROSOFT.IFS([.F581]>5000000;[.$N$72];AND([.F581]>=1000000;[.F581]<=5000000);[.$N$73];AND([.F581]<1000000;[.F581]>0);[.$N$74];[.F581]=0;" ") -> Б | H581: of:=VLOOKUP([.$B581];[.$I$71:.$L$81];4;0) -> 4
B582: 4 | C582: of:=VLOOKUP([.$B582];[.$I$71:.$J$81];2;0) -> Архангельск | D582: 12 | E582: 4518 | F582: of:=IF(ISBLANK([.E582]*[.D582]);"0";[.E582]*[.D582]) -> 54216 | G582: of:=COM.MICROSOFT.IFS([.F582]>5000000;[.$N$72];AND([.F582]>=1000000;[.F582]<=5000000);[.$N$73];AND([.F582]<1000000;[.F582]>0);[.$N$74];[.F582]=0;" ") -> В | H582: of:=VLOOKUP([.$B582];[.$I$71:.$L$81];4;0) -> 2
B583: 6 | C583: of:=VLOOKUP([.$B583];[.$I$71:.$J$81];2;0) -> Владивосток | D583: 57 | E583: 14655 | F583: of:=IF(ISBLANK([.E583]*[.D583]);"0";[.E583]*[.D583]) -> 835335 | G583: of:=COM.MICROSOFT.IFS([.F583]>5000000;[.$N$72];AND([.F583]>=1000000;[.F583]<=5000000);[.$N$73];AND([.F583]<1000000;[.F583]>0);[.$N$74];[.F583]=0;" ") -> В | H583: of:=VLOOKUP([.$B583];[.$I$71:.$L$81];4;0) -> 7
B584: 10 | C584: of:=VLOOKUP([.$B584];[.$I$71:.$J$81];2;0) -> Сочи | D584: 36 | E584: 73522 | F584: of:=IF(ISBLANK([.E584]*[.D584]);"0";[.E584]*[.D584]) -> 2646792 | G584: of:=COM.MICROSOFT.IFS([.F584]>5000000;[.$N$72];AND([.F584]>=1000000;[.F584]<=5000000);[.$N$73];AND([.F584]<1000000;[.F584]>0);[.$N$74];[.F584]=0;" ") -> Б | H584: of:=VLOOKUP([.$B584];[.$I$71:.$L$81];4;0) -> 6
B585: 6 | C585: of:=VLOOKUP([.$B585];[.$I$71:.$J$81];2;0) -> Владивосток | D585: 5 | E585: 68402 | F585: of:=IF(ISBLANK([.E585]*[.D585]);"0";[.E585]*[.D585]) -> 342010 | G585: of:=COM.MICROSOFT.IFS([.F585]>5000000;[.$N$72];AND([.F585]>=1000000;[.F585]<=5000000);[.$N$73];AND([.F585]<1000000;[.F585]>0);[.$N$74];[.F585]=0;" ") -> В | H585: of:=VLOOKUP([.$B585];[.$I$71:.$L$81];4;0) -> 7
B586: 4 | C586: of:=VLOOKUP([.$B586];[.$I$71:.$J$81];2;0) -> Архангельск | D586: 44 | E586: 33385 | F586: of:=IF(ISBLANK([.E586]*[.D586]);"0";[.E586]*[.D586]) -> 1468940 | G586: of:=COM.MICROSOFT.IFS([.F586]>5000000;[.$N$72];AND([.F586]>=1000000;[.F586]<=5000000);[.$N$73];AND([.F586]<1000000;[.F586]>0);[.$N$74];[.F586]=0;" ") -> Б | H586: of:=VLOOKUP([.$B586];[.$I$71:.$L$81];4;0) -> 2
B587: 1 | C587: of:=VLOOKUP([.$B587];[.$I$71:.$J$81];2;0) -> Москва | D587: 85 | E587: 85376 | F587: of:=IF(ISBLANK([.E587]*[.D587]);"0";[.E587]*[.D587]) -> 7256960 | G587: of:=COM.MICROSOFT.IFS([.F587]>5000000;[.$N$72];AND([.F587]>=1000000;[.F587]<=5000000);[.$N$73];AND([.F587]<1000000;[.F587]>0);[.$N$74];[.F587]=0;" ") -> А | H587: of:=VLOOKUP([.$B587];[.$I$71:.$L$81];4;0) -> 8
B588: 2 | C588: of:=VLOOKUP([.$B588];[.$I$71:.$J$81];2;0) -> Санкт-Петербург | D588: 14 | E588: 8143 | F588: of:=IF(ISBLANK([.E588]*[.D588]);"0";[.E588]*[.D588]) -> 114002 | G588: of:=COM.MICROSOFT.IFS([.F588]>5000000;[.$N$72];AND([.F588]>=1000000;[.F588]<=5000000);[.$N$73];AND([.F588]<1000000;[.F588]>0);[.$N$74];[.F588]=0;" ") -> В | H588: of:=VLOOKUP([.$B588];[.$I$71:.$L$81];4;0) -> 9
B589: 2 | C589: of:=VLOOKUP([.$B589];[.$I$71:.$J$81];2;0) -> Санкт-Петербург | D589: 14 | E589: 46934 | F589: of:=IF(ISBLANK([.E589]*[.D589]);"0";[.E589]*[.D589]) -> 657076 | G589: of:=COM.MICROSOFT.IFS([.F589]>5000000;[.$N$72];AND([.F589]>=1000000;[.F589]<=5000000);[.$N$73];AND([.F589]<1000000;[.F589]>0);[.$N$74];[.F589]=0;" ") -> В | H589: of:=VLOOKUP([.$B589];[.$I$71:.$L$81];4;0) -> 9
B590: 5 | C590: of:=VLOOKUP([.$B590];[.$I$71:.$J$81];2;0) -> Краснодар | D590: 14 | E590: 82345 | F590: of:=IF(ISBLANK([.E590]*[.D590]);"0";[.E590]*[.D590]) -> 1152830 | G590: of:=COM.MICROSOFT.IFS([.F590]>5000000;[.$N$72];AND([.F590]>=1000000;[.F590]<=5000000);[.$N$73];AND([.F590]<1000000;[.F590]>0);[.$N$74];[.F590]=0;" ") -> Б | H590: of:=VLOOKUP([.$B590];[.$I$71:.$L$81];4;0) -> 4
B591: 4 | C591: of:=VLOOKUP([.$B591];[.$I$71:.$J$81];2;0) -> Архангельск | D591: 7 | E591: 9583 | F591: of:=IF(ISBLANK([.E591]*[.D591]);"0";[.E591]*[.D591]) -> 67081 | G591: of:=COM.MICROSOFT.IFS([.F591]>5000000;[.$N$72];AND([.F591]>=1000000;[.F591]<=5000000);[.$N$73];AND([.F591]<1000000;[.F591]>0);[.$N$74];[.F591]=0;" ") -> В | H591: of:=VLOOKUP([.$B591];[.$I$71:.$L$81];4;0) -> 2
B592: 6 | C592: of:=VLOOKUP([.$B592];[.$I$71:.$J$81];2;0) -> Владивосток | D592: 68 | E592: 47020 | F592: of:=IF(ISBLANK([.E592]*[.D592]);"0";[.E592]*[.D592]) -> 3197360 | G592: of:=COM.MICROSOFT.IFS([.F592]>5000000;[.$N$72];AND([.F592]>=1000000;[.F592]<=5000000);[.$N$73];AND([.F592]<1000000;[.F592]>0);[.$N$74];[.F592]=0;" ") -> Б | H592: of:=VLOOKUP([.$B592];[.$I$71:.$L$81];4;0) -> 7
B593: 9 | C593: of:=VLOOKUP([.$B593];[.$I$71:.$J$81];2;0) -> Тюмень | D593: 11 | E593: 25559 | F593: of:=IF(ISBLANK([.E593]*[.D593]);"0";[.E593]*[.D593]) -> 281149 | G593: of:=COM.MICROSOFT.IFS([.F593]>5000000;[.$N$72];AND([.F593]>=1000000;[.F593]<=5000000);[.$N$73];AND([.F593]<1000000;[.F593]>0);[.$N$74];[.F593]=0;" ") -> В | H593: of:=VLOOKUP([.$B593];[.$I$71:.$L$81];4;0) -> 3
B594: 5 | C594: of:=VLOOKUP([.$B594];[.$I$71:.$J$81];2;0) -> Краснодар | D594: 71 | E594: 83459 | F594: of:=IF(ISBLANK([.E594]*[.D594]);"0";[.E594]*[.D594]) -> 5925589 | G594: of:=COM.MICROSOFT.IFS([.F594]>5000000;[.$N$72];AND([.F594]>=1000000;[.F594]<=5000000);[.$N$73];AND([.F594]<1000000;[.F594]>0);[.$N$74];[.F594]=0;" ") -> А | H594: of:=VLOOKUP([.$B594];[.$I$71:.$L$81];4;0) -> 4
B595: 9 | C595: of:=VLOOKUP([.$B595];[.$I$71:.$J$81];2;0) -> Тюмень | D595: 15 | E595: 22022 | F595: of:=IF(ISBLANK([.E595]*[.D595]);"0";[.E595]*[.D595]) -> 330330 | G595: of:=COM.MICROSOFT.IFS([.F595]>5000000;[.$N$72];AND([.F595]>=1000000;[.F595]<=5000000);[.$N$73];AND([.F595]<1000000;[.F595]>0);[.$N$74];[.F595]=0;" ") -> В | H595: of:=VLOOKUP([.$B595];[.$I$71:.$L$81];4;0) -> 3
B596: 4 | C596: of:=VLOOKUP([.$B596];[.$I$71:.$J$81];2;0) -> Архангельск | D596: 33 | E596: 86106 | F596: of:=IF(ISBLANK([.E596]*[.D596]);"0";[.E596]*[.D596]) -> 2841498 | G596: of:=COM.MICROSOFT.IFS([.F596]>5000000;[.$N$72];AND([.F596]>=1000000;[.F596]<=5000000);[.$N$73];AND([.F596]<1000000;[.F596]>0);[.$N$74];[.F596]=0;" ") -> Б | H596: of:=VLOOKUP([.$B596];[.$I$71:.$L$81];4;0) -> 2
B597: 2 | C597: of:=VLOOKUP([.$B597];[.$I$71:.$J$81];2;0) -> Санкт-Петербург | D597: 72 | E597: 99851 | F597: of:=IF(ISBLANK([.E597]*[.D597]);"0";[.E597]*[.D597]) -> 7189272 | G597: of:=COM.MICROSOFT.IFS([.F597]>5000000;[.$N$72];AND([.F597]>=1000000;[.F597]<=5000000);[.$N$73];AND([.F597]<1000000;[.F597]>0);[.$N$74];[.F597]=0;" ") -> А | H597: of:=VLOOKUP([.$B597];[.$I$71:.$L$81];4;0) -> 9
B598: 6 | C598: of:=VLOOKUP([.$B598];[.$I$71:.$J$81];2;0) -> Владивосток | D598: 46 | E598: 3695 | F598: of:=IF(ISBLANK([.E598]*[.D598]);"0";[.E598]*[.D598]) -> 169970 | G598: of:=COM.MICROSOFT.IFS([.F598]>5000000;[.$N$72];AND([.F598]>=1000000;[.F598]<=5000000);[.$N$73];AND([.F598]<1000000;[.F598]>0);[.$N$74];[.F598]=0;" ") -> В | H598: of:=VLOOKUP([.$B598];[.$I$71:.$L$81];4;0) -> 7
B599: 6 | C599: of:=VLOOKUP([.$B599];[.$I$71:.$J$81];2;0) -> Владивосток | D599: 43 | E599: 54732 | F599: of:=IF(ISBLANK([.E599]*[.D599]);"0";[.E599]*[.D599]) -> 2353476 | G599: of:=COM.MICROSOFT.IFS([.F599]>5000000;[.$N$72];AND([.F599]>=1000000;[.F599]<=5000000);[.$N$73];AND([.F599]<1000000;[.F599]>0);[.$N$74];[.F599]=0;" ") -> Б | H599: of:=VLOOKUP([.$B599];[.$I$71:.$L$81];4;0) -> 7
B600: 3 | C600: of:=VLOOKUP([.$B600];[.$I$71:.$J$81];2;0) -> Челябинск | D600: 12 | E600: 38466 | F600: of:=IF(ISBLANK([.E600]*[.D600]);"0";[.E600]*[.D600]) -> 461592 | G600: of:=COM.MICROSOFT.IFS([.F600]>5000000;[.$N$72];AND([.F600]>=1000000;[.F600]<=5000000);[.$N$73];AND([.F600]<1000000;[.F600]>0);[.$N$74];[.F600]=0;" ") -> В | H600: of:=VLOOKUP([.$B600];[.$I$71:.$L$81];4;0) -> 1
B601: 7 | C601: of:=VLOOKUP([.$B601];[.$I$71:.$J$81];2;0) -> Мурманск | D601: 69 | E601: 17044 | F601: of:=IF(ISBLANK([.E601]*[.D601]);"0";[.E601]*[.D601]) -> 1176036 | G601: of:=COM.MICROSOFT.IFS([.F601]>5000000;[.$N$72];AND([.F601]>=1000000;[.F601]<=5000000);[.$N$73];AND([.F601]<1000000;[.F601]>0);[.$N$74];[.F601]=0;" ") -> Б | H601: of:=VLOOKUP([.$B601];[.$I$71:.$L$81];4;0) -> 10
B602: 6 | C602: of:=VLOOKUP([.$B602];[.$I$71:.$J$81];2;0) -> Владивосток | D602: 78 | E602: 63030 | F602: of:=IF(ISBLANK([.E602]*[.D602]);"0";[.E602]*[.D602]) -> 4916340 | G602: of:=COM.MICROSOFT.IFS([.F602]>5000000;[.$N$72];AND([.F602]>=1000000;[.F602]<=5000000);[.$N$73];AND([.F602]<1000000;[.F602]>0);[.$N$74];[.F602]=0;" ") -> Б | H602: of:=VLOOKUP([.$B602];[.$I$71:.$L$81];4;0) -> 7
B603: 7 | C603: of:=VLOOKUP([.$B603];[.$I$71:.$J$81];2;0) -> Мурманск | D603: 9 | E603: 72722 | F603: of:=IF(ISBLANK([.E603]*[.D603]);"0";[.E603]*[.D603]) -> 654498 | G603: of:=COM.MICROSOFT.IFS([.F603]>5000000;[.$N$72];AND([.F603]>=1000000;[.F603]<=5000000);[.$N$73];AND([.F603]<1000000;[.F603]>0);[.$N$74];[.F603]=0;" ") -> В | H603: of:=VLOOKUP([.$B603];[.$I$71:.$L$81];4;0) -> 10
B604: 5 | C604: of:=VLOOKUP([.$B604];[.$I$71:.$J$81];2;0) -> Краснодар | D604: 59 | E604: 15266 | F604: of:=IF(ISBLANK([.E604]*[.D604]);"0";[.E604]*[.D604]) -> 900694 | G604: of:=COM.MICROSOFT.IFS([.F604]>5000000;[.$N$72];AND([.F604]>=1000000;[.F604]<=5000000);[.$N$73];AND([.F604]<1000000;[.F604]>0);[.$N$74];[.F604]=0;" ") -> В | H604: of:=VLOOKUP([.$B604];[.$I$71:.$L$81];4;0) -> 4
B605: 8 | C605: of:=VLOOKUP([.$B605];[.$I$71:.$J$81];2;0) -> Новосибирск | D605: 24 | E605: 19089 | F605: of:=IF(ISBLANK([.E605]*[.D605]);"0";[.E605]*[.D605]) -> 458136 | G605: of:=COM.MICROSOFT.IFS([.F605]>5000000;[.$N$72];AND([.F605]>=1000000;[.F605]<=5000000);[.$N$73];AND([.F605]<1000000;[.F605]>0);[.$N$74];[.F605]=0;" ") -> В | H605: of:=VLOOKUP([.$B605];[.$I$71:.$L$81];4;0) -> 5
B606: 9 | C606: of:=VLOOKUP([.$B606];[.$I$71:.$J$81];2;0) -> Тюмень | D606: 54 | E606: 86310 | F606: of:=IF(ISBLANK([.E606]*[.D606]);"0";[.E606]*[.D606]) -> 4660740 | G606: of:=COM.MICROSOFT.IFS([.F606]>5000000;[.$N$72];AND([.F606]>=1000000;[.F606]<=5000000);[.$N$73];AND([.F606]<1000000;[.F606]>0);[.$N$74];[.F606]=0;" ") -> Б | H606: of:=VLOOKUP([.$B606];[.$I$71:.$L$81];4;0) -> 3
B607: 7 | C607: of:=VLOOKUP([.$B607];[.$I$71:.$J$81];2;0) -> Мурманск | D607: 78 | E607: 38388 | F607: of:=IF(ISBLANK([.E607]*[.D607]);"0";[.E607]*[.D607]) -> 2994264 | G607: of:=COM.MICROSOFT.IFS([.F607]>5000000;[.$N$72];AND([.F607]>=1000000;[.F607]<=5000000);[.$N$73];AND([.F607]<1000000;[.F607]>0);[.$N$74];[.F607]=0;" ") -> Б | H607: of:=VLOOKUP([.$B607];[.$I$71:.$L$81];4;0) -> 10
B608: 7 | C608: of:=VLOOKUP([.$B608];[.$I$71:.$J$81];2;0) -> Мурманск | D608: 83 | E608: 36500 | F608: of:=IF(ISBLANK([.E608]*[.D608]);"0";[.E608]*[.D608]) -> 3029500 | G608: of:=COM.MICROSOFT.IFS([.F608]>5000000;[.$N$72];AND([.F608]>=1000000;[.F608]<=5000000);[.$N$73];AND([.F608]<1000000;[.F608]>0);[.$N$74];[.F608]=0;" ") -> Б | H608: of:=VLOOKUP([.$B608];[.$I$71:.$L$81];4;0) -> 10
B609: 1 | C609: of:=VLOOKUP([.$B609];[.$I$71:.$J$81];2;0) -> Москва | D609: 87 | E609: 27439 | F609: of:=IF(ISBLANK([.E609]*[.D609]);"0";[.E609]*[.D609]) -> 2387193 | G609: of:=COM.MICROSOFT.IFS([.F609]>5000000;[.$N$72];AND([.F609]>=1000000;[.F609]<=5000000);[.$N$73];AND([.F609]<1000000;[.F609]>0);[.$N$74];[.F609]=0;" ") -> Б | H609: of:=VLOOKUP([.$B609];[.$I$71:.$L$81];4;0) -> 8
B610: 9 | C610: of:=VLOOKUP([.$B610];[.$I$71:.$J$81];2;0) -> Тюмень | D610: 86 | E610: 67861 | F610: of:=IF(ISBLANK([.E610]*[.D610]);"0";[.E610]*[.D610]) -> 5836046 | G610: of:=COM.MICROSOFT.IFS([.F610]>5000000;[.$N$72];AND([.F610]>=1000000;[.F610]<=5000000);[.$N$73];AND([.F610]<1000000;[.F610]>0);[.$N$74];[.F610]=0;" ") -> А | H610: of:=VLOOKUP([.$B610];[.$I$71:.$L$81];4;0) -> 3
B611: 1 | C611: of:=VLOOKUP([.$B611];[.$I$71:.$J$81];2;0) -> Москва | D611: 51 | E611: 98691 | F611: of:=IF(ISBLANK([.E611]*[.D611]);"0";[.E611]*[.D611]) -> 5033241 | G611: of:=COM.MICROSOFT.IFS([.F611]>5000000;[.$N$72];AND([.F611]>=1000000;[.F611]<=5000000);[.$N$73];AND([.F611]<1000000;[.F611]>0);[.$N$74];[.F611]=0;" ") -> А | H611: of:=VLOOKUP([.$B611];[.$I$71:.$L$81];4;0) -> 8
B612: 3 | C612: of:=VLOOKUP([.$B612];[.$I$71:.$J$81];2;0) -> Челябинск | D612: 87 | E612: 63478 | F612: of:=IF(ISBLANK([.E612]*[.D612]);"0";[.E612]*[.D612]) -> 5522586 | G612: of:=COM.MICROSOFT.IFS([.F612]>5000000;[.$N$72];AND([.F612]>=1000000;[.F612]<=5000000);[.$N$73];AND([.F612]<1000000;[.F612]>0);[.$N$74];[.F612]=0;" ") -> А | H612: of:=VLOOKUP([.$B612];[.$I$71:.$L$81];4;0) -> 1
B613: 9 | C613: of:=VLOOKUP([.$B613];[.$I$71:.$J$81];2;0) -> Тюмень | D613: 33 | E613: 40600 | F613: of:=IF(ISBLANK([.E613]*[.D613]);"0";[.E613]*[.D613]) -> 1339800 | G613: of:=COM.MICROSOFT.IFS([.F613]>5000000;[.$N$72];AND([.F613]>=1000000;[.F613]<=5000000);[.$N$73];AND([.F613]<1000000;[.F613]>0);[.$N$74];[.F613]=0;" ") -> Б | H613: of:=VLOOKUP([.$B613];[.$I$71:.$L$81];4;0) -> 3
B614: 5 | C614: of:=VLOOKUP([.$B614];[.$I$71:.$J$81];2;0) -> Краснодар | D614: 99 | E614: 67848 | F614: of:=IF(ISBLANK([.E614]*[.D614]);"0";[.E614]*[.D614]) -> 6716952 | G614: of:=COM.MICROSOFT.IFS([.F614]>5000000;[.$N$72];AND([.F614]>=1000000;[.F614]<=5000000);[.$N$73];AND([.F614]<1000000;[.F614]>0);[.$N$74];[.F614]=0;" ") -> А | H614: of:=VLOOKUP([.$B614];[.$I$71:.$L$81];4;0) -> 4
B615: 6 | C615: of:=VLOOKUP([.$B615];[.$I$71:.$J$81];2;0) -> Владивосток | D615: 80 | E615: 5072 | F615: of:=IF(ISBLANK([.E615]*[.D615]);"0";[.E615]*[.D615]) -> 405760 | G615: of:=COM.MICROSOFT.IFS([.F615]>5000000;[.$N$72];AND([.F615]>=1000000;[.F615]<=5000000);[.$N$73];AND([.F615]<1000000;[.F615]>0);[.$N$74];[.F615]=0;" ") -> В | H615: of:=VLOOKUP([.$B615];[.$I$71:.$L$81];4;0) -> 7
B616: 4 | C616: of:=VLOOKUP([.$B616];[.$I$71:.$J$81];2;0) -> Архангельск | D616: 19 | E616: 56059 | F616: of:=IF(ISBLANK([.E616]*[.D616]);"0";[.E616]*[.D616]) -> 1065121 | G616: of:=COM.MICROSOFT.IFS([.F616]>5000000;[.$N$72];AND([.F616]>=1000000;[.F616]<=5000000);[.$N$73];AND([.F616]<1000000;[.F616]>0);[.$N$74];[.F616]=0;" ") -> Б | H616: of:=VLOOKUP([.$B616];[.$I$71:.$L$81];4;0) -> 2
B617: 2 | C617: of:=VLOOKUP([.$B617];[.$I$71:.$J$81];2;0) -> Санкт-Петербург | D617: 95 | E617: 61431 | F617: of:=IF(ISBLANK([.E617]*[.D617]);"0";[.E617]*[.D617]) -> 5835945 | G617: of:=COM.MICROSOFT.IFS([.F617]>5000000;[.$N$72];AND([.F617]>=1000000;[.F617]<=5000000);[.$N$73];AND([.F617]<1000000;[.F617]>0);[.$N$74];[.F617]=0;" ") -> А | H617: of:=VLOOKUP([.$B617];[.$I$71:.$L$81];4;0) -> 9
B618: 3 | C618: of:=VLOOKUP([.$B618];[.$I$71:.$J$81];2;0) -> Челябинск | D618: 56 | E618: 34383 | F618: of:=IF(ISBLANK([.E618]*[.D618]);"0";[.E618]*[.D618]) -> 1925448 | G618: of:=COM.MICROSOFT.IFS([.F618]>5000000;[.$N$72];AND([.F618]>=1000000;[.F618]<=5000000);[.$N$73];AND([.F618]<1000000;[.F618]>0);[.$N$74];[.F618]=0;" ") -> Б | H618: of:=VLOOKUP([.$B618];[.$I$71:.$L$81];4;0) -> 1
B619: 5 | C619: of:=VLOOKUP([.$B619];[.$I$71:.$J$81];2;0) -> Краснодар | D619: 7 | E619: 43130 | F619: of:=IF(ISBLANK([.E619]*[.D619]);"0";[.E619]*[.D619]) -> 301910 | G619: of:=COM.MICROSOFT.IFS([.F619]>5000000;[.$N$72];AND([.F619]>=1000000;[.F619]<=5000000);[.$N$73];AND([.F619]<1000000;[.F619]>0);[.$N$74];[.F619]=0;" ") -> В | H619: of:=VLOOKUP([.$B619];[.$I$71:.$L$81];4;0) -> 4
B620: 1 | C620: of:=VLOOKUP([.$B620];[.$I$71:.$J$81];2;0) -> Москва | D620: 64 | E620: 54637 | F620: of:=IF(ISBLANK([.E620]*[.D620]);"0";[.E620]*[.D620]) -> 3496768 | G620: of:=COM.MICROSOFT.IFS([.F620]>5000000;[.$N$72];AND([.F620]>=1000000;[.F620]<=5000000);[.$N$73];AND([.F620]<1000000;[.F620]>0);[.$N$74];[.F620]=0;" ") -> Б | H620: of:=VLOOKUP([.$B620];[.$I$71:.$L$81];4;0) -> 8
B621: 1 | C621: of:=VLOOKUP([.$B621];[.$I$71:.$J$81];2;0) -> Москва | D621: 7 | E621: 49187 | F621: of:=IF(ISBLANK([.E621]*[.D621]);"0";[.E621]*[.D621]) -> 344309 | G621: of:=COM.MICROSOFT.IFS([.F621]>5000000;[.$N$72];AND([.F621]>=1000000;[.F621]<=5000000);[.$N$73];AND([.F621]<1000000;[.F621]>0);[.$N$74];[.F621]=0;" ") -> В | H621: of:=VLOOKUP([.$B621];[.$I$71:.$L$81];4;0) -> 8
B622: 3 | C622: of:=VLOOKUP([.$B622];[.$I$71:.$J$81];2;0) -> Челябинск | D622: 3 | E622: 46389 | F622: of:=IF(ISBLANK([.E622]*[.D622]);"0";[.E622]*[.D622]) -> 139167 | G622: of:=COM.MICROSOFT.IFS([.F622]>5000000;[.$N$72];AND([.F622]>=1000000;[.F622]<=5000000);[.$N$73];AND([.F622]<1000000;[.F622]>0);[.$N$74];[.F622]=0;" ") -> В | H622: of:=VLOOKUP([.$B622];[.$I$71:.$L$81];4;0) -> 1
B623: 3 | C623: of:=VLOOKUP([.$B623];[.$I$71:.$J$81];2;0) -> Челябинск | D623: 28 | E623: 7039 | F623: of:=IF(ISBLANK([.E623]*[.D623]);"0";[.E623]*[.D623]) -> 197092 | G623: of:=COM.MICROSOFT.IFS([.F623]>5000000;[.$N$72];AND([.F623]>=1000000;[.F623]<=5000000);[.$N$73];AND([.F623]<1000000;[.F623]>0);[.$N$74];[.F623]=0;" ") -> В | H623: of:=VLOOKUP([.$B623];[.$I$71:.$L$81];4;0) -> 1
B624: 10 | C624: of:=VLOOKUP([.$B624];[.$I$71:.$J$81];2;0) -> Сочи | D624: 39 | E624: 88876 | F624: of:=IF(ISBLANK([.E624]*[.D624]);"0";[.E624]*[.D624]) -> 3466164 | G624: of:=COM.MICROSOFT.IFS([.F624]>5000000;[.$N$72];AND([.F624]>=1000000;[.F624]<=5000000);[.$N$73];AND([.F624]<1000000;[.F624]>0);[.$N$74];[.F624]=0;" ") -> Б | H624: of:=VLOOKUP([.$B624];[.$I$71:.$L$81];4;0) -> 6
B625: 10 | C625: of:=VLOOKUP([.$B625];[.$I$71:.$J$81];2;0) -> Сочи | D625: 93 | E625: 94318 | F625: of:=IF(ISBLANK([.E625]*[.D625]);"0";[.E625]*[.D625]) -> 8771574 | G625: of:=COM.MICROSOFT.IFS([.F625]>5000000;[.$N$72];AND([.F625]>=1000000;[.F625]<=5000000);[.$N$73];AND([.F625]<1000000;[.F625]>0);[.$N$74];[.F625]=0;" ") -> А | H625: of:=VLOOKUP([.$B625];[.$I$71:.$L$81];4;0) -> 6
B626: 3 | C626: of:=VLOOKUP([.$B626];[.$I$71:.$J$81];2;0) -> Челябинск | D626: 38 | E626: 86204 | F626: of:=IF(ISBLANK([.E626]*[.D626]);"0";[.E626]*[.D626]) -> 3275752 | G626: of:=COM.MICROSOFT.IFS([.F626]>5000000;[.$N$72];AND([.F626]>=1000000;[.F626]<=5000000);[.$N$73];AND([.F626]<1000000;[.F626]>0);[.$N$74];[.F626]=0;" ") -> Б | H626: of:=VLOOKUP([.$B626];[.$I$71:.$L$81];4;0) -> 1
B627: 6 | C627: of:=VLOOKUP([.$B627];[.$I$71:.$J$81];2;0) -> Владивосток | D627: 80 | E627: 79725 | F627: of:=IF(ISBLANK([.E627]*[.D627]);"0";[.E627]*[.D627]) -> 6378000 | G627: of:=COM.MICROSOFT.IFS([.F627]>5000000;[.$N$72];AND([.F627]>=1000000;[.F627]<=5000000);[.$N$73];AND([.F627]<1000000;[.F627]>0);[.$N$74];[.F627]=0;" ") -> А | H627: of:=VLOOKUP([.$B627];[.$I$71:.$L$81];4;0) -> 7
B628: 3 | C628: of:=VLOOKUP([.$B628];[.$I$71:.$J$81];2;0) -> Челябинск | D628: 39 | E628: 12190 | F628: of:=IF(ISBLANK([.E628]*[.D628]);"0";[.E628]*[.D628]) -> 475410 | G628: of:=COM.MICROSOFT.IFS([.F628]>5000000;[.$N$72];AND([.F628]>=1000000;[.F628]<=5000000);[.$N$73];AND([.F628]<1000000;[.F628]>0);[.$N$74];[.F628]=0;" ") -> В | H628: of:=VLOOKUP([.$B628];[.$I$71:.$L$81];4;0) -> 1
B629: 10 | C629: of:=VLOOKUP([.$B629];[.$I$71:.$J$81];2;0) -> Сочи | D629: 53 | E629: 24015 | F629: of:=IF(ISBLANK([.E629]*[.D629]);"0";[.E629]*[.D629]) -> 1272795 | G629: of:=COM.MICROSOFT.IFS([.F629]>5000000;[.$N$72];AND([.F629]>=1000000;[.F629]<=5000000);[.$N$73];AND([.F629]<1000000;[.F629]>0);[.$N$74];[.F629]=0;" ") -> Б | H629: of:=VLOOKUP([.$B629];[.$I$71:.$L$81];4;0) -> 6
B630: 2 | C630: of:=VLOOKUP([.$B630];[.$I$71:.$J$81];2;0) -> Санкт-Петербург | D630: 6 | E630: 34939 | F630: of:=IF(ISBLANK([.E630]*[.D630]);"0";[.E630]*[.D630]) -> 209634 | G630: of:=COM.MICROSOFT.IFS([.F630]>5000000;[.$N$72];AND([.F630]>=1000000;[.F630]<=5000000);[.$N$73];AND([.F630]<1000000;[.F630]>0);[.$N$74];[.F630]=0;" ") -> В | H630: of:=VLOOKUP([.$B630];[.$I$71:.$L$81];4;0) -> 9
B631: 3 | C631: of:=VLOOKUP([.$B631];[.$I$71:.$J$81];2;0) -> Челябинск | D631: 58 | E631: 54781 | F631: of:=IF(ISBLANK([.E631]*[.D631]);"0";[.E631]*[.D631]) -> 3177298 | G631: of:=COM.MICROSOFT.IFS([.F631]>5000000;[.$N$72];AND([.F631]>=1000000;[.F631]<=5000000);[.$N$73];AND([.F631]<1000000;[.F631]>0);[.$N$74];[.F631]=0;" ") -> Б | H631: of:=VLOOKUP([.$B631];[.$I$71:.$L$81];4;0) -> 1
B632: 3 | C632: of:=VLOOKUP([.$B632];[.$I$71:.$J$81];2;0) -> Челябинск | D632: 86 | E632: 53983 | F632: of:=IF(ISBLANK([.E632]*[.D632]);"0";[.E632]*[.D632]) -> 4642538 | G632: of:=COM.MICROSOFT.IFS([.F632]>5000000;[.$N$72];AND([.F632]>=1000000;[.F632]<=5000000);[.$N$73];AND([.F632]<1000000;[.F632]>0);[.$N$74];[.F632]=0;" ") -> Б | H632: of:=VLOOKUP([.$B632];[.$I$71:.$L$81];4;0) -> 1
B633: 7 | C633: of:=VLOOKUP([.$B633];[.$I$71:.$J$81];2;0) -> Мурманск | D633: 1 | E633: 22509 | F633: of:=IF(ISBLANK([.E633]*[.D633]);"0";[.E633]*[.D633]) -> 22509 | G633: of:=COM.MICROSOFT.IFS([.F633]>5000000;[.$N$72];AND([.F633]>=1000000;[.F633]<=5000000);[.$N$73];AND([.F633]<1000000;[.F633]>0);[.$N$74];[.F633]=0;" ") -> В | H633: of:=VLOOKUP([.$B633];[.$I$71:.$L$81];4;0) -> 10
B634: 9 | C634: of:=VLOOKUP([.$B634];[.$I$71:.$J$81];2;0) -> Тюмень | D634: 21 | E634: 88597 | F634: of:=IF(ISBLANK([.E634]*[.D634]);"0";[.E634]*[.D634]) -> 1860537 | G634: of:=COM.MICROSOFT.IFS([.F634]>5000000;[.$N$72];AND([.F634]>=1000000;[.F634]<=5000000);[.$N$73];AND([.F634]<1000000;[.F634]>0);[.$N$74];[.F634]=0;" ") -> Б | H634: of:=VLOOKUP([.$B634];[.$I$71:.$L$81];4;0) -> 3
B635: 9 | C635: of:=VLOOKUP([.$B635];[.$I$71:.$J$81];2;0) -> Тюмень | D635: 51 | E635: 68145 | F635: of:=IF(ISBLANK([.E635]*[.D635]);"0";[.E635]*[.D635]) -> 3475395 | G635: of:=COM.MICROSOFT.IFS([.F635]>5000000;[.$N$72];AND([.F635]>=1000000;[.F635]<=5000000);[.$N$73];AND([.F635]<1000000;[.F635]>0);[.$N$74];[.F635]=0;" ") -> Б | H635: of:=VLOOKUP([.$B635];[.$I$71:.$L$81];4;0) -> 3
B636: 6 | C636: of:=VLOOKUP([.$B636];[.$I$71:.$J$81];2;0) -> Владивосток | D636: 13 | E636: 10628 | F636: of:=IF(ISBLANK([.E636]*[.D636]);"0";[.E636]*[.D636]) -> 138164 | G636: of:=COM.MICROSOFT.IFS([.F636]>5000000;[.$N$72];AND([.F636]>=1000000;[.F636]<=5000000);[.$N$73];AND([.F636]<1000000;[.F636]>0);[.$N$74];[.F636]=0;" ") -> В | H636: of:=VLOOKUP([.$B636];[.$I$71:.$L$81];4;0) -> 7
B637: 5 | C637: of:=VLOOKUP([.$B637];[.$I$71:.$J$81];2;0) -> Краснодар | D637: 16 | E637: 88112 | F637: of:=IF(ISBLANK([.E637]*[.D637]);"0";[.E637]*[.D637]) -> 1409792 | G637: of:=COM.MICROSOFT.IFS([.F637]>5000000;[.$N$72];AND([.F637]>=1000000;[.F637]<=5000000);[.$N$73];AND([.F637]<1000000;[.F637]>0);[.$N$74];[.F637]=0;" ") -> Б | H637: of:=VLOOKUP([.$B637];[.$I$71:.$L$81];4;0) -> 4
B638: 8 | C638: of:=VLOOKUP([.$B638];[.$I$71:.$J$81];2;0) -> Новосибирск | D638: 10 | E638: 10922 | F638: of:=IF(ISBLANK([.E638]*[.D638]);"0";[.E638]*[.D638]) -> 109220 | G638: of:=COM.MICROSOFT.IFS([.F638]>5000000;[.$N$72];AND([.F638]>=1000000;[.F638]<=5000000);[.$N$73];AND([.F638]<1000000;[.F638]>0);[.$N$74];[.F638]=0;" ") -> В | H638: of:=VLOOKUP([.$B638];[.$I$71:.$L$81];4;0) -> 5
B639: 3 | C639: of:=VLOOKUP([.$B639];[.$I$71:.$J$81];2;0) -> Челябинск | D639: 11 | E639: 67519 | F639: of:=IF(ISBLANK([.E639]*[.D639]);"0";[.E639]*[.D639]) -> 742709 | G639: of:=COM.MICROSOFT.IFS([.F639]>5000000;[.$N$72];AND([.F639]>=1000000;[.F639]<=5000000);[.$N$73];AND([.F639]<1000000;[.F639]>0);[.$N$74];[.F639]=0;" ") -> В | H639: of:=VLOOKUP([.$B639];[.$I$71:.$L$81];4;0) -> 1
B640: 8 | C640: of:=VLOOKUP([.$B640];[.$I$71:.$J$81];2;0) -> Новосибирск | D640: 78 | E640: 45207 | F640: of:=IF(ISBLANK([.E640]*[.D640]);"0";[.E640]*[.D640]) -> 3526146 | G640: of:=COM.MICROSOFT.IFS([.F640]>5000000;[.$N$72];AND([.F640]>=1000000;[.F640]<=5000000);[.$N$73];AND([.F640]<1000000;[.F640]>0);[.$N$74];[.F640]=0;" ") -> Б | H640: of:=VLOOKUP([.$B640];[.$I$71:.$L$81];4;0) -> 5
B641: 3 | C641: of:=VLOOKUP([.$B641];[.$I$71:.$J$81];2;0) -> Челябинск | D641: 12 | E641: 10020 | F641: of:=IF(ISBLANK([.E641]*[.D641]);"0";[.E641]*[.D641]) -> 120240 | G641: of:=COM.MICROSOFT.IFS([.F641]>5000000;[.$N$72];AND([.F641]>=1000000;[.F641]<=5000000);[.$N$73];AND([.F641]<1000000;[.F641]>0);[.$N$74];[.F641]=0;" ") -> В | H641: of:=VLOOKUP([.$B641];[.$I$71:.$L$81];4;0) -> 1
B642: 9 | C642: of:=VLOOKUP([.$B642];[.$I$71:.$J$81];2;0) -> Тюмень | D642: 83 | E642: 94014 | F642: of:=IF(ISBLANK([.E642]*[.D642]);"0";[.E642]*[.D642]) -> 7803162 | G642: of:=COM.MICROSOFT.IFS([.F642]>5000000;[.$N$72];AND([.F642]>=1000000;[.F642]<=5000000);[.$N$73];AND([.F642]<1000000;[.F642]>0);[.$N$74];[.F642]=0;" ") -> А | H642: of:=VLOOKUP([.$B642];[.$I$71:.$L$81];4;0) -> 3
B643: 4 | C643: of:=VLOOKUP([.$B643];[.$I$71:.$J$81];2;0) -> Архангельск | D643: 38 | E643: 98543 | F643: of:=IF(ISBLANK([.E643]*[.D643]);"0";[.E643]*[.D643]) -> 3744634 | G643: of:=COM.MICROSOFT.IFS([.F643]>5000000;[.$N$72];AND([.F643]>=1000000;[.F643]<=5000000);[.$N$73];AND([.F643]<1000000;[.F643]>0);[.$N$74];[.F643]=0;" ") -> Б | H643: of:=VLOOKUP([.$B643];[.$I$71:.$L$81];4;0) -> 2
B644: 9 | C644: of:=VLOOKUP([.$B644];[.$I$71:.$J$81];2;0) -> Тюмень | D644: 87 | E644: 26989 | F644: of:=IF(ISBLANK([.E644]*[.D644]);"0";[.E644]*[.D644]) -> 2348043 | G644: of:=COM.MICROSOFT.IFS([.F644]>5000000;[.$N$72];AND([.F644]>=1000000;[.F644]<=5000000);[.$N$73];AND([.F644]<1000000;[.F644]>0);[.$N$74];[.F644]=0;" ") -> Б | H644: of:=VLOOKUP([.$B644];[.$I$71:.$L$81];4;0) -> 3
B645: 5 | C645: of:=VLOOKUP([.$B645];[.$I$71:.$J$81];2;0) -> Краснодар | D645: 44 | E645: 62859 | F645: of:=IF(ISBLANK([.E645]*[.D645]);"0";[.E645]*[.D645]) -> 2765796 | G645: of:=COM.MICROSOFT.IFS([.F645]>5000000;[.$N$72];AND([.F645]>=1000000;[.F645]<=5000000);[.$N$73];AND([.F645]<1000000;[.F645]>0);[.$N$74];[.F645]=0;" ") -> Б | H645: of:=VLOOKUP([.$B645];[.$I$71:.$L$81];4;0) -> 4
B646: 10 | C646: of:=VLOOKUP([.$B646];[.$I$71:.$J$81];2;0) -> Сочи | D646: 30 | E646: 64685 | F646: of:=IF(ISBLANK([.E646]*[.D646]);"0";[.E646]*[.D646]) -> 1940550 | G646: of:=COM.MICROSOFT.IFS([.F646]>5000000;[.$N$72];AND([.F646]>=1000000;[.F646]<=5000000);[.$N$73];AND([.F646]<1000000;[.F646]>0);[.$N$74];[.F646]=0;" ") -> Б | H646: of:=VLOOKUP([.$B646];[.$I$71:.$L$81];4;0) -> 6
B647: 6 | C647: of:=VLOOKUP([.$B647];[.$I$71:.$J$81];2;0) -> Владивосток | D647: 93 | E647: 21713 | F647: of:=IF(ISBLANK([.E647]*[.D647]);"0";[.E647]*[.D647]) -> 2019309 | G647: of:=COM.MICROSOFT.IFS([.F647]>5000000;[.$N$72];AND([.F647]>=1000000;[.F647]<=5000000);[.$N$73];AND([.F647]<1000000;[.F647]>0);[.$N$74];[.F647]=0;" ") -> Б | H647: of:=VLOOKUP([.$B647];[.$I$71:.$L$81];4;0) -> 7
B648: 2 | C648: of:=VLOOKUP([.$B648];[.$I$71:.$J$81];2;0) -> Санкт-Петербург | D648: 62 | E648: 83672 | F648: of:=IF(ISBLANK([.E648]*[.D648]);"0";[.E648]*[.D648]) -> 5187664 | G648: of:=COM.MICROSOFT.IFS([.F648]>5000000;[.$N$72];AND([.F648]>=1000000;[.F648]<=5000000);[.$N$73];AND([.F648]<1000000;[.F648]>0);[.$N$74];[.F648]=0;" ") -> А | H648: of:=VLOOKUP([.$B648];[.$I$71:.$L$81];4;0) -> 9
B649: 7 | C649: of:=VLOOKUP([.$B649];[.$I$71:.$J$81];2;0) -> Мурманск | D649: 34 | E649: 42979 | F649: of:=IF(ISBLANK([.E649]*[.D649]);"0";[.E649]*[.D649]) -> 1461286 | G649: of:=COM.MICROSOFT.IFS([.F649]>5000000;[.$N$72];AND([.F649]>=1000000;[.F649]<=5000000);[.$N$73];AND([.F649]<1000000;[.F649]>0);[.$N$74];[.F649]=0;" ") -> Б | H649: of:=VLOOKUP([.$B649];[.$I$71:.$L$81];4;0) -> 10
B650: 6 | C650: of:=VLOOKUP([.$B650];[.$I$71:.$J$81];2;0) -> Владивосток | D650: 41 | E650: 94574 | F650: of:=IF(ISBLANK([.E650]*[.D650]);"0";[.E650]*[.D650]) -> 3877534 | G650: of:=COM.MICROSOFT.IFS([.F650]>5000000;[.$N$72];AND([.F650]>=1000000;[.F650]<=5000000);[.$N$73];AND([.F650]<1000000;[.F650]>0);[.$N$74];[.F650]=0;" ") -> Б | H650: of:=VLOOKUP([.$B650];[.$I$71:.$L$81];4;0) -> 7
B651: 8 | C651: of:=VLOOKUP([.$B651];[.$I$71:.$J$81];2;0) -> Новосибирск | D651: 38 | E651: 46058 | F651: of:=IF(ISBLANK([.E651]*[.D651]);"0";[.E651]*[.D651]) -> 1750204 | G651: of:=COM.MICROSOFT.IFS([.F651]>5000000;[.$N$72];AND([.F651]>=1000000;[.F651]<=5000000);[.$N$73];AND([.F651]<1000000;[.F651]>0);[.$N$74];[.F651]=0;" ") -> Б | H651: of:=VLOOKUP([.$B651];[.$I$71:.$L$81];4;0) -> 5
B652: 7 | C652: of:=VLOOKUP([.$B652];[.$I$71:.$J$81];2;0) -> Мурманск | D652: 14 | E652: 89360 | F652: of:=IF(ISBLANK([.E652]*[.D652]);"0";[.E652]*[.D652]) -> 1251040 | G652: of:=COM.MICROSOFT.IFS([.F652]>5000000;[.$N$72];AND([.F652]>=1000000;[.F652]<=5000000);[.$N$73];AND([.F652]<1000000;[.F652]>0);[.$N$74];[.F652]=0;" ") -> Б | H652: of:=VLOOKUP([.$B652];[.$I$71:.$L$81];4;0) -> 10
B653: 5 | C653: of:=VLOOKUP([.$B653];[.$I$71:.$J$81];2;0) -> Краснодар | D653: 25 | E653: 12501 | F653: of:=IF(ISBLANK([.E653]*[.D653]);"0";[.E653]*[.D653]) -> 312525 | G653: of:=COM.MICROSOFT.IFS([.F653]>5000000;[.$N$72];AND([.F653]>=1000000;[.F653]<=5000000);[.$N$73];AND([.F653]<1000000;[.F653]>0);[.$N$74];[.F653]=0;" ") -> В | H653: of:=VLOOKUP([.$B653];[.$I$71:.$L$81];4;0) -> 4
B654: 1 | C654: of:=VLOOKUP([.$B654];[.$I$71:.$J$81];2;0) -> Москва | D654: 48 | E654: 52998 | F654: of:=IF(ISBLANK([.E654]*[.D654]);"0";[.E654]*[.D654]) -> 2543904 | G654: of:=COM.MICROSOFT.IFS([.F654]>5000000;[.$N$72];AND([.F654]>=1000000;[.F654]<=5000000);[.$N$73];AND([.F654]<1000000;[.F654]>0);[.$N$74];[.F654]=0;" ") -> Б | H654: of:=VLOOKUP([.$B654];[.$I$71:.$L$81];4;0) -> 8
B655: 4 | C655: of:=VLOOKUP([.$B655];[.$I$71:.$J$81];2;0) -> Архангельск | D655: 7 | E655: 99557 | F655: of:=IF(ISBLANK([.E655]*[.D655]);"0";[.E655]*[.D655]) -> 696899 | G655: of:=COM.MICROSOFT.IFS([.F655]>5000000;[.$N$72];AND([.F655]>=1000000;[.F655]<=5000000);[.$N$73];AND([.F655]<1000000;[.F655]>0);[.$N$74];[.F655]=0;" ") -> В | H655: of:=VLOOKUP([.$B655];[.$I$71:.$L$81];4;0) -> 2
B656: 3 | C656: of:=VLOOKUP([.$B656];[.$I$71:.$J$81];2;0) -> Челябинск | D656: 61 | E656: 68301 | F656: of:=IF(ISBLANK([.E656]*[.D656]);"0";[.E656]*[.D656]) -> 4166361 | G656: of:=COM.MICROSOFT.IFS([.F656]>5000000;[.$N$72];AND([.F656]>=1000000;[.F656]<=5000000);[.$N$73];AND([.F656]<1000000;[.F656]>0);[.$N$74];[.F656]=0;" ") -> Б | H656: of:=VLOOKUP([.$B656];[.$I$71:.$L$81];4;0) -> 1
B657: 7 | C657: of:=VLOOKUP([.$B657];[.$I$71:.$J$81];2;0) -> Мурманск | D657: 51 | E657: 78120 | F657: of:=IF(ISBLANK([.E657]*[.D657]);"0";[.E657]*[.D657]) -> 3984120 | G657: of:=COM.MICROSOFT.IFS([.F657]>5000000;[.$N$72];AND([.F657]>=1000000;[.F657]<=5000000);[.$N$73];AND([.F657]<1000000;[.F657]>0);[.$N$74];[.F657]=0;" ") -> Б | H657: of:=VLOOKUP([.$B657];[.$I$71:.$L$81];4;0) -> 10
B658: 3 | C658: of:=VLOOKUP([.$B658];[.$I$71:.$J$81];2;0) -> Челябинск | D658: 0 | E658: 71569 | F658: of:=IF(ISBLANK([.E658]*[.D658]);"0";[.E658]*[.D658]) -> 0 | G658: of:=COM.MICROSOFT.IFS([.F658]>5000000;[.$N$72];AND([.F658]>=1000000;[.F658]<=5000000);[.$N$73];AND([.F658]<1000000;[.F658]>0);[.$N$74];[.F658]=0;" ") ->   | H658: of:=VLOOKUP([.$B658];[.$I$71:.$L$81];4;0) -> 1
B659: 10 | C659: of:=VLOOKUP([.$B659];[.$I$71:.$J$81];2;0) -> Сочи | D659: 85 | E659: 16312 | F659: of:=IF(ISBLANK([.E659]*[.D659]);"0";[.E659]*[.D659]) -> 1386520 | G659: of:=COM.MICROSOFT.IFS([.F659]>5000000;[.$N$72];AND([.F659]>=1000000;[.F659]<=5000000);[.$N$73];AND([.F659]<1000000;[.F659]>0);[.$N$74];[.F659]=0;" ") -> Б | H659: of:=VLOOKUP([.$B659];[.$I$71:.$L$81];4;0) -> 6
B660: 3 | C660: of:=VLOOKUP([.$B660];[.$I$71:.$J$81];2;0) -> Челябинск | D660: 50 | E660: 29371 | F660: of:=IF(ISBLANK([.E660]*[.D660]);"0";[.E660]*[.D660]) -> 1468550 | G660: of:=COM.MICROSOFT.IFS([.F660]>5000000;[.$N$72];AND([.F660]>=1000000;[.F660]<=5000000);[.$N$73];AND([.F660]<1000000;[.F660]>0);[.$N$74];[.F660]=0;" ") -> Б | H660: of:=VLOOKUP([.$B660];[.$I$71:.$L$81];4;0) -> 1
B661: 6 | C661: of:=VLOOKUP([.$B661];[.$I$71:.$J$81];2;0) -> Владивосток | D661: 45 | E661: 95642 | F661: of:=IF(ISBLANK([.E661]*[.D661]);"0";[.E661]*[.D661]) -> 4303890 | G661: of:=COM.MICROSOFT.IFS([.F661]>5000000;[.$N$72];AND([.F661]>=1000000;[.F661]<=5000000);[.$N$73];AND([.F661]<1000000;[.F661]>0);[.$N$74];[.F661]=0;" ") -> Б | H661: of:=VLOOKUP([.$B661];[.$I$71:.$L$81];4;0) -> 7
B662: 6 | C662: of:=VLOOKUP([.$B662];[.$I$71:.$J$81];2;0) -> Владивосток | D662: 57 | E662: 44551 | F662: of:=IF(ISBLANK([.E662]*[.D662]);"0";[.E662]*[.D662]) -> 2539407 | G662: of:=COM.MICROSOFT.IFS([.F662]>5000000;[.$N$72];AND([.F662]>=1000000;[.F662]<=5000000);[.$N$73];AND([.F662]<1000000;[.F662]>0);[.$N$74];[.F662]=0;" ") -> Б | H662: of:=VLOOKUP([.$B662];[.$I$71:.$L$81];4;0) -> 7
B663: 6 | C663: of:=VLOOKUP([.$B663];[.$I$71:.$J$81];2;0) -> Владивосток | D663: 24 | E663: 45475 | F663: of:=IF(ISBLANK([.E663]*[.D663]);"0";[.E663]*[.D663]) -> 1091400 | G663: of:=COM.MICROSOFT.IFS([.F663]>5000000;[.$N$72];AND([.F663]>=1000000;[.F663]<=5000000);[.$N$73];AND([.F663]<1000000;[.F663]>0);[.$N$74];[.F663]=0;" ") -> Б | H663: of:=VLOOKUP([.$B663];[.$I$71:.$L$81];4;0) -> 7
B664: 8 | C664: of:=VLOOKUP([.$B664];[.$I$71:.$J$81];2;0) -> Новосибирск | D664: 24 | E664: 23310 | F664: of:=IF(ISBLANK([.E664]*[.D664]);"0";[.E664]*[.D664]) -> 559440 | G664: of:=COM.MICROSOFT.IFS([.F664]>5000000;[.$N$72];AND([.F664]>=1000000;[.F664]<=5000000);[.$N$73];AND([.F664]<1000000;[.F664]>0);[.$N$74];[.F664]=0;" ") -> В | H664: of:=VLOOKUP([.$B664];[.$I$71:.$L$81];4;0) -> 5
B665: 4 | C665: of:=VLOOKUP([.$B665];[.$I$71:.$J$81];2;0) -> Архангельск | D665: 62 | E665: 92290 | F665: of:=IF(ISBLANK([.E665]*[.D665]);"0";[.E665]*[.D665]) -> 5721980 | G665: of:=COM.MICROSOFT.IFS([.F665]>5000000;[.$N$72];AND([.F665]>=1000000;[.F665]<=5000000);[.$N$73];AND([.F665]<1000000;[.F665]>0);[.$N$74];[.F665]=0;" ") -> А | H665: of:=VLOOKUP([.$B665];[.$I$71:.$L$81];4;0) -> 2
B666: 3 | C666: of:=VLOOKUP([.$B666];[.$I$71:.$J$81];2;0) -> Челябинск | D666: 7 | E666: 44965 | F666: of:=IF(ISBLANK([.E666]*[.D666]);"0";[.E666]*[.D666]) -> 314755 | G666: of:=COM.MICROSOFT.IFS([.F666]>5000000;[.$N$72];AND([.F666]>=1000000;[.F666]<=5000000);[.$N$73];AND([.F666]<1000000;[.F666]>0);[.$N$74];[.F666]=0;" ") -> В | H666: of:=VLOOKUP([.$B666];[.$I$71:.$L$81];4;0) -> 1
B667: 9 | C667: of:=VLOOKUP([.$B667];[.$I$71:.$J$81];2;0) -> Тюмень | D667: 91 | E667: 97914 | F667: of:=IF(ISBLANK([.E667]*[.D667]);"0";[.E667]*[.D667]) -> 8910174 | G667: of:=COM.MICROSOFT.IFS([.F667]>5000000;[.$N$72];AND([.F667]>=1000000;[.F667]<=5000000);[.$N$73];AND([.F667]<1000000;[.F667]>0);[.$N$74];[.F667]=0;" ") -> А | H667: of:=VLOOKUP([.$B667];[.$I$71:.$L$81];4;0) -> 3
B668: 6 | C668: of:=VLOOKUP([.$B668];[.$I$71:.$J$81];2;0) -> Владивосток | D668: 0 | E668: 26703 | F668: of:=IF(ISBLANK([.E668]*[.D668]);"0";[.E668]*[.D668]) -> 0 | G668: of:=COM.MICROSOFT.IFS([.F668]>5000000;[.$N$72];AND([.F668]>=1000000;[.F668]<=5000000);[.$N$73];AND([.F668]<1000000;[.F668]>0);[.$N$74];[.F668]=0;" ") ->   | H668: of:=VLOOKUP([.$B668];[.$I$71:.$L$81];4;0) -> 7
B669: 7 | C669: of:=VLOOKUP([.$B669];[.$I$71:.$J$81];2;0) -> Мурманск | D669: 33 | E669: 20742 | F669: of:=IF(ISBLANK([.E669]*[.D669]);"0";[.E669]*[.D669]) -> 684486 | G669: of:=COM.MICROSOFT.IFS([.F669]>5000000;[.$N$72];AND([.F669]>=1000000;[.F669]<=5000000);[.$N$73];AND([.F669]<1000000;[.F669]>0);[.$N$74];[.F669]=0;" ") -> В | H669: of:=VLOOKUP([.$B669];[.$I$71:.$L$81];4;0) -> 10
B670: 8 | C670: of:=VLOOKUP([.$B670];[.$I$71:.$J$81];2;0) -> Новосибирск | D670: 16 | E670: 72457 | F670: of:=IF(ISBLANK([.E670]*[.D670]);"0";[.E670]*[.D670]) -> 1159312 | G670: of:=COM.MICROSOFT.IFS([.F670]>5000000;[.$N$72];AND([.F670]>=1000000;[.F670]<=5000000);[.$N$73];AND([.F670]<1000000;[.F670]>0);[.$N$74];[.F670]=0;" ") -> Б | H670: of:=VLOOKUP([.$B670];[.$I$71:.$L$81];4;0) -> 5
B671: 2 | C671: of:=VLOOKUP([.$B671];[.$I$71:.$J$81];2;0) -> Санкт-Петербург | D671: 18 | E671: 7632 | F671: of:=IF(ISBLANK([.E671]*[.D671]);"0";[.E671]*[.D671]) -> 137376 | G671: of:=COM.MICROSOFT.IFS([.F671]>5000000;[.$N$72];AND([.F671]>=1000000;[.F671]<=5000000);[.$N$73];AND([.F671]<1000000;[.F671]>0);[.$N$74];[.F671]=0;" ") -> В | H671: of:=VLOOKUP([.$B671];[.$I$71:.$L$81];4;0) -> 9
B672: 3 | C672: of:=VLOOKUP([.$B672];[.$I$71:.$J$81];2;0) -> Челябинск | D672: 79 | E672: 48717 | F672: of:=IF(ISBLANK([.E672]*[.D672]);"0";[.E672]*[.D672]) -> 3848643 | G672: of:=COM.MICROSOFT.IFS([.F672]>5000000;[.$N$72];AND([.F672]>=1000000;[.F672]<=5000000);[.$N$73];AND([.F672]<1000000;[.F672]>0);[.$N$74];[.F672]=0;" ") -> Б | H672: of:=VLOOKUP([.$B672];[.$I$71:.$L$81];4;0) -> 1
B673: 5 | C673: of:=VLOOKUP([.$B673];[.$I$71:.$J$81];2;0) -> Краснодар | D673: 41 | E673: 32941 | F673: of:=IF(ISBLANK([.E673]*[.D673]);"0";[.E673]*[.D673]) -> 1350581 | G673: of:=COM.MICROSOFT.IFS([.F673]>5000000;[.$N$72];AND([.F673]>=1000000;[.F673]<=5000000);[.$N$73];AND([.F673]<1000000;[.F673]>0);[.$N$74];[.F673]=0;" ") -> Б | H673: of:=VLOOKUP([.$B673];[.$I$71:.$L$81];4;0) -> 4
B674: 2 | C674: of:=VLOOKUP([.$B674];[.$I$71:.$J$81];2;0) -> Санкт-Петербург | D674: 96 | E674: 23897 | F674: of:=IF(ISBLANK([.E674]*[.D674]);"0";[.E674]*[.D674]) -> 2294112 | G674: of:=COM.MICROSOFT.IFS([.F674]>5000000;[.$N$72];AND([.F674]>=1000000;[.F674]<=5000000);[.$N$73];AND([.F674]<1000000;[.F674]>0);[.$N$74];[.F674]=0;" ") -> Б | H674: of:=VLOOKUP([.$B674];[.$I$71:.$L$81];4;0) -> 9
B675: 8 | C675: of:=VLOOKUP([.$B675];[.$I$71:.$J$81];2;0) -> Новосибирск | D675: 4 | E675: 15951 | F675: of:=IF(ISBLANK([.E675]*[.D675]);"0";[.E675]*[.D675]) -> 63804 | G675: of:=COM.MICROSOFT.IFS([.F675]>5000000;[.$N$72];AND([.F675]>=1000000;[.F675]<=5000000);[.$N$73];AND([.F675]<1000000;[.F675]>0);[.$N$74];[.F675]=0;" ") -> В | H675: of:=VLOOKUP([.$B675];[.$I$71:.$L$81];4;0) -> 5
B676: 5 | C676: of:=VLOOKUP([.$B676];[.$I$71:.$J$81];2;0) -> Краснодар | D676: 75 | E676: 64582 | F676: of:=IF(ISBLANK([.E676]*[.D676]);"0";[.E676]*[.D676]) -> 4843650 | G676: of:=COM.MICROSOFT.IFS([.F676]>5000000;[.$N$72];AND([.F676]>=1000000;[.F676]<=5000000);[.$N$73];AND([.F676]<1000000;[.F676]>0);[.$N$74];[.F676]=0;" ") -> Б | H676: of:=VLOOKUP([.$B676];[.$I$71:.$L$81];4;0) -> 4
B677: 5 | C677: of:=VLOOKUP([.$B677];[.$I$71:.$J$81];2;0) -> Краснодар | D677: 17 | E677: 85626 | F677: of:=IF(ISBLANK([.E677]*[.D677]);"0";[.E677]*[.D677]) -> 1455642 | G677: of:=COM.MICROSOFT.IFS([.F677]>5000000;[.$N$72];AND([.F677]>=1000000;[.F677]<=5000000);[.$N$73];AND([.F677]<1000000;[.F677]>0);[.$N$74];[.F677]=0;" ") -> Б | H677: of:=VLOOKUP([.$B677];[.$I$71:.$L$81];4;0) -> 4
B678: 9 | C678: of:=VLOOKUP([.$B678];[.$I$71:.$J$81];2;0) -> Тюмень | D678: 99 | E678: 84751 | F678: of:=IF(ISBLANK([.E678]*[.D678]);"0";[.E678]*[.D678]) -> 8390349 | G678: of:=COM.MICROSOFT.IFS([.F678]>5000000;[.$N$72];AND([.F678]>=1000000;[.F678]<=5000000);[.$N$73];AND([.F678]<1000000;[.F678]>0);[.$N$74];[.F678]=0;" ") -> А | H678: of:=VLOOKUP([.$B678];[.$I$71:.$L$81];4;0) -> 3
B679: 7 | C679: of:=VLOOKUP([.$B679];[.$I$71:.$J$81];2;0) -> Мурманск | D679: 21 | E679: 92423 | F679: of:=IF(ISBLANK([.E679]*[.D679]);"0";[.E679]*[.D679]) -> 1940883 | G679: of:=COM.MICROSOFT.IFS([.F679]>5000000;[.$N$72];AND([.F679]>=1000000;[.F679]<=5000000);[.$N$73];AND([.F679]<1000000;[.F679]>0);[.$N$74];[.F679]=0;" ") -> Б | H679: of:=VLOOKUP([.$B679];[.$I$71:.$L$81];4;0) -> 10
B680: 7 | C680: of:=VLOOKUP([.$B680];[.$I$71:.$J$81];2;0) -> Мурманск | D680: 77 | E680: 72832 | F680: of:=IF(ISBLANK([.E680]*[.D680]);"0";[.E680]*[.D680]) -> 5608064 | G680: of:=COM.MICROSOFT.IFS([.F680]>5000000;[.$N$72];AND([.F680]>=1000000;[.F680]<=5000000);[.$N$73];AND([.F680]<1000000;[.F680]>0);[.$N$74];[.F680]=0;" ") -> А | H680: of:=VLOOKUP([.$B680];[.$I$71:.$L$81];4;0) -> 10
B681: 7 | C681: of:=VLOOKUP([.$B681];[.$I$71:.$J$81];2;0) -> Мурманск | D681: 79 | E681: 65640 | F681: of:=IF(ISBLANK([.E681]*[.D681]);"0";[.E681]*[.D681]) -> 5185560 | G681: of:=COM.MICROSOFT.IFS([.F681]>5000000;[.$N$72];AND([.F681]>=1000000;[.F681]<=5000000);[.$N$73];AND([.F681]<1000000;[.F681]>0);[.$N$74];[.F681]=0;" ") -> А | H681: of:=VLOOKUP([.$B681];[.$I$71:.$L$81];4;0) -> 10
B682: 8 | C682: of:=VLOOKUP([.$B682];[.$I$71:.$J$81];2;0) -> Новосибирск | D682: 38 | E682: 56175 | F682: of:=IF(ISBLANK([.E682]*[.D682]);"0";[.E682]*[.D682]) -> 2134650 | G682: of:=COM.MICROSOFT.IFS([.F682]>5000000;[.$N$72];AND([.F682]>=1000000;[.F682]<=5000000);[.$N$73];AND([.F682]<1000000;[.F682]>0);[.$N$74];[.F682]=0;" ") -> Б | H682: of:=VLOOKUP([.$B682];[.$I$71:.$L$81];4;0) -> 5
B683: 7 | C683: of:=VLOOKUP([.$B683];[.$I$71:.$J$81];2;0) -> Мурманск | D683: 56 | E683: 72503 | F683: of:=IF(ISBLANK([.E683]*[.D683]);"0";[.E683]*[.D683]) -> 4060168 | G683: of:=COM.MICROSOFT.IFS([.F683]>5000000;[.$N$72];AND([.F683]>=1000000;[.F683]<=5000000);[.$N$73];AND([.F683]<1000000;[.F683]>0);[.$N$74];[.F683]=0;" ") -> Б | H683: of:=VLOOKUP([.$B683];[.$I$71:.$L$81];4;0) -> 10
B684: 5 | C684: of:=VLOOKUP([.$B684];[.$I$71:.$J$81];2;0) -> Краснодар | D684: 31 | E684: 78281 | F684: of:=IF(ISBLANK([.E684]*[.D684]);"0";[.E684]*[.D684]) -> 2426711 | G684: of:=COM.MICROSOFT.IFS([.F684]>5000000;[.$N$72];AND([.F684]>=1000000;[.F684]<=5000000);[.$N$73];AND([.F684]<1000000;[.F684]>0);[.$N$74];[.F684]=0;" ") -> Б | H684: of:=VLOOKUP([.$B684];[.$I$71:.$L$81];4;0) -> 4
B685: 2 | C685: of:=VLOOKUP([.$B685];[.$I$71:.$J$81];2;0) -> Санкт-Петербург | D685: 68 | E685: 38972 | F685: of:=IF(ISBLANK([.E685]*[.D685]);"0";[.E685]*[.D685]) -> 2650096 | G685: of:=COM.MICROSOFT.IFS([.F685]>5000000;[.$N$72];AND([.F685]>=1000000;[.F685]<=5000000);[.$N$73];AND([.F685]<1000000;[.F685]>0);[.$N$74];[.F685]=0;" ") -> Б | H685: of:=VLOOKUP([.$B685];[.$I$71:.$L$81];4;0) -> 9
B686: 8 | C686: of:=VLOOKUP([.$B686];[.$I$71:.$J$81];2;0) -> Новосибирск | D686: 39 | E686: 92889 | F686: of:=IF(ISBLANK([.E686]*[.D686]);"0";[.E686]*[.D686]) -> 3622671 | G686: of:=COM.MICROSOFT.IFS([.F686]>5000000;[.$N$72];AND([.F686]>=1000000;[.F686]<=5000000);[.$N$73];AND([.F686]<1000000;[.F686]>0);[.$N$74];[.F686]=0;" ") -> Б | H686: of:=VLOOKUP([.$B686];[.$I$71:.$L$81];4;0) -> 5
B687: 8 | C687: of:=VLOOKUP([.$B687];[.$I$71:.$J$81];2;0) -> Новосибирск | D687: 74 | E687: 17977 | F687: of:=IF(ISBLANK([.E687]*[.D687]);"0";[.E687]*[.D687]) -> 1330298 | G687: of:=COM.MICROSOFT.IFS([.F687]>5000000;[.$N$72];AND([.F687]>=1000000;[.F687]<=5000000);[.$N$73];AND([.F687]<1000000;[.F687]>0);[.$N$74];[.F687]=0;" ") -> Б | H687: of:=VLOOKUP([.$B687];[.$I$71:.$L$81];4;0) -> 5
B688: 6 | C688: of:=VLOOKUP([.$B688];[.$I$71:.$J$81];2;0) -> Владивосток | D688: 47 | E688: 99764 | F688: of:=IF(ISBLANK([.E688]*[.D688]);"0";[.E688]*[.D688]) -> 4688908 | G688: of:=COM.MICROSOFT.IFS([.F688]>5000000;[.$N$72];AND([.F688]>=1000000;[.F688]<=5000000);[.$N$73];AND([.F688]<1000000;[.F688]>0);[.$N$74];[.F688]=0;" ") -> Б | H688: of:=VLOOKUP([.$B688];[.$I$71:.$L$81];4;0) -> 7
B689: 7 | C689: of:=VLOOKUP([.$B689];[.$I$71:.$J$81];2;0) -> Мурманск | D689: 38 | E689: 29558 | F689: of:=IF(ISBLANK([.E689]*[.D689]);"0";[.E689]*[.D689]) -> 1123204 | G689: of:=COM.MICROSOFT.IFS([.F689]>5000000;[.$N$72];AND([.F689]>=1000000;[.F689]<=5000000);[.$N$73];AND([.F689]<1000000;[.F689]>0);[.$N$74];[.F689]=0;" ") -> Б | H689: of:=VLOOKUP([.$B689];[.$I$71:.$L$81];4;0) -> 10
B690: 8 | C690: of:=VLOOKUP([.$B690];[.$I$71:.$J$81];2;0) -> Новосибирск | D690: 99 | E690: 79776 | F690: of:=IF(ISBLANK([.E690]*[.D690]);"0";[.E690]*[.D690]) -> 7897824 | G690: of:=COM.MICROSOFT.IFS([.F690]>5000000;[.$N$72];AND([.F690]>=1000000;[.F690]<=5000000);[.$N$73];AND([.F690]<1000000;[.F690]>0);[.$N$74];[.F690]=0;" ") -> А | H690: of:=VLOOKUP([.$B690];[.$I$71:.$L$81];4;0) -> 5
B691: 8 | C691: of:=VLOOKUP([.$B691];[.$I$71:.$J$81];2;0) -> Новосибирск | D691: 7 | E691: 8128 | F691: of:=IF(ISBLANK([.E691]*[.D691]);"0";[.E691]*[.D691]) -> 56896 | G691: of:=COM.MICROSOFT.IFS([.F691]>5000000;[.$N$72];AND([.F691]>=1000000;[.F691]<=5000000);[.$N$73];AND([.F691]<1000000;[.F691]>0);[.$N$74];[.F691]=0;" ") -> В | H691: of:=VLOOKUP([.$B691];[.$I$71:.$L$81];4;0) -> 5
B692: 1 | C692: of:=VLOOKUP([.$B692];[.$I$71:.$J$81];2;0) -> Москва | D692: 31 | E692: 4617 | F692: of:=IF(ISBLANK([.E692]*[.D692]);"0";[.E692]*[.D692]) -> 143127 | G692: of:=COM.MICROSOFT.IFS([.F692]>5000000;[.$N$72];AND([.F692]>=1000000;[.F692]<=5000000);[.$N$73];AND([.F692]<1000000;[.F692]>0);[.$N$74];[.F692]=0;" ") -> В | H692: of:=VLOOKUP([.$B692];[.$I$71:.$L$81];4;0) -> 8
B693: 10 | C693: of:=VLOOKUP([.$B693];[.$I$71:.$J$81];2;0) -> Сочи | D693: 51 | E693: 20822 | F693: of:=IF(ISBLANK([.E693]*[.D693]);"0";[.E693]*[.D693]) -> 1061922 | G693: of:=COM.MICROSOFT.IFS([.F693]>5000000;[.$N$72];AND([.F693]>=1000000;[.F693]<=5000000);[.$N$73];AND([.F693]<1000000;[.F693]>0);[.$N$74];[.F693]=0;" ") -> Б | H693: of:=VLOOKUP([.$B693];[.$I$71:.$L$81];4;0) -> 6
B694: 8 | C694: of:=VLOOKUP([.$B694];[.$I$71:.$J$81];2;0) -> Новосибирск | D694: 90 | E694: 23249 | F694: of:=IF(ISBLANK([.E694]*[.D694]);"0";[.E694]*[.D694]) -> 2092410 | G694: of:=COM.MICROSOFT.IFS([.F694]>5000000;[.$N$72];AND([.F694]>=1000000;[.F694]<=5000000);[.$N$73];AND([.F694]<1000000;[.F694]>0);[.$N$74];[.F694]=0;" ") -> Б | H694: of:=VLOOKUP([.$B694];[.$I$71:.$L$81];4;0) -> 5
B695: 7 | C695: of:=VLOOKUP([.$B695];[.$I$71:.$J$81];2;0) -> Мурманск | D695: 73 | E695: 54660 | F695: of:=IF(ISBLANK([.E695]*[.D695]);"0";[.E695]*[.D695]) -> 3990180 | G695: of:=COM.MICROSOFT.IFS([.F695]>5000000;[.$N$72];AND([.F695]>=1000000;[.F695]<=5000000);[.$N$73];AND([.F695]<1000000;[.F695]>0);[.$N$74];[.F695]=0;" ") -> Б | H695: of:=VLOOKUP([.$B695];[.$I$71:.$L$81];4;0) -> 10
B696: 9 | C696: of:=VLOOKUP([.$B696];[.$I$71:.$J$81];2;0) -> Тюмень | D696: 45 | E696: 60918 | F696: of:=IF(ISBLANK([.E696]*[.D696]);"0";[.E696]*[.D696]) -> 2741310 | G696: of:=COM.MICROSOFT.IFS([.F696]>5000000;[.$N$72];AND([.F696]>=1000000;[.F696]<=5000000);[.$N$73];AND([.F696]<1000000;[.F696]>0);[.$N$74];[.F696]=0;" ") -> Б | H696: of:=VLOOKUP([.$B696];[.$I$71:.$L$81];4;0) -> 3
B697: 4 | C697: of:=VLOOKUP([.$B697];[.$I$71:.$J$81];2;0) -> Архангельск | D697: 3 | E697: 80980 | F697: of:=IF(ISBLANK([.E697]*[.D697]);"0";[.E697]*[.D697]) -> 242940 | G697: of:=COM.MICROSOFT.IFS([.F697]>5000000;[.$N$72];AND([.F697]>=1000000;[.F697]<=5000000);[.$N$73];AND([.F697]<1000000;[.F697]>0);[.$N$74];[.F697]=0;" ") -> В | H697: of:=VLOOKUP([.$B697];[.$I$71:.$L$81];4;0) -> 2
B698: 3 | C698: of:=VLOOKUP([.$B698];[.$I$71:.$J$81];2;0) -> Челябинск | D698: 77 | E698: 71354 | F698: of:=IF(ISBLANK([.E698]*[.D698]);"0";[.E698]*[.D698]) -> 5494258 | G698: of:=COM.MICROSOFT.IFS([.F698]>5000000;[.$N$72];AND([.F698]>=1000000;[.F698]<=5000000);[.$N$73];AND([.F698]<1000000;[.F698]>0);[.$N$74];[.F698]=0;" ") -> А | H698: of:=VLOOKUP([.$B698];[.$I$71:.$L$81];4;0) -> 1
B699: 4 | C699: of:=VLOOKUP([.$B699];[.$I$71:.$J$81];2;0) -> Архангельск | D699: 5 | E699: 41371 | F699: of:=IF(ISBLANK([.E699]*[.D699]);"0";[.E699]*[.D699]) -> 206855 | G699: of:=COM.MICROSOFT.IFS([.F699]>5000000;[.$N$72];AND([.F699]>=1000000;[.F699]<=5000000);[.$N$73];AND([.F699]<1000000;[.F699]>0);[.$N$74];[.F699]=0;" ") -> В | H699: of:=VLOOKUP([.$B699];[.$I$71:.$L$81];4;0) -> 2
B700: 2 | C700: of:=VLOOKUP([.$B700];[.$I$71:.$J$81];2;0) -> Санкт-Петербург | D700: 88 | E700: 29461 | F700: of:=IF(ISBLANK([.E700]*[.D700]);"0";[.E700]*[.D700]) -> 2592568 | G700: of:=COM.MICROSOFT.IFS([.F700]>5000000;[.$N$72];AND([.F700]>=1000000;[.F700]<=5000000);[.$N$73];AND([.F700]<1000000;[.F700]>0);[.$N$74];[.F700]=0;" ") -> Б | H700: of:=VLOOKUP([.$B700];[.$I$71:.$L$81];4;0) -> 9
B701: 3 | C701: of:=VLOOKUP([.$B701];[.$I$71:.$J$81];2;0) -> Челябинск | D701: 79 | E701: 18076 | F701: of:=IF(ISBLANK([.E701]*[.D701]);"0";[.E701]*[.D701]) -> 1428004 | G701: of:=COM.MICROSOFT.IFS([.F701]>5000000;[.$N$72];AND([.F701]>=1000000;[.F701]<=5000000);[.$N$73];AND([.F701]<1000000;[.F701]>0);[.$N$74];[.F701]=0;" ") -> Б | H701: of:=VLOOKUP([.$B701];[.$I$71:.$L$81];4;0) -> 1
B702: 6 | C702: of:=VLOOKUP([.$B702];[.$I$71:.$J$81];2;0) -> Владивосток | D702: 64 | E702: 63633 | F702: of:=IF(ISBLANK([.E702]*[.D702]);"0";[.E702]*[.D702]) -> 4072512 | G702: of:=COM.MICROSOFT.IFS([.F702]>5000000;[.$N$72];AND([.F702]>=1000000;[.F702]<=5000000);[.$N$73];AND([.F702]<1000000;[.F702]>0);[.$N$74];[.F702]=0;" ") -> Б | H702: of:=VLOOKUP([.$B702];[.$I$71:.$L$81];4;0) -> 7
B703: 6 | C703: of:=VLOOKUP([.$B703];[.$I$71:.$J$81];2;0) -> Владивосток | D703: 26 | E703: 84572 | F703: of:=IF(ISBLANK([.E703]*[.D703]);"0";[.E703]*[.D703]) -> 2198872 | G703: of:=COM.MICROSOFT.IFS([.F703]>5000000;[.$N$72];AND([.F703]>=1000000;[.F703]<=5000000);[.$N$73];AND([.F703]<1000000;[.F703]>0);[.$N$74];[.F703]=0;" ") -> Б | H703: of:=VLOOKUP([.$B703];[.$I$71:.$L$81];4;0) -> 7
B704: 4 | C704: of:=VLOOKUP([.$B704];[.$I$71:.$J$81];2;0) -> Архангельск | D704: 3 | E704: 62499 | F704: of:=IF(ISBLANK([.E704]*[.D704]);"0";[.E704]*[.D704]) -> 187497 | G704: of:=COM.MICROSOFT.IFS([.F704]>5000000;[.$N$72];AND([.F704]>=1000000;[.F704]<=5000000);[.$N$73];AND([.F704]<1000000;[.F704]>0);[.$N$74];[.F704]=0;" ") -> В | H704: of:=VLOOKUP([.$B704];[.$I$71:.$L$81];4;0) -> 2
B705: 1 | C705: of:=VLOOKUP([.$B705];[.$I$71:.$J$81];2;0) -> Москва | D705: 25 | E705: 49795 | F705: of:=IF(ISBLANK([.E705]*[.D705]);"0";[.E705]*[.D705]) -> 1244875 | G705: of:=COM.MICROSOFT.IFS([.F705]>5000000;[.$N$72];AND([.F705]>=1000000;[.F705]<=5000000);[.$N$73];AND([.F705]<1000000;[.F705]>0);[.$N$74];[.F705]=0;" ") -> Б | H705: of:=VLOOKUP([.$B705];[.$I$71:.$L$81];4;0) -> 8
B706: 4 | C706: of:=VLOOKUP([.$B706];[.$I$71:.$J$81];2;0) -> Архангельск | D706: 64 | E706: 95732 | F706: of:=IF(ISBLANK([.E706]*[.D706]);"0";[.E706]*[.D706]) -> 6126848 | G706: of:=COM.MICROSOFT.IFS([.F706]>5000000;[.$N$72];AND([.F706]>=1000000;[.F706]<=5000000);[.$N$73];AND([.F706]<1000000;[.F706]>0);[.$N$74];[.F706]=0;" ") -> А | H706: of:=VLOOKUP([.$B706];[.$I$71:.$L$81];4;0) -> 2
B707: 1 | C707: of:=VLOOKUP([.$B707];[.$I$71:.$J$81];2;0) -> Москва | D707: 28 | E707: 27260 | F707: of:=IF(ISBLANK([.E707]*[.D707]);"0";[.E707]*[.D707]) -> 763280 | G707: of:=COM.MICROSOFT.IFS([.F707]>5000000;[.$N$72];AND([.F707]>=1000000;[.F707]<=5000000);[.$N$73];AND([.F707]<1000000;[.F707]>0);[.$N$74];[.F707]=0;" ") -> В | H707: of:=VLOOKUP([.$B707];[.$I$71:.$L$81];4;0) -> 8
B708: 7 | C708: of:=VLOOKUP([.$B708];[.$I$71:.$J$81];2;0) -> Мурманск | D708: 15 | E708: 43224 | F708: of:=IF(ISBLANK([.E708]*[.D708]);"0";[.E708]*[.D708]) -> 648360 | G708: of:=COM.MICROSOFT.IFS([.F708]>5000000;[.$N$72];AND([.F708]>=1000000;[.F708]<=5000000);[.$N$73];AND([.F708]<1000000;[.F708]>0);[.$N$74];[.F708]=0;" ") -> В | H708: of:=VLOOKUP([.$B708];[.$I$71:.$L$81];4;0) -> 10
B709: 8 | C709: of:=VLOOKUP([.$B709];[.$I$71:.$J$81];2;0) -> Новосибирск | D709: 58 | E709: 12994 | F709: of:=IF(ISBLANK([.E709]*[.D709]);"0";[.E709]*[.D709]) -> 753652 | G709: of:=COM.MICROSOFT.IFS([.F709]>5000000;[.$N$72];AND([.F709]>=1000000;[.F709]<=5000000);[.$N$73];AND([.F709]<1000000;[.F709]>0);[.$N$74];[.F709]=0;" ") -> В | H709: of:=VLOOKUP([.$B709];[.$I$71:.$L$81];4;0) -> 5
B710: 10 | C710: of:=VLOOKUP([.$B710];[.$I$71:.$J$81];2;0) -> Сочи | D710: 93 | E710: 19761 | F710: of:=IF(ISBLANK([.E710]*[.D710]);"0";[.E710]*[.D710]) -> 1837773 | G710: of:=COM.MICROSOFT.IFS([.F710]>5000000;[.$N$72];AND([.F710]>=1000000;[.F710]<=5000000);[.$N$73];AND([.F710]<1000000;[.F710]>0);[.$N$74];[.F710]=0;" ") -> Б | H710: of:=VLOOKUP([.$B710];[.$I$71:.$L$81];4;0) -> 6
B711: 4 | C711: of:=VLOOKUP([.$B711];[.$I$71:.$J$81];2;0) -> Архангельск | D711: 96 | E711: 47044 | F711: of:=IF(ISBLANK([.E711]*[.D711]);"0";[.E711]*[.D711]) -> 4516224 | G711: of:=COM.MICROSOFT.IFS([.F711]>5000000;[.$N$72];AND([.F711]>=1000000;[.F711]<=5000000);[.$N$73];AND([.F711]<1000000;[.F711]>0);[.$N$74];[.F711]=0;" ") -> Б | H711: of:=VLOOKUP([.$B711];[.$I$71:.$L$81];4;0) -> 2
B712: 8 | C712: of:=VLOOKUP([.$B712];[.$I$71:.$J$81];2;0) -> Новосибирск | D712: 82 | E712: 39005 | F712: of:=IF(ISBLANK([.E712]*[.D712]);"0";[.E712]*[.D712]) -> 3198410 | G712: of:=COM.MICROSOFT.IFS([.F712]>5000000;[.$N$72];AND([.F712]>=1000000;[.F712]<=5000000);[.$N$73];AND([.F712]<1000000;[.F712]>0);[.$N$74];[.F712]=0;" ") -> Б | H712: of:=VLOOKUP([.$B712];[.$I$71:.$L$81];4;0) -> 5
B713: 7 | C713: of:=VLOOKUP([.$B713];[.$I$71:.$J$81];2;0) -> Мурманск | D713: 80 | E713: 83008 | F713: of:=IF(ISBLANK([.E713]*[.D713]);"0";[.E713]*[.D713]) -> 6640640 | G713: of:=COM.MICROSOFT.IFS([.F713]>5000000;[.$N$72];AND([.F713]>=1000000;[.F713]<=5000000);[.$N$73];AND([.F713]<1000000;[.F713]>0);[.$N$74];[.F713]=0;" ") -> А | H713: of:=VLOOKUP([.$B713];[.$I$71:.$L$81];4;0) -> 10
B714: 3 | C714: of:=VLOOKUP([.$B714];[.$I$71:.$J$81];2;0) -> Челябинск | D714: 90 | E714: 58405 | F714: of:=IF(ISBLANK([.E714]*[.D714]);"0";[.E714]*[.D714]) -> 5256450 | G714: of:=COM.MICROSOFT.IFS([.F714]>5000000;[.$N$72];AND([.F714]>=1000000;[.F714]<=5000000);[.$N$73];AND([.F714]<1000000;[.F714]>0);[.$N$74];[.F714]=0;" ") -> А | H714: of:=VLOOKUP([.$B714];[.$I$71:.$L$81];4;0) -> 1
B715: 10 | C715: of:=VLOOKUP([.$B715];[.$I$71:.$J$81];2;0) -> Сочи | D715: 38 | E715: 1809 | F715: of:=IF(ISBLANK([.E715]*[.D715]);"0";[.E715]*[.D715]) -> 68742 | G715: of:=COM.MICROSOFT.IFS([.F715]>5000000;[.$N$72];AND([.F715]>=1000000;[.F715]<=5000000);[.$N$73];AND([.F715]<1000000;[.F715]>0);[.$N$74];[.F715]=0;" ") -> В | H715: of:=VLOOKUP([.$B715];[.$I$71:.$L$81];4;0) -> 6
B716: 3 | C716: of:=VLOOKUP([.$B716];[.$I$71:.$J$81];2;0) -> Челябинск | D716: 80 | E716: 86368 | F716: of:=IF(ISBLANK([.E716]*[.D716]);"0";[.E716]*[.D716]) -> 6909440 | G716: of:=COM.MICROSOFT.IFS([.F716]>5000000;[.$N$72];AND([.F716]>=1000000;[.F716]<=5000000);[.$N$73];AND([.F716]<1000000;[.F716]>0);[.$N$74];[.F716]=0;" ") -> А | H716: of:=VLOOKUP([.$B716];[.$I$71:.$L$81];4;0) -> 1
B717: 5 | C717: of:=VLOOKUP([.$B717];[.$I$71:.$J$81];2;0) -> Краснодар | D717: 41 | E717: 32693 | F717: of:=IF(ISBLANK([.E717]*[.D717]);"0";[.E717]*[.D717]) -> 1340413 | G717: of:=COM.MICROSOFT.IFS([.F717]>5000000;[.$N$72];AND([.F717]>=1000000;[.F717]<=5000000);[.$N$73];AND([.F717]<1000000;[.F717]>0);[.$N$74];[.F717]=0;" ") -> Б | H717: of:=VLOOKUP([.$B717];[.$I$71:.$L$81];4;0) -> 4
B718: 5 | C718: of:=VLOOKUP([.$B718];[.$I$71:.$J$81];2;0) -> Краснодар | D718: 67 | E718: 57779 | F718: of:=IF(ISBLANK([.E718]*[.D718]);"0";[.E718]*[.D718]) -> 3871193 | G718: of:=COM.MICROSOFT.IFS([.F718]>5000000;[.$N$72];AND([.F718]>=1000000;[.F718]<=5000000);[.$N$73];AND([.F718]<1000000;[.F718]>0);[.$N$74];[.F718]=0;" ") -> Б | H718: of:=VLOOKUP([.$B718];[.$I$71:.$L$81];4;0) -> 4
B719: 10 | C719: of:=VLOOKUP([.$B719];[.$I$71:.$J$81];2;0) -> Сочи | D719: 55 | E719: 87146 | F719: of:=IF(ISBLANK([.E719]*[.D719]);"0";[.E719]*[.D719]) -> 4793030 | G719: of:=COM.MICROSOFT.IFS([.F719]>5000000;[.$N$72];AND([.F719]>=1000000;[.F719]<=5000000);[.$N$73];AND([.F719]<1000000;[.F719]>0);[.$N$74];[.F719]=0;" ") -> Б | H719: of:=VLOOKUP([.$B719];[.$I$71:.$L$81];4;0) -> 6
B720: 10 | C720: of:=VLOOKUP([.$B720];[.$I$71:.$J$81];2;0) -> Сочи | D720: 13 | E720: 99733 | F720: of:=IF(ISBLANK([.E720]*[.D720]);"0";[.E720]*[.D720]) -> 1296529 | G720: of:=COM.MICROSOFT.IFS([.F720]>5000000;[.$N$72];AND([.F720]>=1000000;[.F720]<=5000000);[.$N$73];AND([.F720]<1000000;[.F720]>0);[.$N$74];[.F720]=0;" ") -> Б | H720: of:=VLOOKUP([.$B720];[.$I$71:.$L$81];4;0) -> 6
B721: 4 | C721: of:=VLOOKUP([.$B721];[.$I$71:.$J$81];2;0) -> Архангельск | D721: 9 | E721: 1226 | F721: of:=IF(ISBLANK([.E721]*[.D721]);"0";[.E721]*[.D721]) -> 11034 | G721: of:=COM.MICROSOFT.IFS([.F721]>5000000;[.$N$72];AND([.F721]>=1000000;[.F721]<=5000000);[.$N$73];AND([.F721]<1000000;[.F721]>0);[.$N$74];[.F721]=0;" ") -> В | H721: of:=VLOOKUP([.$B721];[.$I$71:.$L$81];4;0) -> 2
B722: 4 | C722: of:=VLOOKUP([.$B722];[.$I$71:.$J$81];2;0) -> Архангельск | D722: 73 | E722: 52042 | F722: of:=IF(ISBLANK([.E722]*[.D722]);"0";[.E722]*[.D722]) -> 3799066 | G722: of:=COM.MICROSOFT.IFS([.F722]>5000000;[.$N$72];AND([.F722]>=1000000;[.F722]<=5000000);[.$N$73];AND([.F722]<1000000;[.F722]>0);[.$N$74];[.F722]=0;" ") -> Б | H722: of:=VLOOKUP([.$B722];[.$I$71:.$L$81];4;0) -> 2
B723: 9 | C723: of:=VLOOKUP([.$B723];[.$I$71:.$J$81];2;0) -> Тюмень | D723: 27 | E723: 33516 | F723: of:=IF(ISBLANK([.E723]*[.D723]);"0";[.E723]*[.D723]) -> 904932 | G723: of:=COM.MICROSOFT.IFS([.F723]>5000000;[.$N$72];AND([.F723]>=1000000;[.F723]<=5000000);[.$N$73];AND([.F723]<1000000;[.F723]>0);[.$N$74];[.F723]=0;" ") -> В | H723: of:=VLOOKUP([.$B723];[.$I$71:.$L$81];4;0) -> 3
B724: 4 | C724: of:=VLOOKUP([.$B724];[.$I$71:.$J$81];2;0) -> Архангельск | D724: 48 | E724: 2898 | F724: of:=IF(ISBLANK([.E724]*[.D724]);"0";[.E724]*[.D724]) -> 139104 | G724: of:=COM.MICROSOFT.IFS([.F724]>5000000;[.$N$72];AND([.F724]>=1000000;[.F724]<=5000000);[.$N$73];AND([.F724]<1000000;[.F724]>0);[.$N$74];[.F724]=0;" ") -> В | H724: of:=VLOOKUP([.$B724];[.$I$71:.$L$81];4;0) -> 2
B725: 2 | C725: of:=VLOOKUP([.$B725];[.$I$71:.$J$81];2;0) -> Санкт-Петербург | D725: 76 | E725: 99652 | F725: of:=IF(ISBLANK([.E725]*[.D725]);"0";[.E725]*[.D725]) -> 7573552 | G725: of:=COM.MICROSOFT.IFS([.F725]>5000000;[.$N$72];AND([.F725]>=1000000;[.F725]<=5000000);[.$N$73];AND([.F725]<1000000;[.F725]>0);[.$N$74];[.F725]=0;" ") -> А | H725: of:=VLOOKUP([.$B725];[.$I$71:.$L$81];4;0) -> 9
B726: 8 | C726: of:=VLOOKUP([.$B726];[.$I$71:.$J$81];2;0) -> Новосибирск | D726: 94 | E726: 60752 | F726: of:=IF(ISBLANK([.E726]*[.D726]);"0";[.E726]*[.D726]) -> 5710688 | G726: of:=COM.MICROSOFT.IFS([.F726]>5000000;[.$N$72];AND([.F726]>=1000000;[.F726]<=5000000);[.$N$73];AND([.F726]<1000000;[.F726]>0);[.$N$74];[.F726]=0;" ") -> А | H726: of:=VLOOKUP([.$B726];[.$I$71:.$L$81];4;0) -> 5
B727: 10 | C727: of:=VLOOKUP([.$B727];[.$I$71:.$J$81];2;0) -> Сочи | D727: 31 | E727: 11178 | F727: of:=IF(ISBLANK([.E727]*[.D727]);"0";[.E727]*[.D727]) -> 346518 | G727: of:=COM.MICROSOFT.IFS([.F727]>5000000;[.$N$72];AND([.F727]>=1000000;[.F727]<=5000000);[.$N$73];AND([.F727]<1000000;[.F727]>0);[.$N$74];[.F727]=0;" ") -> В | H727: of:=VLOOKUP([.$B727];[.$I$71:.$L$81];4;0) -> 6
B728: 9 | C728: of:=VLOOKUP([.$B728];[.$I$71:.$J$81];2;0) -> Тюмень | D728: 63 | E728: 83275 | F728: of:=IF(ISBLANK([.E728]*[.D728]);"0";[.E728]*[.D728]) -> 5246325 | G728: of:=COM.MICROSOFT.IFS([.F728]>5000000;[.$N$72];AND([.F728]>=1000000;[.F728]<=5000000);[.$N$73];AND([.F728]<1000000;[.F728]>0);[.$N$74];[.F728]=0;" ") -> А | H728: of:=VLOOKUP([.$B728];[.$I$71:.$L$81];4;0) -> 3
B729: 10 | C729: of:=VLOOKUP([.$B729];[.$I$71:.$J$81];2;0) -> Сочи | D729: 78 | E729: 41173 | F729: of:=IF(ISBLANK([.E729]*[.D729]);"0";[.E729]*[.D729]) -> 3211494 | G729: of:=COM.MICROSOFT.IFS([.F729]>5000000;[.$N$72];AND([.F729]>=1000000;[.F729]<=5000000);[.$N$73];AND([.F729]<1000000;[.F729]>0);[.$N$74];[.F729]=0;" ") -> Б | H729: of:=VLOOKUP([.$B729];[.$I$71:.$L$81];4;0) -> 6
B730: 3 | C730: of:=VLOOKUP([.$B730];[.$I$71:.$J$81];2;0) -> Челябинск | D730: 70 | E730: 9981 | F730: of:=IF(ISBLANK([.E730]*[.D730]);"0";[.E730]*[.D730]) -> 698670 | G730: of:=COM.MICROSOFT.IFS([.F730]>5000000;[.$N$72];AND([.F730]>=1000000;[.F730]<=5000000);[.$N$73];AND([.F730]<1000000;[.F730]>0);[.$N$74];[.F730]=0;" ") -> В | H730: of:=VLOOKUP([.$B730];[.$I$71:.$L$81];4;0) -> 1
B731: 3 | C731: of:=VLOOKUP([.$B731];[.$I$71:.$J$81];2;0) -> Челябинск | D731: 74 | E731: 74862 | F731: of:=IF(ISBLANK([.E731]*[.D731]);"0";[.E731]*[.D731]) -> 5539788 | G731: of:=COM.MICROSOFT.IFS([.F731]>5000000;[.$N$72];AND([.F731]>=1000000;[.F731]<=5000000);[.$N$73];AND([.F731]<1000000;[.F731]>0);[.$N$74];[.F731]=0;" ") -> А | H731: of:=VLOOKUP([.$B731];[.$I$71:.$L$81];4;0) -> 1
B732: 10 | C732: of:=VLOOKUP([.$B732];[.$I$71:.$J$81];2;0) -> Сочи | D732: 39 | E732: 83871 | F732: of:=IF(ISBLANK([.E732]*[.D732]);"0";[.E732]*[.D732]) -> 3270969 | G732: of:=COM.MICROSOFT.IFS([.F732]>5000000;[.$N$72];AND([.F732]>=1000000;[.F732]<=5000000);[.$N$73];AND([.F732]<1000000;[.F732]>0);[.$N$74];[.F732]=0;" ") -> Б | H732: of:=VLOOKUP([.$B732];[.$I$71:.$L$81];4;0) -> 6
B733: 4 | C733: of:=VLOOKUP([.$B733];[.$I$71:.$J$81];2;0) -> Архангельск | D733: 55 | E733: 83208 | F733: of:=IF(ISBLANK([.E733]*[.D733]);"0";[.E733]*[.D733]) -> 4576440 | G733: of:=COM.MICROSOFT.IFS([.F733]>5000000;[.$N$72];AND([.F733]>=1000000;[.F733]<=5000000);[.$N$73];AND([.F733]<1000000;[.F733]>0);[.$N$74];[.F733]=0;" ") -> Б | H733: of:=VLOOKUP([.$B733];[.$I$71:.$L$81];4;0) -> 2
B734: 2 | C734: of:=VLOOKUP([.$B734];[.$I$71:.$J$81];2;0) -> Санкт-Петербург | D734: 44 | E734: 74169 | F734: of:=IF(ISBLANK([.E734]*[.D734]);"0";[.E734]*[.D734]) -> 3263436 | G734: of:=COM.MICROSOFT.IFS([.F734]>5000000;[.$N$72];AND([.F734]>=1000000;[.F734]<=5000000);[.$N$73];AND([.F734]<1000000;[.F734]>0);[.$N$74];[.F734]=0;" ") -> Б | H734: of:=VLOOKUP([.$B734];[.$I$71:.$L$81];4;0) -> 9
B735: 8 | C735: of:=VLOOKUP([.$B735];[.$I$71:.$J$81];2;0) -> Новосибирск | D735: 63 | E735: 29180 | F735: of:=IF(ISBLANK([.E735]*[.D735]);"0";[.E735]*[.D735]) -> 1838340 | G735: of:=COM.MICROSOFT.IFS([.F735]>5000000;[.$N$72];AND([.F735]>=1000000;[.F735]<=5000000);[.$N$73];AND([.F735]<1000000;[.F735]>0);[.$N$74];[.F735]=0;" ") -> Б | H735: of:=VLOOKUP([.$B735];[.$I$71:.$L$81];4;0) -> 5
B736: 2 | C736: of:=VLOOKUP([.$B736];[.$I$71:.$J$81];2;0) -> Санкт-Петербург | D736: 67 | E736: 3022 | F736: of:=IF(ISBLANK([.E736]*[.D736]);"0";[.E736]*[.D736]) -> 202474 | G736: of:=COM.MICROSOFT.IFS([.F736]>5000000;[.$N$72];AND([.F736]>=1000000;[.F736]<=5000000);[.$N$73];AND([.F736]<1000000;[.F736]>0);[.$N$74];[.F736]=0;" ") -> В | H736: of:=VLOOKUP([.$B736];[.$I$71:.$L$81];4;0) -> 9
B737: 8 | C737: of:=VLOOKUP([.$B737];[.$I$71:.$J$81];2;0) -> Новосибирск | D737: 20 | E737: 14176 | F737: of:=IF(ISBLANK([.E737]*[.D737]);"0";[.E737]*[.D737]) -> 283520 | G737: of:=COM.MICROSOFT.IFS([.F737]>5000000;[.$N$72];AND([.F737]>=1000000;[.F737]<=5000000);[.$N$73];AND([.F737]<1000000;[.F737]>0);[.$N$74];[.F737]=0;" ") -> В | H737: of:=VLOOKUP([.$B737];[.$I$71:.$L$81];4;0) -> 5
B738: 7 | C738: of:=VLOOKUP([.$B738];[.$I$71:.$J$81];2;0) -> Мурманск | D738: 29 | E738: 52734 | F738: of:=IF(ISBLANK([.E738]*[.D738]);"0";[.E738]*[.D738]) -> 1529286 | G738: of:=COM.MICROSOFT.IFS([.F738]>5000000;[.$N$72];AND([.F738]>=1000000;[.F738]<=5000000);[.$N$73];AND([.F738]<1000000;[.F738]>0);[.$N$74];[.F738]=0;" ") -> Б | H738: of:=VLOOKUP([.$B738];[.$I$71:.$L$81];4;0) -> 10
B739: 10 | C739: of:=VLOOKUP([.$B739];[.$I$71:.$J$81];2;0) -> Сочи | D739: 89 | E739: 11812 | F739: of:=IF(ISBLANK([.E739]*[.D739]);"0";[.E739]*[.D739]) -> 1051268 | G739: of:=COM.MICROSOFT.IFS([.F739]>5000000;[.$N$72];AND([.F739]>=1000000;[.F739]<=5000000);[.$N$73];AND([.F739]<1000000;[.F739]>0);[.$N$74];[.F739]=0;" ") -> Б | H739: of:=VLOOKUP([.$B739];[.$I$71:.$L$81];4;0) -> 6
B740: 3 | C740: of:=VLOOKUP([.$B740];[.$I$71:.$J$81];2;0) -> Челябинск | D740: 75 | E740: 27885 | F740: of:=IF(ISBLANK([.E740]*[.D740]);"0";[.E740]*[.D740]) -> 2091375 | G740: of:=COM.MICROSOFT.IFS([.F740]>5000000;[.$N$72];AND([.F740]>=1000000;[.F740]<=5000000);[.$N$73];AND([.F740]<1000000;[.F740]>0);[.$N$74];[.F740]=0;" ") -> Б | H740: of:=VLOOKUP([.$B740];[.$I$71:.$L$81];4;0) -> 1
B741: 5 | C741: of:=VLOOKUP([.$B741];[.$I$71:.$J$81];2;0) -> Краснодар | D741: 67 | E741: 46057 | F741: of:=IF(ISBLANK([.E741]*[.D741]);"0";[.E741]*[.D741]) -> 3085819 | G741: of:=COM.MICROSOFT.IFS([.F741]>5000000;[.$N$72];AND([.F741]>=1000000;[.F741]<=5000000);[.$N$73];AND([.F741]<1000000;[.F741]>0);[.$N$74];[.F741]=0;" ") -> Б | H741: of:=VLOOKUP([.$B741];[.$I$71:.$L$81];4;0) -> 4
B742: 2 | C742: of:=VLOOKUP([.$B742];[.$I$71:.$J$81];2;0) -> Санкт-Петербург | D742: 3 | E742: 58437 | F742: of:=IF(ISBLANK([.E742]*[.D742]);"0";[.E742]*[.D742]) -> 175311 | G742: of:=COM.MICROSOFT.IFS([.F742]>5000000;[.$N$72];AND([.F742]>=1000000;[.F742]<=5000000);[.$N$73];AND([.F742]<1000000;[.F742]>0);[.$N$74];[.F742]=0;" ") -> В | H742: of:=VLOOKUP([.$B742];[.$I$71:.$L$81];4;0) -> 9
B743: 8 | C743: of:=VLOOKUP([.$B743];[.$I$71:.$J$81];2;0) -> Новосибирск | D743: 44 | E743: 12420 | F743: of:=IF(ISBLANK([.E743]*[.D743]);"0";[.E743]*[.D743]) -> 546480 | G743: of:=COM.MICROSOFT.IFS([.F743]>5000000;[.$N$72];AND([.F743]>=1000000;[.F743]<=5000000);[.$N$73];AND([.F743]<1000000;[.F743]>0);[.$N$74];[.F743]=0;" ") -> В | H743: of:=VLOOKUP([.$B743];[.$I$71:.$L$81];4;0) -> 5
B744: 9 | C744: of:=VLOOKUP([.$B744];[.$I$71:.$J$81];2;0) -> Тюмень | D744: 91 | E744: 96662 | F744: of:=IF(ISBLANK([.E744]*[.D744]);"0";[.E744]*[.D744]) -> 8796242 | G744: of:=COM.MICROSOFT.IFS([.F744]>5000000;[.$N$72];AND([.F744]>=1000000;[.F744]<=5000000);[.$N$73];AND([.F744]<1000000;[.F744]>0);[.$N$74];[.F744]=0;" ") -> А | H744: of:=VLOOKUP([.$B744];[.$I$71:.$L$81];4;0) -> 3
B745: 2 | C745: of:=VLOOKUP([.$B745];[.$I$71:.$J$81];2;0) -> Санкт-Петербург | D745: 92 | E745: 48676 | F745: of:=IF(ISBLANK([.E745]*[.D745]);"0";[.E745]*[.D745]) -> 4478192 | G745: of:=COM.MICROSOFT.IFS([.F745]>5000000;[.$N$72];AND([.F745]>=1000000;[.F745]<=5000000);[.$N$73];AND([.F745]<1000000;[.F745]>0);[.$N$74];[.F745]=0;" ") -> Б | H745: of:=VLOOKUP([.$B745];[.$I$71:.$L$81];4;0) -> 9
B746: 4 | C746: of:=VLOOKUP([.$B746];[.$I$71:.$J$81];2;0) -> Архангельск | D746: 35 | E746: 42484 | F746: of:=IF(ISBLANK([.E746]*[.D746]);"0";[.E746]*[.D746]) -> 1486940 | G746: of:=COM.MICROSOFT.IFS([.F746]>5000000;[.$N$72];AND([.F746]>=1000000;[.F746]<=5000000);[.$N$73];AND([.F746]<1000000;[.F746]>0);[.$N$74];[.F746]=0;" ") -> Б | H746: of:=VLOOKUP([.$B746];[.$I$71:.$L$81];4;0) -> 2
B747: 6 | C747: of:=VLOOKUP([.$B747];[.$I$71:.$J$81];2;0) -> Владивосток | D747: 62 | E747: 10320 | F747: of:=IF(ISBLANK([.E747]*[.D747]);"0";[.E747]*[.D747]) -> 639840 | G747: of:=COM.MICROSOFT.IFS([.F747]>5000000;[.$N$72];AND([.F747]>=1000000;[.F747]<=5000000);[.$N$73];AND([.F747]<1000000;[.F747]>0);[.$N$74];[.F747]=0;" ") -> В | H747: of:=VLOOKUP([.$B747];[.$I$71:.$L$81];4;0) -> 7
B748: 7 | C748: of:=VLOOKUP([.$B748];[.$I$71:.$J$81];2;0) -> Мурманск | D748: 25 | E748: 79591 | F748: of:=IF(ISBLANK([.E748]*[.D748]);"0";[.E748]*[.D748]) -> 1989775 | G748: of:=COM.MICROSOFT.IFS([.F748]>5000000;[.$N$72];AND([.F748]>=1000000;[.F748]<=5000000);[.$N$73];AND([.F748]<1000000;[.F748]>0);[.$N$74];[.F748]=0;" ") -> Б | H748: of:=VLOOKUP([.$B748];[.$I$71:.$L$81];4;0) -> 10
B749: 2 | C749: of:=VLOOKUP([.$B749];[.$I$71:.$J$81];2;0) -> Санкт-Петербург | D749: 46 | E749: 95757 | F749: of:=IF(ISBLANK([.E749]*[.D749]);"0";[.E749]*[.D749]) -> 4404822 | G749: of:=COM.MICROSOFT.IFS([.F749]>5000000;[.$N$72];AND([.F749]>=1000000;[.F749]<=5000000);[.$N$73];AND([.F749]<1000000;[.F749]>0);[.$N$74];[.F749]=0;" ") -> Б | H749: of:=VLOOKUP([.$B749];[.$I$71:.$L$81];4;0) -> 9
B750: 8 | C750: of:=VLOOKUP([.$B750];[.$I$71:.$J$81];2;0) -> Новосибирск | D750: 21 | E750: 37390 | F750: of:=IF(ISBLANK([.E750]*[.D750]);"0";[.E750]*[.D750]) -> 785190 | G750: of:=COM.MICROSOFT.IFS([.F750]>5000000;[.$N$72];AND([.F750]>=1000000;[.F750]<=5000000);[.$N$73];AND([.F750]<1000000;[.F750]>0);[.$N$74];[.F750]=0;" ") -> В | H750: of:=VLOOKUP([.$B750];[.$I$71:.$L$81];4;0) -> 5
B751: 1 | C751: of:=VLOOKUP([.$B751];[.$I$71:.$J$81];2;0) -> Москва | D751: 79 | E751: 37905 | F751: of:=IF(ISBLANK([.E751]*[.D751]);"0";[.E751]*[.D751]) -> 2994495 | G751: of:=COM.MICROSOFT.IFS([.F751]>5000000;[.$N$72];AND([.F751]>=1000000;[.F751]<=5000000);[.$N$73];AND([.F751]<1000000;[.F751]>0);[.$N$74];[.F751]=0;" ") -> Б | H751: of:=VLOOKUP([.$B751];[.$I$71:.$L$81];4;0) -> 8
B752: 8 | C752: of:=VLOOKUP([.$B752];[.$I$71:.$J$81];2;0) -> Новосибирск | D752: 77 | E752: 83677 | F752: of:=IF(ISBLANK([.E752]*[.D752]);"0";[.E752]*[.D752]) -> 6443129 | G752: of:=COM.MICROSOFT.IFS([.F752]>5000000;[.$N$72];AND([.F752]>=1000000;[.F752]<=5000000);[.$N$73];AND([.F752]<1000000;[.F752]>0);[.$N$74];[.F752]=0;" ") -> А | H752: of:=VLOOKUP([.$B752];[.$I$71:.$L$81];4;0) -> 5
B753: 5 | C753: of:=VLOOKUP([.$B753];[.$I$71:.$J$81];2;0) -> Краснодар | D753: 16 | E753: 45719 | F753: of:=IF(ISBLANK([.E753]*[.D753]);"0";[.E753]*[.D753]) -> 731504 | G753: of:=COM.MICROSOFT.IFS([.F753]>5000000;[.$N$72];AND([.F753]>=1000000;[.F753]<=5000000);[.$N$73];AND([.F753]<1000000;[.F753]>0);[.$N$74];[.F753]=0;" ") -> В | H753: of:=VLOOKUP([.$B753];[.$I$71:.$L$81];4;0) -> 4
B754: 4 | C754: of:=VLOOKUP([.$B754];[.$I$71:.$J$81];2;0) -> Архангельск | D754: 63 | E754: 28586 | F754: of:=IF(ISBLANK([.E754]*[.D754]);"0";[.E754]*[.D754]) -> 1800918 | G754: of:=COM.MICROSOFT.IFS([.F754]>5000000;[.$N$72];AND([.F754]>=1000000;[.F754]<=5000000);[.$N$73];AND([.F754]<1000000;[.F754]>0);[.$N$74];[.F754]=0;" ") -> Б | H754: of:=VLOOKUP([.$B754];[.$I$71:.$L$81];4;0) -> 2
B755: 1 | C755: of:=VLOOKUP([.$B755];[.$I$71:.$J$81];2;0) -> Москва | D755: 21 | E755: 70819 | F755: of:=IF(ISBLANK([.E755]*[.D755]);"0";[.E755]*[.D755]) -> 1487199 | G755: of:=COM.MICROSOFT.IFS([.F755]>5000000;[.$N$72];AND([.F755]>=1000000;[.F755]<=5000000);[.$N$73];AND([.F755]<1000000;[.F755]>0);[.$N$74];[.F755]=0;" ") -> Б | H755: of:=VLOOKUP([.$B755];[.$I$71:.$L$81];4;0) -> 8
B756: 8 | C756: of:=VLOOKUP([.$B756];[.$I$71:.$J$81];2;0) -> Новосибирск | D756: 66 | E756: 89182 | F756: of:=IF(ISBLANK([.E756]*[.D756]);"0";[.E756]*[.D756]) -> 5886012 | G756: of:=COM.MICROSOFT.IFS([.F756]>5000000;[.$N$72];AND([.F756]>=1000000;[.F756]<=5000000);[.$N$73];AND([.F756]<1000000;[.F756]>0);[.$N$74];[.F756]=0;" ") -> А | H756: of:=VLOOKUP([.$B756];[.$I$71:.$L$81];4;0) -> 5
B757: 3 | C757: of:=VLOOKUP([.$B757];[.$I$71:.$J$81];2;0) -> Челябинск | D757: 20 | E757: 38222 | F757: of:=IF(ISBLANK([.E757]*[.D757]);"0";[.E757]*[.D757]) -> 764440 | G757: of:=COM.MICROSOFT.IFS([.F757]>5000000;[.$N$72];AND([.F757]>=1000000;[.F757]<=5000000);[.$N$73];AND([.F757]<1000000;[.F757]>0);[.$N$74];[.F757]=0;" ") -> В | H757: of:=VLOOKUP([.$B757];[.$I$71:.$L$81];4;0) -> 1
B758: 3 | C758: of:=VLOOKUP([.$B758];[.$I$71:.$J$81];2;0) -> Челябинск | D758: 60 | E758: 48780 | F758: of:=IF(ISBLANK([.E758]*[.D758]);"0";[.E758]*[.D758]) -> 2926800 | G758: of:=COM.MICROSOFT.IFS([.F758]>5000000;[.$N$72];AND([.F758]>=1000000;[.F758]<=5000000);[.$N$73];AND([.F758]<1000000;[.F758]>0);[.$N$74];[.F758]=0;" ") -> Б | H758: of:=VLOOKUP([.$B758];[.$I$71:.$L$81];4;0) -> 1
B759: 6 | C759: of:=VLOOKUP([.$B759];[.$I$71:.$J$81];2;0) -> Владивосток | D759: 26 | E759: 41875 | F759: of:=IF(ISBLANK([.E759]*[.D759]);"0";[.E759]*[.D759]) -> 1088750 | G759: of:=COM.MICROSOFT.IFS([.F759]>5000000;[.$N$72];AND([.F759]>=1000000;[.F759]<=5000000);[.$N$73];AND([.F759]<1000000;[.F759]>0);[.$N$74];[.F759]=0;" ") -> Б | H759: of:=VLOOKUP([.$B759];[.$I$71:.$L$81];4;0) -> 7
B760: 9 | C760: of:=VLOOKUP([.$B760];[.$I$71:.$J$81];2;0) -> Тюмень | D760: 93 | E760: 6849 | F760: of:=IF(ISBLANK([.E760]*[.D760]);"0";[.E760]*[.D760]) -> 636957 | G760: of:=COM.MICROSOFT.IFS([.F760]>5000000;[.$N$72];AND([.F760]>=1000000;[.F760]<=5000000);[.$N$73];AND([.F760]<1000000;[.F760]>0);[.$N$74];[.F760]=0;" ") -> В | H760: of:=VLOOKUP([.$B760];[.$I$71:.$L$81];4;0) -> 3
B761: 10 | C761: of:=VLOOKUP([.$B761];[.$I$71:.$J$81];2;0) -> Сочи | D761: 39 | E761: 25464 | F761: of:=IF(ISBLANK([.E761]*[.D761]);"0";[.E761]*[.D761]) -> 993096 | G761: of:=COM.MICROSOFT.IFS([.F761]>5000000;[.$N$72];AND([.F761]>=1000000;[.F761]<=5000000);[.$N$73];AND([.F761]<1000000;[.F761]>0);[.$N$74];[.F761]=0;" ") -> В | H761: of:=VLOOKUP([.$B761];[.$I$71:.$L$81];4;0) -> 6
B762: 7 | C762: of:=VLOOKUP([.$B762];[.$I$71:.$J$81];2;0) -> Мурманск | D762: 27 | E762: 99067 | F762: of:=IF(ISBLANK([.E762]*[.D762]);"0";[.E762]*[.D762]) -> 2674809 | G762: of:=COM.MICROSOFT.IFS([.F762]>5000000;[.$N$72];AND([.F762]>=1000000;[.F762]<=5000000);[.$N$73];AND([.F762]<1000000;[.F762]>0);[.$N$74];[.F762]=0;" ") -> Б | H762: of:=VLOOKUP([.$B762];[.$I$71:.$L$81];4;0) -> 10
B763: 3 | C763: of:=VLOOKUP([.$B763];[.$I$71:.$J$81];2;0) -> Челябинск | D763: 74 | E763: 77729 | F763: of:=IF(ISBLANK([.E763]*[.D763]);"0";[.E763]*[.D763]) -> 5751946 | G763: of:=COM.MICROSOFT.IFS([.F763]>5000000;[.$N$72];AND([.F763]>=1000000;[.F763]<=5000000);[.$N$73];AND([.F763]<1000000;[.F763]>0);[.$N$74];[.F763]=0;" ") -> А | H763: of:=VLOOKUP([.$B763];[.$I$71:.$L$81];4;0) -> 1
B764: 8 | C764: of:=VLOOKUP([.$B764];[.$I$71:.$J$81];2;0) -> Новосибирск | D764: 21 | E764: 56899 | F764: of:=IF(ISBLANK([.E764]*[.D764]);"0";[.E764]*[.D764]) -> 1194879 | G764: of:=COM.MICROSOFT.IFS([.F764]>5000000;[.$N$72];AND([.F764]>=1000000;[.F764]<=5000000);[.$N$73];AND([.F764]<1000000;[.F764]>0);[.$N$74];[.F764]=0;" ") -> Б | H764: of:=VLOOKUP([.$B764];[.$I$71:.$L$81];4;0) -> 5
B765: 1 | C765: of:=VLOOKUP([.$B765];[.$I$71:.$J$81];2;0) -> Москва | D765: 65 | E765: 21228 | F765: of:=IF(ISBLANK([.E765]*[.D765]);"0";[.E765]*[.D765]) -> 1379820 | G765: of:=COM.MICROSOFT.IFS([.F765]>5000000;[.$N$72];AND([.F765]>=1000000;[.F765]<=5000000);[.$N$73];AND([.F765]<1000000;[.F765]>0);[.$N$74];[.F765]=0;" ") -> Б | H765: of:=VLOOKUP([.$B765];[.$I$71:.$L$81];4;0) -> 8
B766: 6 | C766: of:=VLOOKUP([.$B766];[.$I$71:.$J$81];2;0) -> Владивосток | D766: 47 | E766: 94784 | F766: of:=IF(ISBLANK([.E766]*[.D766]);"0";[.E766]*[.D766]) -> 4454848 | G766: of:=COM.MICROSOFT.IFS([.F766]>5000000;[.$N$72];AND([.F766]>=1000000;[.F766]<=5000000);[.$N$73];AND([.F766]<1000000;[.F766]>0);[.$N$74];[.F766]=0;" ") -> Б | H766: of:=VLOOKUP([.$B766];[.$I$71:.$L$81];4;0) -> 7
B767: 2 | C767: of:=VLOOKUP([.$B767];[.$I$71:.$J$81];2;0) -> Санкт-Петербург | D767: 56 | E767: 67303 | F767: of:=IF(ISBLANK([.E767]*[.D767]);"0";[.E767]*[.D767]) -> 3768968 | G767: of:=COM.MICROSOFT.IFS([.F767]>5000000;[.$N$72];AND([.F767]>=1000000;[.F767]<=5000000);[.$N$73];AND([.F767]<1000000;[.F767]>0);[.$N$74];[.F767]=0;" ") -> Б | H767: of:=VLOOKUP([.$B767];[.$I$71:.$L$81];4;0) -> 9
B768: 10 | C768: of:=VLOOKUP([.$B768];[.$I$71:.$J$81];2;0) -> Сочи | D768: 84 | E768: 83756 | F768: of:=IF(ISBLANK([.E768]*[.D768]);"0";[.E768]*[.D768]) -> 7035504 | G768: of:=COM.MICROSOFT.IFS([.F768]>5000000;[.$N$72];AND([.F768]>=1000000;[.F768]<=5000000);[.$N$73];AND([.F768]<1000000;[.F768]>0);[.$N$74];[.F768]=0;" ") -> А | H768: of:=VLOOKUP([.$B768];[.$I$71:.$L$81];4;0) -> 6
B769: 10 | C769: of:=VLOOKUP([.$B769];[.$I$71:.$J$81];2;0) -> Сочи | D769: 78 | E769: 77679 | F769: of:=IF(ISBLANK([.E769]*[.D769]);"0";[.E769]*[.D769]) -> 6058962 | G769: of:=COM.MICROSOFT.IFS([.F769]>5000000;[.$N$72];AND([.F769]>=1000000;[.F769]<=5000000);[.$N$73];AND([.F769]<1000000;[.F769]>0);[.$N$74];[.F769]=0;" ") -> А | H769: of:=VLOOKUP([.$B769];[.$I$71:.$L$81];4;0) -> 6
B770: 6 | C770: of:=VLOOKUP([.$B770];[.$I$71:.$J$81];2;0) -> Владивосток | D770: 31 | E770: 34124 | F770: of:=IF(ISBLANK([.E770]*[.D770]);"0";[.E770]*[.D770]) -> 1057844 | G770: of:=COM.MICROSOFT.IFS([.F770]>5000000;[.$N$72];AND([.F770]>=1000000;[.F770]<=5000000);[.$N$73];AND([.F770]<1000000;[.F770]>0);[.$N$74];[.F770]=0;" ") -> Б | H770: of:=VLOOKUP([.$B770];[.$I$71:.$L$81];4;0) -> 7
B771: 3 | C771: of:=VLOOKUP([.$B771];[.$I$71:.$J$81];2;0) -> Челябинск | D771: 61 | E771: 46953 | F771: of:=IF(ISBLANK([.E771]*[.D771]);"0";[.E771]*[.D771]) -> 2864133 | G771: of:=COM.MICROSOFT.IFS([.F771]>5000000;[.$N$72];AND([.F771]>=1000000;[.F771]<=5000000);[.$N$73];AND([.F771]<1000000;[.F771]>0);[.$N$74];[.F771]=0;" ") -> Б | H771: of:=VLOOKUP([.$B771];[.$I$71:.$L$81];4;0) -> 1
B772: 7 | C772: of:=VLOOKUP([.$B772];[.$I$71:.$J$81];2;0) -> Мурманск | D772: 18 | E772: 83533 | F772: of:=IF(ISBLANK([.E772]*[.D772]);"0";[.E772]*[.D772]) -> 1503594 | G772: of:=COM.MICROSOFT.IFS([.F772]>5000000;[.$N$72];AND([.F772]>=1000000;[.F772]<=5000000);[.$N$73];AND([.F772]<1000000;[.F772]>0);[.$N$74];[.F772]=0;" ") -> Б | H772: of:=VLOOKUP([.$B772];[.$I$71:.$L$81];4;0) -> 10
B773: 6 | C773: of:=VLOOKUP([.$B773];[.$I$71:.$J$81];2;0) -> Владивосток | D773: 49 | E773: 88909 | F773: of:=IF(ISBLANK([.E773]*[.D773]);"0";[.E773]*[.D773]) -> 4356541 | G773: of:=COM.MICROSOFT.IFS([.F773]>5000000;[.$N$72];AND([.F773]>=1000000;[.F773]<=5000000);[.$N$73];AND([.F773]<1000000;[.F773]>0);[.$N$74];[.F773]=0;" ") -> Б | H773: of:=VLOOKUP([.$B773];[.$I$71:.$L$81];4;0) -> 7
B774: 5 | C774: of:=VLOOKUP([.$B774];[.$I$71:.$J$81];2;0) -> Краснодар | D774: 23 | E774: 92497 | F774: of:=IF(ISBLANK([.E774]*[.D774]);"0";[.E774]*[.D774]) -> 2127431 | G774: of:=COM.MICROSOFT.IFS([.F774]>5000000;[.$N$72];AND([.F774]>=1000000;[.F774]<=5000000);[.$N$73];AND([.F774]<1000000;[.F774]>0);[.$N$74];[.F774]=0;" ") -> Б | H774: of:=VLOOKUP([.$B774];[.$I$71:.$L$81];4;0) -> 4
B775: 3 | C775: of:=VLOOKUP([.$B775];[.$I$71:.$J$81];2;0) -> Челябинск | D775: 94 | E775: 16396 | F775: of:=IF(ISBLANK([.E775]*[.D775]);"0";[.E775]*[.D775]) -> 1541224 | G775: of:=COM.MICROSOFT.IFS([.F775]>5000000;[.$N$72];AND([.F775]>=1000000;[.F775]<=5000000);[.$N$73];AND([.F775]<1000000;[.F775]>0);[.$N$74];[.F775]=0;" ") -> Б | H775: of:=VLOOKUP([.$B775];[.$I$71:.$L$81];4;0) -> 1
B776: 1 | C776: of:=VLOOKUP([.$B776];[.$I$71:.$J$81];2;0) -> Москва | D776: 21 | E776: 63271 | F776: of:=IF(ISBLANK([.E776]*[.D776]);"0";[.E776]*[.D776]) -> 1328691 | G776: of:=COM.MICROSOFT.IFS([.F776]>5000000;[.$N$72];AND([.F776]>=1000000;[.F776]<=5000000);[.$N$73];AND([.F776]<1000000;[.F776]>0);[.$N$74];[.F776]=0;" ") -> Б | H776: of:=VLOOKUP([.$B776];[.$I$71:.$L$81];4;0) -> 8
B777: 7 | C777: of:=VLOOKUP([.$B777];[.$I$71:.$J$81];2;0) -> Мурманск | D777: 66 | E777: 15238 | F777: of:=IF(ISBLANK([.E777]*[.D777]);"0";[.E777]*[.D777]) -> 1005708 | G777: of:=COM.MICROSOFT.IFS([.F777]>5000000;[.$N$72];AND([.F777]>=1000000;[.F777]<=5000000);[.$N$73];AND([.F777]<1000000;[.F777]>0);[.$N$74];[.F777]=0;" ") -> Б | H777: of:=VLOOKUP([.$B777];[.$I$71:.$L$81];4;0) -> 10
B778: 6 | C778: of:=VLOOKUP([.$B778];[.$I$71:.$J$81];2;0) -> Владивосток | D778: 15 | E778: 48630 | F778: of:=IF(ISBLANK([.E778]*[.D778]);"0";[.E778]*[.D778]) -> 729450 | G778: of:=COM.MICROSOFT.IFS([.F778]>5000000;[.$N$72];AND([.F778]>=1000000;[.F778]<=5000000);[.$N$73];AND([.F778]<1000000;[.F778]>0);[.$N$74];[.F778]=0;" ") -> В | H778: of:=VLOOKUP([.$B778];[.$I$71:.$L$81];4;0) -> 7
B779: 1 | C779: of:=VLOOKUP([.$B779];[.$I$71:.$J$81];2;0) -> Москва | D779: 7 | E779: 76380 | F779: of:=IF(ISBLANK([.E779]*[.D779]);"0";[.E779]*[.D779]) -> 534660 | G779: of:=COM.MICROSOFT.IFS([.F779]>5000000;[.$N$72];AND([.F779]>=1000000;[.F779]<=5000000);[.$N$73];AND([.F779]<1000000;[.F779]>0);[.$N$74];[.F779]=0;" ") -> В | H779: of:=VLOOKUP([.$B779];[.$I$71:.$L$81];4;0) -> 8
B780: 3 | C780: of:=VLOOKUP([.$B780];[.$I$71:.$J$81];2;0) -> Челябинск | D780: 34 | E780: 23917 | F780: of:=IF(ISBLANK([.E780]*[.D780]);"0";[.E780]*[.D780]) -> 813178 | G780: of:=COM.MICROSOFT.IFS([.F780]>5000000;[.$N$72];AND([.F780]>=1000000;[.F780]<=5000000);[.$N$73];AND([.F780]<1000000;[.F780]>0);[.$N$74];[.F780]=0;" ") -> В | H780: of:=VLOOKUP([.$B780];[.$I$71:.$L$81];4;0) -> 1
B781: 5 | C781: of:=VLOOKUP([.$B781];[.$I$71:.$J$81];2;0) -> Краснодар | D781: 87 | E781: 33258 | F781: of:=IF(ISBLANK([.E781]*[.D781]);"0";[.E781]*[.D781]) -> 2893446 | G781: of:=COM.MICROSOFT.IFS([.F781]>5000000;[.$N$72];AND([.F781]>=1000000;[.F781]<=5000000);[.$N$73];AND([.F781]<1000000;[.F781]>0);[.$N$74];[.F781]=0;" ") -> Б | H781: of:=VLOOKUP([.$B781];[.$I$71:.$L$81];4;0) -> 4
B782: 9 | C782: of:=VLOOKUP([.$B782];[.$I$71:.$J$81];2;0) -> Тюмень | D782: 95 | E782: 22438 | F782: of:=IF(ISBLANK([.E782]*[.D782]);"0";[.E782]*[.D782]) -> 2131610 | G782: of:=COM.MICROSOFT.IFS([.F782]>5000000;[.$N$72];AND([.F782]>=1000000;[.F782]<=5000000);[.$N$73];AND([.F782]<1000000;[.F782]>0);[.$N$74];[.F782]=0;" ") -> Б | H782: of:=VLOOKUP([.$B782];[.$I$71:.$L$81];4;0) -> 3
B783: 6 | C783: of:=VLOOKUP([.$B783];[.$I$71:.$J$81];2;0) -> Владивосток | D783: 73 | E783: 96101 | F783: of:=IF(ISBLANK([.E783]*[.D783]);"0";[.E783]*[.D783]) -> 7015373 | G783: of:=COM.MICROSOFT.IFS([.F783]>5000000;[.$N$72];AND([.F783]>=1000000;[.F783]<=5000000);[.$N$73];AND([.F783]<1000000;[.F783]>0);[.$N$74];[.F783]=0;" ") -> А | H783: of:=VLOOKUP([.$B783];[.$I$71:.$L$81];4;0) -> 7
B784: 1 | C784: of:=VLOOKUP([.$B784];[.$I$71:.$J$81];2;0) -> Москва | D784: 52 | E784: 67066 | F784: of:=IF(ISBLANK([.E784]*[.D784]);"0";[.E784]*[.D784]) -> 3487432 | G784: of:=COM.MICROSOFT.IFS([.F784]>5000000;[.$N$72];AND([.F784]>=1000000;[.F784]<=5000000);[.$N$73];AND([.F784]<1000000;[.F784]>0);[.$N$74];[.F784]=0;" ") -> Б | H784: of:=VLOOKUP([.$B784];[.$I$71:.$L$81];4;0) -> 8
B785: 3 | C785: of:=VLOOKUP([.$B785];[.$I$71:.$J$81];2;0) -> Челябинск | D785: 11 | E785: 17629 | F785: of:=IF(ISBLANK([.E785]*[.D785]);"0";[.E785]*[.D785]) -> 193919 | G785: of:=COM.MICROSOFT.IFS([.F785]>5000000;[.$N$72];AND([.F785]>=1000000;[.F785]<=5000000);[.$N$73];AND([.F785]<1000000;[.F785]>0);[.$N$74];[.F785]=0;" ") -> В | H785: of:=VLOOKUP([.$B785];[.$I$71:.$L$81];4;0) -> 1
B786: 1 | C786: of:=VLOOKUP([.$B786];[.$I$71:.$J$81];2;0) -> Москва | D786: 11 | E786: 49627 | F786: of:=IF(ISBLANK([.E786]*[.D786]);"0";[.E786]*[.D786]) -> 545897 | G786: of:=COM.MICROSOFT.IFS([.F786]>5000000;[.$N$72];AND([.F786]>=1000000;[.F786]<=5000000);[.$N$73];AND([.F786]<1000000;[.F786]>0);[.$N$74];[.F786]=0;" ") -> В | H786: of:=VLOOKUP([.$B786];[.$I$71:.$L$81];4;0) -> 8
B787: 1 | C787: of:=VLOOKUP([.$B787];[.$I$71:.$J$81];2;0) -> Москва | D787: 68 | E787: 98383 | F787: of:=IF(ISBLANK([.E787]*[.D787]);"0";[.E787]*[.D787]) -> 6690044 | G787: of:=COM.MICROSOFT.IFS([.F787]>5000000;[.$N$72];AND([.F787]>=1000000;[.F787]<=5000000);[.$N$73];AND([.F787]<1000000;[.F787]>0);[.$N$74];[.F787]=0;" ") -> А | H787: of:=VLOOKUP([.$B787];[.$I$71:.$L$81];4;0) -> 8
B788: 10 | C788: of:=VLOOKUP([.$B788];[.$I$71:.$J$81];2;0) -> Сочи | D788: 51 | E788: 31435 | F788: of:=IF(ISBLANK([.E788]*[.D788]);"0";[.E788]*[.D788]) -> 1603185 | G788: of:=COM.MICROSOFT.IFS([.F788]>5000000;[.$N$72];AND([.F788]>=1000000;[.F788]<=5000000);[.$N$73];AND([.F788]<1000000;[.F788]>0);[.$N$74];[.F788]=0;" ") -> Б | H788: of:=VLOOKUP([.$B788];[.$I$71:.$L$81];4;0) -> 6
B789: 3 | C789: of:=VLOOKUP([.$B789];[.$I$71:.$J$81];2;0) -> Челябинск | D789: 90 | E789: 37629 | F789: of:=IF(ISBLANK([.E789]*[.D789]);"0";[.E789]*[.D789]) -> 3386610 | G789: of:=COM.MICROSOFT.IFS([.F789]>5000000;[.$N$72];AND([.F789]>=1000000;[.F789]<=5000000);[.$N$73];AND([.F789]<1000000;[.F789]>0);[.$N$74];[.F789]=0;" ") -> Б | H789: of:=VLOOKUP([.$B789];[.$I$71:.$L$81];4;0) -> 1
B790: 4 | C790: of:=VLOOKUP([.$B790];[.$I$71:.$J$81];2;0) -> Архангельск | D790: 80 | E790: 77051 | F790: of:=IF(ISBLANK([.E790]*[.D790]);"0";[.E790]*[.D790]) -> 6164080 | G790: of:=COM.MICROSOFT.IFS([.F790]>5000000;[.$N$72];AND([.F790]>=1000000;[.F790]<=5000000);[.$N$73];AND([.F790]<1000000;[.F790]>0);[.$N$74];[.F790]=0;" ") -> А | H790: of:=VLOOKUP([.$B790];[.$I$71:.$L$81];4;0) -> 2
B791: 10 | C791: of:=VLOOKUP([.$B791];[.$I$71:.$J$81];2;0) -> Сочи | D791: 87 | E791: 75592 | F791: of:=IF(ISBLANK([.E791]*[.D791]);"0";[.E791]*[.D791]) -> 6576504 | G791: of:=COM.MICROSOFT.IFS([.F791]>5000000;[.$N$72];AND([.F791]>=1000000;[.F791]<=5000000);[.$N$73];AND([.F791]<1000000;[.F791]>0);[.$N$74];[.F791]=0;" ") -> А | H791: of:=VLOOKUP([.$B791];[.$I$71:.$L$81];4;0) -> 6
B792: 10 | C792: of:=VLOOKUP([.$B792];[.$I$71:.$J$81];2;0) -> Сочи | D792: 52 | E792: 45109 | F792: of:=IF(ISBLANK([.E792]*[.D792]);"0";[.E792]*[.D792]) -> 2345668 | G792: of:=COM.MICROSOFT.IFS([.F792]>5000000;[.$N$72];AND([.F792]>=1000000;[.F792]<=5000000);[.$N$73];AND([.F792]<1000000;[.F792]>0);[.$N$74];[.F792]=0;" ") -> Б | H792: of:=VLOOKUP([.$B792];[.$I$71:.$L$81];4;0) -> 6
B793: 8 | C793: of:=VLOOKUP([.$B793];[.$I$71:.$J$81];2;0) -> Новосибирск | D793: 41 | E793: 86447 | F793: of:=IF(ISBLANK([.E793]*[.D793]);"0";[.E793]*[.D793]) -> 3544327 | G793: of:=COM.MICROSOFT.IFS([.F793]>5000000;[.$N$72];AND([.F793]>=1000000;[.F793]<=5000000);[.$N$73];AND([.F793]<1000000;[.F793]>0);[.$N$74];[.F793]=0;" ") -> Б | H793: of:=VLOOKUP([.$B793];[.$I$71:.$L$81];4;0) -> 5
B794: 9 | C794: of:=VLOOKUP([.$B794];[.$I$71:.$J$81];2;0) -> Тюмень | D794: 91 | E794: 81828 | F794: of:=IF(ISBLANK([.E794]*[.D794]);"0";[.E794]*[.D794]) -> 7446348 | G794: of:=COM.MICROSOFT.IFS([.F794]>5000000;[.$N$72];AND([.F794]>=1000000;[.F794]<=5000000);[.$N$73];AND([.F794]<1000000;[.F794]>0);[.$N$74];[.F794]=0;" ") -> А | H794: of:=VLOOKUP([.$B794];[.$I$71:.$L$81];4;0) -> 3
B795: 1 | C795: of:=VLOOKUP([.$B795];[.$I$71:.$J$81];2;0) -> Москва | D795: 84 | E795: 28316 | F795: of:=IF(ISBLANK([.E795]*[.D795]);"0";[.E795]*[.D795]) -> 2378544 | G795: of:=COM.MICROSOFT.IFS([.F795]>5000000;[.$N$72];AND([.F795]>=1000000;[.F795]<=5000000);[.$N$73];AND([.F795]<1000000;[.F795]>0);[.$N$74];[.F795]=0;" ") -> Б | H795: of:=VLOOKUP([.$B795];[.$I$71:.$L$81];4;0) -> 8
B796: 1 | C796: of:=VLOOKUP([.$B796];[.$I$71:.$J$81];2;0) -> Москва | D796: 99 | E796: 13516 | F796: of:=IF(ISBLANK([.E796]*[.D796]);"0";[.E796]*[.D796]) -> 1338084 | G796: of:=COM.MICROSOFT.IFS([.F796]>5000000;[.$N$72];AND([.F796]>=1000000;[.F796]<=5000000);[.$N$73];AND([.F796]<1000000;[.F796]>0);[.$N$74];[.F796]=0;" ") -> Б | H796: of:=VLOOKUP([.$B796];[.$I$71:.$L$81];4;0) -> 8
B797: 2 | C797: of:=VLOOKUP([.$B797];[.$I$71:.$J$81];2;0) -> Санкт-Петербург | D797: 12 | E797: 33233 | F797: of:=IF(ISBLANK([.E797]*[.D797]);"0";[.E797]*[.D797]) -> 398796 | G797: of:=COM.MICROSOFT.IFS([.F797]>5000000;[.$N$72];AND([.F797]>=1000000;[.F797]<=5000000);[.$N$73];AND([.F797]<1000000;[.F797]>0);[.$N$74];[.F797]=0;" ") -> В | H797: of:=VLOOKUP([.$B797];[.$I$71:.$L$81];4;0) -> 9
B798: 5 | C798: of:=VLOOKUP([.$B798];[.$I$71:.$J$81];2;0) -> Краснодар | D798: 63 | E798: 17195 | F798: of:=IF(ISBLANK([.E798]*[.D798]);"0";[.E798]*[.D798]) -> 1083285 | G798: of:=COM.MICROSOFT.IFS([.F798]>5000000;[.$N$72];AND([.F798]>=1000000;[.F798]<=5000000);[.$N$73];AND([.F798]<1000000;[.F798]>0);[.$N$74];[.F798]=0;" ") -> Б | H798: of:=VLOOKUP([.$B798];[.$I$71:.$L$81];4;0) -> 4
B799: 10 | C799: of:=VLOOKUP([.$B799];[.$I$71:.$J$81];2;0) -> Сочи | D799: 34 | E799: 28781 | F799: of:=IF(ISBLANK([.E799]*[.D799]);"0";[.E799]*[.D799]) -> 978554 | G799: of:=COM.MICROSOFT.IFS([.F799]>5000000;[.$N$72];AND([.F799]>=1000000;[.F799]<=5000000);[.$N$73];AND([.F799]<1000000;[.F799]>0);[.$N$74];[.F799]=0;" ") -> В | H799: of:=VLOOKUP([.$B799];[.$I$71:.$L$81];4;0) -> 6
B800: 8 | C800: of:=VLOOKUP([.$B800];[.$I$71:.$J$81];2;0) -> Новосибирск | D800: 71 | E800: 23167 | F800: of:=IF(ISBLANK([.E800]*[.D800]);"0";[.E800]*[.D800]) -> 1644857 | G800: of:=COM.MICROSOFT.IFS([.F800]>5000000;[.$N$72];AND([.F800]>=1000000;[.F800]<=5000000);[.$N$73];AND([.F800]<1000000;[.F800]>0);[.$N$74];[.F800]=0;" ") -> Б | H800: of:=VLOOKUP([.$B800];[.$I$71:.$L$81];4;0) -> 5
B801: 3 | C801: of:=VLOOKUP([.$B801];[.$I$71:.$J$81];2;0) -> Челябинск | D801: 50 | E801: 94896 | F801: of:=IF(ISBLANK([.E801]*[.D801]);"0";[.E801]*[.D801]) -> 4744800 | G801: of:=COM.MICROSOFT.IFS([.F801]>5000000;[.$N$72];AND([.F801]>=1000000;[.F801]<=5000000);[.$N$73];AND([.F801]<1000000;[.F801]>0);[.$N$74];[.F801]=0;" ") -> Б | H801: of:=VLOOKUP([.$B801];[.$I$71:.$L$81];4;0) -> 1
B802: 6 | C802: of:=VLOOKUP([.$B802];[.$I$71:.$J$81];2;0) -> Владивосток | D802: 10 | E802: 80121 | F802: of:=IF(ISBLANK([.E802]*[.D802]);"0";[.E802]*[.D802]) -> 801210 | G802: of:=COM.MICROSOFT.IFS([.F802]>5000000;[.$N$72];AND([.F802]>=1000000;[.F802]<=5000000);[.$N$73];AND([.F802]<1000000;[.F802]>0);[.$N$74];[.F802]=0;" ") -> В | H802: of:=VLOOKUP([.$B802];[.$I$71:.$L$81];4;0) -> 7
B803: 9 | C803: of:=VLOOKUP([.$B803];[.$I$71:.$J$81];2;0) -> Тюмень | D803: 26 | E803: 12024 | F803: of:=IF(ISBLANK([.E803]*[.D803]);"0";[.E803]*[.D803]) -> 312624 | G803: of:=COM.MICROSOFT.IFS([.F803]>5000000;[.$N$72];AND([.F803]>=1000000;[.F803]<=5000000);[.$N$73];AND([.F803]<1000000;[.F803]>0);[.$N$74];[.F803]=0;" ") -> В | H803: of:=VLOOKUP([.$B803];[.$I$71:.$L$81];4;0) -> 3
B804: 8 | C804: of:=VLOOKUP([.$B804];[.$I$71:.$J$81];2;0) -> Новосибирск | D804: 11 | E804: 77136 | F804: of:=IF(ISBLANK([.E804]*[.D804]);"0";[.E804]*[.D804]) -> 848496 | G804: of:=COM.MICROSOFT.IFS([.F804]>5000000;[.$N$72];AND([.F804]>=1000000;[.F804]<=5000000);[.$N$73];AND([.F804]<1000000;[.F804]>0);[.$N$74];[.F804]=0;" ") -> В | H804: of:=VLOOKUP([.$B804];[.$I$71:.$L$81];4;0) -> 5
B805: 1 | C805: of:=VLOOKUP([.$B805];[.$I$71:.$J$81];2;0) -> Москва | D805: 5 | E805: 45643 | F805: of:=IF(ISBLANK([.E805]*[.D805]);"0";[.E805]*[.D805]) -> 228215 | G805: of:=COM.MICROSOFT.IFS([.F805]>5000000;[.$N$72];AND([.F805]>=1000000;[.F805]<=5000000);[.$N$73];AND([.F805]<1000000;[.F805]>0);[.$N$74];[.F805]=0;" ") -> В | H805: of:=VLOOKUP([.$B805];[.$I$71:.$L$81];4;0) -> 8
B806: 8 | C806: of:=VLOOKUP([.$B806];[.$I$71:.$J$81];2;0) -> Новосибирск | D806: 41 | E806: 13658 | F806: of:=IF(ISBLANK([.E806]*[.D806]);"0";[.E806]*[.D806]) -> 559978 | G806: of:=COM.MICROSOFT.IFS([.F806]>5000000;[.$N$72];AND([.F806]>=1000000;[.F806]<=5000000);[.$N$73];AND([.F806]<1000000;[.F806]>0);[.$N$74];[.F806]=0;" ") -> В | H806: of:=VLOOKUP([.$B806];[.$I$71:.$L$81];4;0) -> 5
B807: 2 | C807: of:=VLOOKUP([.$B807];[.$I$71:.$J$81];2;0) -> Санкт-Петербург | D807: 73 | E807: 86816 | F807: of:=IF(ISBLANK([.E807]*[.D807]);"0";[.E807]*[.D807]) -> 6337568 | G807: of:=COM.MICROSOFT.IFS([.F807]>5000000;[.$N$72];AND([.F807]>=1000000;[.F807]<=5000000);[.$N$73];AND([.F807]<1000000;[.F807]>0);[.$N$74];[.F807]=0;" ") -> А | H807: of:=VLOOKUP([.$B807];[.$I$71:.$L$81];4;0) -> 9
B808: 4 | C808: of:=VLOOKUP([.$B808];[.$I$71:.$J$81];2;0) -> Архангельск | D808: 87 | E808: 53300 | F808: of:=IF(ISBLANK([.E808]*[.D808]);"0";[.E808]*[.D808]) -> 4637100 | G808: of:=COM.MICROSOFT.IFS([.F808]>5000000;[.$N$72];AND([.F808]>=1000000;[.F808]<=5000000);[.$N$73];AND([.F808]<1000000;[.F808]>0);[.$N$74];[.F808]=0;" ") -> Б | H808: of:=VLOOKUP([.$B808];[.$I$71:.$L$81];4;0) -> 2
B809: 9 | C809: of:=VLOOKUP([.$B809];[.$I$71:.$J$81];2;0) -> Тюмень | D809: 58 | E809: 35289 | F809: of:=IF(ISBLANK([.E809]*[.D809]);"0";[.E809]*[.D809]) -> 2046762 | G809: of:=COM.MICROSOFT.IFS([.F809]>5000000;[.$N$72];AND([.F809]>=1000000;[.F809]<=5000000);[.$N$73];AND([.F809]<1000000;[.F809]>0);[.$N$74];[.F809]=0;" ") -> Б | H809: of:=VLOOKUP([.$B809];[.$I$71:.$L$81];4;0) -> 3
B810: 4 | C810: of:=VLOOKUP([.$B810];[.$I$71:.$J$81];2;0) -> Архангельск | D810: 71 | E810: 18062 | F810: of:=IF(ISBLANK([.E810]*[.D810]);"0";[.E810]*[.D810]) -> 1282402 | G810: of:=COM.MICROSOFT.IFS([.F810]>5000000;[.$N$72];AND([.F810]>=1000000;[.F810]<=5000000);[.$N$73];AND([.F810]<1000000;[.F810]>0);[.$N$74];[.F810]=0;" ") -> Б | H810: of:=VLOOKUP([.$B810];[.$I$71:.$L$81];4;0) -> 2
B811: 5 | C811: of:=VLOOKUP([.$B811];[.$I$71:.$J$81];2;0) -> Краснодар | D811: 51 | E811: 79332 | F811: of:=IF(ISBLANK([.E811]*[.D811]);"0";[.E811]*[.D811]) -> 4045932 | G811: of:=COM.MICROSOFT.IFS([.F811]>5000000;[.$N$72];AND([.F811]>=1000000;[.F811]<=5000000);[.$N$73];AND([.F811]<1000000;[.F811]>0);[.$N$74];[.F811]=0;" ") -> Б | H811: of:=VLOOKUP([.$B811];[.$I$71:.$L$81];4;0) -> 4
B812: 8 | C812: of:=VLOOKUP([.$B812];[.$I$71:.$J$81];2;0) -> Новосибирск | D812: 73 | E812: 83318 | F812: of:=IF(ISBLANK([.E812]*[.D812]);"0";[.E812]*[.D812]) -> 6082214 | G812: of:=COM.MICROSOFT.IFS([.F812]>5000000;[.$N$72];AND([.F812]>=1000000;[.F812]<=5000000);[.$N$73];AND([.F812]<1000000;[.F812]>0);[.$N$74];[.F812]=0;" ") -> А | H812: of:=VLOOKUP([.$B812];[.$I$71:.$L$81];4;0) -> 5
B813: 3 | C813: of:=VLOOKUP([.$B813];[.$I$71:.$J$81];2;0) -> Челябинск | D813: 67 | E813: 46290 | F813: of:=IF(ISBLANK([.E813]*[.D813]);"0";[.E813]*[.D813]) -> 3101430 | G813: of:=COM.MICROSOFT.IFS([.F813]>5000000;[.$N$72];AND([.F813]>=1000000;[.F813]<=5000000);[.$N$73];AND([.F813]<1000000;[.F813]>0);[.$N$74];[.F813]=0;" ") -> Б | H813: of:=VLOOKUP([.$B813];[.$I$71:.$L$81];4;0) -> 1
B814: 5 | C814: of:=VLOOKUP([.$B814];[.$I$71:.$J$81];2;0) -> Краснодар | D814: 76 | E814: 3644 | F814: of:=IF(ISBLANK([.E814]*[.D814]);"0";[.E814]*[.D814]) -> 276944 | G814: of:=COM.MICROSOFT.IFS([.F814]>5000000;[.$N$72];AND([.F814]>=1000000;[.F814]<=5000000);[.$N$73];AND([.F814]<1000000;[.F814]>0);[.$N$74];[.F814]=0;" ") -> В | H814: of:=VLOOKUP([.$B814];[.$I$71:.$L$81];4;0) -> 4
B815: 5 | C815: of:=VLOOKUP([.$B815];[.$I$71:.$J$81];2;0) -> Краснодар | D815: 67 | E815: 91576 | F815: of:=IF(ISBLANK([.E815]*[.D815]);"0";[.E815]*[.D815]) -> 6135592 | G815: of:=COM.MICROSOFT.IFS([.F815]>5000000;[.$N$72];AND([.F815]>=1000000;[.F815]<=5000000);[.$N$73];AND([.F815]<1000000;[.F815]>0);[.$N$74];[.F815]=0;" ") -> А | H815: of:=VLOOKUP([.$B815];[.$I$71:.$L$81];4;0) -> 4
B816: 10 | C816: of:=VLOOKUP([.$B816];[.$I$71:.$J$81];2;0) -> Сочи | D816: 55 | E816: 65367 | F816: of:=IF(ISBLANK([.E816]*[.D816]);"0";[.E816]*[.D816]) -> 3595185 | G816: of:=COM.MICROSOFT.IFS([.F816]>5000000;[.$N$72];AND([.F816]>=1000000;[.F816]<=5000000);[.$N$73];AND([.F816]<1000000;[.F816]>0);[.$N$74];[.F816]=0;" ") -> Б | H816: of:=VLOOKUP([.$B816];[.$I$71:.$L$81];4;0) -> 6
B817: 4 | C817: of:=VLOOKUP([.$B817];[.$I$71:.$J$81];2;0) -> Архангельск | D817: 50 | E817: 68551 | F817: of:=IF(ISBLANK([.E817]*[.D817]);"0";[.E817]*[.D817]) -> 3427550 | G817: of:=COM.MICROSOFT.IFS([.F817]>5000000;[.$N$72];AND([.F817]>=1000000;[.F817]<=5000000);[.$N$73];AND([.F817]<1000000;[.F817]>0);[.$N$74];[.F817]=0;" ") -> Б | H817: of:=VLOOKUP([.$B817];[.$I$71:.$L$81];4;0) -> 2
B818: 1 | C818: of:=VLOOKUP([.$B818];[.$I$71:.$J$81];2;0) -> Москва | D818: 58 | E818: 56383 | F818: of:=IF(ISBLANK([.E818]*[.D818]);"0";[.E818]*[.D818]) -> 3270214 | G818: of:=COM.MICROSOFT.IFS([.F818]>5000000;[.$N$72];AND([.F818]>=1000000;[.F818]<=5000000);[.$N$73];AND([.F818]<1000000;[.F818]>0);[.$N$74];[.F818]=0;" ") -> Б | H818: of:=VLOOKUP([.$B818];[.$I$71:.$L$81];4;0) -> 8
B819: 6 | C819: of:=VLOOKUP([.$B819];[.$I$71:.$J$81];2;0) -> Владивосток | D819: 45 | E819: 94549 | F819: of:=IF(ISBLANK([.E819]*[.D819]);"0";[.E819]*[.D819]) -> 4254705 | G819: of:=COM.MICROSOFT.IFS([.F819]>5000000;[.$N$72];AND([.F819]>=1000000;[.F819]<=5000000);[.$N$73];AND([.F819]<1000000;[.F819]>0);[.$N$74];[.F819]=0;" ") -> Б | H819: of:=VLOOKUP([.$B819];[.$I$71:.$L$81];4;0) -> 7
B820: 6 | C820: of:=VLOOKUP([.$B820];[.$I$71:.$J$81];2;0) -> Владивосток | D820: 69 | E820: 92631 | F820: of:=IF(ISBLANK([.E820]*[.D820]);"0";[.E820]*[.D820]) -> 6391539 | G820: of:=COM.MICROSOFT.IFS([.F820]>5000000;[.$N$72];AND([.F820]>=1000000;[.F820]<=5000000);[.$N$73];AND([.F820]<1000000;[.F820]>0);[.$N$74];[.F820]=0;" ") -> А | H820: of:=VLOOKUP([.$B820];[.$I$71:.$L$81];4;0) -> 7
B821: 3 | C821: of:=VLOOKUP([.$B821];[.$I$71:.$J$81];2;0) -> Челябинск | D821: 86 | E821: 1964 | F821: of:=IF(ISBLANK([.E821]*[.D821]);"0";[.E821]*[.D821]) -> 168904 | G821: of:=COM.MICROSOFT.IFS([.F821]>5000000;[.$N$72];AND([.F821]>=1000000;[.F821]<=5000000);[.$N$73];AND([.F821]<1000000;[.F821]>0);[.$N$74];[.F821]=0;" ") -> В | H821: of:=VLOOKUP([.$B821];[.$I$71:.$L$81];4;0) -> 1
B822: 9 | C822: of:=VLOOKUP([.$B822];[.$I$71:.$J$81];2;0) -> Тюмень | D822: 43 | E822: 37283 | F822: of:=IF(ISBLANK([.E822]*[.D822]);"0";[.E822]*[.D822]) -> 1603169 | G822: of:=COM.MICROSOFT.IFS([.F822]>5000000;[.$N$72];AND([.F822]>=1000000;[.F822]<=5000000);[.$N$73];AND([.F822]<1000000;[.F822]>0);[.$N$74];[.F822]=0;" ") -> Б | H822: of:=VLOOKUP([.$B822];[.$I$71:.$L$81];4;0) -> 3
B823: 4 | C823: of:=VLOOKUP([.$B823];[.$I$71:.$J$81];2;0) -> Архангельск | D823: 41 | E823: 41174 | F823: of:=IF(ISBLANK([.E823]*[.D823]);"0";[.E823]*[.D823]) -> 1688134 | G823: of:=COM.MICROSOFT.IFS([.F823]>5000000;[.$N$72];AND([.F823]>=1000000;[.F823]<=5000000);[.$N$73];AND([.F823]<1000000;[.F823]>0);[.$N$74];[.F823]=0;" ") -> Б | H823: of:=VLOOKUP([.$B823];[.$I$71:.$L$81];4;0) -> 2
B824: 4 | C824: of:=VLOOKUP([.$B824];[.$I$71:.$J$81];2;0) -> Архангельск | D824: 54 | E824: 15525 | F824: of:=IF(ISBLANK([.E824]*[.D824]);"0";[.E824]*[.D824]) -> 838350 | G824: of:=COM.MICROSOFT.IFS([.F824]>5000000;[.$N$72];AND([.F824]>=1000000;[.F824]<=5000000);[.$N$73];AND([.F824]<1000000;[.F824]>0);[.$N$74];[.F824]=0;" ") -> В | H824: of:=VLOOKUP([.$B824];[.$I$71:.$L$81];4;0) -> 2
B825: 10 | C825: of:=VLOOKUP([.$B825];[.$I$71:.$J$81];2;0) -> Сочи | D825: 35 | E825: 78714 | F825: of:=IF(ISBLANK([.E825]*[.D825]);"0";[.E825]*[.D825]) -> 2754990 | G825: of:=COM.MICROSOFT.IFS([.F825]>5000000;[.$N$72];AND([.F825]>=1000000;[.F825]<=5000000);[.$N$73];AND([.F825]<1000000;[.F825]>0);[.$N$74];[.F825]=0;" ") -> Б | H825: of:=VLOOKUP([.$B825];[.$I$71:.$L$81];4;0) -> 6
B826: 2 | C826: of:=VLOOKUP([.$B826];[.$I$71:.$J$81];2;0) -> Санкт-Петербург | D826: 99 | E826: 97486 | F826: of:=IF(ISBLANK([.E826]*[.D826]);"0";[.E826]*[.D826]) -> 9651114 | G826: of:=COM.MICROSOFT.IFS([.F826]>5000000;[.$N$72];AND([.F826]>=1000000;[.F826]<=5000000);[.$N$73];AND([.F826]<1000000;[.F826]>0);[.$N$74];[.F826]=0;" ") -> А | H826: of:=VLOOKUP([.$B826];[.$I$71:.$L$81];4;0) -> 9
B827: 7 | C827: of:=VLOOKUP([.$B827];[.$I$71:.$J$81];2;0) -> Мурманск | D827: 81 | E827: 3968 | F827: of:=IF(ISBLANK([.E827]*[.D827]);"0";[.E827]*[.D827]) -> 321408 | G827: of:=COM.MICROSOFT.IFS([.F827]>5000000;[.$N$72];AND([.F827]>=1000000;[.F827]<=5000000);[.$N$73];AND([.F827]<1000000;[.F827]>0);[.$N$74];[.F827]=0;" ") -> В | H827: of:=VLOOKUP([.$B827];[.$I$71:.$L$81];4;0) -> 10
B828: 7 | C828: of:=VLOOKUP([.$B828];[.$I$71:.$J$81];2;0) -> Мурманск | D828: 38 | E828: 18691 | F828: of:=IF(ISBLANK([.E828]*[.D828]);"0";[.E828]*[.D828]) -> 710258 | G828: of:=COM.MICROSOFT.IFS([.F828]>5000000;[.$N$72];AND([.F828]>=1000000;[.F828]<=5000000);[.$N$73];AND([.F828]<1000000;[.F828]>0);[.$N$74];[.F828]=0;" ") -> В | H828: of:=VLOOKUP([.$B828];[.$I$71:.$L$81];4;0) -> 10
B829: 10 | C829: of:=VLOOKUP([.$B829];[.$I$71:.$J$81];2;0) -> Сочи | D829: 100 | E829: 23316 | F829: of:=IF(ISBLANK([.E829]*[.D829]);"0";[.E829]*[.D829]) -> 2331600 | G829: of:=COM.MICROSOFT.IFS([.F829]>5000000;[.$N$72];AND([.F829]>=1000000;[.F829]<=5000000);[.$N$73];AND([.F829]<1000000;[.F829]>0);[.$N$74];[.F829]=0;" ") -> Б | H829: of:=VLOOKUP([.$B829];[.$I$71:.$L$81];4;0) -> 6
B830: 10 | C830: of:=VLOOKUP([.$B830];[.$I$71:.$J$81];2;0) -> Сочи | D830: 83 | E830: 30124 | F830: of:=IF(ISBLANK([.E830]*[.D830]);"0";[.E830]*[.D830]) -> 2500292 | G830: of:=COM.MICROSOFT.IFS([.F830]>5000000;[.$N$72];AND([.F830]>=1000000;[.F830]<=5000000);[.$N$73];AND([.F830]<1000000;[.F830]>0);[.$N$74];[.F830]=0;" ") -> Б | H830: of:=VLOOKUP([.$B830];[.$I$71:.$L$81];4;0) -> 6
B831: 4 | C831: of:=VLOOKUP([.$B831];[.$I$71:.$J$81];2;0) -> Архангельск | D831: 25 | E831: 40462 | F831: of:=IF(ISBLANK([.E831]*[.D831]);"0";[.E831]*[.D831]) -> 1011550 | G831: of:=COM.MICROSOFT.IFS([.F831]>5000000;[.$N$72];AND([.F831]>=1000000;[.F831]<=5000000);[.$N$73];AND([.F831]<1000000;[.F831]>0);[.$N$74];[.F831]=0;" ") -> Б | H831: of:=VLOOKUP([.$B831];[.$I$71:.$L$81];4;0) -> 2
B832: 8 | C832: of:=VLOOKUP([.$B832];[.$I$71:.$J$81];2;0) -> Новосибирск | D832: 43 | E832: 34725 | F832: of:=IF(ISBLANK([.E832]*[.D832]);"0";[.E832]*[.D832]) -> 1493175 | G832: of:=COM.MICROSOFT.IFS([.F832]>5000000;[.$N$72];AND([.F832]>=1000000;[.F832]<=5000000);[.$N$73];AND([.F832]<1000000;[.F832]>0);[.$N$74];[.F832]=0;" ") -> Б | H832: of:=VLOOKUP([.$B832];[.$I$71:.$L$81];4;0) -> 5
B833: 2 | C833: of:=VLOOKUP([.$B833];[.$I$71:.$J$81];2;0) -> Санкт-Петербург | D833: 93 | E833: 19420 | F833: of:=IF(ISBLANK([.E833]*[.D833]);"0";[.E833]*[.D833]) -> 1806060 | G833: of:=COM.MICROSOFT.IFS([.F833]>5000000;[.$N$72];AND([.F833]>=1000000;[.F833]<=5000000);[.$N$73];AND([.F833]<1000000;[.F833]>0);[.$N$74];[.F833]=0;" ") -> Б | H833: of:=VLOOKUP([.$B833];[.$I$71:.$L$81];4;0) -> 9
B834: 10 | C834: of:=VLOOKUP([.$B834];[.$I$71:.$J$81];2;0) -> Сочи | D834: 8 | E834: 32942 | F834: of:=IF(ISBLANK([.E834]*[.D834]);"0";[.E834]*[.D834]) -> 263536 | G834: of:=COM.MICROSOFT.IFS([.F834]>5000000;[.$N$72];AND([.F834]>=1000000;[.F834]<=5000000);[.$N$73];AND([.F834]<1000000;[.F834]>0);[.$N$74];[.F834]=0;" ") -> В | H834: of:=VLOOKUP([.$B834];[.$I$71:.$L$81];4;0) -> 6
B835: 4 | C835: of:=VLOOKUP([.$B835];[.$I$71:.$J$81];2;0) -> Архангельск | D835: 61 | E835: 83372 | F835: of:=IF(ISBLANK([.E835]*[.D835]);"0";[.E835]*[.D835]) -> 5085692 | G835: of:=COM.MICROSOFT.IFS([.F835]>5000000;[.$N$72];AND([.F835]>=1000000;[.F835]<=5000000);[.$N$73];AND([.F835]<1000000;[.F835]>0);[.$N$74];[.F835]=0;" ") -> А | H835: of:=VLOOKUP([.$B835];[.$I$71:.$L$81];4;0) -> 2
B836: 2 | C836: of:=VLOOKUP([.$B836];[.$I$71:.$J$81];2;0) -> Санкт-Петербург | D836: 19 | E836: 73664 | F836: of:=IF(ISBLANK([.E836]*[.D836]);"0";[.E836]*[.D836]) -> 1399616 | G836: of:=COM.MICROSOFT.IFS([.F836]>5000000;[.$N$72];AND([.F836]>=1000000;[.F836]<=5000000);[.$N$73];AND([.F836]<1000000;[.F836]>0);[.$N$74];[.F836]=0;" ") -> Б | H836: of:=VLOOKUP([.$B836];[.$I$71:.$L$81];4;0) -> 9
B837: 10 | C837: of:=VLOOKUP([.$B837];[.$I$71:.$J$81];2;0) -> Сочи | D837: 42 | E837: 18354 | F837: of:=IF(ISBLANK([.E837]*[.D837]);"0";[.E837]*[.D837]) -> 770868 | G837: of:=COM.MICROSOFT.IFS([.F837]>5000000;[.$N$72];AND([.F837]>=1000000;[.F837]<=5000000);[.$N$73];AND([.F837]<1000000;[.F837]>0);[.$N$74];[.F837]=0;" ") -> В | H837: of:=VLOOKUP([.$B837];[.$I$71:.$L$81];4;0) -> 6
B838: 10 | C838: of:=VLOOKUP([.$B838];[.$I$71:.$J$81];2;0) -> Сочи | D838: 48 | E838: 10640 | F838: of:=IF(ISBLANK([.E838]*[.D838]);"0";[.E838]*[.D838]) -> 510720 | G838: of:=COM.MICROSOFT.IFS([.F838]>5000000;[.$N$72];AND([.F838]>=1000000;[.F838]<=5000000);[.$N$73];AND([.F838]<1000000;[.F838]>0);[.$N$74];[.F838]=0;" ") -> В | H838: of:=VLOOKUP([.$B838];[.$I$71:.$L$81];4;0) -> 6
B839: 6 | C839: of:=VLOOKUP([.$B839];[.$I$71:.$J$81];2;0) -> Владивосток | D839: 9 | E839: 53522 | F839: of:=IF(ISBLANK([.E839]*[.D839]);"0";[.E839]*[.D839]) -> 481698 | G839: of:=COM.MICROSOFT.IFS([.F839]>5000000;[.$N$72];AND([.F839]>=1000000;[.F839]<=5000000);[.$N$73];AND([.F839]<1000000;[.F839]>0);[.$N$74];[.F839]=0;" ") -> В | H839: of:=VLOOKUP([.$B839];[.$I$71:.$L$81];4;0) -> 7
B840: 2 | C840: of:=VLOOKUP([.$B840];[.$I$71:.$J$81];2;0) -> Санкт-Петербург | D840: 5 | E840: 82219 | F840: of:=IF(ISBLANK([.E840]*[.D840]);"0";[.E840]*[.D840]) -> 411095 | G840: of:=COM.MICROSOFT.IFS([.F840]>5000000;[.$N$72];AND([.F840]>=1000000;[.F840]<=5000000);[.$N$73];AND([.F840]<1000000;[.F840]>0);[.$N$74];[.F840]=0;" ") -> В | H840: of:=VLOOKUP([.$B840];[.$I$71:.$L$81];4;0) -> 9
B841: 2 | C841: of:=VLOOKUP([.$B841];[.$I$71:.$J$81];2;0) -> Санкт-Петербург | D841: 18 | E841: 62422 | F841: of:=IF(ISBLANK([.E841]*[.D841]);"0";[.E841]*[.D841]) -> 1123596 | G841: of:=COM.MICROSOFT.IFS([.F841]>5000000;[.$N$72];AND([.F841]>=1000000;[.F841]<=5000000);[.$N$73];AND([.F841]<1000000;[.F841]>0);[.$N$74];[.F841]=0;" ") -> Б | H841: of:=VLOOKUP([.$B841];[.$I$71:.$L$81];4;0) -> 9
B842: 10 | C842: of:=VLOOKUP([.$B842];[.$I$71:.$J$81];2;0) -> Сочи | D842: 42 | E842: 89999 | F842: of:=IF(ISBLANK([.E842]*[.D842]);"0";[.E842]*[.D842]) -> 3779958 | G842: of:=COM.MICROSOFT.IFS([.F842]>5000000;[.$N$72];AND([.F842]>=1000000;[.F842]<=5000000);[.$N$73];AND([.F842]<1000000;[.F842]>0);[.$N$74];[.F842]=0;" ") -> Б | H842: of:=VLOOKUP([.$B842];[.$I$71:.$L$81];4;0) -> 6
B843: 4 | C843: of:=VLOOKUP([.$B843];[.$I$71:.$J$81];2;0) -> Архангельск | D843: 71 | E843: 96520 | F843: of:=IF(ISBLANK([.E843]*[.D843]);"0";[.E843]*[.D843]) -> 6852920 | G843: of:=COM.MICROSOFT.IFS([.F843]>5000000;[.$N$72];AND([.F843]>=1000000;[.F843]<=5000000);[.$N$73];AND([.F843]<1000000;[.F843]>0);[.$N$74];[.F843]=0;" ") -> А | H843: of:=VLOOKUP([.$B843];[.$I$71:.$L$81];4;0) -> 2
B844: 8 | C844: of:=VLOOKUP([.$B844];[.$I$71:.$J$81];2;0) -> Новосибирск | D844: 4 | E844: 25759 | F844: of:=IF(ISBLANK([.E844]*[.D844]);"0";[.E844]*[.D844]) -> 103036 | G844: of:=COM.MICROSOFT.IFS([.F844]>5000000;[.$N$72];AND([.F844]>=1000000;[.F844]<=5000000);[.$N$73];AND([.F844]<1000000;[.F844]>0);[.$N$74];[.F844]=0;" ") -> В | H844: of:=VLOOKUP([.$B844];[.$I$71:.$L$81];4;0) -> 5
B845: 7 | C845: of:=VLOOKUP([.$B845];[.$I$71:.$J$81];2;0) -> Мурманск | D845: 88 | E845: 38947 | F845: of:=IF(ISBLANK([.E845]*[.D845]);"0";[.E845]*[.D845]) -> 3427336 | G845: of:=COM.MICROSOFT.IFS([.F845]>5000000;[.$N$72];AND([.F845]>=1000000;[.F845]<=5000000);[.$N$73];AND([.F845]<1000000;[.F845]>0);[.$N$74];[.F845]=0;" ") -> Б | H845: of:=VLOOKUP([.$B845];[.$I$71:.$L$81];4;0) -> 10
B846: 6 | C846: of:=VLOOKUP([.$B846];[.$I$71:.$J$81];2;0) -> Владивосток | D846: 56 | E846: 70726 | F846: of:=IF(ISBLANK([.E846]*[.D846]);"0";[.E846]*[.D846]) -> 3960656 | G846: of:=COM.MICROSOFT.IFS([.F846]>5000000;[.$N$72];AND([.F846]>=1000000;[.F846]<=5000000);[.$N$73];AND([.F846]<1000000;[.F846]>0);[.$N$74];[.F846]=0;" ") -> Б | H846: of:=VLOOKUP([.$B846];[.$I$71:.$L$81];4;0) -> 7
B847: 3 | C847: of:=VLOOKUP([.$B847];[.$I$71:.$J$81];2;0) -> Челябинск | D847: 89 | E847: 52172 | F847: of:=IF(ISBLANK([.E847]*[.D847]);"0";[.E847]*[.D847]) -> 4643308 | G847: of:=COM.MICROSOFT.IFS([.F847]>5000000;[.$N$72];AND([.F847]>=1000000;[.F847]<=5000000);[.$N$73];AND([.F847]<1000000;[.F847]>0);[.$N$74];[.F847]=0;" ") -> Б | H847: of:=VLOOKUP([.$B847];[.$I$71:.$L$81];4;0) -> 1
B848: 6 | C848: of:=VLOOKUP([.$B848];[.$I$71:.$J$81];2;0) -> Владивосток | D848: 0 | E848: 94051 | F848: of:=IF(ISBLANK([.E848]*[.D848]);"0";[.E848]*[.D848]) -> 0 | G848: of:=COM.MICROSOFT.IFS([.F848]>5000000;[.$N$72];AND([.F848]>=1000000;[.F848]<=5000000);[.$N$73];AND([.F848]<1000000;[.F848]>0);[.$N$74];[.F848]=0;" ") ->   | H848: of:=VLOOKUP([.$B848];[.$I$71:.$L$81];4;0) -> 7
B849: 5 | C849: of:=VLOOKUP([.$B849];[.$I$71:.$J$81];2;0) -> Краснодар | D849: 84 | E849: 53078 | F849: of:=IF(ISBLANK([.E849]*[.D849]);"0";[.E849]*[.D849]) -> 4458552 | G849: of:=COM.MICROSOFT.IFS([.F849]>5000000;[.$N$72];AND([.F849]>=1000000;[.F849]<=5000000);[.$N$73];AND([.F849]<1000000;[.F849]>0);[.$N$74];[.F849]=0;" ") -> Б | H849: of:=VLOOKUP([.$B849];[.$I$71:.$L$81];4;0) -> 4
B850: 7 | C850: of:=VLOOKUP([.$B850];[.$I$71:.$J$81];2;0) -> Мурманск | D850: 43 | E850: 89074 | F850: of:=IF(ISBLANK([.E850]*[.D850]);"0";[.E850]*[.D850]) -> 3830182 | G850: of:=COM.MICROSOFT.IFS([.F850]>5000000;[.$N$72];AND([.F850]>=1000000;[.F850]<=5000000);[.$N$73];AND([.F850]<1000000;[.F850]>0);[.$N$74];[.F850]=0;" ") -> Б | H850: of:=VLOOKUP([.$B850];[.$I$71:.$L$81];4;0) -> 10
B851: 6 | C851: of:=VLOOKUP([.$B851];[.$I$71:.$J$81];2;0) -> Владивосток | D851: 32 | E851: 37661 | F851: of:=IF(ISBLANK([.E851]*[.D851]);"0";[.E851]*[.D851]) -> 1205152 | G851: of:=COM.MICROSOFT.IFS([.F851]>5000000;[.$N$72];AND([.F851]>=1000000;[.F851]<=5000000);[.$N$73];AND([.F851]<1000000;[.F851]>0);[.$N$74];[.F851]=0;" ") -> Б | H851: of:=VLOOKUP([.$B851];[.$I$71:.$L$81];4;0) -> 7
B852: 4 | C852: of:=VLOOKUP([.$B852];[.$I$71:.$J$81];2;0) -> Архангельск | D852: 85 | E852: 40734 | F852: of:=IF(ISBLANK([.E852]*[.D852]);"0";[.E852]*[.D852]) -> 3462390 | G852: of:=COM.MICROSOFT.IFS([.F852]>5000000;[.$N$72];AND([.F852]>=1000000;[.F852]<=5000000);[.$N$73];AND([.F852]<1000000;[.F852]>0);[.$N$74];[.F852]=0;" ") -> Б | H852: of:=VLOOKUP([.$B852];[.$I$71:.$L$81];4;0) -> 2
B853: 3 | C853: of:=VLOOKUP([.$B853];[.$I$71:.$J$81];2;0) -> Челябинск | D853: 12 | E853: 33324 | F853: of:=IF(ISBLANK([.E853]*[.D853]);"0";[.E853]*[.D853]) -> 399888 | G853: of:=COM.MICROSOFT.IFS([.F853]>5000000;[.$N$72];AND([.F853]>=1000000;[.F853]<=5000000);[.$N$73];AND([.F853]<1000000;[.F853]>0);[.$N$74];[.F853]=0;" ") -> В | H853: of:=VLOOKUP([.$B853];[.$I$71:.$L$81];4;0) -> 1
B854: 7 | C854: of:=VLOOKUP([.$B854];[.$I$71:.$J$81];2;0) -> Мурманск | D854: 41 | E854: 19196 | F854: of:=IF(ISBLANK([.E854]*[.D854]);"0";[.E854]*[.D854]) -> 787036 | G854: of:=COM.MICROSOFT.IFS([.F854]>5000000;[.$N$72];AND([.F854]>=1000000;[.F854]<=5000000);[.$N$73];AND([.F854]<1000000;[.F854]>0);[.$N$74];[.F854]=0;" ") -> В | H854: of:=VLOOKUP([.$B854];[.$I$71:.$L$81];4;0) -> 10
B855: 10 | C855: of:=VLOOKUP([.$B855];[.$I$71:.$J$81];2;0) -> Сочи | D855: 17 | E855: 65465 | F855: of:=IF(ISBLANK([.E855]*[.D855]);"0";[.E855]*[.D855]) -> 1112905 | G855: of:=COM.MICROSOFT.IFS([.F855]>5000000;[.$N$72];AND([.F855]>=1000000;[.F855]<=5000000);[.$N$73];AND([.F855]<1000000;[.F855]>0);[.$N$74];[.F855]=0;" ") -> Б | H855: of:=VLOOKUP([.$B855];[.$I$71:.$L$81];4;0) -> 6
B856: 3 | C856: of:=VLOOKUP([.$B856];[.$I$71:.$J$81];2;0) -> Челябинск | D856: 16 | E856: 32564 | F856: of:=IF(ISBLANK([.E856]*[.D856]);"0";[.E856]*[.D856]) -> 521024 | G856: of:=COM.MICROSOFT.IFS([.F856]>5000000;[.$N$72];AND([.F856]>=1000000;[.F856]<=5000000);[.$N$73];AND([.F856]<1000000;[.F856]>0);[.$N$74];[.F856]=0;" ") -> В | H856: of:=VLOOKUP([.$B856];[.$I$71:.$L$81];4;0) -> 1
B857: 10 | C857: of:=VLOOKUP([.$B857];[.$I$71:.$J$81];2;0) -> Сочи | D857: 77 | E857: 54860 | F857: of:=IF(ISBLANK([.E857]*[.D857]);"0";[.E857]*[.D857]) -> 4224220 | G857: of:=COM.MICROSOFT.IFS([.F857]>5000000;[.$N$72];AND([.F857]>=1000000;[.F857]<=5000000);[.$N$73];AND([.F857]<1000000;[.F857]>0);[.$N$74];[.F857]=0;" ") -> Б | H857: of:=VLOOKUP([.$B857];[.$I$71:.$L$81];4;0) -> 6
B858: 2 | C858: of:=VLOOKUP([.$B858];[.$I$71:.$J$81];2;0) -> Санкт-Петербург | D858: 94 | E858: 87257 | F858: of:=IF(ISBLANK([.E858]*[.D858]);"0";[.E858]*[.D858]) -> 8202158 | G858: of:=COM.MICROSOFT.IFS([.F858]>5000000;[.$N$72];AND([.F858]>=1000000;[.F858]<=5000000);[.$N$73];AND([.F858]<1000000;[.F858]>0);[.$N$74];[.F858]=0;" ") -> А | H858: of:=VLOOKUP([.$B858];[.$I$71:.$L$81];4;0) -> 9
B859: 7 | C859: of:=VLOOKUP([.$B859];[.$I$71:.$J$81];2;0) -> Мурманск | D859: 44 | E859: 82029 | F859: of:=IF(ISBLANK([.E859]*[.D859]);"0";[.E859]*[.D859]) -> 3609276 | G859: of:=COM.MICROSOFT.IFS([.F859]>5000000;[.$N$72];AND([.F859]>=1000000;[.F859]<=5000000);[.$N$73];AND([.F859]<1000000;[.F859]>0);[.$N$74];[.F859]=0;" ") -> Б | H859: of:=VLOOKUP([.$B859];[.$I$71:.$L$81];4;0) -> 10
B860: 1 | C860: of:=VLOOKUP([.$B860];[.$I$71:.$J$81];2;0) -> Москва | D860: 4 | E860: 38392 | F860: of:=IF(ISBLANK([.E860]*[.D860]);"0";[.E860]*[.D860]) -> 153568 | G860: of:=COM.MICROSOFT.IFS([.F860]>5000000;[.$N$72];AND([.F860]>=1000000;[.F860]<=5000000);[.$N$73];AND([.F860]<1000000;[.F860]>0);[.$N$74];[.F860]=0;" ") -> В | H860: of:=VLOOKUP([.$B860];[.$I$71:.$L$81];4;0) -> 8
B861: 3 | C861: of:=VLOOKUP([.$B861];[.$I$71:.$J$81];2;0) -> Челябинск | D861: 31 | E861: 93571 | F861: of:=IF(ISBLANK([.E861]*[.D861]);"0";[.E861]*[.D861]) -> 2900701 | G861: of:=COM.MICROSOFT.IFS([.F861]>5000000;[.$N$72];AND([.F861]>=1000000;[.F861]<=5000000);[.$N$73];AND([.F861]<1000000;[.F861]>0);[.$N$74];[.F861]=0;" ") -> Б | H861: of:=VLOOKUP([.$B861];[.$I$71:.$L$81];4;0) -> 1
B862: 9 | C862: of:=VLOOKUP([.$B862];[.$I$71:.$J$81];2;0) -> Тюмень | D862: 97 | E862: 25288 | F862: of:=IF(ISBLANK([.E862]*[.D862]);"0";[.E862]*[.D862]) -> 2452936 | G862: of:=COM.MICROSOFT.IFS([.F862]>5000000;[.$N$72];AND([.F862]>=1000000;[.F862]<=5000000);[.$N$73];AND([.F862]<1000000;[.F862]>0);[.$N$74];[.F862]=0;" ") -> Б | H862: of:=VLOOKUP([.$B862];[.$I$71:.$L$81];4;0) -> 3
B863: 8 | C863: of:=VLOOKUP([.$B863];[.$I$71:.$J$81];2;0) -> Новосибирск | D863: 59 | E863: 31187 | F863: of:=IF(ISBLANK([.E863]*[.D863]);"0";[.E863]*[.D863]) -> 1840033 | G863: of:=COM.MICROSOFT.IFS([.F863]>5000000;[.$N$72];AND([.F863]>=1000000;[.F863]<=5000000);[.$N$73];AND([.F863]<1000000;[.F863]>0);[.$N$74];[.F863]=0;" ") -> Б | H863: of:=VLOOKUP([.$B863];[.$I$71:.$L$81];4;0) -> 5
B864: 2 | C864: of:=VLOOKUP([.$B864];[.$I$71:.$J$81];2;0) -> Санкт-Петербург | D864: 16 | E864: 34900 | F864: of:=IF(ISBLANK([.E864]*[.D864]);"0";[.E864]*[.D864]) -> 558400 | G864: of:=COM.MICROSOFT.IFS([.F864]>5000000;[.$N$72];AND([.F864]>=1000000;[.F864]<=5000000);[.$N$73];AND([.F864]<1000000;[.F864]>0);[.$N$74];[.F864]=0;" ") -> В | H864: of:=VLOOKUP([.$B864];[.$I$71:.$L$81];4;0) -> 9
B865: 3 | C865: of:=VLOOKUP([.$B865];[.$I$71:.$J$81];2;0) -> Челябинск | D865: 56 | E865: 2847 | F865: of:=IF(ISBLANK([.E865]*[.D865]);"0";[.E865]*[.D865]) -> 159432 | G865: of:=COM.MICROSOFT.IFS([.F865]>5000000;[.$N$72];AND([.F865]>=1000000;[.F865]<=5000000);[.$N$73];AND([.F865]<1000000;[.F865]>0);[.$N$74];[.F865]=0;" ") -> В | H865: of:=VLOOKUP([.$B865];[.$I$71:.$L$81];4;0) -> 1
B866: 2 | C866: of:=VLOOKUP([.$B866];[.$I$71:.$J$81];2;0) -> Санкт-Петербург | D866: 66 | E866: 31807 | F866: of:=IF(ISBLANK([.E866]*[.D866]);"0";[.E866]*[.D866]) -> 2099262 | G866: of:=COM.MICROSOFT.IFS([.F866]>5000000;[.$N$72];AND([.F866]>=1000000;[.F866]<=5000000);[.$N$73];AND([.F866]<1000000;[.F866]>0);[.$N$74];[.F866]=0;" ") -> Б | H866: of:=VLOOKUP([.$B866];[.$I$71:.$L$81];4;0) -> 9
B867: 8 | C867: of:=VLOOKUP([.$B867];[.$I$71:.$J$81];2;0) -> Новосибирск | D867: 43 | E867: 41337 | F867: of:=IF(ISBLANK([.E867]*[.D867]);"0";[.E867]*[.D867]) -> 1777491 | G867: of:=COM.MICROSOFT.IFS([.F867]>5000000;[.$N$72];AND([.F867]>=1000000;[.F867]<=5000000);[.$N$73];AND([.F867]<1000000;[.F867]>0);[.$N$74];[.F867]=0;" ") -> Б | H867: of:=VLOOKUP([.$B867];[.$I$71:.$L$81];4;0) -> 5
B868: 4 | C868: of:=VLOOKUP([.$B868];[.$I$71:.$J$81];2;0) -> Архангельск | D868: 9 | E868: 39085 | F868: of:=IF(ISBLANK([.E868]*[.D868]);"0";[.E868]*[.D868]) -> 351765 | G868: of:=COM.MICROSOFT.IFS([.F868]>5000000;[.$N$72];AND([.F868]>=1000000;[.F868]<=5000000);[.$N$73];AND([.F868]<1000000;[.F868]>0);[.$N$74];[.F868]=0;" ") -> В | H868: of:=VLOOKUP([.$B868];[.$I$71:.$L$81];4;0) -> 2
B869: 5 | C869: of:=VLOOKUP([.$B869];[.$I$71:.$J$81];2;0) -> Краснодар | D869: 59 | E869: 10135 | F869: of:=IF(ISBLANK([.E869]*[.D869]);"0";[.E869]*[.D869]) -> 597965 | G869: of:=COM.MICROSOFT.IFS([.F869]>5000000;[.$N$72];AND([.F869]>=1000000;[.F869]<=5000000);[.$N$73];AND([.F869]<1000000;[.F869]>0);[.$N$74];[.F869]=0;" ") -> В | H869: of:=VLOOKUP([.$B869];[.$I$71:.$L$81];4;0) -> 4
B870: 9 | C870: of:=VLOOKUP([.$B870];[.$I$71:.$J$81];2;0) -> Тюмень | D870: 34 | E870: 74164 | F870: of:=IF(ISBLANK([.E870]*[.D870]);"0";[.E870]*[.D870]) -> 2521576 | G870: of:=COM.MICROSOFT.IFS([.F870]>5000000;[.$N$72];AND([.F870]>=1000000;[.F870]<=5000000);[.$N$73];AND([.F870]<1000000;[.F870]>0);[.$N$74];[.F870]=0;" ") -> Б | H870: of:=VLOOKUP([.$B870];[.$I$71:.$L$81];4;0) -> 3
B871: 10 | C871: of:=VLOOKUP([.$B871];[.$I$71:.$J$81];2;0) -> Сочи | D871: 32 | E871: 43359 | F871: of:=IF(ISBLANK([.E871]*[.D871]);"0";[.E871]*[.D871]) -> 1387488 | G871: of:=COM.MICROSOFT.IFS([.F871]>5000000;[.$N$72];AND([.F871]>=1000000;[.F871]<=5000000);[.$N$73];AND([.F871]<1000000;[.F871]>0);[.$N$74];[.F871]=0;" ") -> Б | H871: of:=VLOOKUP([.$B871];[.$I$71:.$L$81];4;0) -> 6
B872: 5 | C872: of:=VLOOKUP([.$B872];[.$I$71:.$J$81];2;0) -> Краснодар | D872: 91 | E872: 66496 | F872: of:=IF(ISBLANK([.E872]*[.D872]);"0";[.E872]*[.D872]) -> 6051136 | G872: of:=COM.MICROSOFT.IFS([.F872]>5000000;[.$N$72];AND([.F872]>=1000000;[.F872]<=5000000);[.$N$73];AND([.F872]<1000000;[.F872]>0);[.$N$74];[.F872]=0;" ") -> А | H872: of:=VLOOKUP([.$B872];[.$I$71:.$L$81];4;0) -> 4
B873: 1 | C873: of:=VLOOKUP([.$B873];[.$I$71:.$J$81];2;0) -> Москва | D873: 2 | E873: 50229 | F873: of:=IF(ISBLANK([.E873]*[.D873]);"0";[.E873]*[.D873]) -> 100458 | G873: of:=COM.MICROSOFT.IFS([.F873]>5000000;[.$N$72];AND([.F873]>=1000000;[.F873]<=5000000);[.$N$73];AND([.F873]<1000000;[.F873]>0);[.$N$74];[.F873]=0;" ") -> В | H873: of:=VLOOKUP([.$B873];[.$I$71:.$L$81];4;0) -> 8
B874: 9 | C874: of:=VLOOKUP([.$B874];[.$I$71:.$J$81];2;0) -> Тюмень | D874: 71 | E874: 7659 | F874: of:=IF(ISBLANK([.E874]*[.D874]);"0";[.E874]*[.D874]) -> 543789 | G874: of:=COM.MICROSOFT.IFS([.F874]>5000000;[.$N$72];AND([.F874]>=1000000;[.F874]<=5000000);[.$N$73];AND([.F874]<1000000;[.F874]>0);[.$N$74];[.F874]=0;" ") -> В | H874: of:=VLOOKUP([.$B874];[.$I$71:.$L$81];4;0) -> 3
B875: 7 | C875: of:=VLOOKUP([.$B875];[.$I$71:.$J$81];2;0) -> Мурманск | D875: 47 | E875: 7287 | F875: of:=IF(ISBLANK([.E875]*[.D875]);"0";[.E875]*[.D875]) -> 342489 | G875: of:=COM.MICROSOFT.IFS([.F875]>5000000;[.$N$72];AND([.F875]>=1000000;[.F875]<=5000000);[.$N$73];AND([.F875]<1000000;[.F875]>0);[.$N$74];[.F875]=0;" ") -> В | H875: of:=VLOOKUP([.$B875];[.$I$71:.$L$81];4;0) -> 10
B876: 1 | C876: of:=VLOOKUP([.$B876];[.$I$71:.$J$81];2;0) -> Москва | D876: 97 | E876: 15211 | F876: of:=IF(ISBLANK([.E876]*[.D876]);"0";[.E876]*[.D876]) -> 1475467 | G876: of:=COM.MICROSOFT.IFS([.F876]>5000000;[.$N$72];AND([.F876]>=1000000;[.F876]<=5000000);[.$N$73];AND([.F876]<1000000;[.F876]>0);[.$N$74];[.F876]=0;" ") -> Б | H876: of:=VLOOKUP([.$B876];[.$I$71:.$L$81];4;0) -> 8
B877: 8 | C877: of:=VLOOKUP([.$B877];[.$I$71:.$J$81];2;0) -> Новосибирск | D877: 55 | E877: 14323 | F877: of:=IF(ISBLANK([.E877]*[.D877]);"0";[.E877]*[.D877]) -> 787765 | G877: of:=COM.MICROSOFT.IFS([.F877]>5000000;[.$N$72];AND([.F877]>=1000000;[.F877]<=5000000);[.$N$73];AND([.F877]<1000000;[.F877]>0);[.$N$74];[.F877]=0;" ") -> В | H877: of:=VLOOKUP([.$B877];[.$I$71:.$L$81];4;0) -> 5
B878: 10 | C878: of:=VLOOKUP([.$B878];[.$I$71:.$J$81];2;0) -> Сочи | D878: 27 | E878: 16402 | F878: of:=IF(ISBLANK([.E878]*[.D878]);"0";[.E878]*[.D878]) -> 442854 | G878: of:=COM.MICROSOFT.IFS([.F878]>5000000;[.$N$72];AND([.F878]>=1000000;[.F878]<=5000000);[.$N$73];AND([.F878]<1000000;[.F878]>0);[.$N$74];[.F878]=0;" ") -> В | H878: of:=VLOOKUP([.$B878];[.$I$71:.$L$81];4;0) -> 6
B879: 1 | C879: of:=VLOOKUP([.$B879];[.$I$71:.$J$81];2;0) -> Москва | D879: 65 | E879: 5736 | F879: of:=IF(ISBLANK([.E879]*[.D879]);"0";[.E879]*[.D879]) -> 372840 | G879: of:=COM.MICROSOFT.IFS([.F879]>5000000;[.$N$72];AND([.F879]>=1000000;[.F879]<=5000000);[.$N$73];AND([.F879]<1000000;[.F879]>0);[.$N$74];[.F879]=0;" ") -> В | H879: of:=VLOOKUP([.$B879];[.$I$71:.$L$81];4;0) -> 8
B880: 3 | C880: of:=VLOOKUP([.$B880];[.$I$71:.$J$81];2;0) -> Челябинск | D880: 5 | E880: 69584 | F880: of:=IF(ISBLANK([.E880]*[.D880]);"0";[.E880]*[.D880]) -> 347920 | G880: of:=COM.MICROSOFT.IFS([.F880]>5000000;[.$N$72];AND([.F880]>=1000000;[.F880]<=5000000);[.$N$73];AND([.F880]<1000000;[.F880]>0);[.$N$74];[.F880]=0;" ") -> В | H880: of:=VLOOKUP([.$B880];[.$I$71:.$L$81];4;0) -> 1
B881: 9 | C881: of:=VLOOKUP([.$B881];[.$I$71:.$J$81];2;0) -> Тюмень | D881: 66 | E881: 23804 | F881: of:=IF(ISBLANK([.E881]*[.D881]);"0";[.E881]*[.D881]) -> 1571064 | G881: of:=COM.MICROSOFT.IFS([.F881]>5000000;[.$N$72];AND([.F881]>=1000000;[.F881]<=5000000);[.$N$73];AND([.F881]<1000000;[.F881]>0);[.$N$74];[.F881]=0;" ") -> Б | H881: of:=VLOOKUP([.$B881];[.$I$71:.$L$81];4;0) -> 3
B882: 4 | C882: of:=VLOOKUP([.$B882];[.$I$71:.$J$81];2;0) -> Архангельск | D882: 7 | E882: 88918 | F882: of:=IF(ISBLANK([.E882]*[.D882]);"0";[.E882]*[.D882]) -> 622426 | G882: of:=COM.MICROSOFT.IFS([.F882]>5000000;[.$N$72];AND([.F882]>=1000000;[.F882]<=5000000);[.$N$73];AND([.F882]<1000000;[.F882]>0);[.$N$74];[.F882]=0;" ") -> В | H882: of:=VLOOKUP([.$B882];[.$I$71:.$L$81];4;0) -> 2
B883: 7 | C883: of:=VLOOKUP([.$B883];[.$I$71:.$J$81];2;0) -> Мурманск | D883: 5 | E883: 5065 | F883: of:=IF(ISBLANK([.E883]*[.D883]);"0";[.E883]*[.D883]) -> 25325 | G883: of:=COM.MICROSOFT.IFS([.F883]>5000000;[.$N$72];AND([.F883]>=1000000;[.F883]<=5000000);[.$N$73];AND([.F883]<1000000;[.F883]>0);[.$N$74];[.F883]=0;" ") -> В | H883: of:=VLOOKUP([.$B883];[.$I$71:.$L$81];4;0) -> 10
B884: 8 | C884: of:=VLOOKUP([.$B884];[.$I$71:.$J$81];2;0) -> Новосибирск | D884: 65 | E884: 39715 | F884: of:=IF(ISBLANK([.E884]*[.D884]);"0";[.E884]*[.D884]) -> 2581475 | G884: of:=COM.MICROSOFT.IFS([.F884]>5000000;[.$N$72];AND([.F884]>=1000000;[.F884]<=5000000);[.$N$73];AND([.F884]<1000000;[.F884]>0);[.$N$74];[.F884]=0;" ") -> Б | H884: of:=VLOOKUP([.$B884];[.$I$71:.$L$81];4;0) -> 5
B885: 2 | C885: of:=VLOOKUP([.$B885];[.$I$71:.$J$81];2;0) -> Санкт-Петербург | D885: 72 | E885: 35800 | F885: of:=IF(ISBLANK([.E885]*[.D885]);"0";[.E885]*[.D885]) -> 2577600 | G885: of:=COM.MICROSOFT.IFS([.F885]>5000000;[.$N$72];AND([.F885]>=1000000;[.F885]<=5000000);[.$N$73];AND([.F885]<1000000;[.F885]>0);[.$N$74];[.F885]=0;" ") -> Б | H885: of:=VLOOKUP([.$B885];[.$I$71:.$L$81];4;0) -> 9
B886: 7 | C886: of:=VLOOKUP([.$B886];[.$I$71:.$J$81];2;0) -> Мурманск | D886: 64 | E886: 13508 | F886: of:=IF(ISBLANK([.E886]*[.D886]);"0";[.E886]*[.D886]) -> 864512 | G886: of:=COM.MICROSOFT.IFS([.F886]>5000000;[.$N$72];AND([.F886]>=1000000;[.F886]<=5000000);[.$N$73];AND([.F886]<1000000;[.F886]>0);[.$N$74];[.F886]=0;" ") -> В | H886: of:=VLOOKUP([.$B886];[.$I$71:.$L$81];4;0) -> 10
B887: 2 | C887: of:=VLOOKUP([.$B887];[.$I$71:.$J$81];2;0) -> Санкт-Петербург | D887: 43 | E887: 77309 | F887: of:=IF(ISBLANK([.E887]*[.D887]);"0";[.E887]*[.D887]) -> 3324287 | G887: of:=COM.MICROSOFT.IFS([.F887]>5000000;[.$N$72];AND([.F887]>=1000000;[.F887]<=5000000);[.$N$73];AND([.F887]<1000000;[.F887]>0);[.$N$74];[.F887]=0;" ") -> Б | H887: of:=VLOOKUP([.$B887];[.$I$71:.$L$81];4;0) -> 9
B888: 8 | C888: of:=VLOOKUP([.$B888];[.$I$71:.$J$81];2;0) -> Новосибирск | D888: 54 | E888: 12696 | F888: of:=IF(ISBLANK([.E888]*[.D888]);"0";[.E888]*[.D888]) -> 685584 | G888: of:=COM.MICROSOFT.IFS([.F888]>5000000;[.$N$72];AND([.F888]>=1000000;[.F888]<=5000000);[.$N$73];AND([.F888]<1000000;[.F888]>0);[.$N$74];[.F888]=0;" ") -> В | H888: of:=VLOOKUP([.$B888];[.$I$71:.$L$81];4;0) -> 5
B889: 4 | C889: of:=VLOOKUP([.$B889];[.$I$71:.$J$81];2;0) -> Архангельск | D889: 16 | E889: 67479 | F889: of:=IF(ISBLANK([.E889]*[.D889]);"0";[.E889]*[.D889]) -> 1079664 | G889: of:=COM.MICROSOFT.IFS([.F889]>5000000;[.$N$72];AND([.F889]>=1000000;[.F889]<=5000000);[.$N$73];AND([.F889]<1000000;[.F889]>0);[.$N$74];[.F889]=0;" ") -> Б | H889: of:=VLOOKUP([.$B889];[.$I$71:.$L$81];4;0) -> 2
B890: 1 | C890: of:=VLOOKUP([.$B890];[.$I$71:.$J$81];2;0) -> Москва | D890: 15 | E890: 91360 | F890: of:=IF(ISBLANK([.E890]*[.D890]);"0";[.E890]*[.D890]) -> 1370400 | G890: of:=COM.MICROSOFT.IFS([.F890]>5000000;[.$N$72];AND([.F890]>=1000000;[.F890]<=5000000);[.$N$73];AND([.F890]<1000000;[.F890]>0);[.$N$74];[.F890]=0;" ") -> Б | H890: of:=VLOOKUP([.$B890];[.$I$71:.$L$81];4;0) -> 8
B891: 9 | C891: of:=VLOOKUP([.$B891];[.$I$71:.$J$81];2;0) -> Тюмень | D891: 52 | E891: 42840 | F891: of:=IF(ISBLANK([.E891]*[.D891]);"0";[.E891]*[.D891]) -> 2227680 | G891: of:=COM.MICROSOFT.IFS([.F891]>5000000;[.$N$72];AND([.F891]>=1000000;[.F891]<=5000000);[.$N$73];AND([.F891]<1000000;[.F891]>0);[.$N$74];[.F891]=0;" ") -> Б | H891: of:=VLOOKUP([.$B891];[.$I$71:.$L$81];4;0) -> 3
B892: 1 | C892: of:=VLOOKUP([.$B892];[.$I$71:.$J$81];2;0) -> Москва | D892: 64 | E892: 38588 | F892: of:=IF(ISBLANK([.E892]*[.D892]);"0";[.E892]*[.D892]) -> 2469632 | G892: of:=COM.MICROSOFT.IFS([.F892]>5000000;[.$N$72];AND([.F892]>=1000000;[.F892]<=5000000);[.$N$73];AND([.F892]<1000000;[.F892]>0);[.$N$74];[.F892]=0;" ") -> Б | H892: of:=VLOOKUP([.$B892];[.$I$71:.$L$81];4;0) -> 8
B893: 3 | C893: of:=VLOOKUP([.$B893];[.$I$71:.$J$81];2;0) -> Челябинск | D893: 9 | E893: 49091 | F893: of:=IF(ISBLANK([.E893]*[.D893]);"0";[.E893]*[.D893]) -> 441819 | G893: of:=COM.MICROSOFT.IFS([.F893]>5000000;[.$N$72];AND([.F893]>=1000000;[.F893]<=5000000);[.$N$73];AND([.F893]<1000000;[.F893]>0);[.$N$74];[.F893]=0;" ") -> В | H893: of:=VLOOKUP([.$B893];[.$I$71:.$L$81];4;0) -> 1
B894: 1 | C894: of:=VLOOKUP([.$B894];[.$I$71:.$J$81];2;0) -> Москва | D894: 97 | E894: 92407 | F894: of:=IF(ISBLANK([.E894]*[.D894]);"0";[.E894]*[.D894]) -> 8963479 | G894: of:=COM.MICROSOFT.IFS([.F894]>5000000;[.$N$72];AND([.F894]>=1000000;[.F894]<=5000000);[.$N$73];AND([.F894]<1000000;[.F894]>0);[.$N$74];[.F894]=0;" ") -> А | H894: of:=VLOOKUP([.$B894];[.$I$71:.$L$81];4;0) -> 8
B895: 5 | C895: of:=VLOOKUP([.$B895];[.$I$71:.$J$81];2;0) -> Краснодар | D895: 61 | E895: 28800 | F895: of:=IF(ISBLANK([.E895]*[.D895]);"0";[.E895]*[.D895]) -> 1756800 | G895: of:=COM.MICROSOFT.IFS([.F895]>5000000;[.$N$72];AND([.F895]>=1000000;[.F895]<=5000000);[.$N$73];AND([.F895]<1000000;[.F895]>0);[.$N$74];[.F895]=0;" ") -> Б | H895: of:=VLOOKUP([.$B895];[.$I$71:.$L$81];4;0) -> 4
B896: 1 | C896: of:=VLOOKUP([.$B896];[.$I$71:.$J$81];2;0) -> Москва | D896: 6 | E896: 39159 | F896: of:=IF(ISBLANK([.E896]*[.D896]);"0";[.E896]*[.D896]) -> 234954 | G896: of:=COM.MICROSOFT.IFS([.F896]>5000000;[.$N$72];AND([.F896]>=1000000;[.F896]<=5000000);[.$N$73];AND([.F896]<1000000;[.F896]>0);[.$N$74];[.F896]=0;" ") -> В | H896: of:=VLOOKUP([.$B896];[.$I$71:.$L$81];4;0) -> 8
B897: 10 | C897: of:=VLOOKUP([.$B897];[.$I$71:.$J$81];2;0) -> Сочи | D897: 96 | E897: 97771 | F897: of:=IF(ISBLANK([.E897]*[.D897]);"0";[.E897]*[.D897]) -> 9386016 | G897: of:=COM.MICROSOFT.IFS([.F897]>5000000;[.$N$72];AND([.F897]>=1000000;[.F897]<=5000000);[.$N$73];AND([.F897]<1000000;[.F897]>0);[.$N$74];[.F897]=0;" ") -> А | H897: of:=VLOOKUP([.$B897];[.$I$71:.$L$81];4;0) -> 6
B898: 6 | C898: of:=VLOOKUP([.$B898];[.$I$71:.$J$81];2;0) -> Владивосток | D898: 22 | E898: 17934 | F898: of:=IF(ISBLANK([.E898]*[.D898]);"0";[.E898]*[.D898]) -> 394548 | G898: of:=COM.MICROSOFT.IFS([.F898]>5000000;[.$N$72];AND([.F898]>=1000000;[.F898]<=5000000);[.$N$73];AND([.F898]<1000000;[.F898]>0);[.$N$74];[.F898]=0;" ") -> В | H898: of:=VLOOKUP([.$B898];[.$I$71:.$L$81];4;0) -> 7
B899: 6 | C899: of:=VLOOKUP([.$B899];[.$I$71:.$J$81];2;0) -> Владивосток | D899: 52 | E899: 62266 | F899: of:=IF(ISBLANK([.E899]*[.D899]);"0";[.E899]*[.D899]) -> 3237832 | G899: of:=COM.MICROSOFT.IFS([.F899]>5000000;[.$N$72];AND([.F899]>=1000000;[.F899]<=5000000);[.$N$73];AND([.F899]<1000000;[.F899]>0);[.$N$74];[.F899]=0;" ") -> Б | H899: of:=VLOOKUP([.$B899];[.$I$71:.$L$81];4;0) -> 7
B900: 3 | C900: of:=VLOOKUP([.$B900];[.$I$71:.$J$81];2;0) -> Челябинск | D900: 46 | E900: 38369 | F900: of:=IF(ISBLANK([.E900]*[.D900]);"0";[.E900]*[.D900]) -> 1764974 | G900: of:=COM.MICROSOFT.IFS([.F900]>5000000;[.$N$72];AND([.F900]>=1000000;[.F900]<=5000000);[.$N$73];AND([.F900]<1000000;[.F900]>0);[.$N$74];[.F900]=0;" ") -> Б | H900: of:=VLOOKUP([.$B900];[.$I$71:.$L$81];4;0) -> 1
B901: 4 | C901: of:=VLOOKUP([.$B901];[.$I$71:.$J$81];2;0) -> Архангельск | D901: 62 | E901: 24080 | F901: of:=IF(ISBLANK([.E901]*[.D901]);"0";[.E901]*[.D901]) -> 1492960 | G901: of:=COM.MICROSOFT.IFS([.F901]>5000000;[.$N$72];AND([.F901]>=1000000;[.F901]<=5000000);[.$N$73];AND([.F901]<1000000;[.F901]>0);[.$N$74];[.F901]=0;" ") -> Б | H901: of:=VLOOKUP([.$B901];[.$I$71:.$L$81];4;0) -> 2
B902: 5 | C902: of:=VLOOKUP([.$B902];[.$I$71:.$J$81];2;0) -> Краснодар | D902: 91 | E902: 95945 | F902: of:=IF(ISBLANK([.E902]*[.D902]);"0";[.E902]*[.D902]) -> 8730995 | G902: of:=COM.MICROSOFT.IFS([.F902]>5000000;[.$N$72];AND([.F902]>=1000000;[.F902]<=5000000);[.$N$73];AND([.F902]<1000000;[.F902]>0);[.$N$74];[.F902]=0;" ") -> А | H902: of:=VLOOKUP([.$B902];[.$I$71:.$L$81];4;0) -> 4
B903: 6 | C903: of:=VLOOKUP([.$B903];[.$I$71:.$J$81];2;0) -> Владивосток | D903: 69 | E903: 84170 | F903: of:=IF(ISBLANK([.E903]*[.D903]);"0";[.E903]*[.D903]) -> 5807730 | G903: of:=COM.MICROSOFT.IFS([.F903]>5000000;[.$N$72];AND([.F903]>=1000000;[.F903]<=5000000);[.$N$73];AND([.F903]<1000000;[.F903]>0);[.$N$74];[.F903]=0;" ") -> А | H903: of:=VLOOKUP([.$B903];[.$I$71:.$L$81];4;0) -> 7
B904: 5 | C904: of:=VLOOKUP([.$B904];[.$I$71:.$J$81];2;0) -> Краснодар | D904: 59 | E904: 21599 | F904: of:=IF(ISBLANK([.E904]*[.D904]);"0";[.E904]*[.D904]) -> 1274341 | G904: of:=COM.MICROSOFT.IFS([.F904]>5000000;[.$N$72];AND([.F904]>=1000000;[.F904]<=5000000);[.$N$73];AND([.F904]<1000000;[.F904]>0);[.$N$74];[.F904]=0;" ") -> Б | H904: of:=VLOOKUP([.$B904];[.$I$71:.$L$81];4;0) -> 4
B905: 2 | C905: of:=VLOOKUP([.$B905];[.$I$71:.$J$81];2;0) -> Санкт-Петербург | D905: 63 | E905: 51307 | F905: of:=IF(ISBLANK([.E905]*[.D905]);"0";[.E905]*[.D905]) -> 3232341 | G905: of:=COM.MICROSOFT.IFS([.F905]>5000000;[.$N$72];AND([.F905]>=1000000;[.F905]<=5000000);[.$N$73];AND([.F905]<1000000;[.F905]>0);[.$N$74];[.F905]=0;" ") -> Б | H905: of:=VLOOKUP([.$B905];[.$I$71:.$L$81];4;0) -> 9
B906: 5 | C906: of:=VLOOKUP([.$B906];[.$I$71:.$J$81];2;0) -> Краснодар | D906: 97 | E906: 9261 | F906: of:=IF(ISBLANK([.E906]*[.D906]);"0";[.E906]*[.D906]) -> 898317 | G906: of:=COM.MICROSOFT.IFS([.F906]>5000000;[.$N$72];AND([.F906]>=1000000;[.F906]<=5000000);[.$N$73];AND([.F906]<1000000;[.F906]>0);[.$N$74];[.F906]=0;" ") -> В | H906: of:=VLOOKUP([.$B906];[.$I$71:.$L$81];4;0) -> 4
B907: 1 | C907: of:=VLOOKUP([.$B907];[.$I$71:.$J$81];2;0) -> Москва | D907: 56 | E907: 86980 | F907: of:=IF(ISBLANK([.E907]*[.D907]);"0";[.E907]*[.D907]) -> 4870880 | G907: of:=COM.MICROSOFT.IFS([.F907]>5000000;[.$N$72];AND([.F907]>=1000000;[.F907]<=5000000);[.$N$73];AND([.F907]<1000000;[.F907]>0);[.$N$74];[.F907]=0;" ") -> Б | H907: of:=VLOOKUP([.$B907];[.$I$71:.$L$81];4;0) -> 8
B908: 2 | C908: of:=VLOOKUP([.$B908];[.$I$71:.$J$81];2;0) -> Санкт-Петербург | D908: 14 | E908: 17643 | F908: of:=IF(ISBLANK([.E908]*[.D908]);"0";[.E908]*[.D908]) -> 247002 | G908: of:=COM.MICROSOFT.IFS([.F908]>5000000;[.$N$72];AND([.F908]>=1000000;[.F908]<=5000000);[.$N$73];AND([.F908]<1000000;[.F908]>0);[.$N$74];[.F908]=0;" ") -> В | H908: of:=VLOOKUP([.$B908];[.$I$71:.$L$81];4;0) -> 9
B909: 4 | C909: of:=VLOOKUP([.$B909];[.$I$71:.$J$81];2;0) -> Архангельск | D909: 70 | E909: 74511 | F909: of:=IF(ISBLANK([.E909]*[.D909]);"0";[.E909]*[.D909]) -> 5215770 | G909: of:=COM.MICROSOFT.IFS([.F909]>5000000;[.$N$72];AND([.F909]>=1000000;[.F909]<=5000000);[.$N$73];AND([.F909]<1000000;[.F909]>0);[.$N$74];[.F909]=0;" ") -> А | H909: of:=VLOOKUP([.$B909];[.$I$71:.$L$81];4;0) -> 2
B910: 8 | C910: of:=VLOOKUP([.$B910];[.$I$71:.$J$81];2;0) -> Новосибирск | D910: 78 | E910: 29391 | F910: of:=IF(ISBLANK([.E910]*[.D910]);"0";[.E910]*[.D910]) -> 2292498 | G910: of:=COM.MICROSOFT.IFS([.F910]>5000000;[.$N$72];AND([.F910]>=1000000;[.F910]<=5000000);[.$N$73];AND([.F910]<1000000;[.F910]>0);[.$N$74];[.F910]=0;" ") -> Б | H910: of:=VLOOKUP([.$B910];[.$I$71:.$L$81];4;0) -> 5
B911: 4 | C911: of:=VLOOKUP([.$B911];[.$I$71:.$J$81];2;0) -> Архангельск | D911: 25 | E911: 79110 | F911: of:=IF(ISBLANK([.E911]*[.D911]);"0";[.E911]*[.D911]) -> 1977750 | G911: of:=COM.MICROSOFT.IFS([.F911]>5000000;[.$N$72];AND([.F911]>=1000000;[.F911]<=5000000);[.$N$73];AND([.F911]<1000000;[.F911]>0);[.$N$74];[.F911]=0;" ") -> Б | H911: of:=VLOOKUP([.$B911];[.$I$71:.$L$81];4;0) -> 2
B912: 10 | C912: of:=VLOOKUP([.$B912];[.$I$71:.$J$81];2;0) -> Сочи | D912: 85 | E912: 7436 | F912: of:=IF(ISBLANK([.E912]*[.D912]);"0";[.E912]*[.D912]) -> 632060 | G912: of:=COM.MICROSOFT.IFS([.F912]>5000000;[.$N$72];AND([.F912]>=1000000;[.F912]<=5000000);[.$N$73];AND([.F912]<1000000;[.F912]>0);[.$N$74];[.F912]=0;" ") -> В | H912: of:=VLOOKUP([.$B912];[.$I$71:.$L$81];4;0) -> 6
B913: 3 | C913: of:=VLOOKUP([.$B913];[.$I$71:.$J$81];2;0) -> Челябинск | D913: 50 | E913: 33322 | F913: of:=IF(ISBLANK([.E913]*[.D913]);"0";[.E913]*[.D913]) -> 1666100 | G913: of:=COM.MICROSOFT.IFS([.F913]>5000000;[.$N$72];AND([.F913]>=1000000;[.F913]<=5000000);[.$N$73];AND([.F913]<1000000;[.F913]>0);[.$N$74];[.F913]=0;" ") -> Б | H913: of:=VLOOKUP([.$B913];[.$I$71:.$L$81];4;0) -> 1
B914: 4 | C914: of:=VLOOKUP([.$B914];[.$I$71:.$J$81];2;0) -> Архангельск | D914: 92 | E914: 96134 | F914: of:=IF(ISBLANK([.E914]*[.D914]);"0";[.E914]*[.D914]) -> 8844328 | G914: of:=COM.MICROSOFT.IFS([.F914]>5000000;[.$N$72];AND([.F914]>=1000000;[.F914]<=5000000);[.$N$73];AND([.F914]<1000000;[.F914]>0);[.$N$74];[.F914]=0;" ") -> А | H914: of:=VLOOKUP([.$B914];[.$I$71:.$L$81];4;0) -> 2
B915: 8 | C915: of:=VLOOKUP([.$B915];[.$I$71:.$J$81];2;0) -> Новосибирск | D915: 44 | E915: 74104 | F915: of:=IF(ISBLANK([.E915]*[.D915]);"0";[.E915]*[.D915]) -> 3260576 | G915: of:=COM.MICROSOFT.IFS([.F915]>5000000;[.$N$72];AND([.F915]>=1000000;[.F915]<=5000000);[.$N$73];AND([.F915]<1000000;[.F915]>0);[.$N$74];[.F915]=0;" ") -> Б | H915: of:=VLOOKUP([.$B915];[.$I$71:.$L$81];4;0) -> 5
B916: 7 | C916: of:=VLOOKUP([.$B916];[.$I$71:.$J$81];2;0) -> Мурманск | D916: 74 | E916: 55543 | F916: of:=IF(ISBLANK([.E916]*[.D916]);"0";[.E916]*[.D916]) -> 4110182 | G916: of:=COM.MICROSOFT.IFS([.F916]>5000000;[.$N$72];AND([.F916]>=1000000;[.F916]<=5000000);[.$N$73];AND([.F916]<1000000;[.F916]>0);[.$N$74];[.F916]=0;" ") -> Б | H916: of:=VLOOKUP([.$B916];[.$I$71:.$L$81];4;0) -> 10
B917: 2 | C917: of:=VLOOKUP([.$B917];[.$I$71:.$J$81];2;0) -> Санкт-Петербург | D917: 68 | E917: 12486 | F917: of:=IF(ISBLANK([.E917]*[.D917]);"0";[.E917]*[.D917]) -> 849048 | G917: of:=COM.MICROSOFT.IFS([.F917]>5000000;[.$N$72];AND([.F917]>=1000000;[.F917]<=5000000);[.$N$73];AND([.F917]<1000000;[.F917]>0);[.$N$74];[.F917]=0;" ") -> В | H917: of:=VLOOKUP([.$B917];[.$I$71:.$L$81];4;0) -> 9
B918: 9 | C918: of:=VLOOKUP([.$B918];[.$I$71:.$J$81];2;0) -> Тюмень | D918: 2 | E918: 10937 | F918: of:=IF(ISBLANK([.E918]*[.D918]);"0";[.E918]*[.D918]) -> 21874 | G918: of:=COM.MICROSOFT.IFS([.F918]>5000000;[.$N$72];AND([.F918]>=1000000;[.F918]<=5000000);[.$N$73];AND([.F918]<1000000;[.F918]>0);[.$N$74];[.F918]=0;" ") -> В | H918: of:=VLOOKUP([.$B918];[.$I$71:.$L$81];4;0) -> 3
B919: 2 | C919: of:=VLOOKUP([.$B919];[.$I$71:.$J$81];2;0) -> Санкт-Петербург | D919: 48 | E919: 5548 | F919: of:=IF(ISBLANK([.E919]*[.D919]);"0";[.E919]*[.D919]) -> 266304 | G919: of:=COM.MICROSOFT.IFS([.F919]>5000000;[.$N$72];AND([.F919]>=1000000;[.F919]<=5000000);[.$N$73];AND([.F919]<1000000;[.F919]>0);[.$N$74];[.F919]=0;" ") -> В | H919: of:=VLOOKUP([.$B919];[.$I$71:.$L$81];4;0) -> 9
B920: 10 | C920: of:=VLOOKUP([.$B920];[.$I$71:.$J$81];2;0) -> Сочи | D920: 83 | E920: 70389 | F920: of:=IF(ISBLANK([.E920]*[.D920]);"0";[.E920]*[.D920]) -> 5842287 | G920: of:=COM.MICROSOFT.IFS([.F920]>5000000;[.$N$72];AND([.F920]>=1000000;[.F920]<=5000000);[.$N$73];AND([.F920]<1000000;[.F920]>0);[.$N$74];[.F920]=0;" ") -> А | H920: of:=VLOOKUP([.$B920];[.$I$71:.$L$81];4;0) -> 6
B921: 8 | C921: of:=VLOOKUP([.$B921];[.$I$71:.$J$81];2;0) -> Новосибирск | D921: 9 | E921: 70163 | F921: of:=IF(ISBLANK([.E921]*[.D921]);"0";[.E921]*[.D921]) -> 631467 | G921: of:=COM.MICROSOFT.IFS([.F921]>5000000;[.$N$72];AND([.F921]>=1000000;[.F921]<=5000000);[.$N$73];AND([.F921]<1000000;[.F921]>0);[.$N$74];[.F921]=0;" ") -> В | H921: of:=VLOOKUP([.$B921];[.$I$71:.$L$81];4;0) -> 5
B922: 5 | C922: of:=VLOOKUP([.$B922];[.$I$71:.$J$81];2;0) -> Краснодар | D922: 4 | E922: 51015 | F922: of:=IF(ISBLANK([.E922]*[.D922]);"0";[.E922]*[.D922]) -> 204060 | G922: of:=COM.MICROSOFT.IFS([.F922]>5000000;[.$N$72];AND([.F922]>=1000000;[.F922]<=5000000);[.$N$73];AND([.F922]<1000000;[.F922]>0);[.$N$74];[.F922]=0;" ") -> В | H922: of:=VLOOKUP([.$B922];[.$I$71:.$L$81];4;0) -> 4
B923: 2 | C923: of:=VLOOKUP([.$B923];[.$I$71:.$J$81];2;0) -> Санкт-Петербург | D923: 81 | E923: 62748 | F923: of:=IF(ISBLANK([.E923]*[.D923]);"0";[.E923]*[.D923]) -> 5082588 | G923: of:=COM.MICROSOFT.IFS([.F923]>5000000;[.$N$72];AND([.F923]>=1000000;[.F923]<=5000000);[.$N$73];AND([.F923]<1000000;[.F923]>0);[.$N$74];[.F923]=0;" ") -> А | H923: of:=VLOOKUP([.$B923];[.$I$71:.$L$81];4;0) -> 9
B924: 3 | C924: of:=VLOOKUP([.$B924];[.$I$71:.$J$81];2;0) -> Челябинск | D924: 82 | E924: 84248 | F924: of:=IF(ISBLANK([.E924]*[.D924]);"0";[.E924]*[.D924]) -> 6908336 | G924: of:=COM.MICROSOFT.IFS([.F924]>5000000;[.$N$72];AND([.F924]>=1000000;[.F924]<=5000000);[.$N$73];AND([.F924]<1000000;[.F924]>0);[.$N$74];[.F924]=0;" ") -> А | H924: of:=VLOOKUP([.$B924];[.$I$71:.$L$81];4;0) -> 1
B925: 9 | C925: of:=VLOOKUP([.$B925];[.$I$71:.$J$81];2;0) -> Тюмень | D925: 36 | E925: 90970 | F925: of:=IF(ISBLANK([.E925]*[.D925]);"0";[.E925]*[.D925]) -> 3274920 | G925: of:=COM.MICROSOFT.IFS([.F925]>5000000;[.$N$72];AND([.F925]>=1000000;[.F925]<=5000000);[.$N$73];AND([.F925]<1000000;[.F925]>0);[.$N$74];[.F925]=0;" ") -> Б | H925: of:=VLOOKUP([.$B925];[.$I$71:.$L$81];4;0) -> 3
B926: 6 | C926: of:=VLOOKUP([.$B926];[.$I$71:.$J$81];2;0) -> Владивосток | D926: 72 | E926: 24196 | F926: of:=IF(ISBLANK([.E926]*[.D926]);"0";[.E926]*[.D926]) -> 1742112 | G926: of:=COM.MICROSOFT.IFS([.F926]>5000000;[.$N$72];AND([.F926]>=1000000;[.F926]<=5000000);[.$N$73];AND([.F926]<1000000;[.F926]>0);[.$N$74];[.F926]=0;" ") -> Б | H926: of:=VLOOKUP([.$B926];[.$I$71:.$L$81];4;0) -> 7
B927: 6 | C927: of:=VLOOKUP([.$B927];[.$I$71:.$J$81];2;0) -> Владивосток | D927: 61 | E927: 61146 | F927: of:=IF(ISBLANK([.E927]*[.D927]);"0";[.E927]*[.D927]) -> 3729906 | G927: of:=COM.MICROSOFT.IFS([.F927]>5000000;[.$N$72];AND([.F927]>=1000000;[.F927]<=5000000);[.$N$73];AND([.F927]<1000000;[.F927]>0);[.$N$74];[.F927]=0;" ") -> Б | H927: of:=VLOOKUP([.$B927];[.$I$71:.$L$81];4;0) -> 7
B928: 7 | C928: of:=VLOOKUP([.$B928];[.$I$71:.$J$81];2;0) -> Мурманск | D928: 28 | E928: 62973 | F928: of:=IF(ISBLANK([.E928]*[.D928]);"0";[.E928]*[.D928]) -> 1763244 | G928: of:=COM.MICROSOFT.IFS([.F928]>5000000;[.$N$72];AND([.F928]>=1000000;[.F928]<=5000000);[.$N$73];AND([.F928]<1000000;[.F928]>0);[.$N$74];[.F928]=0;" ") -> Б | H928: of:=VLOOKUP([.$B928];[.$I$71:.$L$81];4;0) -> 10
B929: 9 | C929: of:=VLOOKUP([.$B929];[.$I$71:.$J$81];2;0) -> Тюмень | D929: 62 | E929: 59783 | F929: of:=IF(ISBLANK([.E929]*[.D929]);"0";[.E929]*[.D929]) -> 3706546 | G929: of:=COM.MICROSOFT.IFS([.F929]>5000000;[.$N$72];AND([.F929]>=1000000;[.F929]<=5000000);[.$N$73];AND([.F929]<1000000;[.F929]>0);[.$N$74];[.F929]=0;" ") -> Б | H929: of:=VLOOKUP([.$B929];[.$I$71:.$L$81];4;0) -> 3
B930: 7 | C930: of:=VLOOKUP([.$B930];[.$I$71:.$J$81];2;0) -> Мурманск | D930: 19 | E930: 31543 | F930: of:=IF(ISBLANK([.E930]*[.D930]);"0";[.E930]*[.D930]) -> 599317 | G930: of:=COM.MICROSOFT.IFS([.F930]>5000000;[.$N$72];AND([.F930]>=1000000;[.F930]<=5000000);[.$N$73];AND([.F930]<1000000;[.F930]>0);[.$N$74];[.F930]=0;" ") -> В | H930: of:=VLOOKUP([.$B930];[.$I$71:.$L$81];4;0) -> 10
B931: 9 | C931: of:=VLOOKUP([.$B931];[.$I$71:.$J$81];2;0) -> Тюмень | D931: 65 | E931: 25500 | F931: of:=IF(ISBLANK([.E931]*[.D931]);"0";[.E931]*[.D931]) -> 1657500 | G931: of:=COM.MICROSOFT.IFS([.F931]>5000000;[.$N$72];AND([.F931]>=1000000;[.F931]<=5000000);[.$N$73];AND([.F931]<1000000;[.F931]>0);[.$N$74];[.F931]=0;" ") -> Б | H931: of:=VLOOKUP([.$B931];[.$I$71:.$L$81];4;0) -> 3
B932: 4 | C932: of:=VLOOKUP([.$B932];[.$I$71:.$J$81];2;0) -> Архангельск | D932: 95 | E932: 37483 | F932: of:=IF(ISBLANK([.E932]*[.D932]);"0";[.E932]*[.D932]) -> 3560885 | G932: of:=COM.MICROSOFT.IFS([.F932]>5000000;[.$N$72];AND([.F932]>=1000000;[.F932]<=5000000);[.$N$73];AND([.F932]<1000000;[.F932]>0);[.$N$74];[.F932]=0;" ") -> Б | H932: of:=VLOOKUP([.$B932];[.$I$71:.$L$81];4;0) -> 2
B933: 9 | C933: of:=VLOOKUP([.$B933];[.$I$71:.$J$81];2;0) -> Тюмень | D933: 52 | E933: 63282 | F933: of:=IF(ISBLANK([.E933]*[.D933]);"0";[.E933]*[.D933]) -> 3290664 | G933: of:=COM.MICROSOFT.IFS([.F933]>5000000;[.$N$72];AND([.F933]>=1000000;[.F933]<=5000000);[.$N$73];AND([.F933]<1000000;[.F933]>0);[.$N$74];[.F933]=0;" ") -> Б | H933: of:=VLOOKUP([.$B933];[.$I$71:.$L$81];4;0) -> 3
B934: 8 | C934: of:=VLOOKUP([.$B934];[.$I$71:.$J$81];2;0) -> Новосибирск | D934: 8 | E934: 66703 | F934: of:=IF(ISBLANK([.E934]*[.D934]);"0";[.E934]*[.D934]) -> 533624 | G934: of:=COM.MICROSOFT.IFS([.F934]>5000000;[.$N$72];AND([.F934]>=1000000;[.F934]<=5000000);[.$N$73];AND([.F934]<1000000;[.F934]>0);[.$N$74];[.F934]=0;" ") -> В | H934: of:=VLOOKUP([.$B934];[.$I$71:.$L$81];4;0) -> 5
B935: 6 | C935: of:=VLOOKUP([.$B935];[.$I$71:.$J$81];2;0) -> Владивосток | D935: 47 | E935: 5799 | F935: of:=IF(ISBLANK([.E935]*[.D935]);"0";[.E935]*[.D935]) -> 272553 | G935: of:=COM.MICROSOFT.IFS([.F935]>5000000;[.$N$72];AND([.F935]>=1000000;[.F935]<=5000000);[.$N$73];AND([.F935]<1000000;[.F935]>0);[.$N$74];[.F935]=0;" ") -> В | H935: of:=VLOOKUP([.$B935];[.$I$71:.$L$81];4;0) -> 7
B936: 3 | C936: of:=VLOOKUP([.$B936];[.$I$71:.$J$81];2;0) -> Челябинск | D936: 26 | E936: 61999 | F936: of:=IF(ISBLANK([.E936]*[.D936]);"0";[.E936]*[.D936]) -> 1611974 | G936: of:=COM.MICROSOFT.IFS([.F936]>5000000;[.$N$72];AND([.F936]>=1000000;[.F936]<=5000000);[.$N$73];AND([.F936]<1000000;[.F936]>0);[.$N$74];[.F936]=0;" ") -> Б | H936: of:=VLOOKUP([.$B936];[.$I$71:.$L$81];4;0) -> 1
B937: 10 | C937: of:=VLOOKUP([.$B937];[.$I$71:.$J$81];2;0) -> Сочи | D937: 51 | E937: 19247 | F937: of:=IF(ISBLANK([.E937]*[.D937]);"0";[.E937]*[.D937]) -> 981597 | G937: of:=COM.MICROSOFT.IFS([.F937]>5000000;[.$N$72];AND([.F937]>=1000000;[.F937]<=5000000);[.$N$73];AND([.F937]<1000000;[.F937]>0);[.$N$74];[.F937]=0;" ") -> В | H937: of:=VLOOKUP([.$B937];[.$I$71:.$L$81];4;0) -> 6
B938: 2 | C938: of:=VLOOKUP([.$B938];[.$I$71:.$J$81];2;0) -> Санкт-Петербург | D938: 60 | E938: 36024 | F938: of:=IF(ISBLANK([.E938]*[.D938]);"0";[.E938]*[.D938]) -> 2161440 | G938: of:=COM.MICROSOFT.IFS([.F938]>5000000;[.$N$72];AND([.F938]>=1000000;[.F938]<=5000000);[.$N$73];AND([.F938]<1000000;[.F938]>0);[.$N$74];[.F938]=0;" ") -> Б | H938: of:=VLOOKUP([.$B938];[.$I$71:.$L$81];4;0) -> 9
B939: 4 | C939: of:=VLOOKUP([.$B939];[.$I$71:.$J$81];2;0) -> Архангельск | D939: 76 | E939: 16938 | F939: of:=IF(ISBLANK([.E939]*[.D939]);"0";[.E939]*[.D939]) -> 1287288 | G939: of:=COM.MICROSOFT.IFS([.F939]>5000000;[.$N$72];AND([.F939]>=1000000;[.F939]<=5000000);[.$N$73];AND([.F939]<1000000;[.F939]>0);[.$N$74];[.F939]=0;" ") -> Б | H939: of:=VLOOKUP([.$B939];[.$I$71:.$L$81];4;0) -> 2
B940: 8 | C940: of:=VLOOKUP([.$B940];[.$I$71:.$J$81];2;0) -> Новосибирск | D940: 23 | E940: 98023 | F940: of:=IF(ISBLANK([.E940]*[.D940]);"0";[.E940]*[.D940]) -> 2254529 | G940: of:=COM.MICROSOFT.IFS([.F940]>5000000;[.$N$72];AND([.F940]>=1000000;[.F940]<=5000000);[.$N$73];AND([.F940]<1000000;[.F940]>0);[.$N$74];[.F940]=0;" ") -> Б | H940: of:=VLOOKUP([.$B940];[.$I$71:.$L$81];4;0) -> 5
B941: 8 | C941: of:=VLOOKUP([.$B941];[.$I$71:.$J$81];2;0) -> Новосибирск | D941: 35 | E941: 24605 | F941: of:=IF(ISBLANK([.E941]*[.D941]);"0";[.E941]*[.D941]) -> 861175 | G941: of:=COM.MICROSOFT.IFS([.F941]>5000000;[.$N$72];AND([.F941]>=1000000;[.F941]<=5000000);[.$N$73];AND([.F941]<1000000;[.F941]>0);[.$N$74];[.F941]=0;" ") -> В | H941: of:=VLOOKUP([.$B941];[.$I$71:.$L$81];4;0) -> 5
B942: 7 | C942: of:=VLOOKUP([.$B942];[.$I$71:.$J$81];2;0) -> Мурманск | D942: 0 | E942: 1412 | F942: of:=IF(ISBLANK([.E942]*[.D942]);"0";[.E942]*[.D942]) -> 0 | G942: of:=COM.MICROSOFT.IFS([.F942]>5000000;[.$N$72];AND([.F942]>=1000000;[.F942]<=5000000);[.$N$73];AND([.F942]<1000000;[.F942]>0);[.$N$74];[.F942]=0;" ") ->   | H942: of:=VLOOKUP([.$B942];[.$I$71:.$L$81];4;0) -> 10
B943: 3 | C943: of:=VLOOKUP([.$B943];[.$I$71:.$J$81];2;0) -> Челябинск | D943: 97 | E943: 3138 | F943: of:=IF(ISBLANK([.E943]*[.D943]);"0";[.E943]*[.D943]) -> 304386 | G943: of:=COM.MICROSOFT.IFS([.F943]>5000000;[.$N$72];AND([.F943]>=1000000;[.F943]<=5000000);[.$N$73];AND([.F943]<1000000;[.F943]>0);[.$N$74];[.F943]=0;" ") -> В | H943: of:=VLOOKUP([.$B943];[.$I$71:.$L$81];4;0) -> 1
B944: 10 | C944: of:=VLOOKUP([.$B944];[.$I$71:.$J$81];2;0) -> Сочи | D944: 54 | E944: 22076 | F944: of:=IF(ISBLANK([.E944]*[.D944]);"0";[.E944]*[.D944]) -> 1192104 | G944: of:=COM.MICROSOFT.IFS([.F944]>5000000;[.$N$72];AND([.F944]>=1000000;[.F944]<=5000000);[.$N$73];AND([.F944]<1000000;[.F944]>0);[.$N$74];[.F944]=0;" ") -> Б | H944: of:=VLOOKUP([.$B944];[.$I$71:.$L$81];4;0) -> 6
B945: 2 | C945: of:=VLOOKUP([.$B945];[.$I$71:.$J$81];2;0) -> Санкт-Петербург | D945: 89 | E945: 35227 | F945: of:=IF(ISBLANK([.E945]*[.D945]);"0";[.E945]*[.D945]) -> 3135203 | G945: of:=COM.MICROSOFT.IFS([.F945]>5000000;[.$N$72];AND([.F945]>=1000000;[.F945]<=5000000);[.$N$73];AND([.F945]<1000000;[.F945]>0);[.$N$74];[.F945]=0;" ") -> Б | H945: of:=VLOOKUP([.$B945];[.$I$71:.$L$81];4;0) -> 9
B946: 3 | C946: of:=VLOOKUP([.$B946];[.$I$71:.$J$81];2;0) -> Челябинск | D946: 37 | E946: 51940 | F946: of:=IF(ISBLANK([.E946]*[.D946]);"0";[.E946]*[.D946]) -> 1921780 | G946: of:=COM.MICROSOFT.IFS([.F946]>5000000;[.$N$72];AND([.F946]>=1000000;[.F946]<=5000000);[.$N$73];AND([.F946]<1000000;[.F946]>0);[.$N$74];[.F946]=0;" ") -> Б | H946: of:=VLOOKUP([.$B946];[.$I$71:.$L$81];4;0) -> 1
B947: 6 | C947: of:=VLOOKUP([.$B947];[.$I$71:.$J$81];2;0) -> Владивосток | D947: 25 | E947: 25121 | F947: of:=IF(ISBLANK([.E947]*[.D947]);"0";[.E947]*[.D947]) -> 628025 | G947: of:=COM.MICROSOFT.IFS([.F947]>5000000;[.$N$72];AND([.F947]>=1000000;[.F947]<=5000000);[.$N$73];AND([.F947]<1000000;[.F947]>0);[.$N$74];[.F947]=0;" ") -> В | H947: of:=VLOOKUP([.$B947];[.$I$71:.$L$81];4;0) -> 7
B948: 7 | C948: of:=VLOOKUP([.$B948];[.$I$71:.$J$81];2;0) -> Мурманск | D948: 79 | E948: 54186 | F948: of:=IF(ISBLANK([.E948]*[.D948]);"0";[.E948]*[.D948]) -> 4280694 | G948: of:=COM.MICROSOFT.IFS([.F948]>5000000;[.$N$72];AND([.F948]>=1000000;[.F948]<=5000000);[.$N$73];AND([.F948]<1000000;[.F948]>0);[.$N$74];[.F948]=0;" ") -> Б | H948: of:=VLOOKUP([.$B948];[.$I$71:.$L$81];4;0) -> 10
B949: 2 | C949: of:=VLOOKUP([.$B949];[.$I$71:.$J$81];2;0) -> Санкт-Петербург | D949: 3 | E949: 65478 | F949: of:=IF(ISBLANK([.E949]*[.D949]);"0";[.E949]*[.D949]) -> 196434 | G949: of:=COM.MICROSOFT.IFS([.F949]>5000000;[.$N$72];AND([.F949]>=1000000;[.F949]<=5000000);[.$N$73];AND([.F949]<1000000;[.F949]>0);[.$N$74];[.F949]=0;" ") -> В | H949: of:=VLOOKUP([.$B949];[.$I$71:.$L$81];4;0) -> 9
B950: 2 | C950: of:=VLOOKUP([.$B950];[.$I$71:.$J$81];2;0) -> Санкт-Петербург | D950: 47 | E950: 2204 | F950: of:=IF(ISBLANK([.E950]*[.D950]);"0";[.E950]*[.D950]) -> 103588 | G950: of:=COM.MICROSOFT.IFS([.F950]>5000000;[.$N$72];AND([.F950]>=1000000;[.F950]<=5000000);[.$N$73];AND([.F950]<1000000;[.F950]>0);[.$N$74];[.F950]=0;" ") -> В | H950: of:=VLOOKUP([.$B950];[.$I$71:.$L$81];4;0) -> 9
B951: 4 | C951: of:=VLOOKUP([.$B951];[.$I$71:.$J$81];2;0) -> Архангельск | D951: 58 | E951: 76028 | F951: of:=IF(ISBLANK([.E951]*[.D951]);"0";[.E951]*[.D951]) -> 4409624 | G951: of:=COM.MICROSOFT.IFS([.F951]>5000000;[.$N$72];AND([.F951]>=1000000;[.F951]<=5000000);[.$N$73];AND([.F951]<1000000;[.F951]>0);[.$N$74];[.F951]=0;" ") -> Б | H951: of:=VLOOKUP([.$B951];[.$I$71:.$L$81];4;0) -> 2
B952: 2 | C952: of:=VLOOKUP([.$B952];[.$I$71:.$J$81];2;0) -> Санкт-Петербург | D952: 17 | E952: 23112 | F952: of:=IF(ISBLANK([.E952]*[.D952]);"0";[.E952]*[.D952]) -> 392904 | G952: of:=COM.MICROSOFT.IFS([.F952]>5000000;[.$N$72];AND([.F952]>=1000000;[.F952]<=5000000);[.$N$73];AND([.F952]<1000000;[.F952]>0);[.$N$74];[.F952]=0;" ") -> В | H952: of:=VLOOKUP([.$B952];[.$I$71:.$L$81];4;0) -> 9
B953: 7 | C953: of:=VLOOKUP([.$B953];[.$I$71:.$J$81];2;0) -> Мурманск | D953: 7 | E953: 16507 | F953: of:=IF(ISBLANK([.E953]*[.D953]);"0";[.E953]*[.D953]) -> 115549 | G953: of:=COM.MICROSOFT.IFS([.F953]>5000000;[.$N$72];AND([.F953]>=1000000;[.F953]<=5000000);[.$N$73];AND([.F953]<1000000;[.F953]>0);[.$N$74];[.F953]=0;" ") -> В | H953: of:=VLOOKUP([.$B953];[.$I$71:.$L$81];4;0) -> 10
B954: 7 | C954: of:=VLOOKUP([.$B954];[.$I$71:.$J$81];2;0) -> Мурманск | D954: 2 | E954: 6440 | F954: of:=IF(ISBLANK([.E954]*[.D954]);"0";[.E954]*[.D954]) -> 12880 | G954: of:=COM.MICROSOFT.IFS([.F954]>5000000;[.$N$72];AND([.F954]>=1000000;[.F954]<=5000000);[.$N$73];AND([.F954]<1000000;[.F954]>0);[.$N$74];[.F954]=0;" ") -> В | H954: of:=VLOOKUP([.$B954];[.$I$71:.$L$81];4;0) -> 10
B955: 2 | C955: of:=VLOOKUP([.$B955];[.$I$71:.$J$81];2;0) -> Санкт-Петербург | D955: 11 | E955: 21093 | F955: of:=IF(ISBLANK([.E955]*[.D955]);"0";[.E955]*[.D955]) -> 232023 | G955: of:=COM.MICROSOFT.IFS([.F955]>5000000;[.$N$72];AND([.F955]>=1000000;[.F955]<=5000000);[.$N$73];AND([.F955]<1000000;[.F955]>0);[.$N$74];[.F955]=0;" ") -> В | H955: of:=VLOOKUP([.$B955];[.$I$71:.$L$81];4;0) -> 9
B956: 3 | C956: of:=VLOOKUP([.$B956];[.$I$71:.$J$81];2;0) -> Челябинск | D956: 23 | E956: 42339 | F956: of:=IF(ISBLANK([.E956]*[.D956]);"0";[.E956]*[.D956]) -> 973797 | G956: of:=COM.MICROSOFT.IFS([.F956]>5000000;[.$N$72];AND([.F956]>=1000000;[.F956]<=5000000);[.$N$73];AND([.F956]<1000000;[.F956]>0);[.$N$74];[.F956]=0;" ") -> В | H956: of:=VLOOKUP([.$B956];[.$I$71:.$L$81];4;0) -> 1
B957: 3 | C957: of:=VLOOKUP([.$B957];[.$I$71:.$J$81];2;0) -> Челябинск | D957: 17 | E957: 24302 | F957: of:=IF(ISBLANK([.E957]*[.D957]);"0";[.E957]*[.D957]) -> 413134 | G957: of:=COM.MICROSOFT.IFS([.F957]>5000000;[.$N$72];AND([.F957]>=1000000;[.F957]<=5000000);[.$N$73];AND([.F957]<1000000;[.F957]>0);[.$N$74];[.F957]=0;" ") -> В | H957: of:=VLOOKUP([.$B957];[.$I$71:.$L$81];4;0) -> 1
B958: 3 | C958: of:=VLOOKUP([.$B958];[.$I$71:.$J$81];2;0) -> Челябинск | D958: 13 | E958: 9378 | F958: of:=IF(ISBLANK([.E958]*[.D958]);"0";[.E958]*[.D958]) -> 121914 | G958: of:=COM.MICROSOFT.IFS([.F958]>5000000;[.$N$72];AND([.F958]>=1000000;[.F958]<=5000000);[.$N$73];AND([.F958]<1000000;[.F958]>0);[.$N$74];[.F958]=0;" ") -> В | H958: of:=VLOOKUP([.$B958];[.$I$71:.$L$81];4;0) -> 1
B959: 6 | C959: of:=VLOOKUP([.$B959];[.$I$71:.$J$81];2;0) -> Владивосток | D959: 87 | E959: 57068 | F959: of:=IF(ISBLANK([.E959]*[.D959]);"0";[.E959]*[.D959]) -> 4964916 | G959: of:=COM.MICROSOFT.IFS([.F959]>5000000;[.$N$72];AND([.F959]>=1000000;[.F959]<=5000000);[.$N$73];AND([.F959]<1000000;[.F959]>0);[.$N$74];[.F959]=0;" ") -> Б | H959: of:=VLOOKUP([.$B959];[.$I$71:.$L$81];4;0) -> 7
B960: 1 | C960: of:=VLOOKUP([.$B960];[.$I$71:.$J$81];2;0) -> Москва | D960: 99 | E960: 22807 | F960: of:=IF(ISBLANK([.E960]*[.D960]);"0";[.E960]*[.D960]) -> 2257893 | G960: of:=COM.MICROSOFT.IFS([.F960]>5000000;[.$N$72];AND([.F960]>=1000000;[.F960]<=5000000);[.$N$73];AND([.F960]<1000000;[.F960]>0);[.$N$74];[.F960]=0;" ") -> Б | H960: of:=VLOOKUP([.$B960];[.$I$71:.$L$81];4;0) -> 8
B961: 6 | C961: of:=VLOOKUP([.$B961];[.$I$71:.$J$81];2;0) -> Владивосток | D961: 10 | E961: 40479 | F961: of:=IF(ISBLANK([.E961]*[.D961]);"0";[.E961]*[.D961]) -> 404790 | G961: of:=COM.MICROSOFT.IFS([.F961]>5000000;[.$N$72];AND([.F961]>=1000000;[.F961]<=5000000);[.$N$73];AND([.F961]<1000000;[.F961]>0);[.$N$74];[.F961]=0;" ") -> В | H961: of:=VLOOKUP([.$B961];[.$I$71:.$L$81];4;0) -> 7
B962: 8 | C962: of:=VLOOKUP([.$B962];[.$I$71:.$J$81];2;0) -> Новосибирск | D962: 98 | E962: 13851 | F962: of:=IF(ISBLANK([.E962]*[.D962]);"0";[.E962]*[.D962]) -> 1357398 | G962: of:=COM.MICROSOFT.IFS([.F962]>5000000;[.$N$72];AND([.F962]>=1000000;[.F962]<=5000000);[.$N$73];AND([.F962]<1000000;[.F962]>0);[.$N$74];[.F962]=0;" ") -> Б | H962: of:=VLOOKUP([.$B962];[.$I$71:.$L$81];4;0) -> 5
B963: 2 | C963: of:=VLOOKUP([.$B963];[.$I$71:.$J$81];2;0) -> Санкт-Петербург | D963: 60 | E963: 8385 | F963: of:=IF(ISBLANK([.E963]*[.D963]);"0";[.E963]*[.D963]) -> 503100 | G963: of:=COM.MICROSOFT.IFS([.F963]>5000000;[.$N$72];AND([.F963]>=1000000;[.F963]<=5000000);[.$N$73];AND([.F963]<1000000;[.F963]>0);[.$N$74];[.F963]=0;" ") -> В | H963: of:=VLOOKUP([.$B963];[.$I$71:.$L$81];4;0) -> 9
B964: 3 | C964: of:=VLOOKUP([.$B964];[.$I$71:.$J$81];2;0) -> Челябинск | D964: 21 | E964: 2396 | F964: of:=IF(ISBLANK([.E964]*[.D964]);"0";[.E964]*[.D964]) -> 50316 | G964: of:=COM.MICROSOFT.IFS([.F964]>5000000;[.$N$72];AND([.F964]>=1000000;[.F964]<=5000000);[.$N$73];AND([.F964]<1000000;[.F964]>0);[.$N$74];[.F964]=0;" ") -> В | H964: of:=VLOOKUP([.$B964];[.$I$71:.$L$81];4;0) -> 1
B965: 10 | C965: of:=VLOOKUP([.$B965];[.$I$71:.$J$81];2;0) -> Сочи | D965: 34 | E965: 31836 | F965: of:=IF(ISBLANK([.E965]*[.D965]);"0";[.E965]*[.D965]) -> 1082424 | G965: of:=COM.MICROSOFT.IFS([.F965]>5000000;[.$N$72];AND([.F965]>=1000000;[.F965]<=5000000);[.$N$73];AND([.F965]<1000000;[.F965]>0);[.$N$74];[.F965]=0;" ") -> Б | H965: of:=VLOOKUP([.$B965];[.$I$71:.$L$81];4;0) -> 6
B966: 5 | C966: of:=VLOOKUP([.$B966];[.$I$71:.$J$81];2;0) -> Краснодар | D966: 78 | E966: 76157 | F966: of:=IF(ISBLANK([.E966]*[.D966]);"0";[.E966]*[.D966]) -> 5940246 | G966: of:=COM.MICROSOFT.IFS([.F966]>5000000;[.$N$72];AND([.F966]>=1000000;[.F966]<=5000000);[.$N$73];AND([.F966]<1000000;[.F966]>0);[.$N$74];[.F966]=0;" ") -> А | H966: of:=VLOOKUP([.$B966];[.$I$71:.$L$81];4;0) -> 4
B967: 4 | C967: of:=VLOOKUP([.$B967];[.$I$71:.$J$81];2;0) -> Архангельск | D967: 97 | E967: 34090 | F967: of:=IF(ISBLANK([.E967]*[.D967]);"0";[.E967]*[.D967]) -> 3306730 | G967: of:=COM.MICROSOFT.IFS([.F967]>5000000;[.$N$72];AND([.F967]>=1000000;[.F967]<=5000000);[.$N$73];AND([.F967]<1000000;[.F967]>0);[.$N$74];[.F967]=0;" ") -> Б | H967: of:=VLOOKUP([.$B967];[.$I$71:.$L$81];4;0) -> 2
B968: 1 | C968: of:=VLOOKUP([.$B968];[.$I$71:.$J$81];2;0) -> Москва | D968: 7 | E968: 5162 | F968: of:=IF(ISBLANK([.E968]*[.D968]);"0";[.E968]*[.D968]) -> 36134 | G968: of:=COM.MICROSOFT.IFS([.F968]>5000000;[.$N$72];AND([.F968]>=1000000;[.F968]<=5000000);[.$N$73];AND([.F968]<1000000;[.F968]>0);[.$N$74];[.F968]=0;" ") -> В | H968: of:=VLOOKUP([.$B968];[.$I$71:.$L$81];4;0) -> 8
B969: 1 | C969: of:=VLOOKUP([.$B969];[.$I$71:.$J$81];2;0) -> Москва | D969: 22 | E969: 6644 | F969: of:=IF(ISBLANK([.E969]*[.D969]);"0";[.E969]*[.D969]) -> 146168 | G969: of:=COM.MICROSOFT.IFS([.F969]>5000000;[.$N$72];AND([.F969]>=1000000;[.F969]<=5000000);[.$N$73];AND([.F969]<1000000;[.F969]>0);[.$N$74];[.F969]=0;" ") -> В | H969: of:=VLOOKUP([.$B969];[.$I$71:.$L$81];4;0) -> 8
B970: 4 | C970: of:=VLOOKUP([.$B970];[.$I$71:.$J$81];2;0) -> Архангельск | D970: 1 | E970: 29167 | F970: of:=IF(ISBLANK([.E970]*[.D970]);"0";[.E970]*[.D970]) -> 29167 | G970: of:=COM.MICROSOFT.IFS([.F970]>5000000;[.$N$72];AND([.F970]>=1000000;[.F970]<=5000000);[.$N$73];AND([.F970]<1000000;[.F970]>0);[.$N$74];[.F970]=0;" ") -> В | H970: of:=VLOOKUP([.$B970];[.$I$71:.$L$81];4;0) -> 2
B971: 4 | C971: of:=VLOOKUP([.$B971];[.$I$71:.$J$81];2;0) -> Архангельск | D971: 85 | E971: 72508 | F971: of:=IF(ISBLANK([.E971]*[.D971]);"0";[.E971]*[.D971]) -> 6163180 | G971: of:=COM.MICROSOFT.IFS([.F971]>5000000;[.$N$72];AND([.F971]>=1000000;[.F971]<=5000000);[.$N$73];AND([.F971]<1000000;[.F971]>0);[.$N$74];[.F971]=0;" ") -> А | H971: of:=VLOOKUP([.$B971];[.$I$71:.$L$81];4;0) -> 2
B972: 6 | C972: of:=VLOOKUP([.$B972];[.$I$71:.$J$81];2;0) -> Владивосток | D972: 90 | E972: 24319 | F972: of:=IF(ISBLANK([.E972]*[.D972]);"0";[.E972]*[.D972]) -> 2188710 | G972: of:=COM.MICROSOFT.IFS([.F972]>5000000;[.$N$72];AND([.F972]>=1000000;[.F972]<=5000000);[.$N$73];AND([.F972]<1000000;[.F972]>0);[.$N$74];[.F972]=0;" ") -> Б | H972: of:=VLOOKUP([.$B972];[.$I$71:.$L$81];4;0) -> 7
B973: 9 | C973: of:=VLOOKUP([.$B973];[.$I$71:.$J$81];2;0) -> Тюмень | D973: 56 | E973: 65699 | F973: of:=IF(ISBLANK([.E973]*[.D973]);"0";[.E973]*[.D973]) -> 3679144 | G973: of:=COM.MICROSOFT.IFS([.F973]>5000000;[.$N$72];AND([.F973]>=1000000;[.F973]<=5000000);[.$N$73];AND([.F973]<1000000;[.F973]>0);[.$N$74];[.F973]=0;" ") -> Б | H973: of:=VLOOKUP([.$B973];[.$I$71:.$L$81];4;0) -> 3
B974: 8 | C974: of:=VLOOKUP([.$B974];[.$I$71:.$J$81];2;0) -> Новосибирск | D974: 85 | E974: 22184 | F974: of:=IF(ISBLANK([.E974]*[.D974]);"0";[.E974]*[.D974]) -> 1885640 | G974: of:=COM.MICROSOFT.IFS([.F974]>5000000;[.$N$72];AND([.F974]>=1000000;[.F974]<=5000000);[.$N$73];AND([.F974]<1000000;[.F974]>0);[.$N$74];[.F974]=0;" ") -> Б | H974: of:=VLOOKUP([.$B974];[.$I$71:.$L$81];4;0) -> 5
B975: 1 | C975: of:=VLOOKUP([.$B975];[.$I$71:.$J$81];2;0) -> Москва | D975: 8 | E975: 3664 | F975: of:=IF(ISBLANK([.E975]*[.D975]);"0";[.E975]*[.D975]) -> 29312 | G975: of:=COM.MICROSOFT.IFS([.F975]>5000000;[.$N$72];AND([.F975]>=1000000;[.F975]<=5000000);[.$N$73];AND([.F975]<1000000;[.F975]>0);[.$N$74];[.F975]=0;" ") -> В | H975: of:=VLOOKUP([.$B975];[.$I$71:.$L$81];4;0) -> 8
B976: 4 | C976: of:=VLOOKUP([.$B976];[.$I$71:.$J$81];2;0) -> Архангельск | D976: 28 | E976: 29973 | F976: of:=IF(ISBLANK([.E976]*[.D976]);"0";[.E976]*[.D976]) -> 839244 | G976: of:=COM.MICROSOFT.IFS([.F976]>5000000;[.$N$72];AND([.F976]>=1000000;[.F976]<=5000000);[.$N$73];AND([.F976]<1000000;[.F976]>0);[.$N$74];[.F976]=0;" ") -> В | H976: of:=VLOOKUP([.$B976];[.$I$71:.$L$81];4;0) -> 2
B977: 10 | C977: of:=VLOOKUP([.$B977];[.$I$71:.$J$81];2;0) -> Сочи | D977: 35 | E977: 82113 | F977: of:=IF(ISBLANK([.E977]*[.D977]);"0";[.E977]*[.D977]) -> 2873955 | G977: of:=COM.MICROSOFT.IFS([.F977]>5000000;[.$N$72];AND([.F977]>=1000000;[.F977]<=5000000);[.$N$73];AND([.F977]<1000000;[.F977]>0);[.$N$74];[.F977]=0;" ") -> Б | H977: of:=VLOOKUP([.$B977];[.$I$71:.$L$81];4;0) -> 6
B978: 5 | C978: of:=VLOOKUP([.$B978];[.$I$71:.$J$81];2;0) -> Краснодар | D978: 83 | E978: 95556 | F978: of:=IF(ISBLANK([.E978]*[.D978]);"0";[.E978]*[.D978]) -> 7931148 | G978: of:=COM.MICROSOFT.IFS([.F978]>5000000;[.$N$72];AND([.F978]>=1000000;[.F978]<=5000000);[.$N$73];AND([.F978]<1000000;[.F978]>0);[.$N$74];[.F978]=0;" ") -> А | H978: of:=VLOOKUP([.$B978];[.$I$71:.$L$81];4;0) -> 4
B979: 10 | C979: of:=VLOOKUP([.$B979];[.$I$71:.$J$81];2;0) -> Сочи | D979: 29 | E979: 34460 | F979: of:=IF(ISBLANK([.E979]*[.D979]);"0";[.E979]*[.D979]) -> 999340 | G979: of:=COM.MICROSOFT.IFS([.F979]>5000000;[.$N$72];AND([.F979]>=1000000;[.F979]<=5000000);[.$N$73];AND([.F979]<1000000;[.F979]>0);[.$N$74];[.F979]=0;" ") -> В | H979: of:=VLOOKUP([.$B979];[.$I$71:.$L$81];4;0) -> 6
B980: 3 | C980: of:=VLOOKUP([.$B980];[.$I$71:.$J$81];2;0) -> Челябинск | D980: 44 | E980: 1612 | F980: of:=IF(ISBLANK([.E980]*[.D980]);"0";[.E980]*[.D980]) -> 70928 | G980: of:=COM.MICROSOFT.IFS([.F980]>5000000;[.$N$72];AND([.F980]>=1000000;[.F980]<=5000000);[.$N$73];AND([.F980]<1000000;[.F980]>0);[.$N$74];[.F980]=0;" ") -> В | H980: of:=VLOOKUP([.$B980];[.$I$71:.$L$81];4;0) -> 1
B981: 4 | C981: of:=VLOOKUP([.$B981];[.$I$71:.$J$81];2;0) -> Архангельск | D981: 82 | E981: 98868 | F981: of:=IF(ISBLANK([.E981]*[.D981]);"0";[.E981]*[.D981]) -> 8107176 | G981: of:=COM.MICROSOFT.IFS([.F981]>5000000;[.$N$72];AND([.F981]>=1000000;[.F981]<=5000000);[.$N$73];AND([.F981]<1000000;[.F981]>0);[.$N$74];[.F981]=0;" ") -> А | H981: of:=VLOOKUP([.$B981];[.$I$71:.$L$81];4;0) -> 2
B982: 3 | C982: of:=VLOOKUP([.$B982];[.$I$71:.$J$81];2;0) -> Челябинск | D982: 89 | E982: 77027 | F982: of:=IF(ISBLANK([.E982]*[.D982]);"0";[.E982]*[.D982]) -> 6855403 | G982: of:=COM.MICROSOFT.IFS([.F982]>5000000;[.$N$72];AND([.F982]>=1000000;[.F982]<=5000000);[.$N$73];AND([.F982]<1000000;[.F982]>0);[.$N$74];[.F982]=0;" ") -> А | H982: of:=VLOOKUP([.$B982];[.$I$71:.$L$81];4;0) -> 1
B983: 9 | C983: of:=VLOOKUP([.$B983];[.$I$71:.$J$81];2;0) -> Тюмень | D983: 2 | E983: 19591 | F983: of:=IF(ISBLANK([.E983]*[.D983]);"0";[.E983]*[.D983]) -> 39182 | G983: of:=COM.MICROSOFT.IFS([.F983]>5000000;[.$N$72];AND([.F983]>=1000000;[.F983]<=5000000);[.$N$73];AND([.F983]<1000000;[.F983]>0);[.$N$74];[.F983]=0;" ") -> В | H983: of:=VLOOKUP([.$B983];[.$I$71:.$L$81];4;0) -> 3
B984: 5 | C984: of:=VLOOKUP([.$B984];[.$I$71:.$J$81];2;0) -> Краснодар | D984: 74 | E984: 84334 | F984: of:=IF(ISBLANK([.E984]*[.D984]);"0";[.E984]*[.D984]) -> 6240716 | G984: of:=COM.MICROSOFT.IFS([.F984]>5000000;[.$N$72];AND([.F984]>=1000000;[.F984]<=5000000);[.$N$73];AND([.F984]<1000000;[.F984]>0);[.$N$74];[.F984]=0;" ") -> А | H984: of:=VLOOKUP([.$B984];[.$I$71:.$L$81];4;0) -> 4
B985: 6 | C985: of:=VLOOKUP([.$B985];[.$I$71:.$J$81];2;0) -> Владивосток | D985: 65 | E985: 58106 | F985: of:=IF(ISBLANK([.E985]*[.D985]);"0";[.E985]*[.D985]) -> 3776890 | G985: of:=COM.MICROSOFT.IFS([.F985]>5000000;[.$N$72];AND([.F985]>=1000000;[.F985]<=5000000);[.$N$73];AND([.F985]<1000000;[.F985]>0);[.$N$74];[.F985]=0;" ") -> Б | H985: of:=VLOOKUP([.$B985];[.$I$71:.$L$81];4;0) -> 7
B986: 1 | C986: of:=VLOOKUP([.$B986];[.$I$71:.$J$81];2;0) -> Москва | D986: 49 | E986: 96856 | F986: of:=IF(ISBLANK([.E986]*[.D986]);"0";[.E986]*[.D986]) -> 4745944 | G986: of:=COM.MICROSOFT.IFS([.F986]>5000000;[.$N$72];AND([.F986]>=1000000;[.F986]<=5000000);[.$N$73];AND([.F986]<1000000;[.F986]>0);[.$N$74];[.F986]=0;" ") -> Б | H986: of:=VLOOKUP([.$B986];[.$I$71:.$L$81];4;0) -> 8
B987: 9 | C987: of:=VLOOKUP([.$B987];[.$I$71:.$J$81];2;0) -> Тюмень | D987: 19 | E987: 94224 | F987: of:=IF(ISBLANK([.E987]*[.D987]);"0";[.E987]*[.D987]) -> 1790256 | G987: of:=COM.MICROSOFT.IFS([.F987]>5000000;[.$N$72];AND([.F987]>=1000000;[.F987]<=5000000);[.$N$73];AND([.F987]<1000000;[.F987]>0);[.$N$74];[.F987]=0;" ") -> Б | H987: of:=VLOOKUP([.$B987];[.$I$71:.$L$81];4;0) -> 3
B988: 9 | C988: of:=VLOOKUP([.$B988];[.$I$71:.$J$81];2;0) -> Тюмень | D988: 55 | E988: 76832 | F988: of:=IF(ISBLANK([.E988]*[.D988]);"0";[.E988]*[.D988]) -> 4225760 | G988: of:=COM.MICROSOFT.IFS([.F988]>5000000;[.$N$72];AND([.F988]>=1000000;[.F988]<=5000000);[.$N$73];AND([.F988]<1000000;[.F988]>0);[.$N$74];[.F988]=0;" ") -> Б | H988: of:=VLOOKUP([.$B988];[.$I$71:.$L$81];4;0) -> 3
B989: 4 | C989: of:=VLOOKUP([.$B989];[.$I$71:.$J$81];2;0) -> Архангельск | D989: 53 | E989: 50181 | F989: of:=IF(ISBLANK([.E989]*[.D989]);"0";[.E989]*[.D989]) -> 2659593 | G989: of:=COM.MICROSOFT.IFS([.F989]>5000000;[.$N$72];AND([.F989]>=1000000;[.F989]<=5000000);[.$N$73];AND([.F989]<1000000;[.F989]>0);[.$N$74];[.F989]=0;" ") -> Б | H989: of:=VLOOKUP([.$B989];[.$I$71:.$L$81];4;0) -> 2
B990: 10 | C990: of:=VLOOKUP([.$B990];[.$I$71:.$J$81];2;0) -> Сочи | D990: 12 | E990: 38670 | F990: of:=IF(ISBLANK([.E990]*[.D990]);"0";[.E990]*[.D990]) -> 464040 | G990: of:=COM.MICROSOFT.IFS([.F990]>5000000;[.$N$72];AND([.F990]>=1000000;[.F990]<=5000000);[.$N$73];AND([.F990]<1000000;[.F990]>0);[.$N$74];[.F990]=0;" ") -> В | H990: of:=VLOOKUP([.$B990];[.$I$71:.$L$81];4;0) -> 6
B991: 7 | C991: of:=VLOOKUP([.$B991];[.$I$71:.$J$81];2;0) -> Мурманск | D991: 66 | E991: 44409 | F991: of:=IF(ISBLANK([.E991]*[.D991]);"0";[.E991]*[.D991]) -> 2930994 | G991: of:=COM.MICROSOFT.IFS([.F991]>5000000;[.$N$72];AND([.F991]>=1000000;[.F991]<=5000000);[.$N$73];AND([.F991]<1000000;[.F991]>0);[.$N$74];[.F991]=0;" ") -> Б | H991: of:=VLOOKUP([.$B991];[.$I$71:.$L$81];4;0) -> 10
B992: 5 | C992: of:=VLOOKUP([.$B992];[.$I$71:.$J$81];2;0) -> Краснодар | D992: 32 | E992: 33133 | F992: of:=IF(ISBLANK([.E992]*[.D992]);"0";[.E992]*[.D992]) -> 1060256 | G992: of:=COM.MICROSOFT.IFS([.F992]>5000000;[.$N$72];AND([.F992]>=1000000;[.F992]<=5000000);[.$N$73];AND([.F992]<1000000;[.F992]>0);[.$N$74];[.F992]=0;" ") -> Б | H992: of:=VLOOKUP([.$B992];[.$I$71:.$L$81];4;0) -> 4
B993: 5 | C993: of:=VLOOKUP([.$B993];[.$I$71:.$J$81];2;0) -> Краснодар | D993: 94 | E993: 92453 | F993: of:=IF(ISBLANK([.E993]*[.D993]);"0";[.E993]*[.D993]) -> 8690582 | G993: of:=COM.MICROSOFT.IFS([.F993]>5000000;[.$N$72];AND([.F993]>=1000000;[.F993]<=5000000);[.$N$73];AND([.F993]<1000000;[.F993]>0);[.$N$74];[.F993]=0;" ") -> А | H993: of:=VLOOKUP([.$B993];[.$I$71:.$L$81];4;0) -> 4
B994: 3 | C994: of:=VLOOKUP([.$B994];[.$I$71:.$J$81];2;0) -> Челябинск | D994: 98 | E994: 5078 | F994: of:=IF(ISBLANK([.E994]*[.D994]);"0";[.E994]*[.D994]) -> 497644 | G994: of:=COM.MICROSOFT.IFS([.F994]>5000000;[.$N$72];AND([.F994]>=1000000;[.F994]<=5000000);[.$N$73];AND([.F994]<1000000;[.F994]>0);[.$N$74];[.F994]=0;" ") -> В | H994: of:=VLOOKUP([.$B994];[.$I$71:.$L$81];4;0) -> 1
B995: 5 | C995: of:=VLOOKUP([.$B995];[.$I$71:.$J$81];2;0) -> Краснодар | D995: 16 | E995: 88264 | F995: of:=IF(ISBLANK([.E995]*[.D995]);"0";[.E995]*[.D995]) -> 1412224 | G995: of:=COM.MICROSOFT.IFS([.F995]>5000000;[.$N$72];AND([.F995]>=1000000;[.F995]<=5000000);[.$N$73];AND([.F995]<1000000;[.F995]>0);[.$N$74];[.F995]=0;" ") -> Б | H995: of:=VLOOKUP([.$B995];[.$I$71:.$L$81];4;0) -> 4
B996: 8 | C996: of:=VLOOKUP([.$B996];[.$I$71:.$J$81];2;0) -> Новосибирск | D996: 92 | E996: 97079 | F996: of:=IF(ISBLANK([.E996]*[.D996]);"0";[.E996]*[.D996]) -> 8931268 | G996: of:=COM.MICROSOFT.IFS([.F996]>5000000;[.$N$72];AND([.F996]>=1000000;[.F996]<=5000000);[.$N$73];AND([.F996]<1000000;[.F996]>0);[.$N$74];[.F996]=0;" ") -> А | H996: of:=VLOOKUP([.$B996];[.$I$71:.$L$81];4;0) -> 5
B997: 7 | C997: of:=VLOOKUP([.$B997];[.$I$71:.$J$81];2;0) -> Мурманск | D997: 9 | E997: 31834 | F997: of:=IF(ISBLANK([.E997]*[.D997]);"0";[.E997]*[.D997]) -> 286506 | G997: of:=COM.MICROSOFT.IFS([.F997]>5000000;[.$N$72];AND([.F997]>=1000000;[.F997]<=5000000);[.$N$73];AND([.F997]<1000000;[.F997]>0);[.$N$74];[.F997]=0;" ") -> В | H997: of:=VLOOKUP([.$B997];[.$I$71:.$L$81];4;0) -> 10
B998: 6 | C998: of:=VLOOKUP([.$B998];[.$I$71:.$J$81];2;0) -> Владивосток | D998: 90 | E998: 16026 | F998: of:=IF(ISBLANK([.E998]*[.D998]);"0";[.E998]*[.D998]) -> 1442340 | G998: of:=COM.MICROSOFT.IFS([.F998]>5000000;[.$N$72];AND([.F998]>=1000000;[.F998]<=5000000);[.$N$73];AND([.F998]<1000000;[.F998]>0);[.$N$74];[.F998]=0;" ") -> Б | H998: of:=VLOOKUP([.$B998];[.$I$71:.$L$81];4;0) -> 7
B999: 2 | C999: of:=VLOOKUP([.$B999];[.$I$71:.$J$81];2;0) -> Санкт-Петербург | D999: 43 | E999: 97887 | F999: of:=IF(ISBLANK([.E999]*[.D999]);"0";[.E999]*[.D999]) -> 4209141 | G999: of:=COM.MICROSOFT.IFS([.F999]>5000000;[.$N$72];AND([.F999]>=1000000;[.F999]<=5000000);[.$N$73];AND([.F999]<1000000;[.F999]>0);[.$N$74];[.F999]=0;" ") -> Б | H999: of:=VLOOKUP([.$B999];[.$I$71:.$L$81];4;0) -> 9
B1000: 1 | C1000: of:=VLOOKUP([.$B1000];[.$I$71:.$J$81];2;0) -> Москва | D1000: 18 | E1000: 64560 | F1000: of:=IF(ISBLANK([.E1000]*[.D1000]);"0";[.E1000]*[.D1000]) -> 1162080 | G1000: of:=COM.MICROSOFT.IFS([.F1000]>5000000;[.$N$72];AND([.F1000]>=1000000;[.F1000]<=5000000);[.$N$73];AND([.F1000]<1000000;[.F1000]>0);[.$N$74];[.F1000]=0;" ") -> Б | H1000: of:=VLOOKUP([.$B1000];[.$I$71:.$L$81];4;0) -> 8
B1001: 9 | C1001: of:=VLOOKUP([.$B1001];[.$I$71:.$J$81];2;0) -> Тюмень | D1001: 28 | E1001: 66092 | F1001: of:=IF(ISBLANK([.E1001]*[.D1001]);"0";[.E1001]*[.D1001]) -> 1850576 | G1001: of:=COM.MICROSOFT.IFS([.F1001]>5000000;[.$N$72];AND([.F1001]>=1000000;[.F1001]<=5000000);[.$N$73];AND([.F1001]<1000000;[.F1001]>0);[.$N$74];[.F1001]=0;" ") -> Б | H1001: of:=VLOOKUP([.$B1001];[.$I$71:.$L$81];4;0) -> 3
B1002: 6 | C1002: of:=VLOOKUP([.$B1002];[.$I$71:.$J$81];2;0) -> Владивосток | D1002: 63 | E1002: 28908 | F1002: of:=IF(ISBLANK([.E1002]*[.D1002]);"0";[.E1002]*[.D1002]) -> 1821204 | G1002: of:=COM.MICROSOFT.IFS([.F1002]>5000000;[.$N$72];AND([.F1002]>=1000000;[.F1002]<=5000000);[.$N$73];AND([.F1002]<1000000;[.F1002]>0);[.$N$74];[.F1002]=0;" ") -> Б | H1002: of:=VLOOKUP([.$B1002];[.$I$71:.$L$81];4;0) -> 7
B1003: 9 | C1003: of:=VLOOKUP([.$B1003];[.$I$71:.$J$81];2;0) -> Тюмень | D1003: 62 | E1003: 34032 | F1003: of:=IF(ISBLANK([.E1003]*[.D1003]);"0";[.E1003]*[.D1003]) -> 2109984 | G1003: of:=COM.MICROSOFT.IFS([.F1003]>5000000;[.$N$72];AND([.F1003]>=1000000;[.F1003]<=5000000);[.$N$73];AND([.F1003]<1000000;[.F1003]>0);[.$N$74];[.F1003]=0;" ") -> Б | H1003: of:=VLOOKUP([.$B1003];[.$I$71:.$L$81];4;0) -> 3
B1004: 3 | C1004: of:=VLOOKUP([.$B1004];[.$I$71:.$J$81];2;0) -> Челябинск | D1004: 78 | E1004: 59501 | F1004: of:=IF(ISBLANK([.E1004]*[.D1004]);"0";[.E1004]*[.D1004]) -> 4641078 | G1004: of:=COM.MICROSOFT.IFS([.F1004]>5000000;[.$N$72];AND([.F1004]>=1000000;[.F1004]<=5000000);[.$N$73];AND([.F1004]<1000000;[.F1004]>0);[.$N$74];[.F1004]=0;" ") -> Б | H1004: of:=VLOOKUP([.$B1004];[.$I$71:.$L$81];4;0) -> 1
B1005: 8 | C1005: of:=VLOOKUP([.$B1005];[.$I$71:.$J$81];2;0) -> Новосибирск | D1005: 34 | E1005: 2885 | F1005: of:=IF(ISBLANK([.E1005]*[.D1005]);"0";[.E1005]*[.D1005]) -> 98090 | G1005: of:=COM.MICROSOFT.IFS([.F1005]>5000000;[.$N$72];AND([.F1005]>=1000000;[.F1005]<=5000000);[.$N$73];AND([.F1005]<1000000;[.F1005]>0);[.$N$74];[.F1005]=0;" ") -> В | H1005: of:=VLOOKUP([.$B1005];[.$I$71:.$L$81];4;0) -> 5
B1006: 8 | C1006: of:=VLOOKUP([.$B1006];[.$I$71:.$J$81];2;0) -> Новосибирск | D1006: 20 | E1006: 82426 | F1006: of:=IF(ISBLANK([.E1006]*[.D1006]);"0";[.E1006]*[.D1006]) -> 1648520 | G1006: of:=COM.MICROSOFT.IFS([.F1006]>5000000;[.$N$72];AND([.F1006]>=1000000;[.F1006]<=5000000);[.$N$73];AND([.F1006]<1000000;[.F1006]>0);[.$N$74];[.F1006]=0;" ") -> Б | H1006: of:=VLOOKUP([.$B1006];[.$I$71:.$L$81];4;0) -> 5
B1007: 2 | C1007: of:=VLOOKUP([.$B1007];[.$I$71:.$J$81];2;0) -> Санкт-Петербург | D1007: 88 | E1007: 9531 | F1007: of:=IF(ISBLANK([.E1007]*[.D1007]);"0";[.E1007]*[.D1007]) -> 838728 | G1007: of:=COM.MICROSOFT.IFS([.F1007]>5000000;[.$N$72];AND([.F1007]>=1000000;[.F1007]<=5000000);[.$N$73];AND([.F1007]<1000000;[.F1007]>0);[.$N$74];[.F1007]=0;" ") -> В | H1007: of:=VLOOKUP([.$B1007];[.$I$71:.$L$81];4;0) -> 9
B1008: 4 | C1008: of:=VLOOKUP([.$B1008];[.$I$71:.$J$81];2;0) -> Архангельск | D1008: 24 | E1008: 46596 | F1008: of:=IF(ISBLANK([.E1008]*[.D1008]);"0";[.E1008]*[.D1008]) -> 1118304 | G1008: of:=COM.MICROSOFT.IFS([.F1008]>5000000;[.$N$72];AND([.F1008]>=1000000;[.F1008]<=5000000);[.$N$73];AND([.F1008]<1000000;[.F1008]>0);[.$N$74];[.F1008]=0;" ") -> Б | H1008: of:=VLOOKUP([.$B1008];[.$I$71:.$L$81];4;0) -> 2
B1009: 4 | C1009: of:=VLOOKUP([.$B1009];[.$I$71:.$J$81];2;0) -> Архангельск | D1009: 43 | E1009: 28572 | F1009: of:=IF(ISBLANK([.E1009]*[.D1009]);"0";[.E1009]*[.D1009]) -> 1228596 | G1009: of:=COM.MICROSOFT.IFS([.F1009]>5000000;[.$N$72];AND([.F1009]>=1000000;[.F1009]<=5000000);[.$N$73];AND([.F1009]<1000000;[.F1009]>0);[.$N$74];[.F1009]=0;" ") -> Б | H1009: of:=VLOOKUP([.$B1009];[.$I$71:.$L$81];4;0) -> 2
B1010: 3 | C1010: of:=VLOOKUP([.$B1010];[.$I$71:.$J$81];2;0) -> Челябинск | D1010: 71 | E1010: 69199 | F1010: of:=IF(ISBLANK([.E1010]*[.D1010]);"0";[.E1010]*[.D1010]) -> 4913129 | G1010: of:=COM.MICROSOFT.IFS([.F1010]>5000000;[.$N$72];AND([.F1010]>=1000000;[.F1010]<=5000000);[.$N$73];AND([.F1010]<1000000;[.F1010]>0);[.$N$74];[.F1010]=0;" ") -> Б | H1010: of:=VLOOKUP([.$B1010];[.$I$71:.$L$81];4;0) -> 1
B1011: 6 | C1011: of:=VLOOKUP([.$B1011];[.$I$71:.$J$81];2;0) -> Владивосток | D1011: 32 | E1011: 80465 | F1011: of:=IF(ISBLANK([.E1011]*[.D1011]);"0";[.E1011]*[.D1011]) -> 2574880 | G1011: of:=COM.MICROSOFT.IFS([.F1011]>5000000;[.$N$72];AND([.F1011]>=1000000;[.F1011]<=5000000);[.$N$73];AND([.F1011]<1000000;[.F1011]>0);[.$N$74];[.F1011]=0;" ") -> Б | H1011: of:=VLOOKUP([.$B1011];[.$I$71:.$L$81];4;0) -> 7
B1012: 3 | C1012: of:=VLOOKUP([.$B1012];[.$I$71:.$J$81];2;0) -> Челябинск | D1012: 36 | E1012: 61792 | F1012: of:=IF(ISBLANK([.E1012]*[.D1012]);"0";[.E1012]*[.D1012]) -> 2224512 | G1012: of:=COM.MICROSOFT.IFS([.F1012]>5000000;[.$N$72];AND([.F1012]>=1000000;[.F1012]<=5000000);[.$N$73];AND([.F1012]<1000000;[.F1012]>0);[.$N$74];[.F1012]=0;" ") -> Б | H1012: of:=VLOOKUP([.$B1012];[.$I$71:.$L$81];4;0) -> 1
B1013: 7 | C1013: of:=VLOOKUP([.$B1013];[.$I$71:.$J$81];2;0) -> Мурманск | D1013: 5 | E1013: 16749 | F1013: of:=IF(ISBLANK([.E1013]*[.D1013]);"0";[.E1013]*[.D1013]) -> 83745 | G1013: of:=COM.MICROSOFT.IFS([.F1013]>5000000;[.$N$72];AND([.F1013]>=1000000;[.F1013]<=5000000);[.$N$73];AND([.F1013]<1000000;[.F1013]>0);[.$N$74];[.F1013]=0;" ") -> В | H1013: of:=VLOOKUP([.$B1013];[.$I$71:.$L$81];4;0) -> 10
B1014: 4 | C1014: of:=VLOOKUP([.$B1014];[.$I$71:.$J$81];2;0) -> Архангельск | D1014: 18 | E1014: 28122 | F1014: of:=IF(ISBLANK([.E1014]*[.D1014]);"0";[.E1014]*[.D1014]) -> 506196 | G1014: of:=COM.MICROSOFT.IFS([.F1014]>5000000;[.$N$72];AND([.F1014]>=1000000;[.F1014]<=5000000);[.$N$73];AND([.F1014]<1000000;[.F1014]>0);[.$N$74];[.F1014]=0;" ") -> В | H1014: of:=VLOOKUP([.$B1014];[.$I$71:.$L$81];4;0) -> 2
B1015: 10 | C1015: of:=VLOOKUP([.$B1015];[.$I$71:.$J$81];2;0) -> Сочи | D1015: 9 | E1015: 62082 | F1015: of:=IF(ISBLANK([.E1015]*[.D1015]);"0";[.E1015]*[.D1015]) -> 558738 | G1015: of:=COM.MICROSOFT.IFS([.F1015]>5000000;[.$N$72];AND([.F1015]>=1000000;[.F1015]<=5000000);[.$N$73];AND([.F1015]<1000000;[.F1015]>0);[.$N$74];[.F1015]=0;" ") -> В | H1015: of:=VLOOKUP([.$B1015];[.$I$71:.$L$81];4;0) -> 6
B1016: 10 | C1016: of:=VLOOKUP([.$B1016];[.$I$71:.$J$81];2;0) -> Сочи | D1016: 69 | E1016: 71523 | F1016: of:=IF(ISBLANK([.E1016]*[.D1016]);"0";[.E1016]*[.D1016]) -> 4935087 | G1016: of:=COM.MICROSOFT.IFS([.F1016]>5000000;[.$N$72];AND([.F1016]>=1000000;[.F1016]<=5000000);[.$N$73];AND([.F1016]<1000000;[.F1016]>0);[.$N$74];[.F1016]=0;" ") -> Б | H1016: of:=VLOOKUP([.$B1016];[.$I$71:.$L$81];4;0) -> 6
B1017: 10 | C1017: of:=VLOOKUP([.$B1017];[.$I$71:.$J$81];2;0) -> Сочи | D1017: 33 | E1017: 49551 | F1017: of:=IF(ISBLANK([.E1017]*[.D1017]);"0";[.E1017]*[.D1017]) -> 1635183 | G1017: of:=COM.MICROSOFT.IFS([.F1017]>5000000;[.$N$72];AND([.F1017]>=1000000;[.F1017]<=5000000);[.$N$73];AND([.F1017]<1000000;[.F1017]>0);[.$N$74];[.F1017]=0;" ") -> Б | H1017: of:=VLOOKUP([.$B1017];[.$I$71:.$L$81];4;0) -> 6
B1018: 1 | C1018: of:=VLOOKUP([.$B1018];[.$I$71:.$J$81];2;0) -> Москва | D1018: 85 | E1018: 65478 | F1018: of:=IF(ISBLANK([.E1018]*[.D1018]);"0";[.E1018]*[.D1018]) -> 5565630 | G1018: of:=COM.MICROSOFT.IFS([.F1018]>5000000;[.$N$72];AND([.F1018]>=1000000;[.F1018]<=5000000);[.$N$73];AND([.F1018]<1000000;[.F1018]>0);[.$N$74];[.F1018]=0;" ") -> А | H1018: of:=VLOOKUP([.$B1018];[.$I$71:.$L$81];4;0) -> 8
B1019: 9 | C1019: of:=VLOOKUP([.$B1019];[.$I$71:.$J$81];2;0) -> Тюмень | D1019: 85 | E1019: 62479 | F1019: of:=IF(ISBLANK([.E1019]*[.D1019]);"0";[.E1019]*[.D1019]) -> 5310715 | G1019: of:=COM.MICROSOFT.IFS([.F1019]>5000000;[.$N$72];AND([.F1019]>=1000000;[.F1019]<=5000000);[.$N$73];AND([.F1019]<1000000;[.F1019]>0);[.$N$74];[.F1019]=0;" ") -> А | H1019: of:=VLOOKUP([.$B1019];[.$I$71:.$L$81];4;0) -> 3
B1020: 6 | C1020: of:=VLOOKUP([.$B1020];[.$I$71:.$J$81];2;0) -> Владивосток | D1020: 41 | E1020: 54695 | F1020: of:=IF(ISBLANK([.E1020]*[.D1020]);"0";[.E1020]*[.D1020]) -> 2242495 | G1020: of:=COM.MICROSOFT.IFS([.F1020]>5000000;[.$N$72];AND([.F1020]>=1000000;[.F1020]<=5000000);[.$N$73];AND([.F1020]<1000000;[.F1020]>0);[.$N$74];[.F1020]=0;" ") -> Б | H1020: of:=VLOOKUP([.$B1020];[.$I$71:.$L$81];4;0) -> 7
B1021: 2 | C1021: of:=VLOOKUP([.$B1021];[.$I$71:.$J$81];2;0) -> Санкт-Петербург | D1021: 49 | E1021: 72700 | F1021: of:=IF(ISBLANK([.E1021]*[.D1021]);"0";[.E1021]*[.D1021]) -> 3562300 | G1021: of:=COM.MICROSOFT.IFS([.F1021]>5000000;[.$N$72];AND([.F1021]>=1000000;[.F1021]<=5000000);[.$N$73];AND([.F1021]<1000000;[.F1021]>0);[.$N$74];[.F1021]=0;" ") -> Б | H1021: of:=VLOOKUP([.$B1021];[.$I$71:.$L$81];4;0) -> 9
B1022: 6 | C1022: of:=VLOOKUP([.$B1022];[.$I$71:.$J$81];2;0) -> Владивосток | D1022: 59 | E1022: 3791 | F1022: of:=IF(ISBLANK([.E1022]*[.D1022]);"0";[.E1022]*[.D1022]) -> 223669 | G1022: of:=COM.MICROSOFT.IFS([.F1022]>5000000;[.$N$72];AND([.F1022]>=1000000;[.F1022]<=5000000);[.$N$73];AND([.F1022]<1000000;[.F1022]>0);[.$N$74];[.F1022]=0;" ") -> В | H1022: of:=VLOOKUP([.$B1022];[.$I$71:.$L$81];4;0) -> 7
B1023: 1 | C1023: of:=VLOOKUP([.$B1023];[.$I$71:.$J$81];2;0) -> Москва | D1023: 27 | E1023: 51013 | F1023: of:=IF(ISBLANK([.E1023]*[.D1023]);"0";[.E1023]*[.D1023]) -> 1377351 | G1023: of:=COM.MICROSOFT.IFS([.F1023]>5000000;[.$N$72];AND([.F1023]>=1000000;[.F1023]<=5000000);[.$N$73];AND([.F1023]<1000000;[.F1023]>0);[.$N$74];[.F1023]=0;" ") -> Б | H1023: of:=VLOOKUP([.$B1023];[.$I$71:.$L$81];4;0) -> 8
B1024: 1 | C1024: of:=VLOOKUP([.$B1024];[.$I$71:.$J$81];2;0) -> Москва | D1024: 45 | E1024: 10419 | F1024: of:=IF(ISBLANK([.E1024]*[.D1024]);"0";[.E1024]*[.D1024]) -> 468855 | G1024: of:=COM.MICROSOFT.IFS([.F1024]>5000000;[.$N$72];AND([.F1024]>=1000000;[.F1024]<=5000000);[.$N$73];AND([.F1024]<1000000;[.F1024]>0);[.$N$74];[.F1024]=0;" ") -> В | H1024: of:=VLOOKUP([.$B1024];[.$I$71:.$L$81];4;0) -> 8
B1025: 3 | C1025: of:=VLOOKUP([.$B1025];[.$I$71:.$J$81];2;0) -> Челябинск | D1025: 65 | E1025: 70296 | F1025: of:=IF(ISBLANK([.E1025]*[.D1025]);"0";[.E1025]*[.D1025]) -> 4569240 | G1025: of:=COM.MICROSOFT.IFS([.F1025]>5000000;[.$N$72];AND([.F1025]>=1000000;[.F1025]<=5000000);[.$N$73];AND([.F1025]<1000000;[.F1025]>0);[.$N$74];[.F1025]=0;" ") -> Б | H1025: of:=VLOOKUP([.$B1025];[.$I$71:.$L$81];4;0) -> 1
B1026: 7 | C1026: of:=VLOOKUP([.$B1026];[.$I$71:.$J$81];2;0) -> Мурманск | D1026: 59 | E1026: 45443 | F1026: of:=IF(ISBLANK([.E1026]*[.D1026]);"0";[.E1026]*[.D1026]) -> 2681137 | G1026: of:=COM.MICROSOFT.IFS([.F1026]>5000000;[.$N$72];AND([.F1026]>=1000000;[.F1026]<=5000000);[.$N$73];AND([.F1026]<1000000;[.F1026]>0);[.$N$74];[.F1026]=0;" ") -> Б | H1026: of:=VLOOKUP([.$B1026];[.$I$71:.$L$81];4;0) -> 10
B1027: 4 | C1027: of:=VLOOKUP([.$B1027];[.$I$71:.$J$81];2;0) -> Архангельск | D1027: 10 | E1027: 45480 | F1027: of:=IF(ISBLANK([.E1027]*[.D1027]);"0";[.E1027]*[.D1027]) -> 454800 | G1027: of:=COM.MICROSOFT.IFS([.F1027]>5000000;[.$N$72];AND([.F1027]>=1000000;[.F1027]<=5000000);[.$N$73];AND([.F1027]<1000000;[.F1027]>0);[.$N$74];[.F1027]=0;" ") -> В | H1027: of:=VLOOKUP([.$B1027];[.$I$71:.$L$81];4;0) -> 2
B1028: 5 | C1028: of:=VLOOKUP([.$B1028];[.$I$71:.$J$81];2;0) -> Краснодар | D1028: 72 | E1028: 89498 | F1028: of:=IF(ISBLANK([.E1028]*[.D1028]);"0";[.E1028]*[.D1028]) -> 6443856 | G1028: of:=COM.MICROSOFT.IFS([.F1028]>5000000;[.$N$72];AND([.F1028]>=1000000;[.F1028]<=5000000);[.$N$73];AND([.F1028]<1000000;[.F1028]>0);[.$N$74];[.F1028]=0;" ") -> А | H1028: of:=VLOOKUP([.$B1028];[.$I$71:.$L$81];4;0) -> 4
B1029: 1 | C1029: of:=VLOOKUP([.$B1029];[.$I$71:.$J$81];2;0) -> Москва | D1029: 83 | E1029: 66372 | F1029: of:=IF(ISBLANK([.E1029]*[.D1029]);"0";[.E1029]*[.D1029]) -> 5508876 | G1029: of:=COM.MICROSOFT.IFS([.F1029]>5000000;[.$N$72];AND([.F1029]>=1000000;[.F1029]<=5000000);[.$N$73];AND([.F1029]<1000000;[.F1029]>0);[.$N$74];[.F1029]=0;" ") -> А | H1029: of:=VLOOKUP([.$B1029];[.$I$71:.$L$81];4;0) -> 8
B1030: 10 | C1030: of:=VLOOKUP([.$B1030];[.$I$71:.$J$81];2;0) -> Сочи | D1030: 34 | E1030: 75029 | F1030: of:=IF(ISBLANK([.E1030]*[.D1030]);"0";[.E1030]*[.D1030]) -> 2550986 | G1030: of:=COM.MICROSOFT.IFS([.F1030]>5000000;[.$N$72];AND([.F1030]>=1000000;[.F1030]<=5000000);[.$N$73];AND([.F1030]<1000000;[.F1030]>0);[.$N$74];[.F1030]=0;" ") -> Б | H1030: of:=VLOOKUP([.$B1030];[.$I$71:.$L$81];4;0) -> 6
B1031: 3 | C1031: of:=VLOOKUP([.$B1031];[.$I$71:.$J$81];2;0) -> Челябинск | D1031: 17 | E1031: 27033 | F1031: of:=IF(ISBLANK([.E1031]*[.D1031]);"0";[.E1031]*[.D1031]) -> 459561 | G1031: of:=COM.MICROSOFT.IFS([.F1031]>5000000;[.$N$72];AND([.F1031]>=1000000;[.F1031]<=5000000);[.$N$73];AND([.F1031]<1000000;[.F1031]>0);[.$N$74];[.F1031]=0;" ") -> В | H1031: of:=VLOOKUP([.$B1031];[.$I$71:.$L$81];4;0) -> 1
B1032: 4 | C1032: of:=VLOOKUP([.$B1032];[.$I$71:.$J$81];2;0) -> Архангельск | D1032: 76 | E1032: 57659 | F1032: of:=IF(ISBLANK([.E1032]*[.D1032]);"0";[.E1032]*[.D1032]) -> 4382084 | G1032: of:=COM.MICROSOFT.IFS([.F1032]>5000000;[.$N$72];AND([.F1032]>=1000000;[.F1032]<=5000000);[.$N$73];AND([.F1032]<1000000;[.F1032]>0);[.$N$74];[.F1032]=0;" ") -> Б | H1032: of:=VLOOKUP([.$B1032];[.$I$71:.$L$81];4;0) -> 2
B1033: 1 | C1033: of:=VLOOKUP([.$B1033];[.$I$71:.$J$81];2;0) -> Москва | D1033: 23 | E1033: 52184 | F1033: of:=IF(ISBLANK([.E1033]*[.D1033]);"0";[.E1033]*[.D1033]) -> 1200232 | G1033: of:=COM.MICROSOFT.IFS([.F1033]>5000000;[.$N$72];AND([.F1033]>=1000000;[.F1033]<=5000000);[.$N$73];AND([.F1033]<1000000;[.F1033]>0);[.$N$74];[.F1033]=0;" ") -> Б | H1033: of:=VLOOKUP([.$B1033];[.$I$71:.$L$81];4;0) -> 8
B1034: 1 | C1034: of:=VLOOKUP([.$B1034];[.$I$71:.$J$81];2;0) -> Москва | D1034: 84 | E1034: 75467 | F1034: of:=IF(ISBLANK([.E1034]*[.D1034]);"0";[.E1034]*[.D1034]) -> 6339228 | G1034: of:=COM.MICROSOFT.IFS([.F1034]>5000000;[.$N$72];AND([.F1034]>=1000000;[.F1034]<=5000000);[.$N$73];AND([.F1034]<1000000;[.F1034]>0);[.$N$74];[.F1034]=0;" ") -> А | H1034: of:=VLOOKUP([.$B1034];[.$I$71:.$L$81];4;0) -> 8
B1035: 6 | C1035: of:=VLOOKUP([.$B1035];[.$I$71:.$J$81];2;0) -> Владивосток | D1035: 85 | E1035: 77856 | F1035: of:=IF(ISBLANK([.E1035]*[.D1035]);"0";[.E1035]*[.D1035]) -> 6617760 | G1035: of:=COM.MICROSOFT.IFS([.F1035]>5000000;[.$N$72];AND([.F1035]>=1000000;[.F1035]<=5000000);[.$N$73];AND([.F1035]<1000000;[.F1035]>0);[.$N$74];[.F1035]=0;" ") -> А | H1035: of:=VLOOKUP([.$B1035];[.$I$71:.$L$81];4;0) -> 7
B1036: 4 | C1036: of:=VLOOKUP([.$B1036];[.$I$71:.$J$81];2;0) -> Архангельск | D1036: 54 | E1036: 70537 | F1036: of:=IF(ISBLANK([.E1036]*[.D1036]);"0";[.E1036]*[.D1036]) -> 3808998 | G1036: of:=COM.MICROSOFT.IFS([.F1036]>5000000;[.$N$72];AND([.F1036]>=1000000;[.F1036]<=5000000);[.$N$73];AND([.F1036]<1000000;[.F1036]>0);[.$N$74];[.F1036]=0;" ") -> Б | H1036: of:=VLOOKUP([.$B1036];[.$I$71:.$L$81];4;0) -> 2
B1037: 4 | C1037: of:=VLOOKUP([.$B1037];[.$I$71:.$J$81];2;0) -> Архангельск | D1037: 73 | E1037: 37260 | F1037: of:=IF(ISBLANK([.E1037]*[.D1037]);"0";[.E1037]*[.D1037]) -> 2719980 | G1037: of:=COM.MICROSOFT.IFS([.F1037]>5000000;[.$N$72];AND([.F1037]>=1000000;[.F1037]<=5000000);[.$N$73];AND([.F1037]<1000000;[.F1037]>0);[.$N$74];[.F1037]=0;" ") -> Б | H1037: of:=VLOOKUP([.$B1037];[.$I$71:.$L$81];4;0) -> 2
B1038: 8 | C1038: of:=VLOOKUP([.$B1038];[.$I$71:.$J$81];2;0) -> Новосибирск | D1038: 100 | E1038: 73856 | F1038: of:=IF(ISBLANK([.E1038]*[.D1038]);"0";[.E1038]*[.D1038]) -> 7385600 | G1038: of:=COM.MICROSOFT.IFS([.F1038]>5000000;[.$N$72];AND([.F1038]>=1000000;[.F1038]<=5000000);[.$N$73];AND([.F1038]<1000000;[.F1038]>0);[.$N$74];[.F1038]=0;" ") -> А | H1038: of:=VLOOKUP([.$B1038];[.$I$71:.$L$81];4;0) -> 5
B1039: 8 | C1039: of:=VLOOKUP([.$B1039];[.$I$71:.$J$81];2;0) -> Новосибирск | D1039: 64 | E1039: 48584 | F1039: of:=IF(ISBLANK([.E1039]*[.D1039]);"0";[.E1039]*[.D1039]) -> 3109376 | G1039: of:=COM.MICROSOFT.IFS([.F1039]>5000000;[.$N$72];AND([.F1039]>=1000000;[.F1039]<=5000000);[.$N$73];AND([.F1039]<1000000;[.F1039]>0);[.$N$74];[.F1039]=0;" ") -> Б | H1039: of:=VLOOKUP([.$B1039];[.$I$71:.$L$81];4;0) -> 5
B1040: 1 | C1040: of:=VLOOKUP([.$B1040];[.$I$71:.$J$81];2;0) -> Москва | D1040: 58 | E1040: 87413 | F1040: of:=IF(ISBLANK([.E1040]*[.D1040]);"0";[.E1040]*[.D1040]) -> 5069954 | G1040: of:=COM.MICROSOFT.IFS([.F1040]>5000000;[.$N$72];AND([.F1040]>=1000000;[.F1040]<=5000000);[.$N$73];AND([.F1040]<1000000;[.F1040]>0);[.$N$74];[.F1040]=0;" ") -> А | H1040: of:=VLOOKUP([.$B1040];[.$I$71:.$L$81];4;0) -> 8
B1041: 9 | C1041: of:=VLOOKUP([.$B1041];[.$I$71:.$J$81];2;0) -> Тюмень | D1041: 65 | E1041: 26199 | F1041: of:=IF(ISBLANK([.E1041]*[.D1041]);"0";[.E1041]*[.D1041]) -> 1702935 | G1041: of:=COM.MICROSOFT.IFS([.F1041]>5000000;[.$N$72];AND([.F1041]>=1000000;[.F1041]<=5000000);[.$N$73];AND([.F1041]<1000000;[.F1041]>0);[.$N$74];[.F1041]=0;" ") -> Б | H1041: of:=VLOOKUP([.$B1041];[.$I$71:.$L$81];4;0) -> 3
B1042: 2 | C1042: of:=VLOOKUP([.$B1042];[.$I$71:.$J$81];2;0) -> Санкт-Петербург | D1042: 41 | E1042: 13089 | F1042: of:=IF(ISBLANK([.E1042]*[.D1042]);"0";[.E1042]*[.D1042]) -> 536649 | G1042: of:=COM.MICROSOFT.IFS([.F1042]>5000000;[.$N$72];AND([.F1042]>=1000000;[.F1042]<=5000000);[.$N$73];AND([.F1042]<1000000;[.F1042]>0);[.$N$74];[.F1042]=0;" ") -> В | H1042: of:=VLOOKUP([.$B1042];[.$I$71:.$L$81];4;0) -> 9
B1043: 3 | C1043: of:=VLOOKUP([.$B1043];[.$I$71:.$J$81];2;0) -> Челябинск | D1043: 12 | E1043: 42479 | F1043: of:=IF(ISBLANK([.E1043]*[.D1043]);"0";[.E1043]*[.D1043]) -> 509748 | G1043: of:=COM.MICROSOFT.IFS([.F1043]>5000000;[.$N$72];AND([.F1043]>=1000000;[.F1043]<=5000000);[.$N$73];AND([.F1043]<1000000;[.F1043]>0);[.$N$74];[.F1043]=0;" ") -> В | H1043: of:=VLOOKUP([.$B1043];[.$I$71:.$L$81];4;0) -> 1
B1044: 4 | C1044: of:=VLOOKUP([.$B1044];[.$I$71:.$J$81];2;0) -> Архангельск | D1044: 19 | E1044: 2693 | F1044: of:=IF(ISBLANK([.E1044]*[.D1044]);"0";[.E1044]*[.D1044]) -> 51167 | G1044: of:=COM.MICROSOFT.IFS([.F1044]>5000000;[.$N$72];AND([.F1044]>=1000000;[.F1044]<=5000000);[.$N$73];AND([.F1044]<1000000;[.F1044]>0);[.$N$74];[.F1044]=0;" ") -> В | H1044: of:=VLOOKUP([.$B1044];[.$I$71:.$L$81];4;0) -> 2
B1045: 1 | C1045: of:=VLOOKUP([.$B1045];[.$I$71:.$J$81];2;0) -> Москва | D1045: 79 | E1045: 20216 | F1045: of:=IF(ISBLANK([.E1045]*[.D1045]);"0";[.E1045]*[.D1045]) -> 1597064 | G1045: of:=COM.MICROSOFT.IFS([.F1045]>5000000;[.$N$72];AND([.F1045]>=1000000;[.F1045]<=5000000);[.$N$73];AND([.F1045]<1000000;[.F1045]>0);[.$N$74];[.F1045]=0;" ") -> Б | H1045: of:=VLOOKUP([.$B1045];[.$I$71:.$L$81];4;0) -> 8
B1046: 2 | C1046: of:=VLOOKUP([.$B1046];[.$I$71:.$J$81];2;0) -> Санкт-Петербург | D1046: 25 | E1046: 44211 | F1046: of:=IF(ISBLANK([.E1046]*[.D1046]);"0";[.E1046]*[.D1046]) -> 1105275 | G1046: of:=COM.MICROSOFT.IFS([.F1046]>5000000;[.$N$72];AND([.F1046]>=1000000;[.F1046]<=5000000);[.$N$73];AND([.F1046]<1000000;[.F1046]>0);[.$N$74];[.F1046]=0;" ") -> Б | H1046: of:=VLOOKUP([.$B1046];[.$I$71:.$L$81];4;0) -> 9
B1047: 2 | C1047: of:=VLOOKUP([.$B1047];[.$I$71:.$J$81];2;0) -> Санкт-Петербург | D1047: 7 | E1047: 33344 | F1047: of:=IF(ISBLANK([.E1047]*[.D1047]);"0";[.E1047]*[.D1047]) -> 233408 | G1047: of:=COM.MICROSOFT.IFS([.F1047]>5000000;[.$N$72];AND([.F1047]>=1000000;[.F1047]<=5000000);[.$N$73];AND([.F1047]<1000000;[.F1047]>0);[.$N$74];[.F1047]=0;" ") -> В | H1047: of:=VLOOKUP([.$B1047];[.$I$71:.$L$81];4;0) -> 9
B1048: 8 | C1048: of:=VLOOKUP([.$B1048];[.$I$71:.$J$81];2;0) -> Новосибирск | D1048: 16 | E1048: 99149 | F1048: of:=IF(ISBLANK([.E1048]*[.D1048]);"0";[.E1048]*[.D1048]) -> 1586384 | G1048: of:=COM.MICROSOFT.IFS([.F1048]>5000000;[.$N$72];AND([.F1048]>=1000000;[.F1048]<=5000000);[.$N$73];AND([.F1048]<1000000;[.F1048]>0);[.$N$74];[.F1048]=0;" ") -> Б | H1048: of:=VLOOKUP([.$B1048];[.$I$71:.$L$81];4;0) -> 5
B1049: 5 | C1049: of:=VLOOKUP([.$B1049];[.$I$71:.$J$81];2;0) -> Краснодар | D1049: 67 | E1049: 43438 | F1049: of:=IF(ISBLANK([.E1049]*[.D1049]);"0";[.E1049]*[.D1049]) -> 2910346 | G1049: of:=COM.MICROSOFT.IFS([.F1049]>5000000;[.$N$72];AND([.F1049]>=1000000;[.F1049]<=5000000);[.$N$73];AND([.F1049]<1000000;[.F1049]>0);[.$N$74];[.F1049]=0;" ") -> Б | H1049: of:=VLOOKUP([.$B1049];[.$I$71:.$L$81];4;0) -> 4
B1050: 2 | C1050: of:=VLOOKUP([.$B1050];[.$I$71:.$J$81];2;0) -> Санкт-Петербург | D1050: 51 | E1050: 51527 | F1050: of:=IF(ISBLANK([.E1050]*[.D1050]);"0";[.E1050]*[.D1050]) -> 2627877 | G1050: of:=COM.MICROSOFT.IFS([.F1050]>5000000;[.$N$72];AND([.F1050]>=1000000;[.F1050]<=5000000);[.$N$73];AND([.F1050]<1000000;[.F1050]>0);[.$N$74];[.F1050]=0;" ") -> Б | H1050: of:=VLOOKUP([.$B1050];[.$I$71:.$L$81];4;0) -> 9
B1051: 10 | C1051: of:=VLOOKUP([.$B1051];[.$I$71:.$J$81];2;0) -> Сочи | D1051: 84 | E1051: 3205 | F1051: of:=IF(ISBLANK([.E1051]*[.D1051]);"0";[.E1051]*[.D1051]) -> 269220 | G1051: of:=COM.MICROSOFT.IFS([.F1051]>5000000;[.$N$72];AND([.F1051]>=1000000;[.F1051]<=5000000);[.$N$73];AND([.F1051]<1000000;[.F1051]>0);[.$N$74];[.F1051]=0;" ") -> В | H1051: of:=VLOOKUP([.$B1051];[.$I$71:.$L$81];4;0) -> 6
B1052: 1 | C1052: of:=VLOOKUP([.$B1052];[.$I$71:.$J$81];2;0) -> Москва | D1052: 49 | E1052: 40896 | F1052: of:=IF(ISBLANK([.E1052]*[.D1052]);"0";[.E1052]*[.D1052]) -> 2003904 | G1052: of:=COM.MICROSOFT.IFS([.F1052]>5000000;[.$N$72];AND([.F1052]>=1000000;[.F1052]<=5000000);[.$N$73];AND([.F1052]<1000000;[.F1052]>0);[.$N$74];[.F1052]=0;" ") -> Б | H1052: of:=VLOOKUP([.$B1052];[.$I$71:.$L$81];4;0) -> 8
B1053: 9 | C1053: of:=VLOOKUP([.$B1053];[.$I$71:.$J$81];2;0) -> Тюмень | D1053: 6 | E1053: 94953 | F1053: of:=IF(ISBLANK([.E1053]*[.D1053]);"0";[.E1053]*[.D1053]) -> 569718 | G1053: of:=COM.MICROSOFT.IFS([.F1053]>5000000;[.$N$72];AND([.F1053]>=1000000;[.F1053]<=5000000);[.$N$73];AND([.F1053]<1000000;[.F1053]>0);[.$N$74];[.F1053]=0;" ") -> В | H1053: of:=VLOOKUP([.$B1053];[.$I$71:.$L$81];4;0) -> 3
B1054: 1 | C1054: of:=VLOOKUP([.$B1054];[.$I$71:.$J$81];2;0) -> Москва | D1054: 43 | E1054: 93460 | F1054: of:=IF(ISBLANK([.E1054]*[.D1054]);"0";[.E1054]*[.D1054]) -> 4018780 | G1054: of:=COM.MICROSOFT.IFS([.F1054]>5000000;[.$N$72];AND([.F1054]>=1000000;[.F1054]<=5000000);[.$N$73];AND([.F1054]<1000000;[.F1054]>0);[.$N$74];[.F1054]=0;" ") -> Б | H1054: of:=VLOOKUP([.$B1054];[.$I$71:.$L$81];4;0) -> 8
B1055: 2 | C1055: of:=VLOOKUP([.$B1055];[.$I$71:.$J$81];2;0) -> Санкт-Петербург | D1055: 100 | E1055: 5725 | F1055: of:=IF(ISBLANK([.E1055]*[.D1055]);"0";[.E1055]*[.D1055]) -> 572500 | G1055: of:=COM.MICROSOFT.IFS([.F1055]>5000000;[.$N$72];AND([.F1055]>=1000000;[.F1055]<=5000000);[.$N$73];AND([.F1055]<1000000;[.F1055]>0);[.$N$74];[.F1055]=0;" ") -> В | H1055: of:=VLOOKUP([.$B1055];[.$I$71:.$L$81];4;0) -> 9
B1056: 10 | C1056: of:=VLOOKUP([.$B1056];[.$I$71:.$J$81];2;0) -> Сочи | D1056: 52 | E1056: 69134 | F1056: of:=IF(ISBLANK([.E1056]*[.D1056]);"0";[.E1056]*[.D1056]) -> 3594968 | G1056: of:=COM.MICROSOFT.IFS([.F1056]>5000000;[.$N$72];AND([.F1056]>=1000000;[.F1056]<=5000000);[.$N$73];AND([.F1056]<1000000;[.F1056]>0);[.$N$74];[.F1056]=0;" ") -> Б | H1056: of:=VLOOKUP([.$B1056];[.$I$71:.$L$81];4;0) -> 6
B1057: 3 | C1057: of:=VLOOKUP([.$B1057];[.$I$71:.$J$81];2;0) -> Челябинск | D1057: 76 | E1057: 26605 | F1057: of:=IF(ISBLANK([.E1057]*[.D1057]);"0";[.E1057]*[.D1057]) -> 2021980 | G1057: of:=COM.MICROSOFT.IFS([.F1057]>5000000;[.$N$72];AND([.F1057]>=1000000;[.F1057]<=5000000);[.$N$73];AND([.F1057]<1000000;[.F1057]>0);[.$N$74];[.F1057]=0;" ") -> Б | H1057: of:=VLOOKUP([.$B1057];[.$I$71:.$L$81];4;0) -> 1
B1058: 4 | C1058: of:=VLOOKUP([.$B1058];[.$I$71:.$J$81];2;0) -> Архангельск | D1058: 23 | E1058: 76165 | F1058: of:=IF(ISBLANK([.E1058]*[.D1058]);"0";[.E1058]*[.D1058]) -> 1751795 | G1058: of:=COM.MICROSOFT.IFS([.F1058]>5000000;[.$N$72];AND([.F1058]>=1000000;[.F1058]<=5000000);[.$N$73];AND([.F1058]<1000000;[.F1058]>0);[.$N$74];[.F1058]=0;" ") -> Б | H1058: of:=VLOOKUP([.$B1058];[.$I$71:.$L$81];4;0) -> 2
B1059: 8 | C1059: of:=VLOOKUP([.$B1059];[.$I$71:.$J$81];2;0) -> Новосибирск | D1059: 21 | E1059: 56378 | F1059: of:=IF(ISBLANK([.E1059]*[.D1059]);"0";[.E1059]*[.D1059]) -> 1183938 | G1059: of:=COM.MICROSOFT.IFS([.F1059]>5000000;[.$N$72];AND([.F1059]>=1000000;[.F1059]<=5000000);[.$N$73];AND([.F1059]<1000000;[.F1059]>0);[.$N$74];[.F1059]=0;" ") -> Б | H1059: of:=VLOOKUP([.$B1059];[.$I$71:.$L$81];4;0) -> 5
B1060: 1 | C1060: of:=VLOOKUP([.$B1060];[.$I$71:.$J$81];2;0) -> Москва | D1060: 26 | E1060: 44623 | F1060: of:=IF(ISBLANK([.E1060]*[.D1060]);"0";[.E1060]*[.D1060]) -> 1160198 | G1060: of:=COM.MICROSOFT.IFS([.F1060]>5000000;[.$N$72];AND([.F1060]>=1000000;[.F1060]<=5000000);[.$N$73];AND([.F1060]<1000000;[.F1060]>0);[.$N$74];[.F1060]=0;" ") -> Б | H1060: of:=VLOOKUP([.$B1060];[.$I$71:.$L$81];4;0) -> 8
B1061: 1 | C1061: of:=VLOOKUP([.$B1061];[.$I$71:.$J$81];2;0) -> Москва | D1061: 57 | E1061: 39542 | F1061: of:=IF(ISBLANK([.E1061]*[.D1061]);"0";[.E1061]*[.D1061]) -> 2253894 | G1061: of:=COM.MICROSOFT.IFS([.F1061]>5000000;[.$N$72];AND([.F1061]>=1000000;[.F1061]<=5000000);[.$N$73];AND([.F1061]<1000000;[.F1061]>0);[.$N$74];[.F1061]=0;" ") -> Б | H1061: of:=VLOOKUP([.$B1061];[.$I$71:.$L$81];4;0) -> 8
B1062: 7 | C1062: of:=VLOOKUP([.$B1062];[.$I$71:.$J$81];2;0) -> Мурманск | D1062: 2 | E1062: 45884 | F1062: of:=IF(ISBLANK([.E1062]*[.D1062]);"0";[.E1062]*[.D1062]) -> 91768 | G1062: of:=COM.MICROSOFT.IFS([.F1062]>5000000;[.$N$72];AND([.F1062]>=1000000;[.F1062]<=5000000);[.$N$73];AND([.F1062]<1000000;[.F1062]>0);[.$N$74];[.F1062]=0;" ") -> В | H1062: of:=VLOOKUP([.$B1062];[.$I$71:.$L$81];4;0) -> 10
B1063: 10 | C1063: of:=VLOOKUP([.$B1063];[.$I$71:.$J$81];2;0) -> Сочи | D1063: 46 | E1063: 47372 | F1063: of:=IF(ISBLANK([.E1063]*[.D1063]);"0";[.E1063]*[.D1063]) -> 2179112 | G1063: of:=COM.MICROSOFT.IFS([.F1063]>5000000;[.$N$72];AND([.F1063]>=1000000;[.F1063]<=5000000);[.$N$73];AND([.F1063]<1000000;[.F1063]>0);[.$N$74];[.F1063]=0;" ") -> Б | H1063: of:=VLOOKUP([.$B1063];[.$I$71:.$L$81];4;0) -> 6
B1064: 1 | C1064: of:=VLOOKUP([.$B1064];[.$I$71:.$J$81];2;0) -> Москва | D1064: 94 | E1064: 98929 | F1064: of:=IF(ISBLANK([.E1064]*[.D1064]);"0";[.E1064]*[.D1064]) -> 9299326 | G1064: of:=COM.MICROSOFT.IFS([.F1064]>5000000;[.$N$72];AND([.F1064]>=1000000;[.F1064]<=5000000);[.$N$73];AND([.F1064]<1000000;[.F1064]>0);[.$N$74];[.F1064]=0;" ") -> А | H1064: of:=VLOOKUP([.$B1064];[.$I$71:.$L$81];4;0) -> 8
B1065: 10 | C1065: of:=VLOOKUP([.$B1065];[.$I$71:.$J$81];2;0) -> Сочи | D1065: 59 | E1065: 17513 | F1065: of:=IF(ISBLANK([.E1065]*[.D1065]);"0";[.E1065]*[.D1065]) -> 1033267 | G1065: of:=COM.MICROSOFT.IFS([.F1065]>5000000;[.$N$72];AND([.F1065]>=1000000;[.F1065]<=5000000);[.$N$73];AND([.F1065]<1000000;[.F1065]>0);[.$N$74];[.F1065]=0;" ") -> Б | H1065: of:=VLOOKUP([.$B1065];[.$I$71:.$L$81];4;0) -> 6
B1066: 3 | C1066: of:=VLOOKUP([.$B1066];[.$I$71:.$J$81];2;0) -> Челябинск | D1066: 5 | E1066: 11060 | F1066: of:=IF(ISBLANK([.E1066]*[.D1066]);"0";[.E1066]*[.D1066]) -> 55300 | G1066: of:=COM.MICROSOFT.IFS([.F1066]>5000000;[.$N$72];AND([.F1066]>=1000000;[.F1066]<=5000000);[.$N$73];AND([.F1066]<1000000;[.F1066]>0);[.$N$74];[.F1066]=0;" ") -> В | H1066: of:=VLOOKUP([.$B1066];[.$I$71:.$L$81];4;0) -> 1
B1067: 3 | C1067: of:=VLOOKUP([.$B1067];[.$I$71:.$J$81];2;0) -> Челябинск | D1067: 30 | E1067: 83322 | F1067: of:=IF(ISBLANK([.E1067]*[.D1067]);"0";[.E1067]*[.D1067]) -> 2499660 | G1067: of:=COM.MICROSOFT.IFS([.F1067]>5000000;[.$N$72];AND([.F1067]>=1000000;[.F1067]<=5000000);[.$N$73];AND([.F1067]<1000000;[.F1067]>0);[.$N$74];[.F1067]=0;" ") -> Б | H1067: of:=VLOOKUP([.$B1067];[.$I$71:.$L$81];4;0) -> 1
B1068: 7 | C1068: of:=VLOOKUP([.$B1068];[.$I$71:.$J$81];2;0) -> Мурманск | D1068: 85 | E1068: 23395 | F1068: of:=IF(ISBLANK([.E1068]*[.D1068]);"0";[.E1068]*[.D1068]) -> 1988575 | G1068: of:=COM.MICROSOFT.IFS([.F1068]>5000000;[.$N$72];AND([.F1068]>=1000000;[.F1068]<=5000000);[.$N$73];AND([.F1068]<1000000;[.F1068]>0);[.$N$74];[.F1068]=0;" ") -> Б | H1068: of:=VLOOKUP([.$B1068];[.$I$71:.$L$81];4;0) -> 10
B1069: 8 | C1069: of:=VLOOKUP([.$B1069];[.$I$71:.$J$81];2;0) -> Новосибирск | D1069: 76 | E1069: 72915 | F1069: of:=IF(ISBLANK([.E1069]*[.D1069]);"0";[.E1069]*[.D1069]) -> 5541540 | G1069: of:=COM.MICROSOFT.IFS([.F1069]>5000000;[.$N$72];AND([.F1069]>=1000000;[.F1069]<=5000000);[.$N$73];AND([.F1069]<1000000;[.F1069]>0);[.$N$74];[.F1069]=0;" ") -> А | H1069: of:=VLOOKUP([.$B1069];[.$I$71:.$L$81];4;0) -> 5
B1070: 6 | C1070: of:=VLOOKUP([.$B1070];[.$I$71:.$J$81];2;0) -> Владивосток | D1070: 13 | E1070: 86193 | F1070: of:=IF(ISBLANK([.E1070]*[.D1070]);"0";[.E1070]*[.D1070]) -> 1120509 | G1070: of:=COM.MICROSOFT.IFS([.F1070]>5000000;[.$N$72];AND([.F1070]>=1000000;[.F1070]<=5000000);[.$N$73];AND([.F1070]<1000000;[.F1070]>0);[.$N$74];[.F1070]=0;" ") -> Б | H1070: of:=VLOOKUP([.$B1070];[.$I$71:.$L$81];4;0) -> 7
B1071: 2 | C1071: of:=VLOOKUP([.$B1071];[.$I$71:.$J$81];2;0) -> Санкт-Петербург | D1071: 63 | E1071: 49666 | F1071: of:=IF(ISBLANK([.E1071]*[.D1071]);"0";[.E1071]*[.D1071]) -> 3128958 | G1071: of:=COM.MICROSOFT.IFS([.F1071]>5000000;[.$N$72];AND([.F1071]>=1000000;[.F1071]<=5000000);[.$N$73];AND([.F1071]<1000000;[.F1071]>0);[.$N$74];[.F1071]=0;" ") -> Б | H1071: of:=VLOOKUP([.$B1071];[.$I$71:.$L$81];4;0) -> 9
B1072: 7 | C1072: of:=VLOOKUP([.$B1072];[.$I$71:.$J$81];2;0) -> Мурманск | D1072: 43 | E1072: 68892 | F1072: of:=IF(ISBLANK([.E1072]*[.D1072]);"0";[.E1072]*[.D1072]) -> 2962356 | G1072: of:=COM.MICROSOFT.IFS([.F1072]>5000000;[.$N$72];AND([.F1072]>=1000000;[.F1072]<=5000000);[.$N$73];AND([.F1072]<1000000;[.F1072]>0);[.$N$74];[.F1072]=0;" ") -> Б | H1072: of:=VLOOKUP([.$B1072];[.$I$71:.$L$81];4;0) -> 10
B1073: 9 | C1073: of:=VLOOKUP([.$B1073];[.$I$71:.$J$81];2;0) -> Тюмень | D1073: 54 | E1073: 28587 | F1073: of:=IF(ISBLANK([.E1073]*[.D1073]);"0";[.E1073]*[.D1073]) -> 1543698 | G1073: of:=COM.MICROSOFT.IFS([.F1073]>5000000;[.$N$72];AND([.F1073]>=1000000;[.F1073]<=5000000);[.$N$73];AND([.F1073]<1000000;[.F1073]>0);[.$N$74];[.F1073]=0;" ") -> Б | H1073: of:=VLOOKUP([.$B1073];[.$I$71:.$L$81];4;0) -> 3
B1074: 5 | C1074: of:=VLOOKUP([.$B1074];[.$I$71:.$J$81];2;0) -> Краснодар | D1074: 34 | E1074: 66446 | F1074: of:=IF(ISBLANK([.E1074]*[.D1074]);"0";[.E1074]*[.D1074]) -> 2259164 | G1074: of:=COM.MICROSOFT.IFS([.F1074]>5000000;[.$N$72];AND([.F1074]>=1000000;[.F1074]<=5000000);[.$N$73];AND([.F1074]<1000000;[.F1074]>0);[.$N$74];[.F1074]=0;" ") -> Б | H1074: of:=VLOOKUP([.$B1074];[.$I$71:.$L$81];4;0) -> 4
B1075: 8 | C1075: of:=VLOOKUP([.$B1075];[.$I$71:.$J$81];2;0) -> Новосибирск | D1075: 48 | E1075: 96846 | F1075: of:=IF(ISBLANK([.E1075]*[.D1075]);"0";[.E1075]*[.D1075]) -> 4648608 | G1075: of:=COM.MICROSOFT.IFS([.F1075]>5000000;[.$N$72];AND([.F1075]>=1000000;[.F1075]<=5000000);[.$N$73];AND([.F1075]<1000000;[.F1075]>0);[.$N$74];[.F1075]=0;" ") -> Б | H1075: of:=VLOOKUP([.$B1075];[.$I$71:.$L$81];4;0) -> 5
B1076: 1 | C1076: of:=VLOOKUP([.$B1076];[.$I$71:.$J$81];2;0) -> Москва | D1076: 61 | E1076: 87285 | F1076: of:=IF(ISBLANK([.E1076]*[.D1076]);"0";[.E1076]*[.D1076]) -> 5324385 | G1076: of:=COM.MICROSOFT.IFS([.F1076]>5000000;[.$N$72];AND([.F1076]>=1000000;[.F1076]<=5000000);[.$N$73];AND([.F1076]<1000000;[.F1076]>0);[.$N$74];[.F1076]=0;" ") -> А | H1076: of:=VLOOKUP([.$B1076];[.$I$71:.$L$81];4;0) -> 8
B1077: 8 | C1077: of:=VLOOKUP([.$B1077];[.$I$71:.$J$81];2;0) -> Новосибирск | D1077: 4 | E1077: 13362 | F1077: of:=IF(ISBLANK([.E1077]*[.D1077]);"0";[.E1077]*[.D1077]) -> 53448 | G1077: of:=COM.MICROSOFT.IFS([.F1077]>5000000;[.$N$72];AND([.F1077]>=1000000;[.F1077]<=5000000);[.$N$73];AND([.F1077]<1000000;[.F1077]>0);[.$N$74];[.F1077]=0;" ") -> В | H1077: of:=VLOOKUP([.$B1077];[.$I$71:.$L$81];4;0) -> 5
B1078: 7 | C1078: of:=VLOOKUP([.$B1078];[.$I$71:.$J$81];2;0) -> Мурманск | D1078: 1 | E1078: 17012 | F1078: of:=IF(ISBLANK([.E1078]*[.D1078]);"0";[.E1078]*[.D1078]) -> 17012 | G1078: of:=COM.MICROSOFT.IFS([.F1078]>5000000;[.$N$72];AND([.F1078]>=1000000;[.F1078]<=5000000);[.$N$73];AND([.F1078]<1000000;[.F1078]>0);[.$N$74];[.F1078]=0;" ") -> В | H1078: of:=VLOOKUP([.$B1078];[.$I$71:.$L$81];4;0) -> 10
B1079: 5 | C1079: of:=VLOOKUP([.$B1079];[.$I$71:.$J$81];2;0) -> Краснодар | D1079: 23 | E1079: 60222 | F1079: of:=IF(ISBLANK([.E1079]*[.D1079]);"0";[.E1079]*[.D1079]) -> 1385106 | G1079: of:=COM.MICROSOFT.IFS([.F1079]>5000000;[.$N$72];AND([.F1079]>=1000000;[.F1079]<=5000000);[.$N$73];AND([.F1079]<1000000;[.F1079]>0);[.$N$74];[.F1079]=0;" ") -> Б | H1079: of:=VLOOKUP([.$B1079];[.$I$71:.$L$81];4;0) -> 4
B1080: 3 | C1080: of:=VLOOKUP([.$B1080];[.$I$71:.$J$81];2;0) -> Челябинск | D1080: 33 | E1080: 83680 | F1080: of:=IF(ISBLANK([.E1080]*[.D1080]);"0";[.E1080]*[.D1080]) -> 2761440 | G1080: of:=COM.MICROSOFT.IFS([.F1080]>5000000;[.$N$72];AND([.F1080]>=1000000;[.F1080]<=5000000);[.$N$73];AND([.F1080]<1000000;[.F1080]>0);[.$N$74];[.F1080]=0;" ") -> Б | H1080: of:=VLOOKUP([.$B1080];[.$I$71:.$L$81];4;0) -> 1
B1081: 6 | C1081: of:=VLOOKUP([.$B1081];[.$I$71:.$J$81];2;0) -> Владивосток | D1081: 19 | E1081: 92360 | F1081: of:=IF(ISBLANK([.E1081]*[.D1081]);"0";[.E1081]*[.D1081]) -> 1754840 | G1081: of:=COM.MICROSOFT.IFS([.F1081]>5000000;[.$N$72];AND([.F1081]>=1000000;[.F1081]<=5000000);[.$N$73];AND([.F1081]<1000000;[.F1081]>0);[.$N$74];[.F1081]=0;" ") -> Б | H1081: of:=VLOOKUP([.$B1081];[.$I$71:.$L$81];4;0) -> 7
B1082: 7 | C1082: of:=VLOOKUP([.$B1082];[.$I$71:.$J$81];2;0) -> Мурманск | D1082: 88 | E1082: 95221 | F1082: of:=IF(ISBLANK([.E1082]*[.D1082]);"0";[.E1082]*[.D1082]) -> 8379448 | G1082: of:=COM.MICROSOFT.IFS([.F1082]>5000000;[.$N$72];AND([.F1082]>=1000000;[.F1082]<=5000000);[.$N$73];AND([.F1082]<1000000;[.F1082]>0);[.$N$74];[.F1082]=0;" ") -> А | H1082: of:=VLOOKUP([.$B1082];[.$I$71:.$L$81];4;0) -> 10
B1083: 1 | C1083: of:=VLOOKUP([.$B1083];[.$I$71:.$J$81];2;0) -> Москва | D1083: 97 | E1083: 92747 | F1083: of:=IF(ISBLANK([.E1083]*[.D1083]);"0";[.E1083]*[.D1083]) -> 8996459 | G1083: of:=COM.MICROSOFT.IFS([.F1083]>5000000;[.$N$72];AND([.F1083]>=1000000;[.F1083]<=5000000);[.$N$73];AND([.F1083]<1000000;[.F1083]>0);[.$N$74];[.F1083]=0;" ") -> А | H1083: of:=VLOOKUP([.$B1083];[.$I$71:.$L$81];4;0) -> 8
B1084: 1 | C1084: of:=VLOOKUP([.$B1084];[.$I$71:.$J$81];2;0) -> Москва | D1084: 43 | E1084: 1405 | F1084: of:=IF(ISBLANK([.E1084]*[.D1084]);"0";[.E1084]*[.D1084]) -> 60415 | G1084: of:=COM.MICROSOFT.IFS([.F1084]>5000000;[.$N$72];AND([.F1084]>=1000000;[.F1084]<=5000000);[.$N$73];AND([.F1084]<1000000;[.F1084]>0);[.$N$74];[.F1084]=0;" ") -> В | H1084: of:=VLOOKUP([.$B1084];[.$I$71:.$L$81];4;0) -> 8
B1085: 4 | C1085: of:=VLOOKUP([.$B1085];[.$I$71:.$J$81];2;0) -> Архангельск | D1085: 29 | E1085: 21033 | F1085: of:=IF(ISBLANK([.E1085]*[.D1085]);"0";[.E1085]*[.D1085]) -> 609957 | G1085: of:=COM.MICROSOFT.IFS([.F1085]>5000000;[.$N$72];AND([.F1085]>=1000000;[.F1085]<=5000000);[.$N$73];AND([.F1085]<1000000;[.F1085]>0);[.$N$74];[.F1085]=0;" ") -> В | H1085: of:=VLOOKUP([.$B1085];[.$I$71:.$L$81];4;0) -> 2
B1086: 4 | C1086: of:=VLOOKUP([.$B1086];[.$I$71:.$J$81];2;0) -> Архангельск | D1086: 57 | E1086: 1394 | F1086: of:=IF(ISBLANK([.E1086]*[.D1086]);"0";[.E1086]*[.D1086]) -> 79458 | G1086: of:=COM.MICROSOFT.IFS([.F1086]>5000000;[.$N$72];AND([.F1086]>=1000000;[.F1086]<=5000000);[.$N$73];AND([.F1086]<1000000;[.F1086]>0);[.$N$74];[.F1086]=0;" ") -> В | H1086: of:=VLOOKUP([.$B1086];[.$I$71:.$L$81];4;0) -> 2
B1087: 2 | C1087: of:=VLOOKUP([.$B1087];[.$I$71:.$J$81];2;0) -> Санкт-Петербург | D1087: 8 | E1087: 35388 | F1087: of:=IF(ISBLANK([.E1087]*[.D1087]);"0";[.E1087]*[.D1087]) -> 283104 | G1087: of:=COM.MICROSOFT.IFS([.F1087]>5000000;[.$N$72];AND([.F1087]>=1000000;[.F1087]<=5000000);[.$N$73];AND([.F1087]<1000000;[.F1087]>0);[.$N$74];[.F1087]=0;" ") -> В | H1087: of:=VLOOKUP([.$B1087];[.$I$71:.$L$81];4;0) -> 9
B1088: 3 | C1088: of:=VLOOKUP([.$B1088];[.$I$71:.$J$81];2;0) -> Челябинск | D1088: 70 | E1088: 26745 | F1088: of:=IF(ISBLANK([.E1088]*[.D1088]);"0";[.E1088]*[.D1088]) -> 1872150 | G1088: of:=COM.MICROSOFT.IFS([.F1088]>5000000;[.$N$72];AND([.F1088]>=1000000;[.F1088]<=5000000);[.$N$73];AND([.F1088]<1000000;[.F1088]>0);[.$N$74];[.F1088]=0;" ") -> Б | H1088: of:=VLOOKUP([.$B1088];[.$I$71:.$L$81];4;0) -> 1
B1089: 3 | C1089: of:=VLOOKUP([.$B1089];[.$I$71:.$J$81];2;0) -> Челябинск | D1089: 82 | E1089: 13971 | F1089: of:=IF(ISBLANK([.E1089]*[.D1089]);"0";[.E1089]*[.D1089]) -> 1145622 | G1089: of:=COM.MICROSOFT.IFS([.F1089]>5000000;[.$N$72];AND([.F1089]>=1000000;[.F1089]<=5000000);[.$N$73];AND([.F1089]<1000000;[.F1089]>0);[.$N$74];[.F1089]=0;" ") -> Б | H1089: of:=VLOOKUP([.$B1089];[.$I$71:.$L$81];4;0) -> 1

Sheet: 2.Бизнес
A1: Задание по бизнесу
A3: Кейс 1: PnL бизнеса, оказывающего услуги в сфере преподавания
A4: 1. Заполнить таблицу, используя формулу Excel
A6: Показатели | B6: 2021 | C6: 2022 | D6: Прирост, руб | E6: Прирост, % | F6: Влияние на прибыль
A7: Кол-во учеников | B7: 12000 | C7: 15000 | D7: of:=[.C7]-[.B7] -> 3000 | E7: of:=[.C7]*100/[.B7]-100 -> 25 | F7: of:=AVERAGE([.B40];[.D40]) -> -82.9420257018444
A8: Стоимость 1 ученика | B8: 1500 | C8: 1300 | D8: of:=[.C8]-[.B8] -> -200 | E8: of:=[.C8]*100/[.B8]-100 -> -13.3333333333333 | F8: of:=AVERAGE([.B41];[.D41]) -> -293.992733741636
A9: Затраты на 1 ученика (преподавание) | B9: 800 | C9: 700 | D9: of:=[.C9]-[.B9] -> -100 | E9: of:=[.C9]*100/[.B9]-100 -> -12.5 | F9: of:=AVERAGE([.B42];[.D42]) -> 311.037021630616
A10: Затраты на маркетинг и продажи | B10: 2000000 | C10: 2300000 | D10: of:=[.C10]-[.B10] -> 300000 | E10: of:=[.C10]*100/[.B10]-100 -> 15 | F10: of:=AVERAGE([.B43];[.D43]) -> 145.195064962651
A11: Численность персонала | B11: 100 | C11: 105 | D11: of:=[.C11]-[.B11] -> 5 | E11: of:=[.C11]*100/[.B11]-100 -> 5 | F11: of:=AVERAGE([.B44];[.D44]) -> 121.779835026729
A12: Средняя ЗП | B12: 10000 | C12: 10400 | D12: of:=[.C12]-[.B12] -> 400 | E12: of:=[.C12]*100/[.B12]-100 -> 4 | F12: of:=AVERAGE([.B45];[.D45]) -> 121.992215323751
A13: ФОТ админ.персонала | B13: 700000 | C13: 800000 | D13: of:=[.C13]-[.B13] -> 100000 | E13: of:=[.C13]*100/[.B13]-100 -> 14.2857142857143 | F13: of:=AVERAGE([.B46];[.D46]) -> 115.766276064715
A14: Выручка | B14: of:=[.B7]*[.B8] -> 18000000 | C14: of:=[.C8]*[.C7] -> 19500000 | D14: of:=[.C14]-[.B14] -> 1500000 | E14: of:=[.C14]*100/[.B14]-100 -> 8.33333333333333 | F14: of:=AVERAGE([.B47];[.D47]) -> 294.276383332743
A15: Маржа | B15: of:=[.B8]*[.B7] - ([.B7]*[.B9]+[.B10]) -> 6400000 | C15: of:=[.C8]*[.C7] - ([.C7]*[.C9]+[.C10]) -> 6700000 | D15: of:=[.C15]-[.B15] -> 300000 | E15: of:=[.C15]*100/[.B15]-100 -> 4.6875 | F15: of:=AVERAGE([.B48];[.D48]) -> 37.7606471483697
A16: OPEX | B16: of:=[.B7]*[.B9]+[.B10]+[.B11]*[.B12]+[.B13] -> 13300000 | C16: of:=[.C7]*[.C9]+[.C10]+[.C11]*[.C12]+[.C13] -> 14692000 | D16: of:=[.C16]-[.B16] -> 1392000 | E16: of:=[.C16]*100/[.B16]-100 -> 10.4661654135338 | F16: of:=AVERAGE([.B49];[.D49]) -> 394.276383332743
A17: Прибыль | B17: of:=[.B7]*[.B8] - ([.B7]*[.B9]+[.B10]+[.B11]*[.B12]+[.B13]) -> 4700000 | C17: of:=[.C7]*[.C8] - ([.C7]*[.C9]+[.C10]+[.C11]*[.C12]+[.C13]) -> 4808000 | D17: of:=[.C17]-[.B17] -> 108000 | E17: of:=[.C17]*100/[.B17]-100 -> 2.29787234042553 | F17: of:=AVERAGE([.B50];[.D50]) -> 100
A18: Рентабельность продаж,% | B18: of:=[.B17]/[.B14]*100% -> 0.261111111111111 | C18: of:=[.C17]/[.C14]*100% -> 0.246564102564103 | D18: - | E18: - | F18: -
A20: 2. Опиши основные причины изменения прибыли текущий год против прошлого года
A22: Ответ
A23: В 2022 году компания добилась значительного роста прибыли по сравнению с предыдущим годом. Это стало возможным благодаря нескольким факторам: * Количество учеников увеличилось на 25%. * Затраты на одного ученика уменьшились на 12,5%. Вероятно, этих результатов удалось достичь благодаря эффективному управлению и оптимизации бизнес-процессов. Компания смогла инвестировать дополнительные средства в маркетинг и продажи, повысить зарплаты преподавателей и административного персонала, а также увеличить штат сотрудников. Однако в 2022 году рентабельность продаж снизилась на 1,45%. Причиной этого может быть снижение стоимости обучения одного ученика на 13,3%.
A40: of:=[.$B$8] - ([.$B$9]+[.$B$10]+[.$B$11]*[.$B$12]+[.$B$13]) -> -3699300 | B40: of:=[.$A40]/[.$B$17]*100 -> -78.7085106382979 | C40: of:=[.C8] - ([.C9]+[.C10]+[.C11]*[.C12]+[.C13]) -> -4191400 | D40: of:=[.$C40]/[.$C$17]*100 -> -87.175540765391
A41: of:=[.$B$7] - ([.$B$7]*[.$B$9]+[.$B$10]+[.$B$11]*[.$B$12]+[.$B$13]) -> -13288000 | B41: of:=[.$A41]/[.$B$17]*100 -> -282.723404255319 | C41: of:=[.C7] - ([.C7]*[.C9]+[.C10]+[.C11]*[.C12]+[.C13]) -> -14677000 | D41: of:=[.$C41]/[.$C$17]*100 -> -305.262063227953
A42: of:=[.$B$7]*[.$B$8] - ([.$B$7]+[.$B$10]+[.$B$11]*[.$B$12]+[.$B$13]) -> 14288000 | B42: of:=[.$A42]/[.$B$17]*100 -> 304 | C42: of:=[.C7]*[.C8] - ([.C7]+[.C10]+[.C11]*[.C12]+[.C13]) -> 15293000 | D42: of:=[.$C42]/[.$C$17]*100 -> 318.074043261231
A43: of:=[.B7]*[.B8] - ([.B7]*[.B9]+[.B11]*[.B12]+[.B13]) -> 6700000 | B43: of:=[.$A43]/[.$B$17]*100 -> 142.553191489362 | C43: of:=[.C7]*[.C8] - ([.C7]*[.C9]+[.C11]*[.C12]+[.C13]) -> 7108000 | D43: of:=[.$C43]/[.$C$17]*100 -> 147.83693843594
A44: of:=[.B7]*[.B8] - ([.B7]*[.B9]+[.B10]+[.B12]+[.B13]) -> 5690000 | B44: of:=[.$A44]/[.$B$17]*100 -> 121.063829787234 | C44: of:=[.C7]*[.C8] - ([.C7]*[.C9]+[.C10]+[.C12]+[.C13]) -> 5889600 | D44: of:=[.$C44]/[.$C$17]*100 -> 122.495840266223
A45: of:=[.B7]*[.B8] - ([.B7]*[.B9]+[.B10]+[.B11]+[.B13]) -> 5699900 | B45: of:=[.$A45]/[.$B$17]*100 -> 121.274468085106 | C45: of:=[.C7]*[.C8] - ([.C7]*[.C9]+[.C10]+[.C11]+[.C13]) -> 5899895 | D45: of:=[.$C45]/[.$C$17]*100 -> 122.709962562396
A46: of:=[.B7]*[.B8] - ([.B7]*[.B9]+[.B10]+[.B11]*[.B12]) -> 5400000 | B46: of:=[.$A46]/[.$B$17]*100 -> 114.893617021277 | C46: of:=[.C7]*[.C8] - ([.C7]*[.C9]+[.C10]+[.C11]*[.C12]) -> 5608000 | D46: of:=[.$C46]/[.$C$17]*100 -> 116.638935108153
A47: of:=[.B7]*[.B9]+[.B10]+[.B11]*[.B12]+[.B13] -> 13300000 | B47: of:=[.$A47]/[.$B$17]*100 -> 282.978723404255 | C47: of:=[.C7]*[.C9]+[.C10]+[.C11]*[.C12]+[.C13] -> 14692000 | D47: of:=[.$C47]/[.$C$17]*100 -> 305.574043261231
A48: of:=[.B11]*[.B12]+[.B13] -> 1700000 | B48: of:=[.$A48]/[.$B$17]*100 -> 36.1702127659575 | C48: of:=[.C11]*[.C12]+[.C13] -> 1892000 | D48: of:=[.$C48]/[.$C$17]*100 -> 39.351081530782
A49: of:=[.B7]*[.B8] -> 18000000 | B49: of:=[.$A49]/[.$B$17]*100 -> 382.978723404255 | C49: of:=[.C7]*[.C8] -> 19500000 | D49: of:=[.$C49]/[.$C$17]*100 -> 405.574043261231
A50: of:=[.B7]*[.B8] - ([.B7]*[.B9]+[.B10]+[.B11]*[.B12]+[.B13]) -> 4700000 | B50: of:=[.$A50]/[.$B$17]*100 -> 100 | C50: of:=[.C7]*[.C8] - ([.C7]*[.C9]+[.C10]+[.C11]*[.C12]+[.C13]) -> 4808000 | D50: of:=[.$C50]/[.$C$17]*100 -> 100

Sheet: 3.SQL
A1: 1. Изучите базу данных и примеры строения таблиц | Q1: Class | T1: Schendule | AB1: Student | AI1: Student_in_class | AM1: Subject | AP1: Teacher | AU1: Timepair
Q2: id | R2: name | T2: id | U2: date | V2: class | W2: number_pair | X2: teacher | Y2: subject | Z2: classroom | AB2: id | AC2: first_name | AD2: middle_name | AE2: last_name | AF2: birthday | AG2: address | AI2: id | AJ2: class | AK2: student | AM2: id | AN2: name | AP2: id | AQ2: first_name | AR2: middle_name | AS2: last_name | AU2: id | AV2: start_pair | AW2: end_pair
B3: Class | J3: Student_in_class | N3: Student | Q3: 3 | R3: 9 C | T3: 1 | U3: 2019-09-01T00:00:00.000Z | V3: 9 | W3: 1 | X3: 11 | Y3: 1 | Z3: 47 | AB3: 1 | AC3: Nikolaj | AD3: Fedorovich | AE3: Sokolov | AF3: 2000-10-01T00:00:00.000Z | AG3: ul. Pushkina, d. 36, kv. 5 | AI3: 67 | AJ3: 9 | AK3: 1 | AM3: 1 | AN3: Math | AP3: 1 | AQ3: Pavel | AR3: Petrovich | AS3: Romashkin | AU3: 1 | AV3: PT08H30M00S | AW3: PT09H15M00S
B4: id | C4: int | J4: id | K4: int | N4: id | O4: int | Q4: 4 | R4: 9 B | T4: 2 | U4: 2019-09-01T00:00:00.000Z | V4: 9 | W4: 2 | X4: 8 | Y4: 2 | Z4: 13 | AB4: 2 | AC4: Vyacheslav | AD4: Evgenevich | AE4: Eliseev | AF4: 2000-11-21T00:00:00.000Z | AG4: ul. Pushkina, d. 40, kv. 7 | AI4: 68 | AJ4: 9 | AK4: 2 | AM4: 2 | AN4: Russian language | AP4: 2 | AQ4: Vasilij | AR4: Antonovich | AS4: Kolesnikov | AU4: 2 | AV4: PT09H20M00S | AW4: PT10H05M00S
B5: name | C5: varchar | J5: class | K5: int | N5: first_name | O5: varchar | Q5: 5 | R5: 9 A | T5: 3 | U5: 2019-09-01T00:00:00.000Z | V5: 9 | W5: 3 | X5: 4 | Y5: 3 | Z5: 13 | AB5: 3 | AC5: Ivan | AD5: Antonovich | AE5: Efremov | AF5: 2000-09-19T00:00:00.000Z | AG5: ul. Pushkina, d. 58, kv. 16 | AI5: 69 | AJ5: 9 | AK5: 3 | AM5: 3 | AN5: Literature | AP5: 3 | AQ5: Mariya | AR5: Stepanovna | AS5: Vaulina | AU5: 3 | AV5: PT10H15M00S | AW5: PT11H00M00S
J6: student | K6: int | N6: middle_name | O6: varchar | Q6: 6 | R6: 10 B | T6: 4 | U6: 2019-09-02T00:00:00.000Z | V6: 9 | W6: 1 | X6: 4 | Y6: 3 | Z6: 13 | AB6: 4 | AC6: Anatolij | AD6: Valentinovich | AE6: ZHdanov | AF6: 2000-07-15T00:00:00.000Z | AG6: ul. Pushkina, d. 21, kv. 7 | AI6: 57 | AJ6: 9 | AK6: 4 | AM6: 4 | AN6: Physics | AP6: 4 | AQ6: Taisiya | AR6: Timurovna | AS6: ZHedrinskaya | AU6: 4 | AV6: PT11H05M00S | AW6: PT11H50M00S
B7: Timepair | G7: Schendule | N7: last_name | O7: varchar | Q7: 7 | R7: 10 A | T7: 5 | U7: 2019-09-02T00:00:00.000Z | V7: 9 | W7: 2 | X7: 2 | Y7: 4 | Z7: 34 | AB7: 5 | AC7: Georgij | AD7: Dmitrievich | AE7: Noskov | AF7: 2000-03-03T00:00:00.000Z | AG7: ul. Pushkina, d. 45, kv. 65 | AI7: 71 | AJ7: 9 | AK7: 5 | AM7: 5 | AN7: Chemistry | AP7: 5 | AQ7: Marina | AR7: Gennadevna | AS7: Sosnovskaya | AU7: 5 | AV7: PT12H50M00S | AW7: PT13H35M00S
B8: id | C8: int | G8: id | H8: int | N8: birthday | O8: date | Q8: 8 | R8: 11 B | T8: 6 | U8: 2019-09-02T00:00:00.000Z | V8: 9 | W8: 3 | X8: 6 | Y8: 5 | Z8: 35 | AB8: 6 | AC8: Artyom | AD8: Borisovich | AE8: Sergeev | AF8: 2000-01-01T00:00:00.000Z | AG8: ul. Pushkina, d. 1, kv. 5 | AI8: 72 | AJ8: 9 | AK8: 6 | AM8: 6 | AN8: Geography | AP8: 6 | AQ8: Ekaterina | AR8: YAkovlevna | AS8: Myasoedova | AU8: 6 | AV8: PT13H40M00S | AW8: PT14H25M00S
B9: start_pair | C9: time | G9: date | H9: date | N9: address | O9: varchar | Q9: 9 | R9: 11 A | T9: 7 | U9: 2019-09-03T00:00:00.000Z | V9: 9 | W9: 1 | X9: 5 | Y9: 6 | Z9: 36 | AB9: 7 | AC9: Arina | AD9: Fyodorovna | AE9: Evseeva | AF9: 2000-08-11T00:00:00.000Z | AG9: ul. Pushkina, d. 21, kv. 51 | AI9: 73 | AJ9: 9 | AK9: 7 | AM9: 7 | AN9: History | AP9: 7 | AQ9: Liliya | AR9: Timurovna | AS9: Arakcheeva | AU9: 7 | AV9: PT14H35M00S | AW9: PT15H20M00S
B10: end_pair | C10: time | G10: class | H10: int | T10: 8 | U10: 2019-09-03T00:00:00.000Z | V10: 9 | W10: 2 | X10: 13 | Y10: 7 | Z10: 37 | AB10: 8 | AC10: Angelina | AD10: Aleksandrovna | AE10: Voroncova | AF10: 2000-05-21T00:00:00.000Z | AG10: ul. Pervomajskaya, d. 121, kv. 5 | AI10: 74 | AJ10: 9 | AK10: 8 | AM10: 8 | AN10: Biology | AP10: 8 | AQ10: Sofya | AR10: Dmitrievna | AS10: Krauze | AU10: 8 | AV10: PT15H25M00S | AW10: PT16H10M00S
G11: number_pair | H11: int | T11: 9 | U11: 2019-09-03T00:00:00.000Z | V11: 9 | W11: 3 | X11: 6 | Y11: 8 | Z11: 38 | AB11: 9 | AC11: Ekaterina | AD11: Alekseevna | AE11: Ustinova | AF11: 2000-01-04T00:00:00.000Z | AG11: ul. Pervomajskaya, d. 45, kv. 2 | AI11: 75 | AJ11: 9 | AK11: 9 | AM11: 9 | AN11: English language | AP11: 9 | AQ11: Viktoriya | AR11: Nikolaevna | AS11: Ostrozhskaya
B12: Teacher | G12: teacher | H12: int | T12: 10 | U12: 2019-09-04T00:00:00.000Z | V12: 9 | W12: 1 | X12: 9 | Y12: 9 | Z12: 39 | AB12: 10 | AC12: Raisa | AD12: Semyonovna | AE12: Lapina | AF12: 2000-02-05T00:00:00.000Z | AG12: ul. Pervomajskaya, d. 56, kv. 7 | AI12: 76 | AJ12: 9 | AK12: 10 | AM12: 10 | AN12: Informatics | AP12: 10 | AQ12: YUrij | AR12: Georgievich | AS12: Krylov
B13: id | C13: int | G13: subject | H13: int | T13: 11 | U13: 2019-09-04T00:00:00.000Z | V13: 9 | W13: 2 | X13: 10 | Y13: 10 | Z13: 40 | AB13: 11 | AC13: Leonid | AD13: Nikitich | AE13: Ignatov | AF13: 2000-12-30T00:00:00.000Z | AG13: ul. Pushkina, d. 78, kv. 9 | AI13: 77 | AJ13: 9 | AK13: 11 | AM13: 11 | AN13: Physical Culture | AP13: 11 | AQ13: Andrej | AR13: Stanislavovich | AS13: Evseev
B14: first_name | C14: varchar | G14: classroom | H14: int | T14: 12 | U14: 2019-09-04T00:00:00.000Z | V14: 9 | W14: 3 | X14: 3 | Y14: 11 | Z14: 41 | AB14: 12 | AC14: Snezhana | AD14: YAkovlevna | AE14: Seliverstova | AF14: 2000-07-23T00:00:00.000Z | AG14: ul. Pushkina, d. 78, kv. 56 | AI14: 78 | AJ14: 9 | AK14: 12 | AM14: 12 | AN14: Robotics | AP14: 12 | AQ14: Bogdan | AR14: Romanovich | AS14: Moiseev
B15: middle_name | C15: varchar | T15: 13 | U15: 2019-09-05T00:00:00.000Z | V15: 9 | W15: 1 | X15: 3 | Y15: 13 | Z15: 43 | AB15: 13 | AC15: Semyon | AD15: Vladislavovich | AE15: Biryukov | AF15: 2000-09-11T00:00:00.000Z | AG15: ul. CHernova, d. 54, kv. 67 | AI15: 79 | AJ15: 9 | AK15: 13 | AM15: 13 | AN15: Technology | AP15: 13 | AQ15: Aleksandr | AR15: Vladimirovich | AS15: Sobolev
B16: last_name | C16: varchar | T16: 14 | U16: 2019-09-05T00:00:00.000Z | V16: 9 | W16: 2 | X16: 11 | Y16: 1 | Z16: 47 | AB16: 14 | AC16: Georgij | AD16: Vyacheslavovich | AE16: Baranov | AF16: 2001-01-11T00:00:00.000Z | AG16: ul. CHernova, d. 56, kv. 89 | AI16: 80 | AJ16: 8 | AK16: 14
T17: 15 | U17: 2019-09-05T00:00:00.000Z | V17: 9 | W17: 3 | X17: 5 | Y17: 6 | Z17: 36 | AB17: 15 | AC17: YUliya | AD17: Rostislavovna | AE17: Vishnyakova | AF17: 2001-12-03T00:00:00.000Z | AG17: ul. Kuratova, d. 96, kv. 45 | AI17: 81 | AJ17: 8 | AK17: 15
B18: Subject
B19: id | C19: int
B20: name | C20: varchar
A22: 2. Выполните задания 3 задания SQL
A23: 2.1 Напишите запрос SQL, который выведет сколько всего 11-ых классов
A24: SELECT COUNT(*)
A25: FROM Class
A26: WHERE name LIKE '11%';
A33: 2.2 Напишите запрос SQL, который выведет, сколько обучается в 9 С классе
A34: SELECT COUNT(*)
A35: FROM Class
A36: JOIN
A37: Student_in_class AS S_i_c
A38: ON Class.id = S_i_c.class
A39: WHERE Class.name = '9 C';
A41: 2.3 Напишите запрос SQL, который выведет, сколько всего занятий у 11 А провел преподаватель с фамилией "Ostrozhskaya"
A42: SELECT COUNT(*)
A43: FROM Schendule AS s
A44: JOIN
A45: Class AS c ON c.id = s.class
A46: JOIN
A47: Teacher AS t ON t.id = s.teacher
A48: WHERE c.name = '11 A'
A49: AND t.last_name = 'Ostrozhskaya';